400 CP,White Cloak of Ulric,Warhammer Fanatasy,"Hewn from the pelt of a great white wolf, this symbol of Middenland was blessed by none other than the high priest of the Cult of Ulric. Such is its sacredness that the Winter God himself looks favorably upon the wearer of this garment, surrounding it with a supernatural aura of cold and frost, which serves to quench even the most searing flames and slow the movements of those who dare reproach you."
50 CP,Nomura Brand Outfit,Kingdom Hearts ,"You get a set of clothes straight out of the mind of Tetsuya Nomura, with all the zippers and bangles and odds and ends that entails. These clothes are somehow completely functional and don’t get caught on things, despite their impractical visual appearance. They’re also extremely comfortable and repair fast enough you probably won’t notice them being damaged in the first place."
50 CP,Dejoule‘s Insulating Cloak ,Legacy of Kain,"This dark gray hooded cloak might not look like much, but it is not without its own blessing. So long as you wear it you will find your powers safely regulated to levels where it will be impossible to accidentally harm others or even yourself. And should the need arise this property can be temporarily empowered, preventing you  energies from leaking out at all and allowing you to pose as an ordinary traveler."
50 CP,Darkstar Cloak ,Warhammer - Dark Elf,"Even the light of the stars is nothing but a resource to the Druchii, as proven by this arcane adornment. Enchanted with the essence of a star stolen from the night sky of Nagarythe, this cloak constantly recharges your mystical energies by a small but persistent rate. It also looks rather stylish, dark as midnight by day and twinkling with distant stars at night. Should you already own another cloak, you may import it into this item to gain it’s aesthetic and enchantment."
500 CP,Terraspark Boots,Terraria,"Allows flight, 34mph running, and extra mobility on ice 8% increase movement speed. Provides the ability to walk on water, honey & lava. Grants immunity to fire and 7 seconds of immunity to lava while reducing damage to lava afterwards."
600 CP,Armour of Evil,Overlord,"This enchanted suit of blackened Arcanium is the ultimate protection for a Master of Evil such as yourself. Not only is it extremely hard to break through, it offers potent protection from the elements, both environmental and magical, increases your strength, speed, and vitality fivefold, and doubles the amount of Minions you can control through [The Gauntlet]. In addition, you are immune to fall damage, so falling off a high tower with an uncertain result is a bit less uncertain."
600 CP,Nightingale Set ,The Elder Scrolls,"As the protectors of Nocturnal's Twilight Sepulcher, they are equipped with the best that the shadowy warriors could ask for. You can summon a set of armor made of shadows at any time. Not only does it conceal your identity, it muffles your movements, makes illusions easier to cast, increases your lockpicking skill and frost damage, and let's you do more damage with weapons. The Nightingale Blade absorbs the health and stamina of it's targets, transferring them to the wielder, while the Nightingale Bow deals a great amount of frost and shock damage."
800 CP,The Magic Belt,Oz,"This golden jeweled belt grants the wearer several magical powers, the wearer may open and close passages of solid stone, transform people into random inanimate ornaments, conjure food, teleport themselves or others, and once per day, grant lesser wishes. It also greatly enhances the magical power of the wearer, allowing them to accomplish feats of magic that would normally be beyond them. Sadly though it can create carved wooden ornaments, and restore them to their original form, it cannot enchant existing wooden objects."
800 CP,Golden Helmet of Phar-Noor,Thundercat,An egyptian headdress that greatly increases all magical and mental powers of the wearer. It particularly increases the ability to dominate the minds of others to the point where it cannot be dispelled or broken until the caster stops wearing the helmet.