50 CP,Heart Container,Hyrule Warriors,"An ornate piece that appears to be made by a gifted artisan, it looks like a heart made of red glass and golden filigree.  Not just for show, the Heart Container is full of magic.  On use, by resting it upon your chest, it permanently increases your health.  This makes it harder for you to die from wounds that aren’t immediately lethal, or blood loss, basically.  You may give these to others for use, or purchase more for 50CP each"
50 CP,Bertie Bott’s Every Flavor Bean,Harry Potter,A paper bag filled with jelly beans enchanted to have one random flavor. ANY flavor and your packet is endless. 
50 CP,Harvesting Kit,Harry Potter,"A set of knives and scalpels, some cleaning potions and materials. It has everything you need to cut up and preserve a magical animal perfectly, without any part going bad. Generates sanitized glass containers to prevent anything getting contaminated, the containers are indestructible. The materials in the kit naturally replace themselves over time when used up and you know how to use all of them."
50 CP,Gigglewater,Fantasic Beasts,"A replenishing bottle of Gigglewater, one of the more popular wizarding drinks in the US. Tastes great, is reasonably strong and taking a shot causes one to giggle for a moment."
50 CP,Spiced Jerky,Chrono Trigger,"
Spiced Jerky (50 CP): This is a bag of jerky from the Snail Stop in Porre - arguably the greatest traveling ration known to mankind. Perfectly prepared and preserved, it's easy on the teeth and stomach, extremely filling, and contains a surprising amount of nutritional content. It's also astoundingly delicious. This bag has a curious enchantment enabling it to hold enough jerky to feed an army, and will slowly replenish over time."
50 CP,Toma's Pop,Chrono Trigger,"How curious. I was certain that this was a bottle of liquor from the town of Choras, but it appears to be a bottle of soda pop instead. I can't tell which it truly is, but both were favorites of the explorer Toma, good reason. Soft or hard, both are some of the finest beverages in existence. Unless my eyes mistake me, this bottle seems to be enchanted to refill each day, though with what I can't be certain."
50 CP,Band Candy,BTVS,This box contains an inite supply of chocolate that makes people act like their teenage selves. This lasts 24 hours per bar consumed. I guess you could use to distract a town full of people or maybe you just want to cause some mayhem.
500 CP,1-Up Mushroom,Super Mario Bros,"Grants a magic mushroom that gives whoever consumes it an extra life. As long as the recipient is still alive when it is given, they will revive in perfect health after something kills them. One refill per year"
500 CP,"Dragon/Demon/God Slayer Lacrima",Fairy Tale,"By consuming/implanting this lacrima in yourself, you become capable of wielding the forbidden slayer magics ( Choice between the any Three and repeatable). Granting you the power of a certain element that you can consume to refill your magic reserves. By using these magics you can bypass resistance to normal magics that anything possesses making you able to kill anything, provided you have enough power. This also gives you the ability to use magic. You are immune to your particular element unless the enemy is also using forbidden magics to power it. Even then should you have enough fortitude and will, you can consume it to not only refill your magic BUT, also add their forbidden element to your own."
500 CP,The Ultra Divine Water,Dragon Ball ,"The Ultra Divine Water is a magic water that will draw out all of the drinker's potential at the cost of it's painful effects. Thus, if a drinker has already obtained their full potential, it will have no effect."
600 CP,Starstuff ,Peter Pan,"A refilling bag of the mythical, green powder that can be produced from stars under rare occasion. It has a variety of magical properties depending on who is exposed. Any animal exposed to the substance transforms into a mythical, humanoid creature similar to its origin; for instance, a fish may become a mermaid, or a bird may become a fairy. Furthermore, humans exposed to it can fly and can gain artistic inspiration; however, overexposure can lead to greed and paranoia, just not for you. Also, unlike its form in the story, the Starstuff cannot be used to destabilize the fabric of the universe.
"
600 CP,Senzu Bean Pouch,Dragon Ball ,"A small pouch of 6 beans that magically restocks after 168 hours. They have amazing regenerative properties, while refilling any lost stamina and energy, they cannot restore any lost appendages, or cure seroius illnesses."
600 CP,Water of Life,Dragon Ball ,"Drawn from springs in the high mountains, this bottled water is greatly enthused with spiritual energy and ki! It’s overall spiritually healthy and good for the soul, but the boost in ki is a temporary matter. Still, it’s excellent for long term cultivation of the soul. Get as much of it as you need for that."
600 CP,Apple of Life,Chronicles of Narnia,"Consuming this apple grants physical immortality – the subject's aging permanently ceases, they become immune to all disease, and they gain an incredible regenerative capability. Such apples almostalways bear a terrible curse, but you've been granted a rare curse-free fruit and you will always have one. "
600 CP,Heartfire ,Dragonheart,"This is a small bottle containing heartfire, the source of a dragon’s power and their life force. While you carry this heartfire you will find all of your fire-based abilities noticeably increased in power, less personally costly to use, and easier to control. You can use this heartfire to heal someone from the brink of death, maybe even a little past it, restoring them completely however doing so will destroy the heartfire and you will not regain it until the start of the next jump. It might be possible to drink the heartfire, taking it into yourself and obtaining a greater increase to your fire powers, and even granting you the ability to project fire like a dragon’s firebreath (a dragon that does not have this item), but this is generally not advised as this will continually burn you from within, killing a normal person within moments."
600 CP,The Cup of Life,Merlin,"Somehow, you now have a perfect replica of the Cup of Life. The cup is a holy artifact of the Old Religion, and an item of great mystical power. Anyone who drinks from the cup will be healed from anything - even normally unhealable curses and poisons - at the cost of another life being taken in their place."
800 CP,Seed of Might,Dragon Ball ,"This seed isn’t much on its own, but when introduced to water, or even blood, it rapidly grows into a massive tree of might by extracting the energy of a planet. It needs an atmosphere to survive, but when it's done draining the planet of its energy (a process that takes a few days), all life in the world with a power level lower than 1,000 will die, and the tree will grow a dozen fruit. Each of these fruit when taken will increase your power by 20 times, though eating more than two at once will cause your body to tear itself apart and wither up. You’ll need to wait at least a month to consume another one to avoid that, and after five times you'll find the power gain dropping off considerably, until it only does 1.5x your original powerlevel. You’ll find that no matter how many times you plant it, the original seed comes back into your possession."