200,The Horn of Kygor,Warhammer ,"A magical, gold-banded warhorn which emits a terrifying, deep bass note that causes non-sapient beasts to go into a murderous frenzy. The magic of the horn is such that when sounded the affected beasts gravitate towards your enemies."
100 CP,Ice Axe ,Tomb Raider Jumpchain,"This fierce looking implement is a fairly standard mountaineer’s ice­axe and climbing aide, with hooked side for hanging and a spiked side for stabbing into rock walls and faces. As long as you are holding this axe, your arms cannot get tired, nor can it slip out of your grip. You could use this to hang on a wall indefinitely. If you have to use the axe to catch a fall, your arms won’t be injured by the sudden shock and deceleration."
200 CP,The Torch ,Tomb Raider Jumpchain,"A length of wood, a metal cage for tinder, and a flask oil to start it up. Once lit, this torch can never be extinguished, (so don’t put it in a closed room). Ghosts, Zombies, Mummies and other undead beings start to smoke and smoulder under its light. This doesn’t damage legit artifacts, but corpses will still at least show up well before they fall on you. If you touch a corpse with the flames of this torch, it will immediately catch fire and burn down to ash, better than even a crematorium. Some undead creatures won’t burn quite as easily, but they’ll definitely burn long enough for you to do something clever."
100,Pan's Flute,Ben 10,"When played, Pan's Flute released magical energy that could bring trees to life. Destroying the flute reversed the effect it had on the trees."
100,Pocket Dis-Organizer,Discworld,"The Mark 6 Whortleberry Pocket Dis-Organizer has many of the best-received features of previous
Personal Demonic Assistants. It can read and summarize paperwork, translate languages, keep track of accounts and appointments, remember names, paint pictures, and survive up to 300 fathoms of water pressure. In addition to such useful tools, it also has a few fun options, such as the “iHum” music system and games. Though it doesn’t have all the problems of the Mark 2, it does occasionally manage to remind you of appointments you haven’t made yet."
200,Interdimensional Phone,Dog Days,"This phone is enhanced by magic so as to allow it to call to anywhere from anywhere. Want to call your childhood friend to tell them you’re ok from a parallel world? No problem, this phone will get it done, and with great clarity too."
50,Omnioculars,Harry Potter,"Pause, rewind, and watch events in slow motion. It's basically a video camera combined with some binoculurs. "
500,Time Turner,Harry Potter,A device that allows the user to go back in time by up to five hours.  Must not let your past-self see you.  Local rules of time travel don't have to apply.
100,Deluminator,Harry Potter ,The basic version of this device is a lighter-like object that can absorb light from light soures.  Can redistribute those orbs of light. 
100,Enchanted Zippo ,Justice League Dark,"Got a light? Now you always will.  This classic Zippo has been enchanted, turning it into a mystical flamethrower.  Just flip the lid, start the flame, and you can manipulate the fire with your will.  Also comes in a Bic version, if you prefer to flick your Bic at ghoulies instead. "
400,The Wayfinder,Star Wars,"This device will point the way toward caches of lost or forgotten lore or artifacts leading you what could be an amazing journey. Once you’ve found a location using this device, you can re-attune it to lead you back with a moment of effort, then it will begin to point a new source. "
200,Lies Translator ,Thundercats,"A pocket size magitech device that can record the words someone says, but when replayed it plays what the person was really thinking in their own voice."
200 CP,Magic Compass,Pirates of Caribbean,"This magical compass has been imbued with your soul. Not in a bad way, just enough to create a link. The needle always points to whatever you most desire, or the means to get to that which you desire. It can be hard to tell. Anyways, at least you’ll always know where your next step is, so long as you know what you want. If you don’t know what you really desire, the compass doesn’t either."
200 CP,Wolski‘s Glass,Pirates of Caribbean,"This spyglass is impressive. It might be a small thing you can stick in a pocket, or a huge pole that needs a stand to balance on, but it has the same magical qualities. First, it’s really incredibly durable; you can use it as a club without worrying about breaking the lenses. It’s also able to see through things it shouldn’t; mists and darkness hide nothing from its eye, and even magical illusions give up their secrets."