Cost,Perk Name,Source,Description
400,All Things Decay,Lords of the Night: Zombie,"You are literally full of death. Overflowing with it, really. You regenerate twice as fast as a troll, with such regeneration hampered by positive energy and similarly constructive forces. Even if it gets through your regeneration, you quickly heal such wounds at half your rate of regeneration. If your unlife is full, your abundant death force pours into a lake of oblivion that you can instantly parcel out to heal yourself, or lay on hands to snuff out the living, ward away positive energy, and heal the undead. You may learn to wield this in more exotic ways over time, but most forms of wards and sanctification is washed away if they attempt to bar or hinder you. This lake is about the same size as your ‘natural’ level of kindled animating force. If that lake is full, the excess negative energy will form an invisible haze about you that bolsters friendly undead, kills harmful life, scours away at blessings and hostile magical forces, poisons the living, and generally invisibly works in your favor. If, for some reason, you wouldn’t want it to do one on this things, like you don’t want to poison the husband who dragged you back to the living world, it won’t."
400,Delegation,Death’s Door,"The Reapers are mundane crows and have no innate ability to collect souls, or any number of the things they manage to do here. The source of these abilities is that the first Lord of Doors delegated the actual duty of collecting souls to them and granted them to the crows.
Similarly, should the need arise you can specify a duty that you could perform and grant the abilities required to do so to your subordinates. The abilities that are granted are much weaker than your own, so be sure to train them properly."
400,Creator,Lords of the Night: Liches,"People focus on the grand secrets, the sublime arts, the intricate techniques of the Arcane. And all of these things exist. But before them all, the truth of the Arcane is simple. It is the Fire of Creation, the Spark that flares into the infinite possibilities of existence. It is a force of Making, and you are utterly in tune with that aspect. When you use Sorcerae to Create something permanently, it only costs two times as much as it does for a transitory thing instead of the ten times it would take normally and such works always have a grace to them that makes them subtly better than they should be, and if you could succeed at such a Sorcerae, you will do so with grace and panache. You might call it a ‘natural 20.’
(Editor’s Note: Please check the note section of the Lords of the Night: Liches jump for more information on the perk’s properties.)"
400,Diadem of the Savant,TES: Magic,"This golden circlet is gifted to anyone who is able to complete Shalidor's Maze, and overcome the trials within. It decreases the amount of magicka your spells would otherwise cost, as well as allowing you to have five times more summons active at once than you could before. Additionally, anything summoned while wearing this will be stronger, faster, and more durable than they otherwise would have been."
400,BFF,The Binding of Isaac,"Friendship is the strongest power of all, so stronger friends must make you strongest-er.
BFF makes your familiars bigger and twice as powerful, making them a force to be
reckoned with. Also applies to any other summons or things of a similar nature."
400,Queen’s Covenant,Fate: The Island of Sin,"Although the King Clan seems quite large at first glance, the truth is that other faeries are simply adopted into the clan. The head of the clan is able to imbue a fraction of her power into those she brings into the clan, making them much stronger, and only weakening her if she is far away from them; as long as they remain in relative proximity, she keeps full access to her abilities.
Now you too are able to infuse your minions with your power, making each one far stronger in exchange for a tiny sliver of yourself that you invest in them. As long as they don’t get more than a city’s-width away from you, you still possess your full strength, only losing access to it if they distance themselves from you.
You can also weaken your perks to provide lesser versions of them to your followers; in exchange for reducing your own perk by 1/100th of its regular power, you can instill a single individual with that same perk at 1/4th the power with which you would normally demonstrate it. However, whatever you invest is permanently given up, and as such will be lost forever if your subordinates die or forswear their loyalty to you. But having an army of warriors able to fight at a significant portion of your own abilities may be worth the cost."
400,All Hail The Nowhere King,Centuarworld,"A powerful ability for a true tyrant. Those who you create can be controlled and commanded by you telepathically, allowing you to manage entire armies with just your thoughts, and also making defying you almost impossible. The main drawback with this control is that if you were to be knocked out while you are exerting this control, your soldiers would be frozen in place as well, unable to move without your commands."
400,Captain,Fear and Hunger,"“Yours is the burden of command, and the benefits.”
It seems I was mistaken, Jumper. You are no mere guard. You are the guard-in-charge, and you better get used to it, because from now on, whenever you work within an organization or group, you will be the one responsible for commanding the rank and file. This alone does not make you the leader, only the underling in charge. If you were part of an army, you would have the rank of captain, at the least. If you have just joined, you will find yourself promoted abnormally fast, by force of circumstance or contrivance.
Furthermore, you now possess a symbiotic relation with those under your command. Their morale will be a reflection of yours, such that, if you are confident or cheery, so are they, but if you are frightened or disheartened, they will be as well. Contrarily, you will take the brunt of their suffering on yourself, sparing them. If they are wounded, you will divert a part of the pain onto yourself, if they are corrupted, most of that will end up on you, and if they are driven to madness and depravity... You better hope your will is strong enough. The death of one of your men will sever the connection with you, so if you find that your troops are beyond salvation, it might be better to finish them off yourself, if you have the guts."
400,Minion Mastery,Wizard 101,"Conjurers often call up assistants both in battle and in life from the eldest halls of legend. You too may now conjure permanent assistants out of battle, and temporary but more powerful Minions in combat! Out of combat, you may maintain 5 permanent summons at a
time to start, with the count increasing in power as you do, up to a maximum of 100. In combat, you may summon a small gang of up to 20 minions at the start, eventually letting you call upon small armies at the heights of power. With practice, you may also vary summon times, allowing for longer lasting but still temporary summons for more involved work. In addition, with a little imagination, just about any spell you have that summons a creature may be used to create a minion, either permanent or temporary."
400,Original Sin,Genesis,"Collective punishments aren’t the solution most of the time, but there are moments in which you need to make everyone knows the severity of their sin. In regards to your creations, when you make any changes to one specimen you can make it affect the others. Take the legs of one and all the others will be forced to slither on the ground to move around, make one able to feel shame and the others will scramble to cover their nakedness."
400,Power​ ​Granting​ ​Deal​​​​​​,Sailor Moon,"You may grant a portion of your power and some of your powers to up to eight willing people at the same time, if you wish. This power is connected to you, and you may take it back any time you wish. However, your power will decrease the more power you give someone. You may also share your powers or other forms with people, but until you take them back you will lack the power you gave. You may, for example, give someone your fire powers or part of your vast wells of magical power or give your excess energy to someone to empower them."
400,Subordination Protocol,Blame!,"The Silicon Life haven’t gotten this far without establishing a structured order of their own. As
chaotic as it may be, their system works – though some would argue that it is just a representation of “Law of the Jungle”. The Silicon Life command through a fear of strength and those who are strong will naturally take control of those who are weak. While those who are subordinate to you will always follow your rules to the letter, with enough time and authority you can wilfully subjugate others to you as well. These drones will also follow your every whim – their lives are yours to expend should you have an appropriate level of control. Your drones can be adjusted to your liking, by forcibly changing their physical makeup with your own biological abilities. So long as they’re under your control, their bodies will adapt to your forced changes with greater ease – though their minds may not fare so well. Just don’t take this subjugation ability for granted – as strength is always a relative matter. While you might be able to demand authority, you aren’t necessarily stamping out free will."
400,Rite of Kindling,Elden Ring,"Madness is like any other problem, often easier to bear once shared. So why not do just that for the blind sheep around you? You may not be one of the Three Fingers, but enough of the Frenzied Flame has soaked into your soul and flesh that you can transmit it to others by various means. Lay a hand on someone, and you can brand their flesh-granting them
instinctive use of the Flame’s Incantations; this takes a great toll on one of mortal constitution, but nothing a quick breather can’t recover from. Sacrifice part of your body-an eyeball for example, or a finger-and not only would they continue to develop new powers pertaining to the Flame or imbue existing ones with it but inspiration for how to incinerate everything will fill them-compelling them to support you if your goals are similarly destructive. Even your blood is a sort of toxic spread both madness-and with great quantities ingested,
spontaneous combustion. And all methods described above can also be used to imbue the Flame into weapons and armor to various effects-or if you like, convert your severed body parts into talismans affiliated with the Flame. As the old adage goes: Give a man a fire and he’s warm for a day, but set a man on fire and he’s warm for the rest of his life."
400,Original Sin,Genesis,"Collective punishments aren’t the solution most of the time, but there are moments in which you need to make everyone knows the severity of their sin. In regards to your creations, when you make any changes to one specimen you can make it affect the others. Take the legs of one and all the others will be forced to slither on the ground to move around, make one able to feel shame and the others will scramble to cover their nakedness."
400,Power​ ​Granting​ ​Deal​​​​​​,Sailor Moon,"You may grant a portion of your power and some of your powers to up to eight willing people at the same time, if you wish. This power is connected to you, and you may take it back any time you wish. However, your power will decrease the more power you give someone. You may also share your powers or other forms with people, but until you take them back you will lack the power you gave. You may, for example, give someone your fire powers or part of your vast wells of magical power or give your excess energy to someone to empower them."
400,Subordination Protocol,Blame!,"The Silicon Life haven’t gotten this far without establishing a structured order of their own. As
chaotic as it may be, their system works – though some would argue that it is just a representation of “Law of the Jungle”. The Silicon Life command through a fear of strength and those who are strong will naturally take control of those who are weak. While those who are subordinate to you will always follow your rules to the letter, with enough time and authority you can wilfully subjugate others to you as well. These drones will also follow your every whim – their lives are yours to expend should you have an appropriate level of control. Your drones can be adjusted to your liking, by forcibly changing their physical makeup with your own biological abilities. So long as they’re under your control, their bodies will adapt to your forced changes with greater ease – though their minds may not fare so well. Just don’t take this subjugation ability for granted – as strength is always a relative matter. While you might be able to demand authority, you aren’t necessarily stamping out free will."
400,Rite of Kindling,Elden Ring,"Madness is like any other problem, often easier to bear once shared. So why not do just that for the blind sheep around you? You may not be one of the Three Fingers, but enough of the Frenzied Flame has soaked into your soul and flesh that you can transmit it to others by various means. Lay a hand on someone, and you can brand their flesh-granting them
instinctive use of the Flame’s Incantations; this takes a great toll on one of mortal constitution, but nothing a quick breather can’t recover from. Sacrifice part of your body-an eyeball for example, or a finger-and not only would they continue to develop new powers pertaining to the Flame or imbue existing ones with it but inspiration for how to incinerate everything will fill them-compelling them to support you if your goals are similarly destructive. Even your blood is a sort of toxic spread both madness-and with great quantities ingested,
spontaneous combustion. And all methods described above can also be used to imbue the Flame into weapons and armor to various effects-or if you like, convert your severed body parts into talismans affiliated with the Flame. As the old adage goes: Give a man a fire and he’s warm for a day, but set a man on fire and he’s warm for the rest of his life."
600,Ascension,Fate Grand Order,"Servants aren't static in power. Depending on their circumstances, they can be stronger or weaker. The most notable influence on this is the Servant vessel. The magical power of the Master can either limit them or allow them to show their full power as well. Outside of that, you might need potent artifacts like Holy Grails to significantly increase the power of a Servant without resummoning them in a better spiritual body. Thankfully, you've learned a few strengthening rituals utilized by Chaldea to enhance their Servants. By utilizing miscellaneous magical material or objects, such as perhaps the bones of magical beasts, Craft Essences, or Mystic Codes, you can slightly but noticeably increase the overall power of a Servant. This can only be done to a limited extent however, due to the natural limits of Saint Graphs.
As a final note, modifying these rituals to work on non-Servant spiritual beings is likely possible, if very difficult, but it would require a lot of magical expertise to make them work on living beings.
(Editor’s Note: The full details are in the Fate Grand Order jump. I only took the first paragraph and a snippet of the final paragraph.)"
600,Fusion,Death Vigil,"You have discovered the true secret of Necromancy. You can now fuse with your summons, taking an abominable hybrid appearance, looking like a human fused to/with an Eldritch Abomination from beyond reality. But you are immune to the Vigils’ sealing and able to fight all but the strongest of them 1 on 1."
600,Black Mass,Lords of the Night: Vampire,"There are many tools of diplomacy available. It’s important not to forget ‘force of arms’ is one of them. You can control a hundred times as much undead at a time. This doesn’t change the ceiling of how powerful they can be. You can control a further thousand times as many bottom tier undead. Finally, your hoards are good at gathering and spinning off forces of uncontrolled undead. They aren’t actually obeying you, but they’re pulled along by a resonance with your own undead, and then cast loose in a direction to rampage. If they won’t listen to your words, then the living shall envy the dead."
600,Pack,Horror Midnight Movie Marathon,"This is a group of 8 werewolves or vampires. They’re not particularly special specimens, but they see you as their sire, progenitor, or alpha, and are fairly loyal, very loyal for what they are. They are also able to spread their curse whether it’s lycanthropy or vampirism, creating new werewolves or vampires, and while their victims will not be as loyal, they will still be inclined towards loyalty towards you. They are unable to spread their ‘blessing’ to you or your companions."
600,God Summoning,Tokyo Ravens,"This perk grants you the ability to summon a god to possess your body. You can choose
whether you remain in control of your body or let the summoned god take over. While
possessed, you gain the god's abilities, and your spiritual energy grows so immense that your aura causes the sky to tremble. Your familiars will also become much stronger during this time. The power of this ability depends on the god you summon, but it is highly taxing on your body, so you can't use it repeatedly in quick succession. The duration of the possession depends on how long the god is willing to stay within you."
600,All The Hanged Men,SCP Foundation,"“With this, our blood, it is the Hanged King’s.”
By claiming your control over a lord, you also lay claim to all their subjects. You cannot actively coerce an opponent into this role, they need to willingly hang the nooses around their own neck. Deception and treachery to earn such a sacrifice will not impair the results. Once they destroy themselves at your instruction, their body and mind become yours to command forevermore. And this control spreads like a plague to all those who accepted the position of power over them. While you don’t have to target leaders, it will allow you to become absolute ruler of anything from gangs to corporations to whole kingdoms after
one powerful victim. Those who accepted them as a superior are now subordinate only to your orders. Should you abdicate the position of leadership all subjects are freed from your control. The same will occur if the ensnared target on your rope is ever destroyed; they need not remain alive exactly, but at least aware of their ongoing defeat. This also comes with an ability to summon forth nooses into any situation. By focusing on individual ropes they can be used as an animated weapon."
600,Staff of Worms,TES: Undead,"The ebony staff once owned by the King of Worms, Mannimarco. Not only does it greatly empower any spells channeled through it, but it makes any of the undead you have risen far more physically capable than they otherwise would have been, easily the equivalent of ten others. Additionally, it allows you to perfectly see and hear through your undead’s eyes and ears, somehow."
600,Preparation For A Ceremony,Loop Hero,"Why lurk in the dark of night? Rather than drawing on your own strength, you’ve found another source of energy that’s just as useful. Through a careful ritual, the light of the morning sun can be channeled into your creations, granting them strength beyond a lesser mage’s wildest conception."
600,Heretical Achievement,Witch on the Holy Night,"Your expertise with magically modifying the body and soul is matched only by the elder Aozaki sister in this town-a heretical mage who aspired to recreate the original human body as her path to the Root. Even powerful spirits and legendary heroes could have their spiritual structure improved and their powers or artifacts enhanced by your tampering. More importantly, somehow you’ve used it to create a truly impressive form of immortality even by the standards of this world-one that almost approaches a True Magic. Even at Touko’s precocious age, she has made puppets so realistic that even if her body was burnt to ash and her soul destroyed, the puppet’s similarity to her would be so exact reality itself would retroactively register it as the true “her” and consider the previous Touko to have been the fake. As if her craft created a sort of quantum superposition for her existence. Last but not least, these skills of yours are potentially transferable to other supernatural powers, letting you develop other forms of simulacrum-based immortality-some of which may even be transferable to others. How do they work for means other than puppeteering? Isn’t the joy of discovery half the fun?"
600,Blessing of Blood,Elden Ring,"Deep under the earth in the wretched Mire beloved of Mohg, you sought the Formless Mother’s favour-and always generous, she bestowed it. Now all manner of blood-themed magic is greatly empowered in your hands, be it wringing more power out of sacrifices or enhancing the lethality of blood-borne curses. Spirits you summon also benefit from this
reviled blessing, healing you slightly when they draw blood from others and gaining strength when inflicting bloodloss by any means on their foes. When you set out to shed blood on your own initiative she favours you further, granting you phantom Great Runes that can bless all beings capable of bloodshed not allied with your chosen victim similarly and enhancing your own capacity for bloodshed further. And last but not least, the Formless Mother
craves wounds she hopes you will spread across the multiverse itself. With her Bloodboon incantation you may thrust into her formless body, spreading bloodflames around you that sear your foes with their cursed heat while wracking them with unnatural bloodloss. With such a direct link with the source of all blood magic, it goes without saying you are a master practitioner of blood incantations. Conjuring swarms of flies and bloodflame talons is old hat for you, and you may easily bestow similar powers on those you favour or in time innovate new ways to channel the power of blood."
600,King of Worms,TES: Undead,"Mannimarco is often credited as the first modern lich as we know them today, and is one of the most powerful mages to have existed. Much like him, you have reached the peak of necromancy. All undead you raise are much more powerful, durable, faster, and more intelligent than they otherwise would be. Additionally, there is no limit to how long your undead may be animated, nor how many you can control at any given time. With such power at your fingertips, it would be wise to fear you."
600,Ceremony of Investiture | Fusion Summoning,Generic Summoner,"Ceremony of Investiture [300CP] (Generic Summoner)
Summons rarely grow in strength, not to the degree one might want them to, and
so, summoners have found a way to empower their summons. You are able to perform an hour long ceremony that uses various materials and your own power as a means to improve upon a summon, investing the essence and power of the materials used into the summon to permanently grant them additional traits, improve upon basic statistics, or add new abilities entirely. These are shaped by the materials used in the creation of the summon and are often expensive, but the rewards are potentially immense for any summoner and their summons. The stronger the summon already is, the more materials and the more power needs to be invested to get a result.
Fusion Summoning [300CP] (Generic Summoner)
When summoning a creature, you can choose to summon two creatures at the same time, merging them into a single, composite summon with traits and abilities drawn from both of the component creatures. Some
abilities will combine, strengths will compound, weaknesses may wax or wane, some will cancel out, others will mutate, all depending on the creatures used in the fusion. If the two creatures fused are intelligent creatures, their minds meld and work in tandem to control the fusion, however, conflicts can arise which may destabilize it and cause the fusion to end prematurely.
Alternatively, you can summon a creature into an already summoned creature, empowering it in much the same way as above, except that the creature infused is dominant in the fusion, providing more direction to the fusion then the infused summon. Such fusions are usually a bit weaker than a full composite but lack the potential for internal conflict that the true fusions possess.
Given time and practice, you will be able to fuse more creatures at a time, though each additional creature added to the fusion becomes more difficult than the last.
(Editor’s Note: I did change the perk’s name, Fusion Summoning, from its original, Fusion, so as for it to not get confused with another. There is a description underneath the Ceremony of Investiture perk in its jump about the synergy with the Fusion Summoning perk. And underneath the Fusion Summoning* perk in its original jump, there is a description about synergy with the Armsman perk.)"
