Cost,Perk Name,Source,Description
400,Pactmaker,Drakengard One,"The original pact came about from a dragon and a young girl seeking to survive. Many beasts since then have made pacts for life as well. But not too many study the act further, not many are like you and seek to fully understand the process. More than most, you can alter the way pacts work. You’ve learned how the process works and can guide others to it easily enough but also how to maintain several pacts at once by yourself. You know how to guide the price of a pact to certain areas, even beneficial ones, such as taking someone’s time. It is possible in the future that you can take this knowledge even further, perhaps learning to create pacts that exchange qualities"
400,Tomorrow's Promise,Library of Ruina,"How odd, normally distortions on the level of Pluto are unique creatures. But given the vastness of the city and the distortion phenomenon I suppose it's not too strange that another would arise. At will you may summon up contracts on black paper and blue ink, which if signed appropriately binds all parties to the terms displayed. It's advisable not to breach the terms yourself, but if the other side fails to fulfill their obligations you may take stipulated from them. This may include things like their heart, which will fly out of their chest only to be returned at your discretion. If you’re creative enough, you could even create disguises for others by taking distinct traits and returning them later. While you might want to trap others in tricky wording, it's important to note that the text only needs to be on the contract, thus even print so minute that a spyglass would be needed to see it are enforced as part of the terms, though truly microscopic sizes fail to count as text to the contract’s mechanisms. Finally, with extensive practice and study it becomes possible to boost the attributes of others by placing a condition onto them, such as restoring their energy so long as they tire themselves to exhaustion soon after."
400,Twenty Dollars is Twenty Dollars,Chainsaw Man,"There’s always money to be made if you’re willing to make sacrifices, but wouldn’t it be better if you were guaranteed a degree of safety in the process? Twenty bucks for swallowing a lit cigarette is now free money for you, Jumper. From now on, any time you are promised a reward for completing a task you will find it that much easier to do so. On top of that, the larger the reward is the greater the effect. If the reward is a result of a contract forged with Contract Creation, this effect is even more pronounced. A devil that would undoubtedly kill you would only have a coin flip’s odds if you were promised a truly great reward for it."
400,A Warm Darkness,Made In Abyss,"So many things in the Abyss that you’d think unintelligent still have a soul and an inner voice. It’s just that nobody is listening. Whether it’s the soul within a White Whistle or the trapped agony of a cursed Narehate, you can understand and converse with those who are trapped in forms unable to speak for themselves. You’d be surprised by what wisdom they can share."
400,Money Talks | Scams,Helluva Boss,"Money Talks [200CP] (Helluva Boss)
This is Hell, there’s really nothing you can’t get if you don’t pay for it down here, and that’s just how life works for you now in general as well. Now you will always have the ability to get in touch with a seller for anything you want to buy with only a moderate amount of effort, though the rarer the thing you want to buy the more you’ll be gouged on the price.
Scams [200CP] (Helluva Boss)
You’re an adept Scam Artist and Confidence Man, you know everything from simple ploys to earn a quick payday and a quick meal, to the subtle art of the pyramid scheme and other long term ploys to net you a constant flow of cash at the expense of the suckers who put their trust in you."
400,"Hustle And Bustle | Bygone, Bygone",High School DxD,"Hustle And Bustle [200CP] (High School DxD)
Time to put your reputation into whole new heights, as now any deeds or actions that you take will become public knowledge and blown out of proportion - if you saved a man, you are called a great hero. If you slew a couple Devils, you are feared by many of their kin as though you were a holy avenger. Your reputation will snowball until you can barely live up to what they say about you - your foes will shake in terror at your name, and powerful allies will flock to your side. The power revolutionaries and leaders dream of. You can even ‘ride’ the tides of your reputation in battle, using it to make your opponents doubt their superiority, or cause a stronger foe to stumble because he is uncertain if you’re just toying with him. However, while you might never have PR problems again, there are quite a bit of people that would happily fight you regardless, so make sure you have some way to measure up to those expectations.
Bygone, Bygone [200CP] (High School DxD)
At the end of the day, you’re only a single person. Nothing to truly worry about – or at least that’s what most people will believe when you go around doing your own thing. You have a talent to make yourself felt as unimportant in the grand scheme of things. The faction leaders allow you to roam around without trouble as long as you don’t directly break any big rule, and the less important grunts just let you be, consider anything else as a more urgent affair. Of course, this can be toggled on and off, just in case you want to catch the attention of the big game."
400,Admire Its Purity,AVP,"Despite your alien and disturbing appearance, beings with an ‘open mind’ find you to be
something to be admired rather than something reviled or perverse. In general, the more they deviate from standard human psychology, the greater this effect will be: Madmen and
psychopaths might be driven to worship by your pure alien form, while those with much tamer obsession disorders might just find their eyes constantly being drawn back to your suggestive appearance."
400,Diplomacy,Fear & Hunger: Termina,"Your words are magnetic. You find that no matter the situation, when you speak, others will listen. Even in the middle of combat, your foes will pause to hear what you have to say, though this trick won’t work twice on the same Enemy. To you lying is as easy as breathing, and you have no tells or micro- expressions that would indicate deception, bypassing even magic or supernatural means of detecting lies.
(Editor’s Note: The perk Moonscorched is the Capstone Booster for this perk.)"
400,Jacob Means Deceiver,Genesis,"Has someone told you what a crafty bastard you are? With your charisma and intelligence, you seem able to make people dance around the palm of your hand to get what you want, being none the wiser till it’s already too late for them to do anything."
400,How to Train Your Slave,Children of an Elder God,"If you want to sale slaves for a living, it’s important to ensure that they can do something worth buying. Any old slave can do ordinary manual labor; it’s slaves in the skilled trades that fetch the highest price. And of course, any new slave needs to be broken in and taught how to behave. You are excellent at breaking people’s will to resist, and at training people—either in new trades, or to improve what they already know. What’s more, your victims seem to learn at an enhanced rate and internalize your lessons to a greater degree if you hold power over them; the more power you have regarding the student’s life, the more deeply the lessons sink."
400,Mad Laws and Madder Lawyers,Don’t Rest Your Head,"Under the watchful eyes of Officer Tock and the Tacks Man, District Thirteen is the closest to an orderly region of the Mad City and attracts no shortage of residents who wish to escape the mostly lawless wasteland outside. Unfortunately, it remains part of the Mad City, and therefor the law is as byzantine and constantly shifting as (in)humanly possible, and prone to
Nightmare-police brutality at any time. Only those with an instinctive grasp of what the constantly changing laws of District Thirteen are can hope to survive here for any great length of time. Like those residents weeded out by harsh natural selection, you too will have an instinctive understanding of what the law is presently, even under a regime that constantly shifts and changes the laws constantly, and an equally good instinct to argue for (against/on both sides simultaneously) of any legal case you end up saddled with. This will not let you evade any and all legal consequences but will make it damnably hard to pin you with something."
400,Recruitment Drive,Pokemon CGD,"These villainous organisations keep sprouting up all over the Pokémon world, don’t they? How do they even find so many willing recruits? Maybe they were using this perk.
You have a ‘sixth sense’ when it comes to discerning which people can be brought under your sway with promises of power or wealth, allowing you to easily find new recruits, or just those susceptible to bribes. This sense will also alert you when such an offer would be a very bad idea, like if the individual was an undercover cop, or an heroic type. Unfortunately, this will not guarantee that your recruits are competent. Perhaps you ought to look closer to home for really powerful allies?"
400,"Hustle And Bustle | Bygone, Bygone",High School DxD,"Hustle And Bustle [200CP] (High School DxD)
Time to put your reputation into whole new heights, as now any deeds or actions that you take will become public knowledge and blown out of proportion - if you saved a man, you are called a great hero. If you slew a couple Devils, you are feared by many of their kin as though you were a holy avenger. Your reputation will snowball until you can barely live up to what they say about you - your foes will shake in terror at your name, and powerful allies will flock to your side. The power revolutionaries and leaders dream of. You can even ‘ride’ the tides of your reputation in battle, using it to make your opponents doubt their superiority, or cause a stronger foe to stumble because he is uncertain if you’re just toying with him. However, while you might never have PR problems again, there are quite a bit of people that would happily fight you regardless, so make sure you have some way to measure up to those expectations.
Bygone, Bygone [200CP] (High School DxD)
At the end of the day, you’re only a single person. Nothing to truly worry about – or at least that’s what most people will believe when you go around doing your own thing. You have a talent to make yourself felt as unimportant in the grand scheme of things. The faction leaders allow you to roam around without trouble as long as you don’t directly break any big rule, and the less important grunts just let you be, consider anything else as a more urgent affair. Of course, this can be toggled on and off, just in case you want to catch the attention of the big game."
400,Admire Its Purity,AVP,"Despite your alien and disturbing appearance, beings with an ‘open mind’ find you to be
something to be admired rather than something reviled or perverse. In general, the more they deviate from standard human psychology, the greater this effect will be: Madmen and
psychopaths might be driven to worship by your pure alien form, while those with much tamer obsession disorders might just find their eyes constantly being drawn back to your suggestive appearance."
400,Diplomacy,Fear & Hunger: Termina,"Your words are magnetic. You find that no matter the situation, when you speak, others will listen. Even in the middle of combat, your foes will pause to hear what you have to say, though this trick won’t work twice on the same Enemy. To you lying is as easy as breathing, and you have no tells or micro- expressions that would indicate deception, bypassing even magic or supernatural means of detecting lies.
(Editor’s Note: The perk Moonscorched is the Capstone Booster for this perk.)"
400,Jacob Means Deceiver,Genesis,"Has someone told you what a crafty bastard you are? With your charisma and intelligence, you seem able to make people dance around the palm of your hand to get what you want, being none the wiser till it’s already too late for them to do anything."
400,How to Train Your Slave,Children of an Elder God,"If you want to sale slaves for a living, it’s important to ensure that they can do something worth buying. Any old slave can do ordinary manual labor; it’s slaves in the skilled trades that fetch the highest price. And of course, any new slave needs to be broken in and taught how to behave. You are excellent at breaking people’s will to resist, and at training people—either in new trades, or to improve what they already know. What’s more, your victims seem to learn at an enhanced rate and internalize your lessons to a greater degree if you hold power over them; the more power you have regarding the student’s life, the more deeply the lessons sink."
400,Mad Laws and Madder Lawyers,Don’t Rest Your Head,"Under the watchful eyes of Officer Tock and the Tacks Man, District Thirteen is the closest to an orderly region of the Mad City and attracts no shortage of residents who wish to escape the mostly lawless wasteland outside. Unfortunately, it remains part of the Mad City, and therefor the law is as byzantine and constantly shifting as (in)humanly possible, and prone to
Nightmare-police brutality at any time. Only those with an instinctive grasp of what the constantly changing laws of District Thirteen are can hope to survive here for any great length of time. Like those residents weeded out by harsh natural selection, you too will have an instinctive understanding of what the law is presently, even under a regime that constantly shifts and changes the laws constantly, and an equally good instinct to argue for (against/on both sides simultaneously) of any legal case you end up saddled with. This will not let you evade any and all legal consequences but will make it damnably hard to pin you with something."
400,Recruitment Drive,Pokemon CGD,"These villainous organisations keep sprouting up all over the Pokémon world, don’t they? How do they even find so many willing recruits? Maybe they were using this perk.
You have a ‘sixth sense’ when it comes to discerning which people can be brought under your sway with promises of power or wealth, allowing you to easily find new recruits, or just those susceptible to bribes. This sense will also alert you when such an offer would be a very bad idea, like if the individual was an undercover cop, or an heroic type. Unfortunately, this will not guarantee that your recruits are competent. Perhaps you ought to look closer to home for really powerful allies?"
500,Bureaumancy | Hand of Athena | Can We Be Friends?,Adrift in the Complex,"Bureaumancy [100CP] (Adrift in the Complex)
It’s pretty well understood that the most common thing an administrator does is stare at papers behind a desk, so let’s make you good at that. You are able to read and perfectly understand any important document you pick up. When you need to write something up, you do it quickly and without error. Bureaucracy is no challenge to you, as you can very easily navigate anything. You also never get bored while doing anything related to a job.
Hand of Athena [200CP] (Adrift in the Complex)
Knowing is half the battle, so you and your companions getting caught flat-footed would be
disastrous. From now on, you are instantly aware of any and all relevant information written by anyone in your organization. You won’t know their favorite color, but you’ll know any proposals and warnings they have. Additionally, any information you deem as significant enough will quickly spread throughout any organization that you run
Can We Be Friends? [200CP] (Adrift in the Complex)
Overseer A, alias Stretch, is the well-loved overseer of M.E.G, who is known for being friendly and upbeat. You instantly grasp social cues, and can strike up rapports with even the most distant people. You clear up troubles and misunderstandings in conversations, and you can use any opportunity to further build friendships. Additionally, you can identify the problems of everyone around you, and can quickly figure out a solution to even the most complex problems."
500,Bureaumancy | Hand of Athena | Can We Be Friends?,Adrift in the Complex,"Bureaumancy [100CP] (Adrift in the Complex)
It’s pretty well understood that the most common thing an administrator does is stare at papers behind a desk, so let’s make you good at that. You are able to read and perfectly understand any important document you pick up. When you need to write something up, you do it quickly and without error. Bureaucracy is no challenge to you, as you can very easily navigate anything. You also never get bored while doing anything related to a job.
Hand of Athena [200CP] (Adrift in the Complex)
Knowing is half the battle, so you and your companions getting caught flat-footed would be
disastrous. From now on, you are instantly aware of any and all relevant information written by anyone in your organization. You won’t know their favorite color, but you’ll know any proposals and warnings they have. Additionally, any information you deem as significant enough will quickly spread throughout any organization that you run
Can We Be Friends? [200CP] (Adrift in the Complex)
Overseer A, alias Stretch, is the well-loved overseer of M.E.G, who is known for being friendly and upbeat. You instantly grasp social cues, and can strike up rapports with even the most distant people. You clear up troubles and misunderstandings in conversations, and you can use any opportunity to further build friendships. Additionally, you can identify the problems of everyone around you, and can quickly figure out a solution to even the most complex problems."
600,Anomalous Contacts,SCP Universe,"This is a small, black, indestructible terminal. It possesses various numbers, which correspond to numerous anomalous suppliers. Through it, you can purchase anomalies from MC&D, Wondertainment, the parapharmaceutical supplier dado, and even the extinct Prometheus Laboratories. The product will be delivered in 1 day inside the Warehouse. The terminal accepts any currency."
600,Gospel,Outlast,"Words are your greatest weapon, and your tongue is your greatest tool. You are fantastically good at manipulating others, to the point that sufficient time and effort could allow you to convince someone to kill themselves. If they have some sort of faith or belief you can exploit this is far easier, as you know exactly how to twist this to get them to do what you want. You can easily claim that mundane problems are actually spiritual in nature, and when you banish people with any loyalty to you from somewhere you have considerable influence, they will not attempt to return.
Capstone Boosted: Perhaps your unusual partner is trying to help, copying
something it encountered during its creation and exploiting its capabilities in new
ways. You seem to be able to brainwash others with how quickly they become
susceptible to your commands. You can even perform minor miracles like changing
the state of a substance or altering the bodies of others via physical contact.
(Editor’s Note: The Capstone Booster requires the possession of The Walrider perk.)"
600,Ringmaster,SCP Foundation,"“They will delight and astound you!”
The Greatest Show in the World requires the greatest showman. You’re the star for the role. The show must go on. With you, it will always go on. Because that’s just your type, you’re the king of hype. You’re the master of flair, to the point it’s not fair. No matter the act, it’s just a fact. Your ability to entice and excite is incomparable. You are always the most charming and intense person in a given scene and command attention. Your force of personality is such that the slightest gesture communicates your intents to those you wish, allowing you to silently give clear messages to specific individuals while presenting a completely different façade to the rest of your audience. Everyone will be able to follow your cues easily. Furthermore, you can easily bestow this limelight on any associates or subordinates. It’s easy for you to make anyone hypervisible by sharing your own popularity and charisma with them. Though, even when they bungle an act you can bounce back without harm to your reputation from a subordinates mistakes."
600,My War Crimes Are Bigger Than Yours,Jujutsu Kaisen,You know just how to hit where it hurts. You can easily create elaborate plans that exist for centuries just so you can do a single thing. Perhaps you put your brain into someone purely to create a child just so you can use them. Maybe you devised a plan to revive a bunch of dead sorcerers so that you can accomplish such a goal. You are insanely convoluted and mentally insane. So insane in fact that some would say you loop back to sanity. You also have a knack for just being an incredibly giant jerk. Using humans as meat shields and causing giant amounts of property damage. You are an insanely smart terrorist but a terrorist nonetheless. You also have a large amount of knowledge on barrier techniques and how to make half curses.
600,Our Sun,Library of Ruina,"The White Nights, Dark Days incident and its consequences have been a disaster for the City's inhabitants. Though, perhaps, less so for you, someone who seems to have similar properties to its mysterious voice. You seem to have a real knack for pushing people to their limits. While this is still based on the information you have on them, when it comes to causing horrific degrees of mental stress, you’re great at pushing them until one of two things happen: They snap under your arguments, becoming monstrous Distortions, beings rooted in their own desires, which have boiled over to consume them body and soul. These twisted humans have powers and forms wrapped around their wishes. Or, they control their emotions and desires, reifying them into E.G.O equipment, powerful weapons formed of the same wishes, but focused. This may be slightly less deadly or versatile on average, but the control and, well, sanity more than make up for it. In future jumps, you’ll continue to be able to awaken others to their Inner Light, and moreover awaken similar abilities based on extremes of stress.
(Editor’s Note: This perk does have a capstone boosted effect, it can be found in the Library of Ruina jump.)"
600,Blood Money,Helluva Boss,"You have an interesting trait, the more suffering you cause the more wealth and social status you gain. The form this takes is honestly up to you- maybe your business gets more lucrative contracts if you consistently exploit the poor- or maybe verbally abusing your husband auto-magically pads your Bank Account enough to hire an expensive hitman. People will also start to value your opinion more and consider you more important the more consistently you make life worse for people."
600,New World Order,SCP Foundation,"Logic out of Illogic.
You were but a small force against the tides of impossibility. A single variable that stands against the status quo. Someone who seeks to create logic and stability in a world that despises both. That is the Chaos Insurgency. You are the Chaos Insurgency. The mechanisms of chance and probability will be laid to waste. Welcome to your own LK-Class Probability Failure Scenario. The cause succeeded. Chaos is no more. Now it goes according to The Plan. You control the variables, pushing the odds into near- certainties. You can turn any of the 50/50 odds into a 1-in-100, depending on what’s part of your design. Impossible is impossible, and absolute remains absolute. As long as you can account for it, set the steps in motion, it all will all go according to plan. The only limit is understanding all the moving parts. There’s no other outcome except your utopia. All you have to do is work for it. This perk is extremely vulnerable to the tampering by other entities that have some form of fate or luck abilities."
600,Demon | In Plain Sight,Monster,"Demon [200CP] (Monster)
Every crime you commit will have any and all physical forensic evidence left behind almost instantly erased. Bullet casings will disappear, bloodstains on your person will clean themselves, etc. The only two things that will remain as evidence of what you have done will be witness testimony and paper trails. Outside of those, it will be as if you were a ghost.
In Plain Sight [400CP] (Monster)
“The big secret to breaking the rules is to make it look like you're following them”. Are you a student? Maybe a construction worker? Or was it a mob boss? Why not all of them? You are now able to manage several different false lives all at the same time, with zero ill effects coming from your absence, so long as you still check in regularly enough. For example, you could be running a mafia for a week then return to your day job. No one will be suspicious and you won’t even be demerited."
