Cost,Perk Name,Source,Description
1300,Insectoid Efficiency | Convergence | Allowance | True Hive Mind,Prototype,"Insectoid Efficiency [100CP] (Prototype)
Infected tend to scramble, running around and spreading to the closest tar- get like a cancer. While this tactic may be useful against a large horde of otherwise defenseless targets, if you are trying to infect more intelligent or advanced species you will need organization. With this perk your hive and everything controlled by it will set up a system similar to insects, where there are distinct roles for each unit that they will follow until you tell them otherwise. With each hive built the complexity of your unit strategies will increase as well.
Convergence [200CP] (Prototype)
Depending on how far-out your infection has spread, getting a large number of minions to your side might take some time, which can lead to you being in a pinch when there is no one to guard you. No longer is that the case! With this perk you can summon all the infected that you control to your position at once, and they will move at incredible speeds to reach you, even if you are hidden in prison! If you are not infected, then this perk instead will work the same way for any allies that are undyingly loyal to you.
Allowance [400CP] (Prototype)
In most cases minion consumed biomass will stay with them, and would be digested. This is
not the case for you however, infected minions that consume targets will give you a small portion of the biomass consumed without having to come into contact with them for you to use, this does not come without a compromise however. Taking the biomass from a minion also means that the minion will need to eat more to compensate for this. This does work both ways as well...
True Hive Mind [600CP] (Prototype)
If you are trying to control a massive hive, it is going to take a lot of effort to control them, especially if you have your own body. With this perk you will be able to dissolve your body and transfer your ” essence” to your hive, where the only way to kill you is by destroying all of the hives you have under control. But hives are completely sessile, so you will be unable
to escape should someone invade your hives and destroy them. This also grants greater control to your hive, where you are able to execute attacks and strategies like they are chess pieces, and allows access to any of your powers, as long as they do not allow you to
move the location of any hive. If you want your body back it will take a full week to form, and a large amount of biomass to create it."
1400,The Power to Share | The Originator of Quincy,OoC Quincy Supplement,"The Power to Share [600CP] (OoC Quincy Supplement)
This perk allows you to share a fragment of your soul with another person through physical contact. When you do, you can decide whether the recipient gains a general increase in power or receives a copy of a specific perk or ability of your choosing. Those who receive a
fragment of your soul are healed of all physical, mental, and spiritual ailments. As their wounds heal, the knowledge, skills, and talents they possess are imprinted onto the soul fragment they have received. Healing someone through this method significantly reduces their lifespan, but you can choose whether or not this reduction occurs. When a person with one of your soul fragments dies, the fragment returns to you, increasing your strength and extending your lifespan. You can forcibly reclaim your soul fragments using a technique called Auswählen. This technique creates a ring of light that emits beams targeting individuals who carry your fragments. Auswählen not only retrieves your soul fragments but also absorbs the general power of the targets, weakening them. Auswählen allows you to redistribute power among those who carry your soul fragments, enabling you to weaken some while strengthening others. Those empowered by Auswählen are fully healed and can even be revived from death, including yourself. However, this technique is fatal to those with weak souls, as they may be unable to withstand the light of Auswählen, causing them to perish and be reduced to bones.
The Originator of Quincy [800CP] (OoC Quincy Supplement)
This perk significantly enhances the strength of all your soul-related abilities, particularly your Quincy powers, granting you perfect control over spiritual energy and the ability to reconstruct spiritual objects into any desired form. You can also generate and fire Heilig Pfeil
without needing a Spirit Weapon. These projectiles can appear either as arrows or blasts of blue energy, both forms carrying the same level of power. Additionally, you can use Spiritual Power alone as your energy source, removing the need to combine it with Spirit Particles for your Quincy abilities. This perk also enables you to grant others the powers of a Quincy or bestow them with a Schrift. By allowing others to drink your blood, you can choose whether they gain Quincy powers, a Schrift, or both. The Quincies you create through this method are considered Echt Quincy, and their offspring will be a Quincy as well. If one parent is not a Quincy, their child will become a Gemischt Quincy. Unlike Yhwach, this bestowal does not require sharing a piece of your soul to impart a Schrift. Instead, you engrave a letter into the recipient’s soul using your energy, which forms their Schrift. This process requires an immense amount of energy.
The specific Schrift a person gains is determined by the letter you engrave, but the ability associated with it is random. For example, engraving the letter R might result in The Roar
Schrift. While the strength of the awakened Schrift varies, no Schrift is ever useless. Some may manipulate elements, while others can alter fundamental aspects of reality. However, the Schrift granted through this perk will never surpass or equal the power of The Almighty, the strongest Schrift. The most powerful Schrift granted through this ability would be par with The Balance. Most Schrift fall within the power range of 100 CP to 400 CP tier in terms of strength, though you can grant one person a Schrift equivalent to the 600 CP tier once every twenty years. A Schrift equal to the 800 CP tier can only be granted once every two hundred years. Those who receive a Schrift from you can also access Vollständig at will."
1400,The Power to Share | The Originator of Quincy,OoC Quincy Supplement,"The Power to Share [600CP] (OoC Quincy Supplement)
This perk allows you to share a fragment of your soul with another person through physical contact. When you do, you can decide whether the recipient gains a general increase in power or receives a copy of a specific perk or ability of your choosing. Those who receive a
fragment of your soul are healed of all physical, mental, and spiritual ailments. As their wounds heal, the knowledge, skills, and talents they possess are imprinted onto the soul fragment they have received. Healing someone through this method significantly reduces their lifespan, but you can choose whether or not this reduction occurs. When a person with one of your soul fragments dies, the fragment returns to you, increasing your strength and extending your lifespan. You can forcibly reclaim your soul fragments using a technique called Auswählen. This technique creates a ring of light that emits beams targeting individuals who carry your fragments. Auswählen not only retrieves your soul fragments but also absorbs the general power of the targets, weakening them. Auswählen allows you to redistribute power among those who carry your soul fragments, enabling you to weaken some while strengthening others. Those empowered by Auswählen are fully healed and can even be revived from death, including yourself. However, this technique is fatal to those with weak souls, as they may be unable to withstand the light of Auswählen, causing them to perish and be reduced to bones.
The Originator of Quincy [800CP] (OoC Quincy Supplement)
This perk significantly enhances the strength of all your soul-related abilities, particularly your Quincy powers, granting you perfect control over spiritual energy and the ability to reconstruct spiritual objects into any desired form. You can also generate and fire Heilig Pfeil
without needing a Spirit Weapon. These projectiles can appear either as arrows or blasts of blue energy, both forms carrying the same level of power. Additionally, you can use Spiritual Power alone as your energy source, removing the need to combine it with Spirit Particles for your Quincy abilities. This perk also enables you to grant others the powers of a Quincy or bestow them with a Schrift. By allowing others to drink your blood, you can choose whether they gain Quincy powers, a Schrift, or both. The Quincies you create through this method are considered Echt Quincy, and their offspring will be a Quincy as well. If one parent is not a Quincy, their child will become a Gemischt Quincy. Unlike Yhwach, this bestowal does not require sharing a piece of your soul to impart a Schrift. Instead, you engrave a letter into the recipient’s soul using your energy, which forms their Schrift. This process requires an immense amount of energy.
The specific Schrift a person gains is determined by the letter you engrave, but the ability associated with it is random. For example, engraving the letter R might result in The Roar
Schrift. While the strength of the awakened Schrift varies, no Schrift is ever useless. Some may manipulate elements, while others can alter fundamental aspects of reality. However, the Schrift granted through this perk will never surpass or equal the power of The Almighty, the strongest Schrift. The most powerful Schrift granted through this ability would be par with The Balance. Most Schrift fall within the power range of 100 CP to 400 CP tier in terms of strength, though you can grant one person a Schrift equivalent to the 600 CP tier once every twenty years. A Schrift equal to the 800 CP tier can only be granted once every two hundred years. Those who receive a Schrift from you can also access Vollständig at will."