Cost,Perk Name,Source,Description
200,Stealth,World of Horror,"Destruction of the forces of evil is all well and good, but there’s time to gather information and be a little more discreet, seeing as what you’re doing in the interest of the greater good is probably more than a little illegal. You’re good at blending in with crowds and putting in a lot of work into disguises. You’d be surprised how easy it is to get into the closed hospital with a decent nurse uniform and a look on your face like you belong there."
200,Solomon’s Testament,Shin Megami Tensei II,"Demonic power is used by all powers of note in this world, and more than a few humans have managed to charm or coerce them to their side. The problem is that when negotiating such a contract, many Demons are not terribly...straightforward in their bargaining, some just stealing their gifts and bribes without anything in return. Whether from a similarly alien mindset or some hard-earned lessons in this cycle of mad negotiations, you know how to
reach an accord and understanding when speaking with Demons, and understand what you need to give or say to them to bring them to your side. It won’t work terribly well on those staunchly determined to stand against you, but at least you won’t dump your life savings at a powerful demon only for them to attack you anyways. This works on demons in later jumps, as well."
200,Noncon Contract,Chainsaw Man,"Once per Jump you can show someone this adaptive contract with a proposal for something they have and you want. They are forced to assign you a job in exchange. The more willful and powerful they are in comparison to you, the more valuable and difficult the job can be in relation to what you request. Upon completing the job they will be forced to honor your reward and everyone will accept this exchange. You cannot use this to ask for things that are impossible to give and everything you ask for must be under a single general theme. How much they personally value what you request also impacts the difficulty of the task."
200,High Priest,Marvel Comics: Symbiotes,"Are you perhaps the leader of your... Anyway, you’ve got a certain dark charisma that allows you to easily talk to receptive people around your way of thinking, seduce them to your worldview, and convince them of the truth of any occult or religious secrets you’re aware of. You can also spot the tells of people who might be receptive to your teachings... Or, in a more sinister light, people who could be manipulated and indoctrinated. And yes, you can apply these skills to other forms of social interactions."
200,A Fearsome Reputation,Drakan,"You could burn this whole village to the ground to get what you want, but why bother when you can just ask... menacingly? You have a terrifying aura that can cause hardened soldiers to quake in their boots when you turn your gaze on them. People who are afraid of you will be more inclined to answer your questions or give you what you want. Finally, any evil deeds you commit will grow more horrific in the telling."
200,An Article Of Faith,Outlast,"You are good at the business side of things. You have a thorough understanding of economics, and the ability to turn any service or resource into a profit given enough effort."
200,Secret Brando Family Technique,Jorge Joestar,"Much as you may like it to be otherwise, villains have a habit of losing at the end of the day. The heroes time and again rise up and ruin your schemes. It may not be fair but it is how it is. Luckily the heroes also have a habit of letting you slink away freely after they win. Not that they stop hating you or forgive you for your crimes but it just seems to drift out of their minds that they should be stopping you and not relaxing after saving the day. It won’t work if you keep on attacking them or try to restart the failed plot but as long as you actively try to escape once a plot has gone sour, you’ll almost always manage to do so."
200,Judgement,Genesis,"After the fall of man happened it seemed like they had taken some traits from the deceiving snake, namely their propensity to lie. But you are not easily fooled, given that your eyes can see how wicked those in front of you are and your ears can detect any falsehood spoken to you."
200,Hidden Meaning,Danmachi,"Everyone has a motive that drives them to keep going on the road of life. Through this you can learn the motives and goals of a person with just a short conversation with them or detailed analysis of their past actions even a short battle would allow you to figure it out. This also makes you skilled and experienced at finding people that you can trust your secrets with, who have an ill intent towards you and would likely want to see you fail or someone neutral towards you that wouldn’t care about your motives and goals."
200,Pressure Submission,Garage: Bad Dream Adventure,"Even though “Juice” had a far higher Ego-level than “Yang”. He still managed to make her
followed his whim and became the immobile milky fuel generator. Almost as if he overwhelmed her verbally. You seem quite good at that, making those you can successfully talk down or into doing something becomes submission to your wants and orders. Though it could have just been the case of “Juice” adopting her real-life counterpart’s submissive demeanor."
200,"Kill the Soul, Over And Over Again",Jujutsu Kaisen Remake,"Aren't you the spiteful little fucker? And you're talented at it too, knowing just the right way of breaking people's hearts, crushing their will to dust. There's the obvious route of just killing everyone they love, but you can use subtler ways as well, like maybe copying their technique at the worst moment. The body can only die once, the soul can be killed many times, that's your motto… Man you are just the absolute worst."
200,Killing Intent,Fear & Hunger: Termina,"You passively emit an aura of danger, that any beastly or base being will recognize and abide. Unintelligent beasts, such as wild hounds or peasants are unlikely to attack or confront you, as their instincts warn them to avoid you. If you somehow come into conflict with something affected by this perk, your aura will also distract and spook them, causing them to act hastily and hesitantly."
200,Now I See Ya,Jorge Joestar,"Growing up on the streets made you into a real quick thinker, a talent that’s going to go a heckuva lot further than you’re thinking it might. As long as you’re aware enough to see things clearly, you can adapt to any situation in an instant. Whether it be trying to start up a new crime branch a few cities over and needing to adapt to the local customs or finding yourself teleported onto a spaceship over Mars in the future, you’re not thrown off for even an instant by anything that comes your way. You’ll always be balanced, focused and ready to act, even when the utterly impossible is happening right before your eyes. With a quick trigger finger and a quicker mind, you’ll be able to survive even once these weirdos start pulling out their Stands."
200,Secret Brando Family Technique,Jorge Joestar,"Much as you may like it to be otherwise, villains have a habit of losing at the end of the day. The heroes time and again rise up and ruin your schemes. It may not be fair but it is how it is. Luckily the heroes also have a habit of letting you slink away freely after they win. Not that they stop hating you or forgive you for your crimes but it just seems to drift out of their minds that they should be stopping you and not relaxing after saving the day. It won’t work if you keep on attacking them or try to restart the failed plot but as long as you actively try to escape once a plot has gone sour, you’ll almost always manage to do so."
200,Judgement,Genesis,"After the fall of man happened it seemed like they had taken some traits from the deceiving snake, namely their propensity to lie. But you are not easily fooled, given that your eyes can see how wicked those in front of you are and your ears can detect any falsehood spoken to you."
200,Hidden Meaning,Danmachi,"Everyone has a motive that drives them to keep going on the road of life. Through this you can learn the motives and goals of a person with just a short conversation with them or detailed analysis of their past actions even a short battle would allow you to figure it out. This also makes you skilled and experienced at finding people that you can trust your secrets with, who have an ill intent towards you and would likely want to see you fail or someone neutral towards you that wouldn’t care about your motives and goals."
200,Pressure Submission,Garage: Bad Dream Adventure,"Even though “Juice” had a far higher Ego-level than “Yang”. He still managed to make her
followed his whim and became the immobile milky fuel generator. Almost as if he overwhelmed her verbally. You seem quite good at that, making those you can successfully talk down or into doing something becomes submission to your wants and orders. Though it could have just been the case of “Juice” adopting her real-life counterpart’s submissive demeanor."
200,"Kill the Soul, Over And Over Again",Jujutsu Kaisen Remake,"Aren't you the spiteful little fucker? And you're talented at it too, knowing just the right way of breaking people's hearts, crushing their will to dust. There's the obvious route of just killing everyone they love, but you can use subtler ways as well, like maybe copying their technique at the worst moment. The body can only die once, the soul can be killed many times, that's your motto… Man you are just the absolute worst."
200,Killing Intent,Fear & Hunger: Termina,"You passively emit an aura of danger, that any beastly or base being will recognize and abide. Unintelligent beasts, such as wild hounds or peasants are unlikely to attack or confront you, as their instincts warn them to avoid you. If you somehow come into conflict with something affected by this perk, your aura will also distract and spook them, causing them to act hastily and hesitantly."
200,Now I See Ya,Jorge Joestar,"Growing up on the streets made you into a real quick thinker, a talent that’s going to go a heckuva lot further than you’re thinking it might. As long as you’re aware enough to see things clearly, you can adapt to any situation in an instant. Whether it be trying to start up a new crime branch a few cities over and needing to adapt to the local customs or finding yourself teleported onto a spaceship over Mars in the future, you’re not thrown off for even an instant by anything that comes your way. You’ll always be balanced, focused and ready to act, even when the utterly impossible is happening right before your eyes. With a quick trigger finger and a quicker mind, you’ll be able to survive even once these weirdos start pulling out their Stands."
300,Extra Contracts,Chainsaw Man,"For each purchase of this ability you gain three canon (or OC
companion) devil powers in the form of a favourable contract with that devil. They are free
to use but overusing them will draw the ire of the devil and going beyond the capabilities
of the devil is impossible (you can’t use the ability more often than the devil can)
however you can opt to take on the costs yourself to continue using them.
The soft and hard caps are increased with your strength in relation to the ability. These abilities count as the abilities of a nearby ally so they don’t get stronger with perks that increase your power. The more the devil favours you and your actions, the more uses you will be alloted. You receive a discount on devils as a companion if you obtain one of their
abilities through this. Maximum of three purchases."
300,Radiant Presence | Perfect Secretary,Kill la Kill,"Radiant Presence [100CP] (Kill la Kill)
Something about you just seems to shine, like a rainbow of lights in your presence. This doesn’t merely serve to make you look more stylish and appealing (though it does that), but it lends a sense of weight and authority to your words when dealing with anyone who has some reason to respect you, even if it's only in their mind. It won’t help with people who hate your guts and wish death upon you, but anyone else will find this making them react more favorably.
Perfect Secretary [200CP] (Kill la Kill)
You possess the uncanny ability to organize a mundane business of any kind easily  however, this won’t make you skilled at running schemes to take over the planet through clothing innately but it will make you talented at investing resources wisely and making sure that all necessary details are gathered and recorded efficiently. You could easily juggle dozens of business meetings a day and turn an average company into an international superpower over the course of a year or less by fully applying these skills, Jumper!"
300,Weakest Link | The Lesser Evil | Roundabout,Abara,"Weakest Link [100CP] (Abara)
Whether it's billionaires looking to rig a court case or massive conspiracies who want a cop to keep an eye on any nosy detectives, you’re their man. You’re almost always the first pick for bribes or privileges in return for facilitating the corruption, unless you build a track record of turning down such offers.
The Lesser Evil [100CP] (Abara)
No matter how much you’ve wronged someone personally, as long as there is a greater evil than you in the picture, you can still convince people to fight with you against it. They won’t necessarily listen to your orders. At best, you can point them in the direction you want, but it’s better than killing you on sight.
Roundabout [100CP] (Abara)
Sometimes it’s best that the right hand is blind to the left. You are a master at working behind your superior’s back in any organization. Even if your goals are directly opposed to those of your superior’s, and you use the group’s resources to accomplish it, they’re unlikely to notice until you’ve already played your hand."
300,Bad Riddles | Complacency | Gossipmonger,SK’s: TDTS,"Bad Riddles [100CP] (SK’s: TDTS)
You know just how to get under someone’s skin in the pettiest of ways, whether through humour they find intolerable or increasingly vexatious questions. Can provoke outright aggression while making them look like they’re overreacting.
Complacency [100CP] (SK’s: TDTS)
Although some who aren’t satisfied with their place in life will spit out ‘complacent’ as an insult, you have found that floating calmly down the river often takes you where you need to be. And even if it doesn’t, if you see a bear mauling someone on shore - do you really want to get involved, when you’re nice and safe exactly where you are? You’d get your bullet shells all wet, might ruin the powder for your six-shooters, and get nothing but claws in your belly once you finish wading to shore. No, you know that sometimes bad things happen around you and as long as they’re not happening to you, you’ll find a way to get by without going into a moral crisis over your choice not to act. It was, after all, only practical.
Gossipmonger [100CP] (SK’s: TDTS)
Your canny eyes see the sordid secrets of town regulars, learning them over lengthy
immersion and observation. Know who’s having affairs, where so-and-so’s hooch stash
hides, and the fact that the worm-white man on the hill keeps not one but five padlocks on his heavy basement door. Know their personal quirks and the ways to play them against each other.
- Passively updates once for every week you spend in a location; if you are actively
snooping around, you may update once per day instead.
- You may leave for up to a week at a time while this perk is active, providing you
return to the community before the time is out.
- You never lose knowledge of a place or the people where you used to live, but your
knowledge is only as good as the last time you paid the area a visit.
- When you jump, it updates immediately with a new community appropriate for your
origin upon arrival.
Does not work for populations of greater than 2,500 people."
300,Radiant Presence | Perfect Secretary,Kill la Kill,"Radiant Presence [100CP] (Kill la Kill)
Something about you just seems to shine, like a rainbow of lights in your presence. This doesn’t merely serve to make you look more stylish and appealing (though it does that), but it lends a sense of weight and authority to your words when dealing with anyone who has some reason to respect you, even if it's only in their mind. It won’t help with people who hate your guts and wish death upon you, but anyone else will find this making them react more favorably.
Perfect Secretary [200CP] (Kill la Kill)
You possess the uncanny ability to organize a mundane business of any kind easily  however, this won’t make you skilled at running schemes to take over the planet through clothing innately but it will make you talented at investing resources wisely and making sure that all necessary details are gathered and recorded efficiently. You could easily juggle dozens of business meetings a day and turn an average company into an international superpower over the course of a year or less by fully applying these skills, Jumper!"
300,Weakest Link | The Lesser Evil | Roundabout,Abara,"Weakest Link [100CP] (Abara)
Whether it's billionaires looking to rig a court case or massive conspiracies who want a cop to keep an eye on any nosy detectives, you’re their man. You’re almost always the first pick for bribes or privileges in return for facilitating the corruption, unless you build a track record of turning down such offers.
The Lesser Evil [100CP] (Abara)
No matter how much you’ve wronged someone personally, as long as there is a greater evil than you in the picture, you can still convince people to fight with you against it. They won’t necessarily listen to your orders. At best, you can point them in the direction you want, but it’s better than killing you on sight.
Roundabout [100CP] (Abara)
Sometimes it’s best that the right hand is blind to the left. You are a master at working behind your superior’s back in any organization. Even if your goals are directly opposed to those of your superior’s, and you use the group’s resources to accomplish it, they’re unlikely to notice until you’ve already played your hand."
300,Bad Riddles | Complacency | Gossipmonger,SK’s: TDTS,"Bad Riddles [100CP] (SK’s: TDTS)
You know just how to get under someone’s skin in the pettiest of ways, whether through humour they find intolerable or increasingly vexatious questions. Can provoke outright aggression while making them look like they’re overreacting.
Complacency [100CP] (SK’s: TDTS)
Although some who aren’t satisfied with their place in life will spit out ‘complacent’ as an insult, you have found that floating calmly down the river often takes you where you need to be. And even if it doesn’t, if you see a bear mauling someone on shore - do you really want to get involved, when you’re nice and safe exactly where you are? You’d get your bullet shells all wet, might ruin the powder for your six-shooters, and get nothing but claws in your belly once you finish wading to shore. No, you know that sometimes bad things happen around you and as long as they’re not happening to you, you’ll find a way to get by without going into a moral crisis over your choice not to act. It was, after all, only practical.
Gossipmonger [100CP] (SK’s: TDTS)
Your canny eyes see the sordid secrets of town regulars, learning them over lengthy
immersion and observation. Know who’s having affairs, where so-and-so’s hooch stash
hides, and the fact that the worm-white man on the hill keeps not one but five padlocks on his heavy basement door. Know their personal quirks and the ways to play them against each other.
- Passively updates once for every week you spend in a location; if you are actively
snooping around, you may update once per day instead.
- You may leave for up to a week at a time while this perk is active, providing you
return to the community before the time is out.
- You never lose knowledge of a place or the people where you used to live, but your
knowledge is only as good as the last time you paid the area a visit.
- When you jump, it updates immediately with a new community appropriate for your
origin upon arrival.
Does not work for populations of greater than 2,500 people."
400,Scofflaw,Made In Abyss,"Just like that scoundrel Bondrewd, you’ll find that the rules of any organization you belong to... Don’t tend to apply. As long as you don’t flaunt your actions, you can get away with just about anything that doesn’t directly harm the organization that you’re part of. Kidnapping
orphans? Human experimentation? Recruiting illegal delvers? All acceptable, as long as you don’t target your compatriots. Don’t expect a helping hand if your rule-breaking puts you in danger."
400,You Know My Reputation,DC Occult,You have an astounding capacity to bluff your way out of anything - mostly due to your supernaturally good poker face. You have absolutely no tells and even attempts to peer into your mind can't discern whether or not you're lying. You could lie to God and he'd be none the wiser.
400,Malfunction,SCP Foundation,"Keep working.
To make something worse, on purpose. There are practical benefits for making such terrible items. For one, being the cheap alternative might allow you to sell more than any competition. You can cut all costs (financial, material, or spiritual) down to a fraction of the normal values. A corrupt product will only cost you a tenth of the resources as the mundane equivalent. Instead of using quality materials, you can substitute filth and garbage. Anything you can create in such a way is easy to make en masse. Employees can manufacture your designs on your behalf once directed. You won’t directly be able to exploit this by designing
intentional effects. These production processes are almost as cursed for you as any consumer that treats them as the normal thing. But you can indirectly benefit as it’s inevitable that after discovering the flaws that you can find someone with a use for your malevolent products. Rarely, you could get lucky and they have a clear use to you. Especially since you’re passable at making almost any normal product and can easily get adequate raw materials to experiment. Finally, any curses or crafting you do costs 10% less in resources even if not made “wrong”."
400,The Company You Work For Belongs To A Company | Unnecessary Expense Makes Us Sad,Outlast,"The Company You Work For Belongs To A Company [200CP] (Outlast)
That belongs to a company that belongs to the Murkoff Corporation. And this might not be known to the employees, let alone the public. You can conceal the real ownership of a company or something similar by creating a chain of shell companies, and nobody will be able to track down who really owns everything... or who is ultimately responsible for any illegal activities they’re up to.
Unnecessary Expense Makes Us Sad [200CP] (Outlast)
And because you don’t want to be sad, or make your employers sad, you are very good at minimising the expenses of any activity. This includes covering up accidents and other incidents that could lead to litigation."
400,Unhallowed Messiahs Raven-Black Tongue,Exalted: Abyssals,"As the holy spiritualists of the Abyss, the Scions of Resplendent Darkness are expected to
spread their dark brand of piety in Creation as well as in the Underworld. They teach mortals
the proper respect for and veneration of the dead, and help the living to accept the simple
fact that they too must die someday. Once the living finally come to accept that, they’ll
realize that there’s no point putting off until tomorrow what could just as well come today.
While any of them in Creation could have death cults grow like tumors around them, you
have a particular talent for converting people and awakening fanatic devotion. In your wake,
cults of death or people's ancestors pop up with disturbing regularity, merely through a few
words germinating into an unholy ideal or an example set and followed by the living. With
your surpassingly eloquent speeches and preaching, even the most devout might come to
doubt their faith in the face of your dark theology. Needless to say, you will find it easy to
provide your circle with spies, assassins, essence, and a haven in the living lands."
400,Blood Ties,Horror Midnight Movie Marathon,"Your biological family is loyal to you. Exceedingly loyal to you. Like hide you as a serial killer, or even join in to avoid being parted from you loyal. This is strongest on your next of kin, who can be trusted to side with you against any and all outsiders almost universally, and who short of extraordinary temptation would never betray you, but it will still apply outwards through the generations. Get enough steps removed and it will stop, but the more shared genetics they possess the stronger the effect, and the more naturally inclined to loyalty towards you they will be.
This goes well with the fact that inbreeding is now less detrimental to your line. Oh odd
traits and phenotypical exaggerations will still show up, but outright deadly or crippling
disorders do not seem to spring from your line as a result of it intermingling with itself or
you as its root. In fact your children, and their descendants, can inherit reduced versions
of your special powers and biology though the further they get from you the weaker these
powers will be with inbreeding bringing them closer to your original. This won’t grant
purely narrative perks or the like, nor will it grant knowledge or skills, though they will
gain a natural aptitude and increased learning speed in reaching your perk granted skills
or at least a reduced version of them."
