Cost,Perk Name,Source,Description
0,Create Quasi-Apostle [100CP*],Berserk,"You are capable of granting other creatures the powers of Apostles, without forcing them to go through their own transformation. To do so, you have to physically touch them and impart your power. The powers they gain are thematically tied with their own personality, physical forms, and beliefs, but the specifics are not up to you. The powers gained are chosen from this list of Apostle powers. There is no limit on the amount of individuals you can grant powers to in a single week, but you can only grant a maximum amount of CP equal to the amount you purchased this power for, divided up among the different people you grant powers to. At the beginning of each week, this “power pool” replenishes.
Those you grant powers retain their own personalities, memories, and desires, but are fueled by the demonic instincts which gave you your own powers. The more they use the powers you granted, the more they will be perverted by desires of power, control, and subjugation.
(Editor’s Note: The Apostle powers list can be found in the Berserk jump.)"
100,Spirit Tuner,Elden Ring,"Spirit tuning goes beyond simply imbuing strength, but as an art lies somewhere between tuning an instrument and conducting a conversation-leaving both parties enriched. Even tormented souls can find respite from their damnation through spirit tuning, and more usefully on the battlefield summoned spirits of all kinds are made more powerful overall by it.
You’re one of the few with the innate talent for this art as well as a fair amount of experience. By buying this perk here, this also grants you a large field of graven glovewort-the flowers used in spirit tuning-which can optionally become a Warehouse attachment."
100,Staying Awake,Don’t Rest Your Head,"You may make others Awake by forcing someone else not to sleep for around
a week. They will receive their own relevant Madness and Exhaustion talents as well as the advantages of being Awake. Here, it’s hard to see how this is a good thing, but perhaps in worlds without Nightmares you’ll find it more pleasant. Note: You probably should be careful who you make Awake, or they might just end up turning into Nightmares."
100,Staying Awake,Don’t Rest Your Head,"You may make others Awake by forcing someone else not to sleep for around
a week. They will receive their own relevant Madness and Exhaustion talents as well as the advantages of being Awake. Here, it’s hard to see how this is a good thing, but perhaps in worlds without Nightmares you’ll find it more pleasant. Note: You probably should be careful who you make Awake, or they might just end up turning into Nightmares."
200,Master of Slaves,WHF: Tomb Kings,"To construct the immense tombs and monoliths you were ordered to create, you needed the
assistance of countless labourers and workers. You could not construct it on your own but you could only motivate a force of thousands to work on your own, without a single rebellious action being taken against you by any less than a real heroic sort, you can also turn even uneducated slaves into an effective work force. They are unlikely to know what they are doing or how it should be done but under your watchful eye, they will not make mistakes and will work as if using your own two hands."
200,Mental Bond,TES: Magic,"One thing that is often forgotten about the School of Conjuration, is that telepathy can be used on more than just summons. By performing a short and easy ritual, you can permanently mark anyone you desire and create a telepathic link with them. This link cannot be broken in willfully, and you can even communicate with them from entirely separate dimensions."
200,Accelerated Growth,Jurassic Park Books,An impressive modification that Wu made was the accelerated growth of the animals. The most impressive part is that he was able to maintain this growth without increasing their dietary intake. This means that his animals grew between two and five times as fast without any additional resources. You have studied this concept and learned to apply it to your products and creations. When you apply this there will be no negative effects from the growth rate such as a lowered lifespan. You may apply this effect to yourself as well if you have any powers that grow stronger as you age.
200,Voice For The Voiceless,Grime,"For those who exist without a voice either by their origin or an event that caused such a state...You can designate someone by sight and have the ability to give them a ‘voice’ that they can use to communicate with you.
It may be weird for them to vocalize either for the very first time or after so long, but it is made to where they can grow comfortable with it. Of course, this works better if the person is of the mind to talk and if they do wish to engage…"
200,Conceptual Fertilization,Fate/Legend: Garden of Avalon,"The secret art of Conceptual Fertilization is one that may seem a bit strange and even unnatural to those not as invested as you in the mystic arts but...well, they don’t complain so much when you show them the results. Conceptual Fertilization refers to a very rare magical ability that allows one to combine two things during the creation process of one of those things, transferring the qualities of the second thing onto the first. Combining the blood of a dragon with an infant in the womb to grant them the magical power of that dragon as they grow up, for instance. With time and further mastery, it may even be possible to combine more than one thing in this way, though one cannot begin to think of the sacrifices the failed attempts might cause. Additionally, you find that you are also able to perform this process on other things in their creation process, not just living beings, allowing you to infuse weapons or other objects in the process of being created with the traits of other things."
200,Summoner,Terraria: Journey’s End,"A special branch of magic focuses on summoning minions and sentries to fight at your
command, and you are a master of it. Summons that you call forth will be stronger and more
clever, and you also have an understanding of how to take bits and pieces from monsters or
enemies and figure out how to use them to create new ‘summoning weapons’ to call versions of them to fight for you."
200,Trickle-Down,Abara,"You find that those who work under you gradually adapt to fit your leader style. If you’re cold and secretive, they’ll naturally become more intimidating. If you’re compassionate, they’ll become more charismatic. If you’re especially zealous, they’ll gradually adopt your passion and philosophy, etc."
200,Reimplementation,Blame!,"As the Governing Agency’s power has dwindled over time, more and more of their former
privileges have been revoked. While the Governing Agency could formerly reboot bodies in a
fashion similar to how TOHA Heavy Industries reboots clones, they can no longer perform this reboot on a body as complex as yours. However, the same does not hold true for your minions. Should mundane creatures which are subordinate to you fall – your invisible helper can extend their aid by resurrecting them in the same place they fell. This only works once however, so if you care for your underlings – maybe you shouldn’t let them die in the first place."
200,Trickle-Down,Abara,"You find that those who work under you gradually adapt to fit your leader style. If you’re cold and secretive, they’ll naturally become more intimidating. If you’re compassionate, they’ll become more charismatic. If you’re especially zealous, they’ll gradually adopt your passion and philosophy, etc."
200,Reimplementation,Blame!,"As the Governing Agency’s power has dwindled over time, more and more of their former
privileges have been revoked. While the Governing Agency could formerly reboot bodies in a
fashion similar to how TOHA Heavy Industries reboots clones, they can no longer perform this reboot on a body as complex as yours. However, the same does not hold true for your minions. Should mundane creatures which are subordinate to you fall – your invisible helper can extend their aid by resurrecting them in the same place they fell. This only works once however, so if you care for your underlings – maybe you shouldn’t let them die in the first place."
300,Template Maker,Generic Summoner,"An interesting technique, you have the capacity to develop and create Templates, a series
of adaptations and minor mutations that can be applied to a creature as you summon it. These can range from simple environmental adaptations to allow a creature to, for example, survive underwater should you find yourself deep below the surface, or they can be more generalized, such as a Template to enhance the natural armaments a creature has while bolstering their speed for a combat buff.
Creating a Template requires you to collect a resource, which this perk allows you to see and interact with, that pools in areas where the Template would allow a creature to thrive. A former battlefield, for example, would help develop a Template to improve combat abilities while a volcano would give a Template to adapt a creature towards living around flames and lava. This resource can then be used to construct the template over time, similar to the methods of the Imagination Summoner Archetype.
To start, you’ll only be able to create minor Templates with limited effects, however, with practice you will be able to push your skills to allow you to develop more potent and complex Templates, opening up newer and better options in time. Do note, however, that applying a template adds an additional drain to the summoning.
At first, you will only be able to apply a single archetype at a time to a single creature at a time, but over time you will be able to apply them to more creatures and more of them to any individual creature.
(Editor’s Note: Like other perks from the Generic Summoner jump, I suggest tweaking the description to better fit with the Darkest Tome and scale to your discretion. Though in the end, it’s purely up to you.)"
300,A Familiar Friend,Generic Summoner,"A summon isn’t always a tool for a summoner, sometimes, they are a friend. However,
summons rarely grow beyond the bounds of their innate abilities and can be outstripped by other, newer summons. Well, you have changed that! You are able to designate a single summon as a Familiar, granting it the ability to grow as you do, getting stronger, unlocking new abilities, and developing as you grow in power and strength yourself.
Such a summon is also unbound by the normal limitations of summoning and can remain active indefinitely, go beyond the normal bounds a summon can reach, and similar such limitations, even if you do not have the perks to allow your summons to do so.
Additionally, as you grow in power, you will be able to apply this perk’s effects to additional summons. By default, this is one per jump, applied retroactively.
(Editor’s Note: Like other perks from the Generic Summoner jump, I suggest tweaking the description to better fit with the Darkest Tome and scale to your discretion. Though in the end, it’s purely up to you.)"
300,Investiture,Generic Necromancer,"Raising the dead quickly to amass an army is an easy thing to do, any necromancer worth their salt could do so, and yet, the truly renowned necromancers often spend months creating a single undead, investing great amounts of time, effort, and resources into their creation to get a powerful ally. Now, you can do the same. By spending more time, effort, and resources on creating something, you can make it better in a wide variety of ways.
By default, this is a general, nearly equal boost in all categories, however, given time and practice, you can direct the areas this boost is applied to and potentially develop new expressions of abilities the creation would possess. This does not simply apply to the creation of undead, but anything you can create. Even artifacts, spells, food, or fortifications can benefit from this perk. This is proportional to the time it would normally take to create whatever you are using the perk on. Something taking months normally would see a smaller boost if done over a year than something that’d only take minutes normally."
300,Grafting,Generic Necromancer,"You know the process behind taking the dead flesh from a creature and implant or attach it to a living creature to impart some quality from the donor creature to the living one, as well as how to use necromancy to jumpstart the biological processes that allow the flesh to merge with the creature and avoid rejection. Grafting is a complicated but potent skill that allows one to gain incredible strength by simply taking from the creatures they slay and applying them to themselves or other creatures. You could, for example, take the scales of a dragon and graft them to a creature to impart the resilience and fire resistance of the dragon donor, or you could take the blood of a hydra and find a way to graft it to a creature to render their blood poisonous and impart the healing abilities of the hydra to them, in a lesser form. Given time, you may even be able to create new bodies entirely from grafted flesh, which you could then animate to create unique forms of undead."
300,Empowered Summons,Generic Summoner,"When you summon a creature, you are able to integrate other powers into the summon to empower the summoned creature. For example, if you had access to a spell that would grant the target increased physical strength, you can incorporate that effect into your summon to grant them improved physical strength. If you then learned how to make a potion capable of inducing regeneration, you could incorporate that into the summon to grant them regeneration or the ability to produce a healing substance that induces a weaker form of the effect. You can incorporate multiple such effects at once, but each one adds up any resources that would normally be drawn from you to use them or some of your physical, mental, or magical stamina.
(Editor’s Note: Like other perks from the Generic Summoner jump, I suggest tweaking the description to better fit with the Darkest Tome and scale to your discretion. Though in the end, it’s purely up to you.)"
300,Blue Nights,Dorohedoro,"Normally a power reserved only to Chidaruma’s use, you too are capable of forming ‘contracts’ inside of people. These contracts act as organs of the involved parties, and by using a special tool that you can summon, you can extract said contracts and exchange them between two individuals, making them ‘partners’.
If both individuals are willing, they will gain a general awareness of the location of their partner and their wellbeing. If forcibly torn, they will just regenerate over time, faster the closer they are to their partner. But if one of the parties is unwilling, the forced party will instead be brainwashed into becoming loyal to the willing party.
As you are now, the effects of this ritual only last for four years, although you may find ways to improve it. Individuals with a powerful will may refuse the contract’s effects to the point of killing themselves, although such cases are extremely rare. You can also revoke the effects of the contracts you have made at any time."
300,Patronage,Generic Necromancer,"Powerful undead are known to be able to grant some measure of their strength to living
servants, either to act as generals for their armies or to aid in something the living can do that the undead cannot do so easily. And some necromancers have learned to emulate this ability before they become undead themselves.
With this perk, you gain a single thread of power that you can invest into a creature to empower it until such a time as you choose to revoke the power from them. The abilities developed will begin largely random, a combination of your own influence on the power and the innate potential of the individual you have invested the power into creating a unique expression of the power in question. Such powers will always be weaker than you. Undead, animals, and other unintelligent creatures will usually gain a boost in intelligence from this investment which may persist even after the thread of power is reclaimed.
(Editor's Note: The full details of the perk can be found under the perk’s name in the Generic Necromancer jump.)"
300,Evolutionary Summons,Generic Summoner,"Your summons are capable of growth beyond merely learning to apply their existing abilities or training, they can become something greater than they started as. As your summons are used, they develop and become stronger, eventually plateauing in their growth. Once they reach this plateau, you are able to induce an evolution in your summons, causing their form to change and their base abilities to become stronger, but resetting them back to their base level in the process. This is often signified by minor changes in physical form or an increase in size. This can be repeated multiple times.
It is possible to use this on creatures other than your summons, including yourself, however, doing so will effectively weaken you in the short term to offer you greater potential in your growth.
(Editor’s Note: Like other perks from the Generic Summoner jump, I suggest tweaking the description to better fit with the Darkest Tome and scale to your discretion. Though in the end, it’s purely up to you.)"
400,Big Picture,Lords of the Night: Liches,"Sometimes when telling a story, you don’t focus on an individual element, but on elements that touch on everything in the scene, keeping the whole mosaic you’re making in mind. You can dream such dreams with your Sorcerae. You excel at wielding luck, fate, blessings and curses, and other such immaterial elements that affect what will happen, rather than more material elements. You could bless (buff) a swordsman with skill, a field to grow healthy crops, and an army with skill in battle. You could also do the reverse, casting dooms (debuffs) on individuals, or kingdoms. For the purpose of this perk, effects that create disasters and wide-scale hazards count as ‘curses,’ and those that do the opposite kind of summoning are ‘blessings.’ Not only does it seem that you have a second store of Arcane energy equal to your normal one just for such works, one that refills with blinding speed, but all such works count as if they were a spell you knew, of a level you could cast, of a permitted school when determining the cost in Arcane energy to cast them via Sorcerae. The ripple of disturbance for such effects is greatly suppressed such that it’s almost impossible to detect your use of the Arcane in such ways. Lastly, if you could succeed at such a Sorcerae, you will with grace and panache. You might call it a ‘natural 20.’"
400,Innate Talent: Enhanced Summoning | Specific Specialisation: Summoning,Overlord (The Series),"Innate Talent: Enhanced Summoning [200CP] (Overlord (The Series))
You possess the good fortune to have an Innate Talent. Innate Talents are abilities that people are born with, and usually only one in two hundred people will actually have one. They can run the gamut of all sorts of things, though there is no certainty people will be born with an ability they will actually be able to make use of. For example someone born with an innate talent for learning magic doesn’t actually help them find a magic teacher, and thus some innate talents may go to waste. Thankfully for you you can choose what Innate Talent you have from the following list. You possess the unheard of ability to have more than one Innate Talent, assuming you purchase more than one.
Enhanced Summoning - All summoned creatures you call forth will be 50% more powerful, stick around for 50% longer if the summon is duration based, and will cost 50% less magic to actually summon. Only works on creatures you summon with magic, creatures you create with magic don’t count. Discounted with Summoning Specialty.
Specific Specialisation: Summoning [200CP] (Overlord (The Series))
You can purchase this perk more than once, each time you do so you can specialize in a specific branch or theme of magic. You will then be capable of spells of greater potency, scope, power, or so forth within that specific theme. The spells and magics you learn via these choices will always be superior than the ones you could learn without them, often being cheaper to cast, more powerful, larger in scope, or so forth. Taking a specialization doesn’t make you worse at things outside of your specialization, it just makes you better at the things you specialize in.
Summoning - You are really good at summoning magics. Creatures you call up are more powerful, longer lasting, and often tend to have special abilities they wouldn’t otherwise have. Maybe you called up frost wolves that have a chill aura rather than regular wolves, or maybe that fire elemental you called up can spawn more of itself that will then also fall under your control. This explicitly works with summoning magic you know even outside of this jump, granting your summoned creatures extra strength and abilities thematic with their nature. If you were to purchase this alongside the Augmented Summoning innate talent your magical summons would be fearsome indeed. Why bother dealing with something yourself when you could send a disposable minion to do it for you? The perfect ability for masterminds (or the lazy). Summons made via the Ranked Magic system are perfectly loyal to you unto death, and you’ll find that with this that loyalty applies even to summons via other magic systems. Creatures and beings of godlike power, however, may be able to resist the enforced loyalty clause. Summon Mab or Cthulhu at your own risk. Additionally most summons are temporary, and the enforced loyalty is only in effect while they are serving as your summon. Keep in mind when using summons from other jumps that some summoned creatures have long memories, and may seek you out on their own if they feel you abused your influence over them."
400,Summoner,Rise of Legends,"This is perhaps the most famous talent that the Alin are known for; almost every major figure of the Alin has some summoning skills through their magic. You’ve embraced this oldest of traditions, and your skill at wielding this power is extraordinary indeed. Any abilities you use to summon magical beasts or elementals will be twice as effective, with the specific advantages chosen by you at the time of use. The most straight-forward advantage would be to summon twice as many creatures to your side, but you could just as easily choose to strengthen your creations instead, or perhaps grant them some limited magical powers of their own."
400,The Gift of Names,Fate: The Island of Sin,"When Morgan began gifting her Tam Lin with names from Proper Human History, it served several purposes—ones that are now available to you, too. The first is that it allowed her to partially merge the Spirit Origin of a Heroic Spirit from Proper Human History into her knights. Now, you can create this fusion for other people, layering a part of the “concept” of the chosen Heroic Spirit from Proper Human History atop your target and turning them into a faerie knight, a Tam Lin (even if they aren’t a faerie). This gifts them with a skill or ability possessed by that hero, although it is not of as high a rank as it was for the original.
Secondly, bearing the name of a hero from Proper Human History allowed her knights to distance themselves from their own true nature as nascent Calamities. Those you gift a Tam Lin name to will receive a superior version of this; any racial or inherent weaknesses they may possess will cease to have an effect for as long as they are known by their title as a Tam Lin, rather than their original name. They will likewise find that they have an easier time fighting against any urges of their base nature they may possess, such as the drive to destroy a nation.
Thirdly, it obscured the original name of the Tam Lin. Those you have gifted a Tam Lin name to will find that even people who already knew their original name are unable to remember, hear, or even read it. Know that this is a deceptive effect, so abilities such as Fae Eyes will see straight through it and remember it clearly. Furthermore, once someone manages to openly reveal a Tam Lin’s true name, this method of hiding that their name ceases to have an effect on anyone for the rest of the jump, although they will not lose their abilities if their true name is discovered. This will also serve to hide your Tam Lin’s true name from those who have some method to discover it, unless that individual also possesses the means to see “the truth” of things.
Unlike the original, those who bear the title of Tam Lin will be able to toggle these effects on and off, making themselves “normal” again if they would prefer to be, and reassuming these powers when they want them. You cannot gift yourself a Tam Lin name."
400,Ambitions of the Dead,Loop Hero,"The novice necromancer dreams of an endless legion. You know that quality is what really counts. In your hands, an ordinary pile of bones can be reshaped into powerful, specialized undead creations. And when your creations slaughter, they draw on the necromantic tide to become more powerful still."
400,Ritual Master,The Elder Scrolls Series,"Magic is a delicate force, one that cannot be properly expressed in spells that only take a second to cast. You can now perform rituals that increase a spell's power tenfold, and potentially even higher. All it takes is the right know-how, the right supplies, and enough magicka and skill to pull it off."
