Cost,Name,Source,Description
0CP,Powers,Chronicle,"What would you do if you had the power to do whatever you want, Jumper? No matter what 
your answer to that question is, you’ll be able to prove it to the world soon enough. Through 
strange means, you have gained the potential to do great things, though you might not notice it 
for the first few weeks. But after some time, you will come to realize the existence of what might 
be described as a new sort of muscle. One that allows you to use a power commonly called 
telekinesis in fiction. After you first begin to use it, even moving a baseball around for a few 
seconds will be too much overexertion, the strain making your nose bleed. But like any other 
muscle, this one can be trained as well. Throughout the course of a few weeks, if you trained 
regularly, your power would grow by leaps and bounds, allowing you to easily move around 
cars, fly, or create a protective forcefield around yourself. And just a mere month after that, you 
would be able to throw around buses like they weighted nothing, easily fly through skyscrapers 
without harm, and create telekinetic pulses and vibrations to push away dozens of cars or 
threaten the structural integrity of multiple high-rises. If you kept at it, who knows how much 
stronger you could become.  

If you want to, you may instead gain these powers from a strange crystal, far down a hole in a 
Seattle forest, perhaps alongside a few others, some teenagers or your companions. That will 

cause you to develop what could be called a psychic connection: should one of you experience 
an extreme emotion such as anger or fear, your nose will start bleeding heavily as if you had 
overused your powers, and you will even start to vaguely hear voices and sounds around them. "
0CP,Airburst,My Hero Academia,"The user is able to compress small quantities of air into marbles and
project them. The marbles rupture on contact with something, popping with the force of a
large balloon.
The marbles even sound like popping balloons, leaving them a startling, attention
grabbing distraction but ultimately harmless. The user must hold their breath while
collecting and throwing these marbles of air, requiring strong lungs."
0CP,Anesthetic,My Hero Academia,"The Quirk user is able to temporarily numb a portion of themselves or
another living creature by poking them with their fingers.
This poke feels like a minor prick, and causes a small area around the point of
contact to lose sensation for a period of ten to twenty minutes. Target is not inhibited in any
way otherwise. There is a small cooldown between each activation of this Quirk."
0CP,Badger,My Hero Academia,"This Quirk grants the power to lengthen and harden the user’s nails a bit
on command. This can be helpful with peeling tags, clawing people, poking through plastic,
scratching a particular itch and so on. Comes at the expense of the effects not being very
potent."
0CP,Barbs,My Hero Academia,"The user is able to cause small thorns to sprout from inanimate objects
they touch, around an inch in length each. They can cause barbs to appear up to half a yard
from their touch.
The thorns take on the hardness of the material they’re made of, meaning some
might be more dangerous than others, but not the toughness, as they’re persistently brittle.
This means thorns made of things that would ordinarily bend or dent like rubber or
iron will instead crack and crumble when enough force is applied."
0CP,Bendy Fingers,My Hero Academia,"The Quirk user has a heightened range of movement within their
fingers, allowing them to bend backwards and side to side as easily as normal fingers could
be curled forward. This heightened flexibility and dexterity is exclusively in the fingers."
0CP,Big Horn,My Hero Academia,"The user of this Quirk has a large pair of horns of whatever shape and
size they desire. The horns are incredibly strong, needing industrial equipment to break.
The user’s skull and spine are also strengthened, which in combination with the
horns allows the user to charge, batter and slam their horns and heads into enemies with
less personal risk of harm.
The horns due to their size can often get in the way. Horns heal over time if severed
unlike other body parts, but do so somewhat slowly."
0CP,Blade Arms,My Hero Academia,"The user, as you guessed it, has the ability to sprout short metal
blades from their arms. The metal blades have about the same general sharpness and
strength as a normal knife.
The user’s primary limitation is the fact that they can only sprout the blades from
the backs of their arms and they’re rather short, making them a bit awkward to use."
0CP,Booze Hound,My Hero Academia,"The user of this Quirk is acutely aware of alcohol in their area,
being able to detect general location, strength and amount fairly easily.
Someone with this Quirk would be able to easily make out the blood alcohol content
of someone if they have doubts of their sobriety, or hidden wine or booze when
interrogating.
The strength of the Quirk is such that someone soaked with alcohol could be reliably
tracked as well. The user of this quirk can start getting tipsy if the sense is left active too long."
0CP,Brail,My Hero Academia,"The Quirk user has a heightened sense of touch that has a complex
interaction with the language processing sections of the brain. Through this, the Quirk user
is able to read from physical mediums of writing such as magazines or books by simply laying
their hand on the cover.
The Quirk user must know the language they’re attempting to read. Doesn’t work
with text not recorded in a physical medium, such as that on a computer screen. Only a few
times faster than reading it through ordinary means."
0CP,Censor!,My Hero Academia,"As opposed to most Sensory Quirks, “Censor!"" allows the Quirk user to
deprive themselves. The Quirk user has the capacity to blur or censor things within their
perception.
Erasing the sight of something within vision as if covering it with marker, dulling
scents as if stuffing your nose, distorting sounds as if throwing them through a filter and
more.
As this only allows the Quirk user to ignore things, it is usually more of a tool of
convenience rather than true utility. You are only able to censor things within your
perception, not the perception of others."
0CP,Coating,My Hero Academia,"The user of this Quirk is able to smooth over whatever they touch, giving
it a slippery, shiny surface as if given a wax polish. This can be used to reduce traction and
cause accidents.
The user of this perk needs to be able to press and wipe their hand across something
to smooth it, needing it to already be solid and firm. Damage to an object’s surface reverts
the effects."
0CP,Confetti,My Hero Academia,"This Quirk bestows the ability to manipulate pieces of paper after the
Quirk user has come into contact with them. Their control is such that they can manipulate
many pieces over a wide area, making folds and cuts as desired to shape and split it up.
Confetti is unable to manipulate any one piece weighing more than a standard piece
of notebook paper however, such as a magazine or a poster. The Quirk user loses the ability
to manipulate paper that’s been wet too much, the paper’s integrity failing and weight
becoming too great."
0CP,Curveball,My Hero Academia,"This Quirk allows the user to apply a delayed rotation to small objects,
designating the direction at that time. This rotation activates the moment the object begins
to move at any significant speeds, and will scale in speed with the speed of the object.
The Quirk may be activated and applied through one degree of separation, such as
through striking something with a club or bat. The effects of this Quirk end once the object
affected comes to a stop, after initial activation."
0CP,Four Arms,My Hero Academia,"The user of this Quirk has four arms, obviously. These arms are all
exactly the same in strength, length and so on. The user can obviously hold more things or
punch with more limbs.
The user of this Quirk will still have a preferred side like normal people making them
more handy with their right or left side. The extra arms may make tight corridors a problem."
0CP,Graffiti,My Hero Academia,"The user is able to change the color of whatever they touch to any color
in the rainbow and spread that color as they please from the point of contact up to a meter.
Despite the colors of the material actually changing, the effects can be removed as if
it was wet paint with moisture and a little pressure such as water, sweat and skin oils. No
residue remains."
0CP,Green Thumbs,My Hero Academia,"The user of this Quirk can transform their thumbs into long,
prehensile vines with leaves growing off of them and full sensations.
This can be used to grab or thwap thing near the user, as well as having a limited
capacity to soak nutrients out of soil, water and light, though certainly not enough to live.
The vines aren’t quite as durable as a human thumb, and if cut or damaged severely,
the user will experience intense pain. They have a length limit of five meters."
0CP,Gyrate,My Hero Academia,"The Quirk user has the ability to rotate their body parts independently of
one another at potentially high speeds. The Quirk user can get hurt due to their otherwise
normal body attempting to rotate when stuck, or colliding with hard objects.
This Quirk treat clothing over rotating body parts as an extension of the body part.
The Quirk user may become dizzy if they spin their head or eyes, having no resistance to this."
0CP,Hammerhead,My Hero Academia,"The user of this Quirk has small, vertical lines going across their
face and nose allowing them to sense electricity within a couple meters in front of them,
double that in water.
This allows the user to search for hidden lifeforms or electronics that would be
otherwise hidden from sight, smell or sound. The relatively short range limits its
effectiveness unless the user already has a general idea of what they’re looking for though."
0CP,Hardening,My Hero Academia,"The user of this Quirk is able to harden any part of their body. This
protects them against not only physical force, but also heat and shock.
Such protection is minimal to start, but as with most Quirks can be trained up
tremendously. Hardening effects can be worn down with repeated abuse."
0CP,Hay Fever,My Hero Academia,"The user is able to produce a pollen-like powder from their body,
blowing it away into the surrounding area and triggering allergy-like symptoms in whoever
breaths it in.
This can excess mucus production, watery eyes, inflamed sinuses, itchy skin and
similar affects. The user of this Quirk is not immune to its effects, requiring protection."
0CP,Headlights,My Hero Academia,"The user of this Quirk is able to collect and manipulate photons inside
their eyes and then use them to shine beams of light later on, like personal flashlights or
headlights.
The user of this Quirk is able to concentrate or widen the rays of light, which allows
them to potential beam lasers into someone’s eyes to temporarily blind them.
The user is heavily limited due to needing to recharge regularly and being unable to
see out of an eye when they’re using their powers, necessitating the need to use only one
eye at a time if they wish to use it to light their way."
0CP,Hedgehog,My Hero Academia,"The Quirk user is born with large metal spikes growing from their back
which become larger with age. The spikes will fall out if the Quirk user becomes too cold,
and will not grow back. They’re ordinarily about as hard as iron."
0CP,Ice Cube,My Hero Academia,"This Quirk allows the Quirk user to produce perfectly chilled ice cubes
by shaking a closed fist, causing them to fall out of their fist. Crushed ice and dry ice are
options.
Ice Cube uses body moisture as a resource to generate ice. Several average coolers
could be filled before the quirk user starts getting thirsty."
0CP,Interject,My Hero Academia,"The Quirk user has the ability to disrupt a target’s chain of thought by
interrupting them as they speak. This causes them to completely lose track of whatever they
were talking about, allowing the user to stop speeches or arguments in their tracks. No long
term memory effects."
0CP,Leaf Manipulation,My Hero Academia,"The user of this Quirk has to power to project leaves from
their surroundings as small, sharp blades at a target. Able to shoot many at once with
relative ease.
They have no real control over the leaves beyond shooting them, and their lack of
real mass doesn’t make them very dangerous for the most part. No ability to generate leaves
or very difficult to project heavily damaged leaves."
0CP,Lighter,My Hero Academia,"The user of this Quirk is able to able to produce flames over their thumbs
by snapping, using the air in their lungs as fuel.
Using this Quirk allows one to either sustain a small flame for a bit by parceling out
their breath, or blow it all away in a small fireball that leaves themselves breathless. Limited
by lung capacity."
0CP,Little Pompeii,My Hero Academia,"The Quirk user has the ability to produce and control ashes from
their finger tips. Little Pompeii seems to provide an immunity, or strong resistance, to
degenerative side effects of smoking. Fingertips glow orange while active.
Ashes are hot to the touch, but lack so much mass and are hard enough to produce
that not much can be done with them other than ignite already highly flammable materials."
0CP,Love,My Hero Academia,"The Quirk user is able to directly enhance the strength, speed and resilience
of a single individual by declaring their love for them. The potency of the enhancement
scales directly with the amount of love felt towards the target, having no effect on strangers
or those disliked by the user.
The Quirk may only be used once every 24 hours. The target must be within range to
hear the Quirk user’s declaration. The enhancement is temporary, lasting a moderate length
of time before wearing off."
0CP,Love Lucky,My Hero Academia,"This Quirk automatically cross compares all known traits, features
and knowledge collected on two individuals that is present within the user’s mind, even if
‘forgotten’, and measures compatibility based on such information.
The Quirk is used by observing the two people in mind and activating it. After a
moment, the user’s vision will tint a certain color to indicate the general level of
compatibility. White tinted vision indicates the highest possible compatibility while black is
the lowest. (Other colors are up to you.)
The Quirk is only as good as how well the user knows the two targets. The
information on how compatible they are as individuals has no inherent benefit, but can be
used to partner potential friends together for teamwork purposes or play matchmaker."
0CP,Mochi Press,My Hero Academia,"The user of this Quirk possesses a long, thin tail ending in a
cylindrical club that they can use like a mallet to mash things into a sticky, soft solid.
This Quirk is able to mash liquids, completely dry powders, grains and any solid soft
enough to pound and mash into the same dough-like texture after beating it enough.
This Quirk is heavily limited by the tail’s own durability, leaving the user unable to
affect anything too hard without damaging their tail. Repeated use can leave tail muscles
sore."
0CP,Mustard,My Hero Academia,"The user of this Quirk has small antennae that give them an acute sense
of gravity, allowing them to always tell up from down even while disoriented.
This inherently gives better coordination as the user is able to twist and flip while
always knowing up from down. It also gives a general sense of day and night by sensing the
moon’s pull.
The user of this Quirk gains no inherent additional agility to better make use of their
Quirk, needing to become better at it themselves."
0CP,Negative,My Hero Academia,"With a touch, allows the Quirk user to flip an object or person’s color
palette as if to turn it into a photo negative. Persons affected by this Quirk also view the
world this way, seeing light as dark and dark as light, highlighting objects normally hidden in
the scenery.
This can usually be more of a negative than a boon. Only lasts several minutes at a
time. Unable to affect objects larger than a refrigerator."
0CP,Orbit,My Hero Academia,"The one born with this Quirk naturally has a gravitational pull, passively
pulling small objects towards the user and into a steady orbit around them.
The holder of this Quirk is able to change the part of their body that emits this field
such as to their head or hand, but cannot shut it off entirely."
0CP,Paralyzation,My Hero Academia,"The user of this Quirk is able to lock up the muscles of a target’s
body, paralyzing them. It can work on just about anyone, but has severe limitations with its use.
The user requires three seconds of sustained eye contact with the target before
activation. Additionally, either party breaking eye contact causes the effects to wear off."
0CP,Peeper,My Hero Academia,"The Quirk user has x-ray vision, allowing them to see through solid
objects and surfaces to peer at what’s beneath. The thicker and/or denser something is, the
more difficult it is to see through. Perception of what lies underneath becomes blurrier and
unclear.
Difficulties begin with anything thicker than your pinky finger. You really should be
careful where you’re aiming this. Some things are better left unseen."
0CP,Pepper Breath,My Hero Academia,"The user of this Quirk’s saliva induces a chemical reaction with the
stomach acid of others. If the user can get them to swallow it, it will temporarily produce a
thick smoke.
This smoke is unsavory, causes a bit of coughing and can cloud vision for the one
expelling it. It also makes them look like they just got done eating something rather spicy.
This Quirk is dependent on the user kissing a target or otherwise getting their spit in
their stomach, making it difficult to say the least. The smoke produce varies based on spit
swapped, lasting between ten seconds and a minute."
0CP,Permeation,My Hero Academia,"The user of this Quirk is able to become intangible, causing
everything to pass through them harmlessly, with many conditions and caveats.
When the user sinks into an object with their power and deactivates their perk,
they’re shunted out due to matter being unable to overlap, popping them back up on the
surface.
The major limitation is obvious, the user causes everything to pass through them,
including light, air, varying small particles, vibrations and so on.
This essentially causes their senses to stop functioning due to lack of input until the
user shuts off their Quirk. This can be incredibly dangerous due to the user being unable to
breath, hear or see."
0CP,Placebo,My Hero Academia,"This Quirk allows the user to create small, strangely patterned pills from
their hands. Those who swallow one of these pills increase their suggestibility, making them
more likely to believe the Quirk user over what the pill is supposed to do.
Despite the odd appearance, these are just synthesized sugar pills with no actual
effect on the biology on most creatures. The suggestibility may be broken if the target is
informed over the nature of the pills."
0CP,Radio Star,My Hero Academia,"The user of this Quirk is able to perceive and pick up on radio waves,
either listening to them internally or playing them from their teeth like miniature speakers
for others.
Using this Quirk, the user can listen to whatever songs or radio talk shows might be
on, tune in to police scanners, or potentially even listen in on secret radio communications.
The user has excellent reception, having twice the range of average radios while
picking things up clearly. The user can’t really shut the power off though, simply switch to
dead air when they want to rest, potentially meaning sudden unwanted static if someone
starts using their dead air."
0CP,Ringer,My Hero Academia,"The user of this Quirk can dull a target’s sense of hearing by slapping their
ears simultaneously, causing the target to hear everything as if they were underwater.
The user of this Quirk must slap both ears around the same time to activate the
Quirk. This Quirk lasts for five minutes before wearing off, restoring a target’s hearing."
0CP,Rule Breaker,My Hero Academia,"The Quirk user has the ability to reverse the gender of living
creatures, making males into females, and females into males. The Quirk user requires
physical contact with their target for ten seconds before they may activate this ability.
The Quirk user has the ability to reverse the effects the same way they applied them.
Those affected by this Quirk will revert to their original gender regardless after several hours
of time pass."
0CP,Scarface,My Hero Academia,"The Quirk user has the power to have their voice originate from any
point within a small radius around their body. This gives them limited ability with throwing
their voice and a particular talent with ventriloquism if they pursue that.
Coincidentally, the Quirk user is unable to open their mouth while making use of
their Quirk, and for several seconds after. This can be threatening if their nose is suddenly
sealed."
0CP,Season City,My Hero Academia,"The user of this Quirk is able to manipulate condiments or
seasonings found on most tables such as salt, sugar, pepper, ketchup and mustard.
The primary limitation of this Quirk is only being able to take control of one type of
thing at a time, as well as obviously being in short supply outside of a restaurant, store or
home."
0CP,Shadow Puppets,My Hero Academia,"The Quirk user gains the ability to manipulate their own shadow.
Stretching it, twisting it, shaping it, growing it, shrinking it and even adjusting the shade.
This Quirk does not give any unique properties to the shadow by itself. The Quirk
user has difficulty with growing their shadow more than twice its current size."
0CP,Soda Fountain,My Hero Academia,"The Quirk user has the capacity to turn water into another fluid
with a touch. This new fluid is selected at the time of purchase, and may be any safe to
consume fluid or beverage the Quirk user desires, such as vinegar, wine, or lemonade.
The quirk user is limited to converting up to a gallon of water into this new fluid at a
time. The Quirk user absorbs a small amount of water with each use, inhibiting extended
usage."
0CP,Stink Bomb,My Hero Academia,"The Quirk user smells just awful. The smell pushes into the nose and
can disorient people just with the wretching scent alone. It’s resilient enough to even
penetrate lesser filters. As a downside, it can’t really be turned off, not fully, you will always
smell pretty bad."
0CP,Sunburn,My Hero Academia,"The Quirk user is able to grab and peel off the thin surface of inanimate
objects. This allows the user to clean a dust covered shelf with a pinch, remove screen
protectors with ease or take off the charred surface of an overcooked piece of meat.
This ‘surface’ is usually pliable when being pulled by this Quirk, even when it
shouldn’t be, like the previous example of the dust covered shelf where the surface is a
collection of particles.
Difficult to use on the same surface more than once in quick succession. Few
noticeable applications outside of household utility and cleaning."
0CP,Sunspots,My Hero Academia,"The user of this Quirk can flash a light in the center of their palms for a
fraction of a second. If someone is looking into their palm during the flash, their vision will
be crippled.
The center of a target’s vision will be dominated by a bright purple circle, leaving
only their peripherals available. The circle lasts until the target blinks twenty times. The user
is unable to use their flash more than once every two minutes."
0CP,Telescoping,My Hero Academia,"The user of this Quirk is able to lengthen their spine and torso up to
five times its normal length, or contract it down to half its normal length.
This Quirk allows the user to essentially stretch themselves to grab on to high ledges
before contracting themselves back to normal, or shoot their upper body at enemies.
The user of this Quirk has no special ability to be used to the full height allowed,
making moving around with short legs unaccustomed to the extra weight and awkward
height difficult."
0CP,Trace Empathy,My Hero Academia,"This Quirk allows you to broadcast the way you feel, causing a
mental inclination to develop in all those around you to feel the way you do. With no true
control over how you feel though, the actual utility can often fluctuate."
0CP,Transparency,My Hero Academia,"The one born with this Quirk is completely transparent, invisible to
the naked eye. The user of this Quirk cannot shut it off or turn their clothes invisible
however.
Because of the user’s need to strip down to nothing at all, the risks inherent with
completely exposed skin like extreme heat or cold become readily apparent."
0CP,Uppercrust,My Hero Academia,"The user of this Quirk is able to create and spread a hard, jagged
material made of keratin among other things from their hands, allowing them to protect
their firsts or bind enemies.
The strength of this material is similar to fingernails, but can be layered to
strengthen it. The user is unable to produce much at once and the quality of the material
can degrade with stress."
