Cost,Name,Source,Description
200CP,Self-Molecular Rearranging,Kingdom Come,"You have super strength, and the ability to rearrange your own molecular structure. Making yourself
lighter or heavier or changing your height is possible with your abilities, and your strength grows and
shrinks with your height. Right now this is the only way to increase your strength, but maybe if you’re
smart you could think of other ways to increase your strength without needing to become bigger. You
have no theoretical limit to what you can grow or shrink, but 60 feet is the maximum height you can
maintain for a significant amount of time as of your current mastery of this ability. Further training is
needed to expand it. You can also manipulate your molecular structure to let you phase through walls as
well, in case you need to sneak somewhere instead of punching holes in walls.
You could also extend this ability to shift between the different states of matter, but to enter the state of
plasma will require an external energy source other than what this power provides. Furthermore,
changing your state of matter is past your current mastery of this ability, and becoming plasma is a state
of matter that has to be achieved separately past the other states of matter."
200CP,Shadow Manipulation,Kingdom Come,"You can manipulate shadows, merging with your own to slide across the ground or fly in the air and
possessing the shadows of others. You can also grow to a huge size as a shadow and create physical
items and shapes in a way similar to that of the Green Lantern ring. Your body also resists antimatter to a
degree as well, thanks to your exposure to the Shadowlands.
You also have telepathic abilities to a minor degree, able to speak in the minds of others and have them
reply back. No mind control, for one exception. You can make someone see the depths of their evil side.
All their horrifying thoughts, desires, and dreams. This could drive them to the brink out of remorse and
regret for their actions, or horrifically traumatize them. Or both."
200CP,Super Senses,Kingdom Come,"You’re not as strong as Superman or as fast as him...but you are his equal in one respect. You posses
super senses of his strength. Not only that, you’re able to freely dull or focus them if they become too
overwhelming. You’re able to hear clouds scrape together, to see tiny bacteria squirm on the ground,
heart the heartbeat of a man over half the world away, and other such wild feats thanks to your super
senses. But your senses are different from Superman in one respect--you have a sense for magic. You
can see and feel magic, and identify it. The strength and what sort of magic it is. You’ll have to gain
knowledge of magic to sense it, but that’s a nice ability still."
200CP,Wind Powers,Kingdom Come,"People will go on and on about how weak wind manipulation is, until they’re on the ground choking to
death and their mighty jets helplessly rolling in the winds at your mercy. Creating a hurricane is as easy
as breathing with your power. Your entire body can turn into wind, and carries all the immunities it implies.
You could level a building in seconds at the 350 miles per hour winds at your control. But unlike Red
Tornado, you have no android body.
But you can turn into wind to compensate. To harm you would be like harming the wind with all the futility
it implies, and you cannot be moved in this state except through your own will. People cannot use fans or
any other way to control your movements. You are an unstoppable force, and they will kneel to you. You
could also separate your windy self and escape through any cracks in this form, or turn parts of your body
into the wind. Become the greatest tornado of their nightmares."
200CP,Botanical Evolution,Marvel Age of Krakoa,"Whenever you’re injured, you heal back composed of
plants fungi, algae or moss, lichens, or similar things adapted to resist that type of
damage or otherwise create some small improvement.  The faster you can heal, the
faster this happens. The adaptions scale to what happened and are relatively minor to
start, unless a significant portion of your body is destroyed you won’t see more than
negligible improvement from any one instance of this, but adaptations stack on top of
each other and can snowball quickly: Over the course of billions of years the thresholder
Grove became the living continent Okkara and when killed her remains regenerated into
Krakoa and Arakko the living Islands. Rarely you may develop new abilities from this,
like Krakoa’s ability to control the properties of the plants and fungi it is composed of
and alter their growth at will or its ability to feed on psychic energy. Since you’re paying
CP for this, you can revert from your botanical form and return to it at will and limit its
size or how inhuman it becomes, if you aren’t interested in being a kaiju or genius locus,
and suppress any inconvenient adaptions until they’re needed. Even if your entire
nervous system is destroyed and replaced, you will still be you with full continuity of
memory, personality, cognition, and existence, and your botanical form and its
component organisms will contain your original self’s biological information and all of
its traits. You can control the cosmetics of your botanical form, and adaptions are saved
and automatically applied when other body parts are damaged.
Best of Both Kingdoms (100 CP, Required Botanical Evolution): Rather than
have a separate Botanical Form, you have a single form that combines the best traits of
your Botanical state and whatever you’d be without this power. You retain the ability to
appear “normal” at will, but other than factors of size or deviations in body plan this is
purely cosmetic with you retaining any adaptions you did not suppress and you can
manifest aspects of one form while in the other at will."
200CP,Cyberpathy,Marvel Age of Krakoa,"Your brain combines the best features of an organic brain and a
highly advanced supercomputer. This doesn't make you “smarter” per se, but it does
mean that you can store and perfectly recall an infinite amount of information without it
being distorted, process far more information from your senses than you otherwise
could, perform strenuous mental tasks for longer, and think at far faster speeds—twenty
times peak human at a minimum. The exact benefit scales up with your intellect and
combines synergistically with any and every other mental enhancement you might
possess."
200CP,Explodey,Marvel Age of Krakoa,"You have the power to generate fiery explosions centered on
yourself, with a radius of a few meters and power comparable to a conventional
incendiary explosive. You’re immune to the heat and force of your own explosions."
200CP,Aftershock,Marvel's Kid Heroes,"You can generate large amounts of electricity, and absorb the same. Toss around
electric blasts, give anyone grabbing you a bad time, even turn
into a person made of electricity to arc short distances or run
yourself through wires or metal surfaces, which you can also
stick to."
200CP,Aftershock,Marvel's Kid Heroes,"You can generate large amounts of electricity, and absorb the same. Toss around
electric blasts, give anyone grabbing you a bad time, even turn
into a person made of electricity to arc short distances or run
yourself through wires or metal surfaces, which you can also
stick to."
200CP,Brick & Mortar,Marvel's Kid Heroes,"You can turn into a person made of concrete, but can decide at any given moment how solid or liquid any part of it is."
200CP,Energy,Marvel's Kid Heroes,"You can disintegrate things and absorb some energy from them, glowing brighter and
brighter as you do so. With a charge, you can ﬁre power-balls
from your torso which arc however you’d like at launch and
explode on impact. Since a power-ball would be fantastically
lethal against a human target, you can instead ﬁre off multiple
smaller power-balls that only stun. You can even learn to ﬁre
off a power-ball that explodes into dozens of little stunners.
Finally, you can power up by absorbing energy straight. There
is an upper limit to how much you can absorb, after which you
cannot disintegrate things, and absorbing more energy would
cause you to bulk up, destabilize and eventually explode unless
you vent some of the power."
200CP,Hardball,Marvel's Kid Heroes,"You can create spherical forceﬁelds of varying size within a
relatively short range. You could give yourself boxing gloves,
or protect you or a few people nearby. You can also create
electromagnetic balls that disrupt electronics."
200CP,Human Torch,Marvel's Kid Heroes,"You can engulf your body in ﬂames, then ﬂy, and create ﬁreblasts, ﬁreballs and
very simple pyrokinetic constructs. You absorb heat
automatically and cannot be injured by it."
200CP,Ice Guys Finish First!,Marvel's Kid Heroes,"You have cyrokinetic powers letting you create ice and snow, to freeze things over a wide
area, even become a person made of ice."
200CP,Loa,Marvel's Kid Heroes,"You disrupt matter, allowing you to pass through.
Like the phasing, but things you pass through crumble to dust
right after."
200CP,Phasing,Marvel's Kid Heroes,"You can turn intangible, and apply this effect to a couple of people you’re touching. In this
state you can ﬂoat. Passing through electrical systems causes
them to short out, and you can wipe hard-drives this way."
200CP,Acid,My Hero Academia,"Acid allows the Quirk User to produce corrosive fluids from their skin,
adjusting its solubility, viscosity and acidity. This acid is strong enough to melt through steel
and stone at max.
The properties of this fluid can allow it to take both glue or lubricant, and even so
viscous it can form a temporary yet powerful wall. On the downside, it may melt your
clothes or other things it touches you don’t wish to melt if you aren’t careful."
200CP,Animal Mimicry,My Hero Academia,"The one born with this type of Quirk has an appearance, traits
and abilities based on an animal in the natural world, one you may choose upon purchase.
The various special abilities bestowed upon the one with this Quirk vary based on
animal selected, tending to be exaggerations of that animal’s natural abilities taken to the
next level.
Examples of such would be a Frog Human with a powerful extending tongue, wall
crawling, camouflage, super jumping and super swimming abilities.
Another example would be an Orca Human which would have great strength and
durability, as well as the power to emit concussive sound blasts.
The major limitations of this Quirk are based on the animal selected, but usually
severe. Aquatic Animal Humans need to keep hydrated for their own health way more than
other, while cold blooded animals often become extremely lethargic and weak in the cold."
200CP,Assault,My Hero Academia,"A simple Quirk, this one allows the user to increase the speed and power
of their punches. Scaling off of the initial power of your punch, even a weakling could
pulverize brick with a single bullet fast blow. Those who work on power and form will see
incredible gains in return.
Outside of the destructive potential of the user’s arms, the rest of their body lacks
the offensive presence and protection, opening up potential for brutal counters."
200CP,Black Cat,My Hero Academia,"The user of this Quirk causes a target to generate a pulling/weakening
field in a cylinder pointed up around them after tripping them as they walk or run and
making them fall.
This field makes it appear as if the target has been given bad luck, as random
miscellaneous close to them or above them get pulled their way, such as statues or branches,
and can make projectiles fired at them drawn in, causing them to be more accurate and hard
hitting.
The weakening field isn’t very strong by comparison, but puts enough stress on
supports like nails, rope and otherwise that the first effect can break them and make things
fail for or around the target.
The user of this Quirk, besides the strange activation method, is also limited by
minor backlash the longer they keep their Quirk active. Like karmic backlash, they’ll develop
the same effects over time until deactivating the Quirk."
200CP,Blood Knight,My Hero Academia,"The Quirk user has minor regeneration and heightened blood
regeneration that allows them to lose multiple times the blood that would be lethal to any
normal human. Additionally, it holds unique coagulation properties.
Whenever the Quirk user is injured to the point of drawing blood, their blood
instantly spreads and coagulates in the form of flexible plate armor. The more the Quirk user
is injured, the more seriously they’re injured, the more armor of blood they’ll gain making
them harder to hurt.
At the moment the user is wounded and the blood first starts to coagulate, it still
has the capacity to block small arms fire before hardening into a much more protective state.
Attacks powerful enough to push through before the armor fully hardens can brutally harm
the user before their protection goes up."
200CP,Brainwashing,My Hero Academia,"While you are willing it, anyone who verbally responds to you will
have their body fall under your complete control, forced to do what you say.
Refusing or being unable to respond to you allows them to avoid the effect, and the
effect may be broken by a sudden great deal of pain. Victims are vaguely aware they’re
being controlled."
200CP,Brick,My Hero Academia,"The Quirk user has a more powerful and efficient physiology compared to
the average man or woman. Musculature weaving, bone structure alteration, there are a
number of complexities, though in basic terms it means they’re much stronger, faster,
tougher and enduring than others.
The Quirk user could throw cars through the air, outrun them on the interstate, and
just feel pretty sore if they actually got run over. The Quirk user has a higher metabolism,
requiring them to eat more than others. Takes active practice to reign in their strength for
delicate work."
200CP,Cement,My Hero Academia,"This Quirk gives power over cement and cement-like materials simply by
being in contact with them, able to exert a great deal of control over a large quantity of
material at once.
The user of this Quirk is able to even expand, grow or repair the materials they’re
using as well. While powerful and convenient in urban settings, this Quirk falls off hard in
places lacking in concrete."
200CP,Clones,My Hero Academia,"This Quirk allows the user to expel glowing, ectoplasm-like slime that can
then be transformed into clones of the user. The user can either create numerous clones of
the same size as the user or expend more ectoplasm to make bigger clones.
The number limit is normally in the tens for same size clones, but can fluctuate
depending on mood. A good mood increases the number a bit, while a bad mood decreases
the number a bit."
200CP,Dead Zone,My Hero Academia,"The Quirk user is able to reduce the electrical conductivity of
everything in the area around them down to zero. This effectively applies nigh immunity to
lightning and other forms of electrical damage to the user and others in the area while in
effect.
Electronics and other electricity reliant objects in the area will also shut down while
the Quirk is active, of course. The user can extend or contract the dead zone to the
maximum range of around half a kilometer or down to just the user’s body.
Dead Zone doesn’t penetrate living beings, unable to shut down nerve signals in
humans and other animals. The user is unable to affect the shape of the dead zone, just the
size, rendering them near incapable of shutting down specific electronics if that’s their
desire."
200CP,Dental Manipulation,My Hero Academia,"The user is able to enlarge, shape, and control their teeth to
form dangerous branching blades. The user of this Quirk’s teeth are also made many times
stronger.
The user of this Quirk is able to pick themselves up and move around by their
branching teeth with no apparent discomfort. Knocking out the user’s teeth can cripple this
Quirk."
200CP,Diagnosis,My Hero Academia,"This Quirk can be used to give the user incredible amounts of varied
and specific knowledge on the body of those visually observed.
With this power, the user is able to get precise measurements of all kinds, age,
medical conditions, broken bones, birth marks and more. The longer the user continues to
observe a target, the more details they are able to learn, almost endlessly.
Useful for locating enemy weaknesses or applying medical treatment in equal parts.
The user must continue observing for additional details and observe a target in person.
Collected details through this Quirk can be remembered incredibly well."
200CP,Dupliarms,My Hero Academia,"The user of this Quirk bares two tentacles on each side of their body
connected to the arms by webbings of skin. These tentacles have the ability to replicate
enhanced versions of the user’s body parts.
Ears would be more sensitive, vision of eyes more acute, hands having stronger grip
strength, mouths having stronger teeth and jaws and so on.
These tentacles can sprout more than one additional body part each, but each past
the more sprouted, the less efficient they become."
200CP,Dust Bunny,My Hero Academia,"The Quirk user has powerful, highly refined control over dust and
similar particulates over a wide area. With this ability, they may simulate the power of a
sandblaster to grind away at things with abrasive powder or obscure the area around them
by kicking up a dust storm.
The Quirk user may also create ‘dust bunnies’, which are filthy, fluffy constructs with
the capacity for flight and carrying people on the air.
Overuse of Dust Bunny causes the skin to chafe as the ability eventually attempts to
shed dead cells faster to supply the Quirk user with more material."
200CP,Earphone Jack,My Hero Academia,"This Quirk manifests as a pair of elongated, prehensile earlobes
ending with appears to be earphone jacks that can penetrate and insert themselves into all
sorts of things.
The user can channel amplified sounds of their heartbeat into a penetrated target to
wreak internal havoc with vibrations, or listen in to faint sounds on the opposite side of an
object.
The earlobes can stretch up to 6 meters and even be used as stone shattering whips.
Aside from obvious limitations, louder sounds can damage or cancel out Earphone Jack’s
effects."
200CP,Easter Eggs,My Hero Academia,"The user of this strange quirk is able to cause bizarre, speckled eggs
to pop out of their hands. These eggs, coming in three varieties, have explosive properties
when cracked open.
Blue eggs with red spots explode in a plume of flame and smoke, the yolk continuing
to burn and produce red smoke for a short time after triggering. This smoke doubles as an
irritant.
Green eggs with orange spots explode in a spray of sticky orange slime that behaves
almost like glue, aggressively clinging to anything it touches. The more victims struggle
against it, the more resilient it is.
Purple and yellow eggs will produce a small, localized tornado with vacuum like
suction that pulls those nearby into it for a short time. Crackling thunder periodically booms
from inside.
Eggs are always made in a specific sequence, Blue to Green to Purple to Blue again
and so on. This quirk uses calories as a resource. The yolks themselves carry these effects,
take that as you will."
200CP,Elasticity,My Hero Academia,"The Quirk user is able to bestow elasticity to whatever they touch,
including large objects, the ground and even the air. This can be used to manipulate the
environment to one’s advantage, such as creating trampolines for 3D movement, or trapping
others in air-based rubber walls.
The Quirk user is unable to affect living things with their Quirk, limiting them to
environmental and object-based manipulations. The Quirk user may not manually disable
the effects of their quirk. Objects affected will instead return to normal after a moderate
amount of time has passed."
200CP,Erasure,My Hero Academia,"The user of this Quirk is able to shut off the target’s Quirk simply by
staring at them. While powerful and unable to be resisted, it has a number of weaknesses.
The effect wears off when the user closes their eyes or loses track of the target.
Quirk users with passive Quirks like Mutation or Animal Mimicry types are immune.
Finally, prolonged usage can dry out the user’s eyes on account of needing to keep
them open to prolong the effects."
200CP,Explosion,My Hero Academia,"The user is able to excrete sweat similar to nitroglycerin from their
palms and ignite it to create various explosions at will, which includes propelling one’s self
through the air.
The more the user sweats, the more powerful the explosions. During cold weather,
the nitroglycerin-like sweat requires more time to ignite, as opposed to heat, where
conditions are optimal for ignition.
The user needs to be able to sweat to create explosions. Additionally, the user’s arm
and shoulder aren’t fully immune to the kickback of the explosions, wearing them out with
repeated use in a short period of time."
200CP,Extend-o-Hair,My Hero Academia,"The Quirk user has incredible control over their own body hair,
allowing them to grow and manipulate it with great ease. Hair is exceptionally healthy and
strong, allowing them to leverage it for offense, defense and utility. This includes self-
enhancement or enemy incapacitation.
The Quirk user grows hair from most everywhere to supply the Quirk. The Quirk
user’s hair is prone to tangling, which can prove painful at times."
200CP,Fiber Master,My Hero Academia,"The user of this Quirk is able to freely control and manipulate
textiles. This gives them an advantage against anyone that wears clothes, which is to say
most everyone.
The user is able to textiles as completely intact clothing, or unravel clothes or cloth
into fibers and strings for alternative uses such as setting traps or binding enemies.
Notably, this power can also be used to aid allies by moving them out of the way of
an enemy attack. This power is notably tricky to use and difficulty varies by the type of
textile, working best on denim, while sweats remain tricky."
200CP,Flashback,My Hero Academia,"The Quirk user is able to record the area and events around them,
either a single moment like a snapshot or an extended recording. At any time after that, they
play this recording back in their mind and inspect it from new angles, walking through this
recorded memory.
Listen in on secret conversations that were too far at the time to hear, inspect
details again and again for some clue, navigate a crime scene as it progressed for the
identities of all those involved. Time slows to a crawl as you have this “flashback"" allowing
you to see things again and again.
There is a range of approximately forty meters maximum in an orb around the user
that may be recorded. They may only record thirty minutes of time at a time. The more
recordings kept, the harder it becomes to navigate them."
200CP,Foldabody,My Hero Academia,"The user of this Quirk is able to control the thinness of their own body
and stretch, allowing them to spread or unfurl themselves while becoming thin as paper or more so.
This allows the user to pass through incredibly narrow passages or strike completely
undetected. The primary limitation is the time it takes to transform, and movement is a bit
tricky after doing so."
200CP,Forced Activation,My Hero Academia,"This Quirk gives the user the ability to manifest branching black
spears with a circuit pattern from their body to harmlessly jack in to a target’s body. Once
connected, the user is able to forcefully activate and control the victim’s Quirk as desired.
This can be used to turn enemies on their allies, gain the aid of unconscious allies of
your own or directing the quirk of another in a way beneficial to the user such as forcing a
captive with a unique Quirk to go along with demands.
The branching spears of this Quirk aren’t the most powerful, durable or fast things
around and as such it’s highly difficult to make use of them on a resisting target. If the user
has no idea what the target’s Quirk is or how it works, they can’t use their Quirk nearly as
well."
200CP,Fuel Siphon,My Hero Academia,"The Quirk user is able to inhale and absorb the stamina/energy of
whoever they’re touching. This can quickly drain a victim to the point of incapacitation if
contact isn’t broken.
Drained stamina can be used not only to reinvigorate the Quirk user, leaving them
fully refreshed. An overabundance of drained energy can also be channeled into temporarily
increasing the Quirk user’s size, strength and durability, leaving them even more powerful
than before.
As previously stated, there are two conditions for this Quirk. The user must breath in,
taking a deep breath, and sustained contact is required for the duration of this time.
Breaking contact or preventing the Quirk user from breathing in can interrupt this Quirk’s
effects and leave a victim with a chance."
200CP,Glamour,My Hero Academia,"The Quirk user may emit a mist from their mouth, which can then be
manipulated to form complex visual and auditory illusions over a wide area. Sound and
appearance with a bit of thought can reach lifelike realism or become a fantastic spectacle.
The Quirk user must emit their mist before forming illusions. The Quirk user’s mist
will dissipate given enough time, cancelling the illusions in place if not replenished."
