Cost,Name,Source,Description
400CP,Master of Disguise,Marvel Age of Krakoa,"You have psionic-metamorphic physiology. That is to
say that your cells are highly mutable, responding to your thoughts to alter themselves
or even move around in your body. This allows you to freely alter your bodily
appearance on every level changing your apparent age, your physical sex, your skin hair
and eye colors, height, build, apparent weight… The only hard limit is that your mass
must stay roughly the same. You can also shape clothing from your biomass, but it’s
hit-and-miss. Some textures are harder to imitate than others, it can be hard to get
buttons and zippers to look right, and a big poofy petticoat made of your own flesh will
do nothing against the cold of a dark London night. Finally, you possess a form of ESP
that allows you to subconsciously memorize even the finest details of someone’s body
allowing for perfect impersonations and a mastery of vocal mimicry that will let you
perfectly replicate someone’s voice and mannerisms after just a few lines of natural
dialog."
400CP,Speedster,Marvel Age of Krakoa,"You’re fast, Jumper. Very fast. With this perk you can manipulate
your momentum or personal time flow or something along those lines, allowing you to
casually cruise along at supersonic speeds. Naturally, you have the enhanced perception,
reaction time, stamina, metabolic efficiency, and durability—especially concerning
tendons and ligaments—for those to work properly. With time and effort, you might be
able develop all sorts of cool tricks involving your speed or the effects that cause it.
Eventually, you might even be able to run at relativistic speeds."
400CP,Density,Marvel's Kid Heroes,"You can disperse your molecules, becoming a kind of cloud person who cannot be hurt,
and can ﬂy and ﬁt through tiny cracks. Or condense to become a
tiny person with your full weight.  You might transform this
way in midair as an attack. You can also affect the density of
air or water around you, creating and controlling sponge nets,
cushions (perfect for catching falling people) and shields out
of air bubbles that compress but do not pop."
400CP,Embiggen!,Marvel's Kid Heroes,"You are a Shape-shifter able to alter your appearance,
stretch your body parts to great lengths, and alter your size,
ranging from action-ﬁgure to the size of a small building."
400CP,Ink,Marvel's Kid Heroes,"You gain different powers depending on what is
tattooed on your ﬂesh. A red cross or a caduceus might give you
healing powers, but healing of self, or others? You’ll need to
experiment to ﬁnd out. You can’t copy the greatest of forces,
like the Phoenix Force or Power Cosmic this way, but you can
create shallow imitations which will likely have a high energy
cost."
400CP,Majesdanian,Marvel's Kid Heroes,"You’re an alien who is powered by the sun, no, not that one. You glow with all the
colors of the rainbow, able to ﬂy and ﬁre energy blasts, which
you can also shape into shields or very basic constructs."
400CP,Pheromones,Marvel's Kid Heroes,"You can give off subliminal scent-cues that can have a powerful inﬂuence on
people’s mood, in particular making people suggestible."
400CP,Speed,Marvel's Kid Heroes,"You’ve got it, the ability to run at Mach 4 or more, plus the expected incidentals,
the reﬂexes to avoid smashing into things at speed, the
toughness to mostly be okay with smashing into things,
immunity to heat from air friction, etc."
400CP,Spider,Marvel's Kid Heroes,"You were bitten by a
radioactive arachnid, and now have the powers of one of the most
famous teen heroes. Proportional strength of a spider,
wall-crawling, vastly enhanced reﬂexes and agility, and a
danger sense. There are also various add-ons worth 50 cp each.
- Organic Webbing Just like the Raimi ﬁlms, you can produce
webs from spinnerets in your wrists, in case you don’t like
web-shooters for some reason.
- Ultimate Besides the base powers, you can turn invisible
on command and deliver an electric “venom-blast” by touch.
- Spider-Woman You can glide, are immune to most poisons,
create pheromones that may attract people depending on
gender and mood, and have ranged bioelectric
venom-blasts."
400CP,Wild-Child,Marvel's Kid Heroes,"You know the drill, drastically enhanced senses, healing factor, adamantium
sheathed bones and pop-out claws. As long as you have no more
than six to a limb (Ultimate Sabertooth was lame) I don’t
particularly care if they all come out your hands, or wrists, or
feet, elbows or knees.  Just… try not to hurt yourself, alright?"
400CP,Living Lightning,Spiderman PS4,"It’s like the most powerful amp in the world just took up residence inside your body. You’re a living
lighting man, a person who can straight up throw bolts of electricity like the gods of old. As a living
electrical capacitor, you’re able to generate more than 1000 volts a minute and store up to a million
volts at a time inside of you, just to start. Your can emit and control this electricity, using it in deadly
blasts to tear apart living beings or blast your way through brick walls. You can even fly through the
air at great speed by using your electricity this way and perhaps stranger uses are yet to be found,
should you gain some more control over your powers. It’s also possible for your powers to grow
even more, perhaps to the extent of becoming literally living lightning, though you might need some
outside assistance."
400CP,Cryokinesis,X-Men Evolution,"The power of ice is a formidable power once properly used. By 
manipulating thermal energy to create extreme cold you can freeze anything, create cold winds 
that freeze things within seconds, and more all while being immune to anything cold related. It’s 
not just all about freezing though as you can create snow to form barriers, bridges of ice, and 
other things. The ice you use can form a variety of things from tools, structures, constructs, and 
even a full-body armor that increases physical stats, but still allows free movement. Lastly since 
you freeze everything on the atomic level anything you touch with your ice can be made fragile."
400CP,Duplication,X-Men Evolution,"You can create identical, physical, and living duplicates of yourself with any 
items on yourself or are touching included as well. Rule of thumb is that if you can carry 
whatever you’re touching then it can be replicated. This process is spontaneous and requires 
zero effort. The duplicates think, feel, and act independently, though are usually guided by the 
original. You are telepathically and empathically linked to your duplicates with no regard to 
distance nor plane of existence. Should your clones make any gains or become stronger than 
the original you don’t have to worry. Any experiences, abilities, etc are returned to the original 
upon their death or if you reabsorb them.  

 

You can create up to eight clones at the start that are as powerful as the original and can 
instantly create a clone as soon as its destroyed. With training or time you’ll be able to create 
even more full power clones until there’s a vast army of you’s and can go much further beyond 
even that. Although your clones can’t use this specific duplication power there is nothing 
stopping them from using any other cloning ability you have to make more clones. Have clones 
that create clones that create even more clones and so on."
400CP,Leech,X-Men Evolution,"When no one has powers everyone is normal. You can release a unique type of 
energy pulse over a city block at the start or in concentrated blasts. This pulse disrupts all 
energy fields in the surrounding, shutting down all energy-based systems in the immediate 
proximity for only a short while although there is no cooldown to how many times you can let 
loose a blast. A wide range blast last usually around a minute while concentration can extend 
the blackout duration. This also suppresses even the Mutant X-Gene, temporarily rendering any 
mutant hit by the pulse powerless. In other universes, people that have powers due to some 
genetic mutations will be suppressed. (Aliens don’t count.) "
400CP,Magnetism,X-Men Evolution,"You generate and control magnetic fields and various magnetic forces. 
Metals can be manipulated to levitate or moved in a manner similar to telekinesis and even 
limited flight can be done by using your own magnetism. As a side effect you generate powerful, 
electromagnetic pulses capable of shutting down electrical systems around yourself. Things 
such as manipulating the terrain of a construction site from easily a mile away on the roof of a 
city skyscraper, levitating multiple military tanks and jeeps, and extending your reaches to the 
outer edges of the atmosphere to grab hold of satellites are child’s play. Due note that you won’t 
be reaching the comic’s version of Magneto anytime soon. "
400CP,Organic Steel,X-Men Evolution,"You have the ability to transform your entire body into a form of ""organic 
steel"". In this armored form, your gain superhuman stamina, durability, and strength that is 
allows you to as toss buses and monster trucks into the air. It’s comparable to even the 
unstoppable Juggernaut of this universe who stopped a speeding train with a simple slap. While 
in this state you lack any biological needs of a human like food, sleep, air, etc to sustain 
yourself, and are extremely resistant to injury. High-impact assaults, large caliber bullets, falling 
from tremendous heights, extreme temperatures, and electricity no longer phase you.  With 
training armor can be selectively formed over portions of your body instead of all of your body. "
400CP,Telekinesis,X-Men Evolution,"Mind over matter as the saying goes. You have the ability to move objects 
with your mind. Using this you lift objects such as cars, trains, people, and even yourself to fly. 
You project a great force with your mind which includes such things as powerful shockwaves 
and force fields (strong enough to hold back the water flow of a broken dam or contain a 
massive train explosion). With training or time, you could juggle helicopters with ease and 
possibly even alter the shape of inorganic materials on the molecular level."
400CP,Telepathy,X-Men Evolution,"The power of the mind is truly a powerful thing. You are able to read and 
control minds, pick up psychic screams, project your thoughts to others, create powerful 
illusions that trick all the senses, and can scan locations to find specific minds. Along with that 
you can influence both cognitive and motor functions in others making them do things they 
wouldn’t normally do. Altering memories although highly grey can be done as well if you can stomach the ethics.  
At the start you’ll be able to alter the minds of dozens of individuals at once. With time or training 
you’ll be able to affects a packed sports stadium which ranges from the hundreds to thousands. 
Your psychic abilities will improve to the point where you can project your mind outside your 
body to travel the astral plane, gain the power to fly, and the the ability to create psychic energy 
constructs/weapons, such as a scythe, swords, and horses. "
400CP,Weather Control,X-Men Evolution,"Just like the shamans who used witchcraft to control the weather you 
too have received the ability to control natural forces thanks to a psionic connection to air 
currents, water vapor, and natural electrical energy. In simple terms this means you are able to 
manipulate and control all forms of weather on both a large and small scale usually no bigger 
than a city at the start. You can sustain flight at high speeds in low atmospheres and are 
immune to greater levels of heat and cold without any ill-effects. Modifying the temperature and 
humidity of the environment by controlling the air molecules, controlling all forms of precipitation, 
flash freeze people, forming tornadoes, blizzards, tsunamis, and bringing down lightning are just 
basic skills you’ll manage and with a bit of creativity can come up with much more."
400CP,Animal Morphing,X-Men Movies,"You can take the form of any earth animal, living or extinct. Eventually, you may 
be able to learn to take the form of alien animals, but only things on par with earth animals - you can't 
transform into a dragon or something with superpowers. "
400CP,Energy Blasts,X-Men Movies,"You can now fire energy blasts from one part of your body. Can either be extreme 
heat or concussive blasts. Heat beams can easily cut through solid steel and concussive blasts can punch 
through the same. Order now and you can choose any color for your energy to be! "
400CP,Healing Factor,X-Men Movies,"You heal real fast. In addition to normal healing being sped up, this also means 
you'll be in the prime of your life for centuries and you'll never need to worry about mundane diseases 
or - to a lesser extent - poisons. Pretty much the only way to completely kill you is to destroy nearly all of 
your body, destroy your whole brain, or decapitate you and move your head away from your body. "
400CP,Inorganic Form,X-Men Movies,"You can shift into an inorganic form. Maybe it's steel, maybe it's diamond, maybe 
it's rock, who knows? Whatever the case, it's much more durable than the material would normally be. 
While in this form, you have strength in the 25 ton range, durability enough to ignore being hit with an 
RPG, and essentially limitless stamina. However, it's all or nothing - you can't just transform parts of your 
body. "
400CP,Technopathy,X-Men Movies," You can sense and control technology. Your range is around a mile, but your powers 
work through wifi and over the Internet. No technology is truly safe from you, but more advanced 
systems can stall or even stop you. 
Essentially, a VI or extremely advanced security program can slow you down, an actual, full AI could stop 
you, and something extremly advanced could melt your brain. "
400CP,Teleportation,X-Men Movies,"You can teleport and you can do it fast. Your max range is around 5 miles, but you 
can quickly chain them together to move farther. You'll never be thrown off by teleporting, but other 
people will often puke the first few times they take a ride with you. "
400CP,Astral Shadow,X-Men the Claremont Years,"Any telepath can astrally
project themselves, but most remain tethered to their corporeal body. You, on the other
hand, are capable of existing as a purely astral form, leaving your corporeal existence
behind and surviving in the world of the mind. While in this astral form you cannot affect
the physical world without taking over a host, allowing your mind to overcome and

occupy theirs, but neither will most physical effects affect you; you are a living
manifestation of pure mental energy on the plane of thought. Be warned, though, that
while taking a physical host may allow you to interact with the world, if your host is
killed it will destroy your astral form as well.
Once per jump (or 1 per 10 years in longer jumps) if you are destroyed you may reform
from this astral manifestation. This is neither a comfortable or quick process taking at
least a year, and usually years.
This power alone does not grant you an ability to possess others. You have your original
body for free, and if you leave it you must find your own way back to the physical plane.
To help you, however, if you bought this power at a discount you may also buy
Telepathy and/or Possessive at a discount.
Alternatively you may pay an additional cost of 200 CP (discounted if this was) to gain
Malice’s ability to possess a host by bringing out their emotional shadowside. This can be
resisted, or broken by the strong willed, and you can only possess a single host at a time."
400CP,Cybernetic Body,X-Men the Claremont Years,"Your body has been almost completely replaced with cybernetics. This robotic form grants you super
human speed, durability, endurance, and strength; enough to overcome someone who was
Animalistic and throw them about if your skill in battle was equal, or surpass a
Proudstar in all fields except endurance. You still are not as strong as someone with
Brute Strength and someone made of Organic Steel could rip you limb from limb given
the opportunity. However your cybernetic form makes you particularly receptive to other
attempts to technologically augment your form, easing your attempts to technologically
upgrade yourself. You may import pre-existing CP backed cybernetics, or additional CP
backed cybernetics you obtain later as part of this body.
You may choose to have this power be a mutant power which allows you to somehow
shift between a normal form and that of a cyborg, there’s been weirder, or to be purely
technological in origin. If the latter it will be unaffected by abilities that shut down
mutant powers, or otherwise influence your biologically derived superpowers. Regardless
of which option you choose you may choose to import any man portable items you
purchase here as part of your cybernetic form. If you have bought an Adamantium
Skeleton, for an additional -200 CP (discounted if this was) you may choose to have
this robotic form be armored in adamantium, while this doesn’t make you invincible -
joints and wiring remain vulnerable - you will be very very resistant to harm.
If you bought this power at a discount you may also buy Healing Factor and/or Energy
Blast at a discount."
400CP,Empath,X-Men the Claremont Years,"You now have the ability to understand and manipulate the emotions of others within a certain radius around you.
With but a thought, you can psionically control one emotion (at a time) affecting those
within your range, the degree of manipulation you can cause is also within your control
allowing you to limit your hold over others. For example with anger you can cause others
to be a little ‘ticked off’ or be a hair trigger away from full-blown homicidal rage."
400CP,Gravity Increase,X-Men the Claremont Years,"You are able to increase the effect of gravity on an object or creature. The longer you maintain this power the more strain it
puts upon your body but you are able to geometrically increase the force upon an object
by gravity. Harold Leland, the canon possessor of this ability, was able to cause
Wolverine (already heavy due to his metal skeleton) to break through floors quickly,
cause Colossus to become so heavy he began to sink into the ground, and increase his
weight to the point that even turning human once more did not save him, hold down the
advanced sentinel Nimrod, and decelerate a man launched into the air before
re-accelerating him downwards to hit with the force of a small meteor although the strain
killed him. Most likely as a healthy and fit individual, unlike Leland who was
substantially overweight to the point of heart issues derived from it, you can do more.
Leland was able to with great difficulty extend this power out to a maximum of 4 objects
simultaneously.
For an additional -200 CP (discounted if this was) you may also reverse this effect
making objects lighter, and the pull of gravity upon them less noticeable."
400CP,Illusion Casting,X-Men the Claremont Years,"You are able to project illusions into the minds of others. This can cause them to see, feel, and perceive
something as real even if they know it is an illusion. A strong enough mind can overcome
this power - especially when aware of it - and while possible to project the image into
more than one mind simultaneously it can miss people when doing so. The power of
these illusions is not limitless; someone perceiving a wall might be able to push through
it with strength enough to break through a wall, and it’s better used for making a wall
than something to hit them with as while they may perceive the force it does not create
any actual force."
400CP,Kinetic Charging,X-Men the Claremont Years,"Through skin contact you are able to charge an object causing it to turn (at least some of)
its potential energy into kinetic energy in a large explosion. The larger the object the
more time and energy from you needed to charge it, so you’re unlikely to explode the
Earth with just this power, with objects like playing cards being somewhat weaker than

Energy Blasts, and larger objects like quarterstaffs being a bit stronger; in general if you
charge a larger object you get a larger explosion.
For an additional cost of -200 CP this ability is improved to be able to include more
diverse forms of energization, similar to the Marauder Harpoon’s power, allowing objects
to be charged to paralyze targets, disintegrate living matter, or simply stun targets."
400CP,Miraculous Longshot,X-Men the Claremont Years,"Now with this you’re just plain lucky. Or not. Like the Mojoverse native Longshot, you have the power
of good luck. Events and things just happen to go your way, fly a jetpack through a laser
defense field on your first try, just happen to vault an electric fence where you knock out
the power system of the place you’re breaking into and allow your unpowered and
unskilled companion to walk straight in, and other even more improbable events go in
your favor. This is not necessarily an always active power, you can toggle it off or on as
you desire, and there are two reasons you might want to. The first is that the luck comes
from somewhere for you to be lucky someone else has to be unlucky. This doesn’t
necessarily strike those near you, and in many cases it’s as simple as good luck for you
being bad luck for your opponent. The second is that this luck is reliant on the purity of
your motives. The more pure your motives the luckier you will be, and if you’re selfish
and greedy in your motives using this power may instead bring you misfortune."
400CP,Mirage,X-Men the Claremont Years,"You have the power to project images of the greatest fear of those around you. This image seems real to the individual it’s drawn
from, but to others it will seem to be no more than a half-real illusion. With training and
experience you can project other images, such as their greatest desire or what they love
most, as well as passable illusions of things that you merely wish for people to see - such
as creating the illusion that you are dressed in a manner befitting a high class restaurant -
or images which each individual sees separately as their own greatest fear. This power
also gives you an empathic connection with non-sapient animals, perhaps they’re just
more in touch with their fears and desires. If you bought this power at a discount you may
also take Valkyrie at a discount.
For an additional 200 CP (discounted if this was) you can create a single projection
with physical substance, manifesting it as if it was real. It draws its power from your own
psychic strength, so its durability and power can meet upper limits. You can change this
projection when you desire, and while it must remain a singular concept, it’s possible to
create such things as a car, a bow and arrows, or a swarm of miniature demons.
Separate of the above upgrade, you may pay an additional 100 CP (discounted if this
was) to gain the ability to create arrow/dart like projections of psychic energy which can
disrupt target’s neural pathways by forcing them to relive past trauma, and with time and
effort even physically affect objects with them."
400CP,Organic Steel,X-Men the Claremont Years,"You are able to transmute your skin into living steel. Far stronger than regular steel, you become extremely resistant to harm
and damage in this form, easily as powerful as someone with Brute Strength, and with
increased endurance. While you’ll still be weaker than a Flying Brick by a noticeable
margin, your strength should not be underestimated, and your durability is if anything
more impressive. Be warned that this living steel form does leave you vulnerable to
ferrokinetics and magnetokinetics, though it does come with a great deal of resistance to
other damage; you may not even have a heartbeat, and being heated to white hot and then
covered in several trucks full of liquid nitrogen might lock you in a near dead state but


you could survive it if your powers were somehow deactivated and you were given a
healer’s touch.
For an additional -200 CP (discounted if this was) like Colossus when he was locked
into his iron form your strength is increased; now roughly a match for a Flying Brick’s,
but that is a minor benefit. His living iron form made him disruptive to the magical might
of the Adversary. A trait that has been haphazardly applied in comics since. For you it is
not a haphazard effect; you are now resistant to magic while in your organic steel form
and able to disrupt its effects with your presence. This is not total immunity, it is still
possible for harmful magic to affect you, but it is still enough to create a chance to defeat
a primordial force of multiversal chaos and to make otherwise infallible effects have a
sizeable chance of failure.
If you have bought an Adamantium Skeleton, for an additional -400 CP (discounted if
this was) you may choose to be organic adamantium, applying the durability of
adamantium to your entire body. Not only does this render you nigh immune to physical
harm, you will find your strength increased to approximately the level of a Flying
Brick’s, or closer to the first upgraded level if bought with the previous upgrade to this
ability."
