Cost,Perk Name,Source,Description
0,Civilian Skills,History’s Strongest Disciple Kenichi) ​(100,"You find it exceedingly easy to apply your martial arts skills to mundane tasks. Leg strength developed through repeated kicking and great leaps could be applied to travel faster, and recreational parkour. Alternatively powerful punches, tight grasps and natural leverage techniques could be used in construction, repair and advanced art or sculpture. You will find innumerable uses when you begin applying your martial arts to everyday life."
0,Jutsu Technique (E Rank),Naruto,"The world of Naruto contains a multitude of jutsu that can do just about anything, from raising the dead to teleportation. While here, you’re guaranteed to encounter situations where you can learn some of these amazing feats, but this perk will ensure that you’ve got something special right out of the gate. You may learn any E-rank jutsu for free."
50,Style Blender,Generic Fist Jump,"You are a genius at combining your fighting styles together, finding their similarities and mixing them into a single, usually superior, style all your own."
50,Martial Art,History’s Strongest Disciple Kenichi,"​The main focus of the series. All who enter this world know at the very least the basics of their chosen martial art as well as its various strengths and weaknesses. The more styles you choose to study, the longer it will take to incorporate them into a cohesive and usable whole. You may also choose any real­world martial art not listed here if you so desire. You will however remain a novice in your style unless you can somehow obtain a master or worthy sparring partner."
50,Clinging With Your Feet,Medaka Box Abnormal,"A very strange martial art is the discipline of clinging to walls and ceilings with your feet, allowing you to walk on them as if they were the ground. You’ve become a master of this art, to the point of being able to use it even when you’re wearing shoes or piloting a mecha. Gravity only holds you down when you want it to. Or when you jump and stop holding on with your feet."
50,Jutsu Technique (D Rank),Naruto,"For 50 CP, you know a D-rank jutsu such as the Body Flicker Technique."
100,Advanced Infantry Training,Generic First Jump,"While you are no Special Forces operator, you have been through Basic Training and Advanced Infantry School, or the equivalent for the setting, and are a highly trained and conditioned soldier."
100,Student of War,Generic First Jump,"The study of history is often the study of war, and you have become an expert at it. You are not only an expert strategist and tactician, you are also an expert at logistics and organization, the unsung heroes of any military campaign."
100,Fighting Style,Generic Fist Jump,"You are at expert level in one real world fighting style, which must be primarily unarmed and could just be street fighting if you choose. This can be taken multiple times. For an additional 50cp, you are upgraded to a master of all your chosen fighting styles, one of the best in the world, possibly the very best."
100,Control,Generic Fist Jump,"When the majority of your fights are organized sporting events, you need to be able to defeat your opponent without actually killing them. You can now restrain any attack you make, so that it will only deal non-lethal damage to the target."
100,It’s No Fun With Two Hands,Bleach,"Not everyone is as blessed as you are in matters of war. Most likely, they’re a whole lot less lucky if they find themselves facing you. But you can be kind. You’re in it for fun too, after all, so why not take a little handicap to make things interesting? You’ve got an easy time weakening yourself, to the point that you’re always able to find a way to limit or suppress your powers and abilities to some degree if desired. It might be a special ability that lets you do it or easily finding devices to help out, but it’ll ensure you can still get a good scrap going. It’ll even retain some of the fun, if you’re the sort to not enjoy it when limited, letting you gain satisfaction from winning under these challenging restrictions."
100,Field “Medicine”,Akame ga Kill,"You are experienced not only with medical care, but how to use it in the middle of battle. This includes how to use it on your enemies, drugs, medicine, places to cut, what to suture you can use them to either aid or harm anyone in the middle of a fight. While it would be rather hard to apply a suture to your enemy, you do have the skill to pull it off, though it is much trickier than just attacking them."
100,Shield Wall,The Elder Scrolls V: Skyrim,"Since dodging in heavy armor can be difficult, it makes sense to rely on your trusty old shield to tank the blows. You're very good at using it to weather any blow you can't dodge, sometimes even using it to your advantage by directing the enemy's thrusts to make an opening. You're in fact good enough to use it even against ranged attacks, like arrows and even magic, though do keep in mind that if the shield itself is flimsy then it won't be able to take a direct hit; you're not going to be tanking dragonfire with an ordinary shield of common iron, for example. But you will get as much use as is physically possible out of that ordinary iron shield."
100,Pistol-Whipper,Full Metal Alchemist,"Shooting guns isn’t as easy as Fullmetal Alchemist may have you believe. While this won’t give you some crazy skill with guns, it’s still enough that you won’t be too far behind people like Riza Hawkeye, you are a soldier after all. Whatever type of firearm it is, even if you haven’t held it before, as long as it’s conventional, and widely used for the world you’re in, you immediately know the best way to shoot it, get great accuracy like the example above, and the ability to keep it while stressed. This starts off with the knowledge of most of the firearms used in this setting, and how to use and maintain them."
100,Defense Focused,Overlord,"You’re trained and skilled in one particular area, taking damage. Whether it's because you’re naturally tough, particularly skilled at wearing armor, or have masterful use of a shield the simple fact is you can take damage like a champ and get up from hits that would leave lesser men dazed, if not dead outright. Additionally you are particularly skilled at grabbing, and maintaining, the attention of your enemies, ensuring they waste their time targeting you when they could be better spending their time focusing on your less defensively skilled comrades. Just starting out you’ll have a level of skill at rolling with the hits that would leave you easily capable of taking on small groups of armed men, with nary a scratch to show for it, and oftentimes not a scratch at all. You’ll possess abilities geared for gaining the attention of the enemy, even if they would normally ignore you, as well as abilities geared towards intercepting the attacks of others so that they strike at you instead of their intended target. You’ll also have access to several abilities that will allow you to easily repair any damage done to your equipment.


--- (Requires Realm of Heroes): In the Realm of Heroes you’ll be taking on entire small armies of trained warriors (say a hundred or so) and will be unlikely to be injured by them to any significant degree, potentially walking away with no injuries so long as you aren’t careless. Your abilities in maintaining the attention of foes are greater, allowing you to grab the attention of many enemies at once and keep it on you with ease, as well as allowing you to easily intercept the attacks even of enemies that aren’t actually nearby. Your equipment can now be fixed in the middle of battle even as its being damaged, leaving the canny defensive fighter well suited for prolonged conflict. Additionally at this point you will be able to set a small group of allies as being ‘body-guarded’ by you. Half of any damage they would take is transferred to you, though your defensive abilities still apply to the damage in full, meaning it is likely you won’t be hurt very much if at all. ---


--- (Requires Level One Hundred): At Level One Hundred you can easily walk through entire swarms and throngs of ravenous monsters and berserker warriors and not even notice their attacks upon you. You’ll be able to get and then keep, until you allow them to focus elsewhere, the attention of any foe you engage with regardless of whether or not attacking you would be a wise course of action for them, and your equipment is now impossible to break or be damaged by any method so long as you are holding or wearing it. Your bodyguard abilities can now be applied to a massive number of people, and will intercept up to 90% of the damage that would normally have gone to them. Your defensive abilities apply in full against the damage sent your way, as normal, meaning you could potentially tank for entire raid groups all on your own. Finally you gain the Super-Move known as Invulnerable Aegis special ability. You can activate this at any time, several times per day, to render any attack made against you completely and utterly negated no matter how powerful it is. It is one of the few defenses known to be capable of fending off the Dimension Slash ability of the damage focused warrior. Naturally no matter what level you are as a defense focused warrior you’re decent at actual fighting as well, though not quite to the same extent as the magic warrior or monk, and nowhere close to the damage focused warrior. This class synergizes tremendously well with Tireless and World Champion, allowing the defense focused warrior to drag out battles near indefinitely, allowing them to benefit from regeneration, tirelessness, and slowly-increasing strength as the battle grows longer until eventually they’ll be able to batter down just about any opposition. To defeat such a warrior would require quick and overwhelming force, for in the long battle (which they would be uniquely suited to engaging in) they are a nearly insurmountable force. ---"
100,The Hunter with 7 Weapons,Duel Monsters - Shadow Realm,"You’re a fair hand with a blade, aren’t you? You have a great deal of expertise with melee weapons of almost every make and kind, being able to pick up and use any medieval weapon and use it as if you were a veteran right away!"
100,Monk Fighter,Duel Monsters - Shadow Realm,"You are a hardened warrior, you learnt how to strike and not hurt yourself. From now on, you don’t take ‘backlash’ from your bare-handed strikes, i.e if you punch a rock, you don’t get the pain from the punch itself, though if the rock punches you back it won’t protect from that."
100,Good With a Blade,Akame ga Kill,"You are particularly skilled with some type of weapon, or possibly your bare hands, well and beyond what people can reasonably expect to achieve through normal means, but not quite supernatural. Not that a supernatural level of ability is out of the question in this world, and having such skill wouldn't truly qualify as rare."
100,Huntsman Training,RWBY,You graduated from a prestigious combat academy and you have the skill to show for it. You’ve mastered the acrobatic combat that is a staple for Huntsmen and Huntresses and can hold your own against hordes of mindless Grimm
100,Spoon To The Eye!,Arifureta Shokugyou de Sekai Saikyou,"The monsters of this world are many and more dangerous than the average joe imagines, not to mention the war going on and the enmity of the fellow man. Training, all kinds of training are needed and you got it, both from your teachers and from the battlefield itself. You know your way around most weapons, be it a longsword, shortbow, mace, war-axe, war scythe, club, spear, halbert, sabre, dagger, kriegsmesser, longbow, and many, many, many more. As expected, such expertise lets you pick up new weapons and master them to some degree with more ease. Of course, your style is highly unpredictable and unorthodox, being basically created by you, but no one can deny it’s effective."
100,Combat Skill,King Arthur,"Every knight needs to know how to fight. Most are trained to use a large variety of weapons, and most have either average or below skill in each. You don't settle with average however. You have the skill to match even masters in the use of a sword, bow, and seven other melee weapons."
100,Saint-Rank Fighter,Mushoku Tensei: Jobless Reincarnation,"While you might not practice one of the three famed sword styles, you are undoubtedly a capable opponent in combat, having learned and reached incredible amounts of proficiency and mastery in Saint Dragon Battle Aura Fighting-Style of the Six-Faced World that you could be considered a Saint-Rank in this Combat-Style. While this also gives you all the knowledge of the techniques of the Saint Dragon Battle Aura Fighting-Style, you only master these techniques at Saint-Rank. This elevates your Mana Reserves to the point that you can cast half a dozen Saint-Rank Spells before being exhausted along with elevating your mastery and control of your Battle Aura that it can amplify your physical capabilities to its limits allowing you to become stronger than Advance-Rank Warrior but weaker than Saint-Rank Warrior in pure stats alone. You also gained an incredible innate talent at learning and mastering any Martial Arts-Styles and Powers though this is more prominent in Unarmed Combat-Styles and Magic-Spells which would allow you to reach Saint-Rank starting scratch within three years amount time though it would be faster if you have a master to learn from or if you already have a foundation for it."
100,Saint-Ranked Warrior,Mushoku Tensei: Jobless Reincarnation,"The training that you underwent since you were a child has borne fruits, and you manage to learned and reached incredible amount of proficiency and mastery in North-God, Sword-God, and Water-God Sword-Styles of the Six-Faced World such that you could be considered a Saint-Rank in this Three Sword-Styles. While this also gives you all the knowledge of the secret techniques of the Three Sword-Styles, you only master them at Saint-Rank of the said secret techniques. This elevates your Battle Aura that it can amplify your physical capabilities to extremity allowing you to rival any Saint-Rank Warrior in pure stats alone. You also gained an incredible innate talent at learning and mastering any Martial Arts-Styles though this is more prominent in Armed Martial Arts-Styles which would allow you to reach Saint-Rank starting scratch within a year’s time though it would be faster if you have a master to learn from or if you already have a foundation for it."
100,Book of Martial Arts,Mushoku Tensei: Jobless Reincarnation,There are many forms of Martial Arts that existed and there those famous and unknown ones but with this book records all of it. This book has the record of all known and unknown Martial Arts Styles in this world and it also contains instructions of the training regimens for each Style which are detailed and easy to understand that it’s nearly impossible not to understand the meaning and descriptions of each Styles and training regimens. This book also records the Martial Arts Styles or something equivalent that you know or invented. Post-Jump this book automatically updates to include the Martial Arts System or Other Systems equivalent to it in the future worlds that you are in and the book has effectively infinite pages and opening to the desired page or style with just a thought.
100,Caped Combat,With This Ring,"​Fighting with super-strength is not the same as fighting with normal strength: a skilled user will rely on grapples to deny leverage rather than simply punching someone through something as soft as concrete. Likewise, fighting with super-speed, telekinesis, a danger-sense, or some other superpower demands different approaches to combat, both to fight with or against them. You have a great deal of skill fighting with and against supernatural powers and you adapt quickly when fighting with or against new powers."
100,Killed Him with a Shoe,Ender’s Game,You can make anything into a deadly weapon and instinctively know how to get the best performance out of things that actually are deadly weapons.
100,Beast of Gods,Fate/Grand Order,"Could there be any warrior more perfect? Any man more flawless? Compared to you? Not at all. At least when you’re just observing from afar, you appear to be totally without flaws or weaknesses to anyone. You're perfect in aesthetics, though you are quite handsome, but you seem to lack any weaknesses, flaws, holes in your defences or other disadvantages to onlookers. Even those who have special powers to notice such things will fail to do so. It is only after directly interacting with your weaknesses that they can uncover them, such as by noticing that you take much more damage from fire than other sorts of attacks if you have a weakness to fire. Even that will be difficult to notice however, as any injuries you take seem far less serious to your opponents, though your allies can still realise the severity if you wish them to."
100,Shinobi,Generic Naruto Fanfiction,"What with all the screaming jutsu names and giant fireballs and kaiju summoning, its like these people have entirely forgotten that ninja are supposed to be stealthy. Well, good thing you’re here to remind them. You are a true Ninja, a true ‘Old School’ shinobi. You have ungodly dexterity, patience and sheer skill at sneaking. You could sneak through a village full of ninja at high alert while wearing bright orange, and your skills at lockpicking, picking pockets, stealing, sneak attacks and the like, trades which demand stealth like this, are just as ridiculous. In addition, you no longer need to cry out any of your jutsu’s names, being able to just execute any and all of your techniques without even uttering a word. You’re also a dab hand at using the more ‘traditional’ ninja methods of dealing with people, such as poison use and various practical assassination techniques that don’t require engulfing your hand in lightning and running in a straight line at someone. Finally, while you do not gain any supernatural abilities related to stealth, you can maintain any abilities you do have in just about any condition, be it drunk, injured, or unconscious."
100,Combat Experience,That Time I Was Reincarnated as a Slime,This world is a world where the Strong eat the Weak and the Weak serve the Strong and nobody without combat experience is going to survive for long here without heroes to save them. You’ve decided not to rely on something as nebulous as a hero and learned to fight and survive by yourself and gone into a fair amount scraps whether as an Adventurer of the Freedom Association or just as a Monster trying to survive their natural environment.
100,Turtle and Crane,Dragon Ball Z,"You’ve trained in martial arts, earning the title of ‘master’, and it shows. You’ve gained mastery of at least three mundane martial arts of your choosing, and also have a knack for learning new styles. Augmenting your chosen styles with ki comes as naturally as breathing to you, though it may take some extra practice to gain such ease-of-use with ones you learn later in life."
100,The Basics,Generic Xianxia,"Mastering the basics is what makes you advanced, and you have learned the arts of combat a long time ago. As such, your fighting ability has improved. The effects are noticeable compared to a neophyte; you deal more damage, you hit more often, you evade and parry more, you hit where it hurts and it hurts less when you're hit. Ultimately you are better at finding or creating advantages when fighting. This applies whether the battle is a physical, mental, or spiritual one. Additionally you find you have an easier time grasping the basics of any new technique, skill, or ability you learn, though progression beyond the basics will be entirely up to your own time and effort."
100,Monk,Overlord,"Differently from a ‘damage focused’ warrior who chooses their body as their weapon (and is more of a brawler) the Monk focuses on skill and grace, paired with explosive physical strength. Possessing the sturdiest, most flexible, and quickest bodies of all the physical classes they excel at striking when and where it would be most effective, rather than trying to overpower their foes with sheer brute strength. Just starting out you’ll be faster, tougher, stronger, heartier, and with a greater level of finesse (with your body at least) than warriors that chose to focus on swords and armor, though such individuals may outperform you if their equipment is of exceptional quality.

--- (Requires Realm of Heroes): Within the Realm of Heroes however your skin is akin to heavy steel plate at the weakest, and your strikes land with such quickness and ferocity that many bystanders will not even realize you’ve struck until after the fact. Additionally your heartiness will have grown to the point that you could casually resist even strong poisons, and disease and infirmity of the body are a thing of the past. You’ll also possess a number of abilities of a more spiritual sort, such as eventually being able to see the invisible, strike the intangible, ignore the damage reduction of enemies, and reinforce your body, mind, and spirit to significantly superhuman levels of resilience. ---

--- (Requires Level One Hundred): At Level One Hundred your blows could crack castle walls, your fists and feet moving so fast that you do not even appear to have swung them, and your movement is so quick that even with just a casual walking pace it may seem to passersby that you are practically teleporting. Your spiritual abilities will have also struck their peak, able to ignore poisons no matter how potent, understand the hearts and minds of living beings (even if you can’t speak their language, or they yours), and your physical aging will have stopped entirely. This class synergies tremendously well with that of a ‘damage focused’ warrior that chooses their body as their weapon, granting the skill, speed, and grace of the monk alongside the overwhelming brute power of the ‘damage focused’ class. ---"
100,Sorcerous Swordsman,Overlord,"It doesn’t have to be swords actually, it could just as easily be spears, or axes, or maces, or bows, or any other singular weapon type. With that one type you have a masterful level of skill, and the skills of a passable veteran in everything else. You’re skilled enough to face any three of your peers and come out the victor, in sheer skill at least, though a disparity in quality of equipment may swing the odds for or against you and being skilled won’t help you if they’re so fast you can’t see them move, or so tough that your weapon can’t hurt them. In addition you’re well knowledgeable with magic, roughly equivalent in ability to your weapon skills, and with a particular focus on ‘buffing’ yourself to fight even better. Just starting out you’ll easily defeat any of your peers in melee except the truly skilled and specialized, and your magics will serve best to empower yourself (or your friends) to allow you to close the gap even then. Your breadth of knowledge about so many different weapon types allows you a flexibility rarely seen in even professional soldiers and gladiators.

--- (Requires Realm of Heroes): In the Realm of Heroes you could effortlessly defeat entire warrior bands on your lonesome with nothing but pure skill, and your magics to empower yourself could let you come out of such encounters without so much as a single scratch, nor even a shortness of breath. ---


--- (Requires Level One Hundred): At Level One Hundred you’ll be able to regularly defeat entire armies of soldiers with nothing but sheer skill alone, often times while giving them a handicap of only using one arm, and your magics could empower you to such heights that if you truly pressed yourself you might rival the armies of a whole nation of regular men, assuming they were all in one place and didn’t run away once they saw you get really moving. Don’t think that this will trivialize a fight against a peer of equivalent level and strength without considerable effort on your part however, broadness of skill often times is trumped by specialization for good reason after all. ---"
