Cost,Perk Name,Source,Description
600,Evasive Maneuver,RWBY,"You usually need to take damage to lose a fight, and you’re incredibly good at making sure you never get hit. You have an almost supernatural ability to not only dodge and deflect attacks, but to gracefully control the flow of battle as you do so. Your combat reflexes are instantaneous and so long as you are even slightly relative to your opponent in speed, it’s unlikely that you’ll ever be touched. This also boosts all of your skills and abilities when they’re being applied to avoiding damage. Survival is what you do best after all."
600,A Funny thing happened,Marvel Cinematic Universe Vol. 1,"You are a walking bastion of skill and danger. Your martial art skills are so sharp that you could take on a group of trained soldiers single-handedly. Your marksman skills are enough that Annie Oakley would tip her hat in respect, and you could do that while using your weapons to gun-kata the aforementioned group. You've trained enough that you know how to utilize the environment to your surroundings, your situational awareness drastically increased as a result of learning to gauge situations of their dangers and what you could do to alleviate it. People would claim they were lucky to have NOT met you... now if only it could help you choose what kind of doughnut you wanted."
600,Old Fashioned Asskicking,Marvel Cinematic Universe Vol. 1,"You can't always be at the back seat of a fight directing things. Sometimes you need to get out in the field and show your troops you're willing to work alongside them, and they will be invigorated as a result. Groups you fight with will have their morale drastically improved, and their battle tactics improved just as much. Synergy, accuracy, reflexes, and coordination take a very noticeable increase, and you could almost swear that they hit harder too. Guess they're just happy you care for them."
600,God-Rank Fighter,Mushoku Tensei: Jobless Reincarnation,"When your peers mocked you for not learning the three famed Sword-Styles, you manage to persevere and reach the pinnacle of the Saint Dragon Battle Aura Fighting-Style. Your proficiency and mastery of the techniques of the Saint Dragon Battle Aura Fighting-Style that combines Magic-Arts/Spells and Wushu/Unarmed Martial Arts reached completion and you can claim to be a God-Rank Fighter of the Saint Dragon Battle Aura Fighting-Style. This elevates your Mana Reserves to the point that you can cast half a dozen God-Rank Spells before being exhausted along with elevating your mastery and control of your Battle Aura such that it can amplify your physical capabilities to the limit allowing you to to become stronger than Emperor-Rank Warrior but weaker than God-Rank Warrior in pure stats alone. Completely mastering the Saint Dragon Battle Aura Fighting-Style has given you the ability to meld Magic-Arts/Spells and Wushu/Unarmed Martial Arts into one Combat-Style gaining all of the advantages and discarding their disadvantages. This also elevates your innate talent at learning and mastering any Martial Arts-Styles and Powers though this is more prominent in Unarmed Martial Arts-Styles and Magic-Spells which would allow you to reach God-Rank, starting from scratch, within three years amount time though it would be faster if you have a master to learn from or if you already have a foundation for it. This also allows you to invent, innovate and re-create any Unarmed Martial Arts-Styles and Magic-Spells that you see and face with a few times of experiencing it or observing it and it also bleeds to any Martial Arts-Styles and Powers to a lesser degree."
600,God-Ranked Warrior,Mushoku Tensei: Jobless Reincarnation,"Well done, you’ve managed to become one and reach the pinnacle of the Three Sword-Styles of the Six-Faced World. Your proficiency and mastery of the secret techniques of the North-God’s Unorthodox and Underhanded Tricks, Sword-God’s Relentless and Light Speed attacks and techniques, and Water-God’s Perfect Defense and Ultimate Counter have reached completion such that you can claim to be a God-Rank Swordsman of the Three Sword-Styles. This elevates your mastery and control of your Battle Aura that it can amplify your physical capabilities to the limit allowing you to rival any God-Rank Warrior in pure stats alone. Completely mastering the Three Sword-Styles has given you the ability to meld any Armed Martial Art-Styles into one Combat-Style gaining all of the advantages and discarding their disadvantages. This also elevates your innate talent at learning and mastering any Martial Arts-Styles though this is more prominent in Armed Martial Arts-Styles which would allow you to reach God-Rank starting scratch within a year’s time though it would be faster if you have a master to learn from or if you already have a foundation for it. This also allows you to invent, innovate and re-create any Armed Martial Arts-Styles that you see and face with a few times of experiencing it or observing it and it also bleeds to any Martial Arts-Styles to a lesser degree."
600,Sword Goddess,Bleach,"It’s easy to think that every Kenpachi is a violent brute. They all favour sheer power and strength, even those that have some technique or intelligence in battle prefer to channel it into using their natural power. But it didn’t start that way. The very first of this line relied not on furious power but on graceful skill. Graceful, terrifying, murderous skill. The countless styles of swordsmanship that Unohana Yachiru mastered in pursuit of the perfection of dealing death were passed down to you, maybe from the woman herself, rendering you her equal in Zanjutsu at least. The myriad styles have endless applications and intended uses, from barbaric greatswords to precise rapiers. Styles to allow the effortless counter-attacks to almost any blow, turning the enemy’s strength against them, or to cut away at the spiritual components of the enemy. Your skill is hardly limited to just what a mortal human would see as physically possible and the techniques you’re aware of make you capable of easily laying low those more powerful than yourself. Unohana, even centuries after she put down her blade, still easily killed the mighty Zaraki many times over despite his physical advantages. If desired, you can exchange this talent in swordsmanship for similar skill for another armed weapon form. Spears or hammers or axes or some of the wilder tools the Shinigami employ. Unarmed combat is unavailable as a choice but otherwise you’ll attain the same vast breadth and depth of skill with your chosen weapon for."
600,Ace of Aces,Infinite Stratos,"There’s the professionals. Then the prodigies. Then you. The IS, and any other mecha, are more like an extension of your own body then a robotic armour. You could easily fight alone a half dozen other pilots at once, each good enough to represent their country as their top pilots, and come out of it smiling and victorious. Even when you’ve just picked up a new mecha, it’ll only take you a couple minutes to get used to the new controls before you’re as good as ever. Piloting is just innate to your very being. Give it a few years and you could fight the Brunhilde, Orimura Chifuyu herself to a standstill. Optionally, Students can choose to become their country’s Representative Candidate with this."
600,Hengen Musou,Rising of the Shield Hero,"You have been trained in the Peerless Transformation Style, a martial art created with the belief that people should not rely on heroes to save the world. A style that does not lean on weapons, but is equally capable of augmenting any. It is the ultimate expression of Ki manipulation, as most of its techniques rely on it. You know how to attack bypassing defenses, and defend in turn from attacks of this nature, by manipulating the opponent’s and your own Ki in turn. Its main technique is Musou Kassei - sucking Ki from the air and using it to further boost your abilities, though it places a burden on the body. It artificially creates something similar to the SP of the heroes, that can also be used to supercharge your magical abilities. It is best used in high-intensity bursts, though if you were particularly talented you may find more benefit in a more constant, low-powered state. You may adapt this style to work on other energy sources, rather than Ki. Chakra, magic, Aura, all may be used in a similar manner with enough practice. You do not need to buy the Ki perk for this, but in that case you will have to learn how to use it by yourself"
600,One Step Further,Dragon Ball Z,"Wait...how did you...huh. Interesting. You’ve managed to unlock a famous technique of North Kai, the Kaioken. This allows one to temporarily push past their current limits in terms of strength, speed, durability, and power for a very short amount of time, letting them multiply it up to one hundred of their original strength. Normally, this technique is extremely dangerous and draining, the body losing many times the energy gained and spent from the boost, enough to knock out or even kill the user if they overtax themselves. However, this version seems to be an improvement of the original - the duration of the technique starts off being able to last for a full minute instead of a ‘heartbeat’ of an instant, and the backlash will never do anything more severe than a stamina drain to your body. As you practice using this technique in both battle and training, you will learn how to multiply your strength beyond one hundred, and while the drain and backlash grows more severe the more you reach for power, this can be overcome or at least mastered with enough time, training, and mastery. The duration may also be extended over time as you master these greater heights, little by little, perhaps even letting you surpass the art of Transformation entirely...it will not be easy, but such lofty heights are within your reach, now."
600,Jumper-Jin,The God of Highschool,"No longer are you a relative beginner in the martial arts. With the purchase of this, you have become one of the strongest beings on Earth. Your skill with any Martial Arts or National Treasures that you have bought is on the level of a member of The Six, humans second only to Taejin Jin in power and skill. Your physical form as undertaken a similar boost in might, with all your physical attributes raised to absurdly superhuman levels. You could survive being punched from Seoul to Beijing, run back in a few minutes and then punch your attacker two hundred kilometres away, embedding them halfway into a mountain. You are not yet on the level of the High Gods but you’re closer than all but a dozen or two people in all the universe."
600,World Champion​,Overlord,"You are the very model of what it means to be a warrior. Your every swing is a master stroke, your every maneuver a brilliant display of skill and ferocity. Your physical combat abilities are boosted tremendously and you will find yourself gaining in strength, speed, and agility the longer a battle continues and the more opponents y face, though this increase in physical power will slowly return to its base level once the battle has concluded. In terms of fighting prowess you could defeat any three peers of your same level, regardless of the difference in equipment between you, with utter and humiliating (for them) ease. Additionally you will find that the better a strategist and tactician you are the more dangerous you become, the knowledge of battle planning and tactical ability combining together to give you a reliable and comprehensive battle precognition that will let you see your enemies moves long before they arrive, and maneuver them appropriately to render them utterly impotent. The greater your skill in strategy and tactics the more far reaching this foresight becomes, though it only applies to combat. You could potentially plan out an entire war with this if your tactical acumen rivaled that of a god, but you wouldn’t have any insight on how to keep your country economically stable afterwards.
"