Cost,Perk Name,Source,Description
100,Magic Warrior,Overlord,"You’re skilled in magic as well as swordplay. It’s not really on the same level as your physical abilities but you’re not exactly a slouch either. You’re particularly decent at spells meant to debuff or otherwise hinder large groups of low-level foes, as well as spells designed to force singular opponents into unfavorable positions that you can then take advantage of. Additionally you’re skilled enough with both your magic and physical abilities such that you can easily make use of both even in chaotic melee. That said your magic is best put to use putting your foes into unfavorable positions or forcing them to face you where you are strong and they are weak, don’t expect to be blasting armies out of existence with this. Starting out you can easily best small groups of trained warriors via a combination of both might and magic, easily channeling your foes into unfavorable situations and footing in order to take solid advantage of them. You possess magic capable of weaving illusory effects, as well as more physical magics such as changing the consistency of the ground (such as from hard earth to soft mud) or causing negative effects such a grease or sleet to form where you desire. Your magics and abilities that directly target your enemies focus mostly on slowing them down and sowing confusion, often via dazzling them with bright lights, flashes, sounds, and so forth. You naturally have the ability to channel these sorts of powers through your weapon, allowing you to inflict these effects as you hit your foes.

--- (Requires Realm of Heroes): In the Realm of Heroes you could trivially defeat large groups of trained warriors. You could easily sow confusion amongst their ranks via the crafting of illusions, such that they see everyone as an enemy, or everyone as an ally, or for single targets literal confusion as they are stuck by spells that leave them incapable of telling real from unreal or up from down. Induction of vertigo, poisoning, curses, literally slowing people, and even petrification are all possible at this level, and you can even haste yourself. Naturally your melee skills are top notch at this point as well, capable of easily taking advantage of the openings your magic makes in order to make easy kills. Even without the benefit of your magic though your skill is nothing to complain about, easily the equal or superior of anyone that isn’t a damage focused warrior or monk of a peer level to you. ---

--- (Requires Level One Hundred): At Level One Hundred you’ll be able to make literal topographical changes to the nearby terrain, creating gullies, small lakes, pitfalls, cliffs, and more. Your illusions are so powerful that it is virtually impossible to see through them without specific prepared counters, and the debuffs you can layer onto your enemies run the entire gamut of negative status effects, even including potential instant death, and can even hit large swathes of enemies all at once. Additionally your lower-leveled debuffs and effects become passive abilities, allowing you to layer such debilitations onto anyone you strike with your weapon without the need to actually expend mana in the casting. At this level your sword skills are near peerless, easily the equal of your magics, and outside of other peer level warriors it is unlikely you’ll ever meet someone that can give you true challenge in melee. A Magic Warrior benefits tremendously from the knowledge of strategy and tactics that comes with The Long Game, allowing them to effortlessly direct their spells, attentions, and technique in such a fashion as to hinder their enemies into near-inability to act, leaving the Magic Warrior free to take action at their own direction and at their own pace. ---"
100,Damage Focused,Overlord,"You’re trained and skilled in one particular area, dealing damage. You have focused on a singular weapon type to the exclusion of all else (your body can be your weapon), and are at the level of a grand master with it. You could easily best any seven of your peers in sheer skill alone, though skill may not help you if the differences in equipment or physical ability are too far out of your favor. Regardless of that however is your sheer ability to deal raw, unrelenting, damage with your chosen weapon. You’ll be able to pierce through armor with it, deal devastating blows, and cause massive amounts of critical damage to your enemies. Just starting out you’ll be able to slay small groups of trained soldiers with relative ease, and so long as you’re careful you’re unlikely to take any damage of note. You’ll possess a number of special abilities designed for striking with more power, increasing your accuracy, dealing considerably greater critical damage, as well for determining potential weaknesses in a foe.

--- (Requires Realm of Heroes): In the Realm of Heroes you could easily enough defeat the garrison of an entire castle single handedly, and your special abilities have increased even further. Aside from more powerful versions of your previous skills you will also possess the ability to deal wounds that resist natural healing efforts, may ignore the damage resistance of enemies, and in addition you will have learned several methods to allow you to blow through the prepared defenses of a magic caster. ---


--- (Requires Level One Hundred): At Level One Hundred your skills are virtually unmatched when it comes to the slaying of others. You could casually defeat entire armies of men and beasts without even batting an eyelash, and even beings of legendary martial prowess will find themselves merely your peers, at best. Your special abilities are even more powerful, and additionally you may now deal wounds that prevent both natural and magical methods of healing, as well as forcing weaknesses in creatures and enemies that do not normally have them. You’ll also possess the ability to strike at range, well outside of melee, through either air pressure or the simple force of your martial prowess (your choice). Finally you will have unlocked the most devastating of all direct damage abilities. The Super-Move, Dimensional Slash (or pierce/smash). With this technique you will be able to, several times per day, deliver strikes so devastating that they travel across dimensions, bypassing virtually every single defensive measure known. Armor fails, toughness fails, magic fails. Only pure skill and dodging will save your foes from this technique and with this ability before you virtually anything can be killed. Pointedly it does not prevent foes from being resurrected. A damage focused warrior benefits tremendously from also training in defense focus, as their increased knowledge and skill in defensive ability serves only to heighten their knowledge at exploiting the defenses of others. ---"
100,Total Concentration Breathing (Breathing),Demon Slayer,"Requires Total Concentration Breathing

Of course, this baseline assumes you’re practicing an established style...but with an additional purchase of this Perk, you develop you’ll achieved Pillar-level mastery of something more unique, a signature style of sword-fighting that may very well be yours and yours alon."
100,Total Concentration Breathing,Demon Slayer,"Requires Total Concentration Breathing (Breathing)

Buying this Perk a third time, you are the progenitor and grandmaster of a complete fighting style on par with the Breath of the Sun itself - hell, if may not even be a sword-based fighting style. This will allow you to teach others your style as well and like the Breath of the Sun, there will be enough material for other skilled fighters to develop their own variations of it."
100,Marksmanship,Justice League Unlimited,"Although guns might not work against a lot of the supernatural threats you’ll face in this world, it’s still a good idea to know how to use one just in case you come across a regular guy who wants to blow your head off or if you manage to acquire a powerful alien blaster. For 50cp you’ll be able to use either modern weapons like guns, rocket launchers, and grenades, or antiquated weapons like bows and spears as well as a highly trained soldier of the proper era. If you spend 100cp you'll become one of the most accurate individuals on earth with ranged weaponry. Not quite as good a marksmen as someone like Deadshot, Vigilante, or even Captain Boomerange, but with just a few years of practice or experience your skills can equal these legendary heroes and villains."
100,Jutsu Technique (C Rank),Naruto,"For 100 CP, you know a C-rank jutsu like Lee’s Drunken Fist."
200,Way of the Bat,DCEU,"Gadgets and powers can work on their own but adding in martial training will multiply their effectiveness several times over. You learnt since childhood the ways of beating other men into the dirt and making sure that they don’t get back up. You’ve become extremely skilled in several forms of martial arts, covering both unarmed combat, weapon usage and how to effectively use any devices or powers you have gained here in combat. A super strong brawler might be scary but that’s nothing compared to a super strong master martial artist."
200,LET’S MURDER SOMEONE,Medaka Box Abnormal,"A bunch of knives, a spear, a sword, a rocket launcher, a club larger than your actual body- how the heck are you fitting all of this under your clothes? It’s almost like you have some sort of pocket dimension through which to store a truck’s worth of size inside the hidden spots on your body. In reality, you’re just supernaturally good at hiding things on your body, even if the space is inside your mouth or under your armpit. You still have the weight of the things hidden on you but they are entirely undetectable and able to be instantly withdrawn when you desire it, as well as working as an incredibly effective training weight system that will rapidly train your physical strength and speed. ALL ABOUT ME- 200"
200,Combat Analysis,Toaruverse,"Having fought for hundreds of battles you gained preternatural ability to analyze and exploit the weakness of your enemies, at glance you can roughly guess to overall power of a person or group. The longer the fight or the more you stare them the more you can guess their weakness and the full extent of their powers even they haven’t showed it which is very accurate. The stronger you are the faster you can analyze the strength and weakness of everyone and if the gap is too great between you and you’re target you can instantly know everything about your opponents. This also applies to technology or any constructs that you want to find its structural weakness."
200,Not the Head!,To Love-Ru,"Your defensive skills seem to increase whenever you are in actual danger of death or permanent harm, proportionate to how high or immediate this danger is. Evading a sword slash may become easier than evading a punch."
200,Fists of Modern Fury,Petals of Reincarnation,"Sealing the deal? Pshaw, you’ll do more than that. You’ve got the talent and skill to make yourself far beyond what even world class martial artists consider possible here. Barehanded against a squad or three of highly trained, fully loaded Special Forces operatives? They’d been scraping their remains off the wall, quite literally, whilst you’d waltz out of there whistling away. Not only are you a brilliant martial artist, your martial arts also manage to hurt people regardless of the weird abilities they have. It won’t bypass durability or the natural material of their bodies, so don’t try to punch some kind of slime person, but they can’t negate your martial moves with any kind of esoteric ability. They won’t be rewriting the past to get rid of any bruises you’ve given them or using supernatural shields to stop your kicks reaching them."
200,Tank,Generic Gamer,"You were born to be a tank. No, not an army tank — a game-style tank, focused around taking the enemy’s hits so your friends don’t have to. It’s not necessarily that you’re tough, though you very well may be — attacks and hostile effects just seem to have less effect on you. Swords nick rather than slice, electricity treats you like you’re made of rubber, altered gravity has a fifth the effect on you that it should, and so on; it’s pretty weird how resilient you are to everything, but it’s exclusively beneficial, so who cares? It’s not just a matter of being able to take a bunch of hits without going down, though — you know how to redirect strikes to do the least damage to you they can. And, somehow, you’re not only able to enrage your enemies so they attack you rather than anyone else, but you’re able to do the same thing to their attacks, drawing them towards you regardless of their initial target so long as you’re within range"
200,DPS,Generic Gamer,"That stands for ‘damage per second’, by the way. Something you’re great at dishing out. You have a knack for using your powers and abilities offensively, such that you could use even normally non-lethal powers totally new to you to deadly effect, as if you’d practiced with them for decades. You not only have an intuitive grasp of what sort of attacks would be most harmful to a particular enemy, but you’re able to spot weaknesses and chinks in their armor with ease; if that weren’t enough, your attacks seem to actively seek out their targets — and their weak points, if they have any — of their own accord. Your attacks seem to move faster and take less out of you, sword swings ignoring air resistance and fireballs requiring less fuel. Furthermore, your attacks seem to at least partially ignore defenses; this means that they do more damage than they otherwise would, sure, but it also enables you to hurt people with what they’re normally immune to, even when it doesn’t make sense, poisoning someone without a body or burning a fire elemental."
200,Specialist,Naruto,"Every ninja no matter what, specializes in at least one area. Some specialize in ninjutsu, some specialize in genjutsu, and some in fūinjutsu. Specialists possess far greater power and skill than those not specialized in their chosen area. For each purchase of this perk, you can become exceptionally good at learning your chosen specialization. For example, one who picks fūinjutsu would have the potential to equal the greatest of the Uzumaki Clan with the proper training, while those who pick genjutsu could eventually rival Itachi Uchiha himself even with his Sharingan. This purchase bestows all the relevant knowledge and information needed and allows for a beginner to learn everything related to your chosen specialty in a fraction of the time it would normally take. The narrower the focus of your specialization, the faster you learn. This perk can be purchased multiple times, and you can mix specialties for free, such as making a Nin-Taijutsu specialization, but you have to purchase the specialties you want to mix and fuse in order to do so. Barring medical ninjutsu, you can purchase any specialty. For specialties that have multiple different styles, like taijutsu and kenjutsu, you can choose what style you want, such as kenjutsu in either the iai-focused samurai style or Killer B’s multi-bladed style or focusing on the Strong Fist or the Gentle Fist for taijutsu. For those who want to purchase multiple styles, they get a discount, but only if they are purchasing different styles for the same specialty."
200,Specialist - Kenjutsu,Naruto,"Every ninja no matter what, specialises in at least one area. Some specialise in ninjutsu, some specialise in genjutsu, and some in fuinjutsu. Specialists possess far greater power and skill than those not specialised in their chosen area. For each purchase of this perk, you can become exceptionally good at learning your chosen specialization. For example,  one who picks fuinjutsu would have the potential to equal the greatest of the Uzumaki Clan with the proper training, while those who pick genjutsu could eventually rival Itachi Uchiha himself even with his Sharingan. This purchase bestows all the relevant knowledge and information needed and allows for a beginner to learn everything related to your chosen specialty in a fraction of the time it would normally take. The narrower the  focus of your specialization, the faster you learn. This perk can be purchased multiple times, and you can mix specialities for free, such as making a Nin-Taijutsu specialization, but you have to purchase the specialities you want to mix and fuse in order to do so. Barring medical ninjutsu, you can purchase any specialty."
200,Master Monk,Duel Monsters - Shadow Realm,"Day in and day out training has allowed youcombat reflexes that are unmatched by any other’s! When you’re attacking with your bare hands, you could strike with twice the amount of speed as normal, performing two blows in the time it’d take for you to normally land one!"
200,Instinct of Doug,Rune Factory,"So when it comes to combat, monsters are pretty tough to beat, especially ones that you aren’t familiar with. From now when you’re fighting an enemy, you’ll innately know the extent of their abilities and how strong they are. You learn attack patterns, weaknesses, variants, resistances, you name it. As you fight them and win, you become better at taking them down or killing them, even if you shouldn’t be. While this does help you in combat, this doesn’t give you any combat skills or help you to exploit the knowledge you actually have, this just gets you a way to not die within the first 12 seconds or so."
200,Combat Savant,Sekirei,You’re a lot better at fighting than people might think. Using weapons or your fists will have quite a bit more impact against your enemies. You’re light footed and quick to react in combat related situations too.
200,Fist over Hand,Marvel Cinematic Universe Vol. 2,"There is a special power that granted to only those the monks of K’un L’un deem worthy. It is a gift from Heaven itself, that grants one the potential to become so much more than a mere human and to walk with great purpose in their life. But it’s doubtful you want to be stuck with such a burden, so instead let’s work around that and offer this power for a price. Upon purchase, this grants you the ability to collect, harness, and train the mystical force of Chi. This power comes from within and can be used for a myriad of effects including healing others of wounds and poison, increasing one’s strength and reflexes, and even enhanced control over the functions of one’s body. More effects will inevitably be unlocked as you train, with prior effects being able to grow to new heights."
200,Senjutsu,Highschool DxD,"While magic and mana are the universal constants of this world, and magical systems are different ways of utilizing it, other energies and practices do exist in this world. This trick in particular allows you to control and harness your own vitality into an energy called ‘ki’, which when concentrated will strengthen your physical form considerably, letting your fists and feet strike much harder against foes. In addition, it lets you read and sense the ‘ki’ of others, letting you read and predict movements and spy on the enemy’s current state from a distance. Take a deep breath, because now this power is yours to command."
200,Kyokushin Karate,The God of Highschool,"Otherwise known as Full Contact Karate, it is one of the most popular Martial Arts in the whole world, having many millions of practitioners counted and likely even more uncounted. The version you have learnt is far above the normal art that is taught however. You have learnt the Four Pillars techniques, moves that involve the manipulation and enhancement of your life energy to create incredibly destructive blows or blasts or energy. You could even unlock the final secret technique in time, built on using all Four Pillar moves in concert to hit with the force of an entire mountain."
200,Revival Taekwondo,The God of Highschool,"also called Re-Taekwondo, was South Korea’s answer to this. Created by Taejin Jin with WTF Taekwondo as a base, it focused on eliminating what weaknesses remained in Northern style and enhancing the art as a whole with stealth techniques. A perfect counter to the Northern style, it progressed greatly under the hands of its founder, with techniques to manipulate air pressure or apply the force of singular attacks multiple times over being created."
200,Who Needs a Sword?,The God of Highschool,"Not you, that’s for sure. A lot of Martial Arts might seem to need weapons or be made for unarmed use but you’ve realised that it’s all just a manner of perspective. Make a flat palm and swing it around really fast and you might as well be using a sword. You’ve got the ability to be able to use Martial Arts techniques that require a weapon or require not using a weapon with the opposite instead. Your sword techniques can be used with empty hands and your unarmed martial arts can be translated easily into forms that you can utilise with a sword, spear or other weapon. Whilst this ability works instantaneously, the translated techniques will be less powerful until you can actually train their use for a bit to recover that power. And anything that actually does require a specific weapon, such as an ability or move unique to a single sword, cannot be translated to the opposite format with this."
200,Team ABC,The God of Highschool,"You and the other Judges may work often as solo agents but you’re real strength comes out when all of you are fighting in tandem. Rather than spend time hashing out a battle plan in the midst of a running conflict, you and anyone fighting on your side on a small scale will just innately know what each member of the party can and can’t do and what action they’re about to take. You’ll work together like you’ve been fighting partners for decades, even if you’ve only met each other a few times. When you’re off the clock, there’s no guarantee you’ll get along with whoever’s on your side in the slightest but when it comes time to get serious, you’ll always be able to put behind you any grudges and work with your allies, as they will be able to do the same for you."
200,Limit Break,Arifureta Shokugyou de Sekai Saikyou,"You have been gifted with one of the most useful skills that there could be. The ability to multiply all your stats for brief periods of time. A trump card when facing tough opponents. While it starts as a x3 multiplier for mere five minutes, with time and training you will become able to unlock more powerful versions that last longer and boosts you further."
200,Mechanised Martial Arts,Infinite Stratos,"A lot of people might think that putting years of your life into learning martial arts is pointless when you only fight in a mecha suit anyway. You’re here to prove that yes, wrestling is indeed a viable form of mecha on mecha combat, regardless of what the haters say. You’ve got a great enough mastery over one style of martial arts, armed or unarmed, to be able to win national competitions with ease and better yet, you can perfectly translate this martial art to any giant robot you pilot. If you know other forms of fighting, you can still learn to translate them this way, but it’ll take a lot more time."
200,Importance of Control,Dragon Ball,"This is a lesson that so few warriors in this world truly learn - knowing when to hold back or use restraint. When you can shatter stone like glass or move faster than the wind, the world around you feels just a little more fragile. You’ve gained a sense for when your strength or powers will overwhelm someone or something, and the ability to make your blows non-lethal before impact, sparing unnecessary casualties and merely knocking them out - injured, but alive. This control also lets you greatly reduce if not eliminate the risk of collateral damage, preventing it before it truly happens."
200,Only What You Need,Dragon Ball,"How do you make it look so effortless?! When you dodge or strike at an enemy, you’re able to do with incredibly efficient movements, only using the muscle power and telegraphing the absolute minimum of your movements. This lets you enjoy a boost of speed and dexterity, as well as conserve much more stamina than you could normally in a long battle. As a bonus, this can let you look casual and collected in battle, which is impressive to those who watch it."
200,KILLING IMPULSE,Medaka Box Abnormal,"Born to kill, you’re better than anyone can be at it. You’ve got an instinctual desire to kill everything you see but unlike Munakata, you are in full control of this desire. The benefits you gain? That same desire results in an effortless mastery of every form of killing. You are naturally talented in the extreme at all forms of combat, assassination and murder and find it even easier to improve your talents to greater, physics-defying degrees such as becoming good enough with a sword to cut through sound. You are also exceptionally good at avoiding being killed, knowing exactly how to maximally reduce the damage you take from blows, even if you can only shift a few inches at the time."
