Cost,Perk Name,Source,Description
0,Airburst,My Hero Academia,"The user is able to compress small quantities of air into marbles and project them. The marbles rupture on contact with something, popping with the force of a large balloon. The marbles even sound like popping balloons, leaving them a startling, attention grabbing distraction but ultimately harmless. The user must hold their breath while collecting and throwing these marbles of air, requiring strong lungs."
0,Confetti,My Hero Academia,"This Quirk bestows the ability to manipulate pieces of paper after the Quirk user has come into contact with them. Their control is such that they can manipulate many pieces over a wide area, making folds and cuts as desired to shape and split it up. Confetti is unable to manipulate any one piece weighing more than a standard piece of notebook paper however, such as a magazine or a poster. The Quirk user loses the ability to manipulate paper that’s been wet too much, the paper’s integrity failing and weight becoming too great."
0,Curveball,My Hero Academia,"This Quirk allows the user to apply a delayed rotation to small objects, designating the direction at that time. This rotation activates the moment the object begins to move at any significant speeds, and will scale in speed with the speed of the object. The Quirk may be activated and applied through one degree of separation, such as through striking something with a club or bat. The effects of this Quirk end once the object affected comes to a stop,"
0,Leaf Manipulation,My Hero Academia,"The user of this Quirk has to power to project leaves from their surroundings as small, sharp blades at a target. Able to shoot many at once with relative ease. They have no real control over the leaves beyond shooting them, and their lack of real mass doesn’t make them very dangerous for the most part. No ability to generate leaves or very difficult to project heavily damaged leaves."
0,Little Pompeii,My Hero Academia,"The Quirk user has the ability to produce and control ashes from their finger tips. Little Pompeii seems to provide an immunity, or strong resistance, to degenerative side effects of smoking. Fingertips glow orange while active. Ashes are hot to the touch, but lack so much mass and are hard enough to produce that not much can be done with them other than ignite already highly flammable materials."
0,Shadow Puppets,My Hero Academia,"The Quirk user gains the ability to manipulate their own shadow. Stretching it, twisting it, shaping it, growing it, shrinking it and even adjusting the shade. This Quirk does not give any unique properties to the shadow by itself. The Quirk user has difficulty with growing their shadow more than twice its current size."
0,Weak Attraction,My Hero Academia,"With this perk you may pull small, lightweight objects closer to you. This is a Quirk of convenience, grabbing things from the other side of the room like keys or drinks. It is heavily limited by the weight of the individual objects it can grab, mostly focused on small, lightweight things under a few pounds."
0,Dou Qi Method,Battle Through the Heavens,"While Dou Qi Skills may have been the bread and butter or cultivation, Dou Qi methods are the foundation upon which everything rests. These are the things that allow cultivators to cultivate, to gather Dou Qi and grow stronger. As such, the strength of one's Dou Qi Method is extremely important. The better it is, the faster and higher one will rise. You may get a Huang, Xuan, Di, or Tian tier Qi technique. Each rank increases the speed of cultivation and rate of recovery of Dou Qi. Normal Huang Methods are open to the public. Xuan methods are things that smaller clans might have. Tian Methods are sufficient to drive Dou Zun crazy."
0,Dou Qi Skill,Battle Through the Heavens,"The bread and butter of the cultivation world. These are the techniques used by cultivators in order to fight against the many beings within this world. Many cultivators will have numerous different Dou Qi Skills with a range of strengths and weaknesses. These are to cultivators what spells are to mages. You receive a scroll upon which is written a Huang, Xuan, Di, or Tian tier Qi technique. Each rank greatly increases their strength and efficiency. Be warned that the higher level techniques will require much more Dou Qi to use."
100,Absorb & Release,My Hero Academia,"This Quirk allows the user to absorb enemy attacks, kinetic and energy based, hold them within their body and release them whenever and however they wish. It is heavily limited, however, by the fact that it doesn’t protect the user of the Quirk in the process of absorbing the attack, causing them to be burnt by fire, shocked by electricity and so on."
100,Bending Arts: Air,Avatar: The Last Airbender,"You were born with the ability to manipulate the element of your nation, and have been trained in its use. The Bending Arts differ from element to element, but always involve a combination of physical movements designed to evoke that element, focused with the will of the Bender. Bending an element provides substantial control over it, allowing you to move it, shape it, and direct it, though the exact nature of each depends on the individual element. It should be noted, however, that you cannot actually create an element - though Firebenders can transform their body heat into a raging inferno and Airbenders can make the breath from their lungs into a gale, Waterbenders and Earthbenders must have a source of their element to Bend."
100,Bending Arts: Earth,Avatar: The Last Airbender,"You were born with the ability to manipulate the element of your nation, and have been trained in its use. The Bending Arts differ from element to element, but always involve a combination of physical movements designed to evoke that element, focused with the will of the Bender. Bending an element provides substantial control over it, allowing you to move it, shape it, and direct it, though the exact nature of each depends on the individual element. It should be noted, however, that you cannot actually create an element - though Firebenders can transform their body heat into a raging inferno and Airbenders can make the breath from their lungs into a gale, Waterbenders and Earthbenders must have a source of their element to Bend."
100,Bending Arts: Fire,Avatar: The Last Airbender,"You were born with the ability to manipulate the element of your nation, and have been trained in its use. The Bending Arts differ from element to element, but always involve a combination of physical movements designed to evoke that element, focused with the will of the Bender. Bending an element provides substantial control over it, allowing you to move it, shape it, and direct it, though the exact nature of each depends on the individual element. It should be noted, however, that you cannot actually create an element - though Firebenders can transform their body heat into a raging inferno and Airbenders can make the breath from their lungs into a gale, Waterbenders and Earthbenders must have a source of their element to Bend."
100,Bending Arts: Water,Avatar: The Last Airbender,"You were born with the ability to manipulate the element of your nation, and have been trained in its use. The Bending Arts differ from element to element, but always involve a combination of physical movements designed to evoke that element, focused with the will of the Bender. Bending an element provides substantial control over it, allowing you to move it, shape it, and direct it, though the exact nature of each depends on the individual element. It should be noted, however, that you cannot actually create an element - though Firebenders can transform their body heat into a raging inferno and Airbenders can make the breath from their lungs into a gale, Waterbenders and Earthbenders must have a source of their element to Bend."
100,Blood Manipulation,My Hero Academia,"The user of this Quirk is able to manipulate their own blood. They can harden it, eject it from their body, pull it back in, manipulate it inside their body to move their own body and so on. The limitations of Blood Manipulation are obvious, as it’s important to keep most of it inside of you to avoid dying and such, and pulling it back in after ejecting it may prove dangerous if it brings back any contaminants."
100,Homing,My Hero Academia,"This Quirk allows the user to alter the trajectory of bullets or other projectiles they personally fire or release, allowing them to almost always hit their mark. The user is able to cause projectiles to accelerate somewhat and make several sharp turns in the air before impact, but is ultimately limited by how well they can perceive their own projectiles, the initial speed of the projectile after being fired and actually having ammo."
100,Inner Strength,Battle Through the Heavens,"Bones break and flesh tears. Those can be healed with relative ease by cultivators or using pills. The inner qi pathways are a slightly harder matter to resolve. Your particular Qi pathways have been tempered and are more resilient. They are capable of withstanding far more abuse. This has several advantages. First and foremost, it would let you take more damage with minimal lasting effects. However it also has the benefit of meaning that your pathways are sturdy enough to withstand strong pills that would ordinarily be too much for your body to handle."
100,Kido Training,Bleach,"The arts of the Shinigami are many, fitting given their long existence. Few Shinigami pursue training in all the disciplines available and Kido is by far the most neglected. Many Shinigami possess only rudimentary skill in the Demon Magic Art, the spellcasting system of Soul Society. Some have no knowledge at all. But you’ve eagerly pursued such things, reaching the level of a capable caster in both Hado and Bakudo spells. Hado spells largely deal with offense and destruction, while Bakudo is for both defense and a variety of support uses. At least ninety nine spells exist for each form, numbered in order of power. You know over a dozen spells for each discipline with your maximum abilities being a pair of spells in the 30 range. 31 Shakkaho, a powerful blast of fire in the Hado arts or 30 Shitotsu Sansen, a Bakudo spell that creates restrictive triangles of light around an opponent. In Shinigami terms, you’re the equivalent of a graduate of the academy who received top marks in Kido, which may explain the natural talent you have for learning more Kido down the line."
100,Larceny,My Hero Academia,"This Quirk allows the user to steal any objects they can see on a target’s body, including manifestations of their Quirk that aren’t permanent fixtures like a temporary tentacle. ‘Stolen’ objects transport straight to the Quirk user’s hands, making it difficult, if not impossible to stop them from taking whatever they have their eyes on. Larceny cannot be used to steal anything too large, leaving them unable to take large pieces of equipment and such. As the Quirk user needs to confirm a target with their eyes, being blinded or blindfolded will lock off the use of Larceny."
100,Lock Down,My Hero Academia,"This Quirk allows the user to lock objects in space, essentially immobilizing it. This is done by pushing the user’s finger, which gains key teeth protrusions, into the desired object and turning that finger like a key. This allows the user to prevent pieces of furniture from moving, stopping objects in the middle of the air as a form of obstacle, stopping projectiles from continuing towards them among other applications. There are limits on size and force, making the task of stopping out of control trucks or giant pieces of falling rubble daunting threats, especially if they lay on the edge of what’s possible. This Quirk may not effect living things."
100,Signal Pirate,My Hero Academia,"This Quirk allows the user to hijack electronic signals and manipulate the audio and video of nearby electronics. This would allow them to broadcast their face and voice over TVs, make themselves invisible to security cameras or blow out speakers with top volume cacophonies. This quirk has an effective range of just over 50 meters and obviously has few uses when out of range of any suitable electronics to apply their Quirk on."
100,Water Balloon,My Hero Academia,"The user of this Quirk is able to alter the surface tension of liquids within their surroundings and keep them that way. They’re able to leave the surface of a liquid hard, rubbery, soft, velvety, even abrasive, or just return them to normal. Inventive applications include literally walking on water, trapping someone in a liquid jail by making it impossible to breach, even handle useful liquids like adhesives or poisons by turning them into water balloon style projectiles and altering their properties at the last second. Being so reliant on outside resources can prove troublesome. The Quirk user’s influence extends to the surface, not below, reducing their total options somewhat."
100,Size,My Hero Academia,"The Quirk user is able to increase the size of objects they’ve interacted with up to two dozen times over. The activation condition for this effect is the user touching their five fingertips on each hand together, similar in nature to a prayer. They may increase the size of objects from quite far away, even outside their line of sight, providing they focus on their target(s). They may manually deactivate the changes with the same gesture as before. The Quirk user is unable to affect living things such as plants or people."
100,Alchemy/Alkahestry,Full Metal Alchemist,"The art of Alchemy involves many different components, and is part science and part mystical. It involves the law of equivalent exchange, and with that limit in mind, one can comprehend, deconstruct, and reconstruct physical matter into different forms. Amestrian Alchemy involves using the power generated by the Earth’s tectonic shifts to power this transformation, and an alchemical circle to make the change. Alkahestry on the other hand is a more medical, and spiritual form of Alchemy that involves the “Dragon’s Pulse” which is a concept that details the constant pulse of Chi or life energy within the Earth. Unlike Alchemy, it is far better for healing wounds, and can project transmutation across distances. With this perk, you gain a decent understanding of either Alchemy or Alkahestry, enough to be a State Alchemist for the former, with a minor focus on one form of Alchemy, and similar skill for the latter with a minor focus towards either healing or combat. "
100,Alchemy/Alkahestry (Other),Full Metal Alchemist,"Requires Alchemy/Alkahestry.

If you pay an extra 100CP discounted to Alchemists, you have instead a similar understanding of both principles due to your Origin studying both, or if you’re a Drop In, due to Jump Shenanigans. Before you think yourself a God capable of deciding life and death with this"
100,Dou Qi Method (Rank Increase),Battle Through the Heavens,"Requires Dou Qi Method.

While Dou Qi Skills may have been the bread and butter or cultivation, Dou Qi methods are the foundation upon which everything rests. These are the things that allow cultivators to cultivate, to gather Dou Qi and grow stronger. As such, the strength of one's Dou Qi Method is extremely important. The better it is, the faster and higher one will rise. You may get a Huang, Xuan, Di, or Tian tier Qi technique. Each rank increases the speed of cultivation and rate of recovery of Dou Qi. Normal Huang Methods are open to the public. Xuan methods are things that smaller clans might have. Tian Methods are sufficient to drive Dou Zun crazy."
100,Dou Qi Skill (Rank Increase),Battle Through the Heavens,"Requires Dou Qi Skill.

The bread and butter of the cultivation world. These are the techniques used by cultivators in order to fight against the many beings within this world. Many cultivators will have numerous different Dou Qi Skills with a range of strengths and weaknesses. These are to cultivators what spells are to mages. You receive a scroll upon which is written a Huang, Xuan, Di, or Tian tier Qi technique. Each rank greatly increases their strength and efficiency. Be warned that the higher level techniques will require much more Dou Qi to use."
200,Self-Molecular Rearranging,DC – Kingdom Come,"You have super strength, and the ability to rearrange your own molecular structure. Making yourself lighter or heavier or changing your height is possible with your abilities, and your strength grows and shrinks with your height. Right now this is the only way to increase your strength, but maybe if you’re smart you could think of other ways to increase your strength without needing to become bigger. You have no theoretical limit to what you can grow or shrink, but 60 feet is the maximum height you can maintain for a significant amount of time as of your current mastery of this ability. Further training is needed to expand it. You can also manipulate your molecular structure to let you phase through walls as well, in case you need to sneak somewhere instead of punching holes in walls. You could also extend this ability to shift between the different states of matter, but to enter the state of plasma will require an external energy source other than what this power provides. Furthermore, changing your state of matter is past your current mastery of this ability, and becoming plasma is a state of matter that has to be achieved separately past the other states of matter."
200,Shadow Manipulation,DC – Kingdom Come,"You can manipulate shadows, merging with your own to slide across the ground or fly in the air and possessing the shadows of others. You can also grow to a huge size as a shadow and create physical items and shapes in a way similar to that of the Green Lantern ring. Your body also resists antimatter to a degree as well, thanks to your exposure to the Shadowlands. You also have telepathic abilities to a minor degree, able to speak in the minds of others and have them reply back. No mind control, for one exception. You can make someone see the depths of their evil side. All their horrifying thoughts, desires, and dreams. This could drive them to the brink out of remorse and regret for their actions, or horrifically traumatize them. Or both."
200,Aerokinesis,Young Justice,"Aerokinesis allows the user to create and manipulate the air, allowing them to push and pull objects and enemies with air currents and create certain weather phenomena, such as twisters or tornadoes. Skilled users can use this ability to fly."
200,Cement,My Hero Academia,"This Quirk gives power over cement and cement-like materials simply by being in contact with them, able to exert a great deal of control over a large quantity of material at once. The user of this Quirk is able to even expand, grow or repair the materials they’re using as well. While powerful and convenient in urban settings, this Quirk falls off hard in places lacking in concrete."
200,Combat Bender,Avatar: The Last Airbender,"Since time immemorial, Bending has served as mankind's sword and shield - and now it's yours. You are unusually skilled in using your Bending in combat - shaping your element into lethal or non-lethal strikes, deflecting or countering others, even controlling a battlefield's terrain all come naturally to you. You are even able to adapt your forms into martial techniques, allowing you to use them in close combat even without your element. This runs both ways - should you know any other forms of martial arts, you can adapt your bending forms to them, letting you strike with your element."
200,Cooperative Bender,Avatar: The Last Airbender,"Though your own Bending may or may not be anything special, what you excel in is harmonizing it with the bending of others. By directing other Benders while bending along with them, your team can perform feats rivaled only by a fully- empowered Avatar. This isn't limited to your own element, either; if you have Benders from other Nations working with you, you can work with them just as easily, letting you combine elements to fantastic effect. This has also given you practice with wide-scale bending, and even without a team, the amount of your element you can bend has greatly increased."
200,Creation Methods,Battle Through the Heavens,"Every pill has a story behind it. Every skill has an expert who made it. Even the mysterious Flame Mantra, whose origin is a mystery to the previous Dou Di, ultimately came from someone’s brilliant mind. You have similarly stepped onto this path of creation. Over the years, your sharp mind has shown a natural aptitude for the creation of Dou Qi skills and methods. It wouldn’t be too surprising if when advancing between realms you comprehended a new skill. If you happen to be an alchemist, this skill will naturally extend to the creation of pill formulas. No need to wallow in mediocrity when you can forge your own future."
200,Crippled Past,Battle Through the Heavens,"Haven’t you been at the same initial cultivation stage for a while? Your cultivation has been stagnated for years now, and has only recently started moving again. While that means you will have a later start than some, it has also gifted you an incredibly stable foundation of Dou Qi, the basis upon which your future cultivation will be built. Consequently you will find progressing in cultivation far easier than you would otherwise."
200,Dead Zone,My Hero Academia,"The Quirk user is able to reduce the electrical conductivity of everything in the area around them down to zero. This effectively applies nigh immunity to lightning and other forms of electrical damage to the user and others in the area while in effect. Electronics and other electricity reliant objects in the area will also shut down while the Quirk is active, of course. The user can extend or contract the dead zone to the maximum range of around half a kilometer or down to just the user’s body. Dead Zone doesn’t penetrate living beings, unable to shut down nerve signals in humans and other animals. The user is unable to affect the shape of the dead zone, just the size, rendering them near incapable of shutting down specific electronics if that’s their desire."
200,Fiber Master,My Hero Academia,"The user of this Quirk is able to freely control and manipulate textiles. This gives them an advantage against anyone that wears clothes, which is to say most everyone. The user is able to textiles as completely intact clothing, or unravel clothes or cloth into fibers and strings for alternative uses such as setting traps or binding enemies. Notably, this power can also be used to aid allies by moving them out of the way of an enemy attack. This power is notably tricy to use and difficulty varies by the type of textile, working best on denim, while sweats remain tricky."
200,Flight,My Hero Academia,"The Quirk user is able to manipulate a special aerodynamic barrier that passively covers their body. The barrier is very strong and temperature controlled, allowing the Quirk user to use it for high speed flight without concern of upper atmosphere cold. The Quirk user can feign physical enhancement by leveraging their barrier to lift or strike things in their surroundings. The Quirk user may share their barrier with whatever they’re in contact with, though this thins the barrier out and leaves it more vulnerable to overpowering forces or temperatures."
200,Handyman,My Hero Academia,"This Quirk allows the user to mentally grab and manipulate the pieces of a broken object before putting it back together, the object regenerating additional damage upon doing so. Handyman gives a period of around one minute where the Quirk user has full control over the broken pieces before they’ll fly together and attempt to reform the original object. Objects must be broken before they may be “repaired.” This quirk is unable to affect the pieces of an object that has been almost completely destroyed/pulverized/molten down/etc."
200,Kido Specialist,Bleach,"Kido is far from a single unified discipline. The most obvious divisions are that of Hado and Bakudo but several groups exist outside of this numbered system as well. Kaido, also referred to as the healing arts, or the wide variety of seals and large scale barrier techniques apparently outside of normal Bakudo. You’ve found quite the gift for one such field of Kido, one of the above classifications or even just a type of spell like those that manipulate lightning or which suppress spiritual energy. You’ll easily make great strides of progress in learning your specialty and find it possible to take those arts well beyond the normal limitations. Much of this has to do with how easy you find it to modify existing spells that fit your chosen field. Hado 4- Byakurai is normally a single beam of powerful lightning but in your hands, it could quickly be used as a homing laser that chased foes till caught or a rapid fire blast of smaller lightning bolts or even act as a lightning rod towards your fingers to protect others."
200,Maneuverable Bender,Avatar: The Last Airbender,"You have a natural aptitude for using Bending to enhance your movements. Though each element has its specialties, all of them provide a variety of ways to increase your speed, agility, and acrobatic prowess, as well as give you unique methods of movement. Whether you're leaping gorges with gusts of flame or wind, gliding across a lake on a slab of ice, or crawling across a ceiling with rock shoes and gloves, where you go few others could hope to follow. You are also able to better use your Bending art on the go, adapting your forms to take advantage of your natural stride."
