Cost,Perk Name,Source,Description
200,Path to Power,Dragon Ball,"One of the simplest and earliest uses of spiritual power is to make the body healthier and stronger. While not quite full mastery or utilizing of ki, you’ve gotten the basics down - you can power yourself up, increasing your muscle mass and physical strength, speed, and durability just a bit higher than your normal maximum. This is tiring to sustain, however, and can leave you extremely winded if you’re not careful...so be sure to keep up your training!"
200,Perfect Control,Naruto,"To be a medic requires absolute control over one's chakra, both to regulate the chakra and to conserve it. You in particular are a master of the art, able to precisely utilize the exact amount of energy needed for a task without any additional energy being wasted whatsoever. As a by-product of such control, you can control the flow and molding of the energy needed for jutsu or other techniques with only a fraction of the seals required and with no loss in power or range."
200,Pharmacist,Generic Xianxia,"The plants and animals of the land can be turned into medicines and food that when eaten allows one to gain strength. With this perk, you can mix the parts of flora and fauna to create such. While they may have side effects, they are never permanently harmful, and they will always make the consumer stronger, though to what extent and for how long depends on the ingredients, process, and your skill. Furthermore your pills, elixirs, potions, and other similar such things made for the purpose of beneficial effects will be strengthened by almost half-again what they would normally be capable of, and if temporary in nature they will even last half-again as long.

Alchemist’s Refining Equipment ​(Free): A necessity for anyone looking to get in on the ground floor of esoteric and/or mystical reagents. This series of tools is perfect for the refinement and distillation of potions, pills, poisons and mystical elixirs of all kinds. Whatever your chemical or alchemical needs, this equipment will always be perfectly matched to your skill level. Anything that you could theoretically brew given enough time and the proper equipment, can be brewed with this equipment. It cannot do the impossible however and if you are not skilled enough in the esoteric sciences of pharmacology then naturally, so will this equipment."
200,Photokinesis,Arrowverse,"You have the power to shoot out high energized blasts of bright hot luminous light. These blasts of light are able to blind someone temporarily, and possibly permanently, as well as cut through metal. Your control over the ability is to the point you can bend light around your skin making you invisible while allowing you to still see. However, you can't turn any of your clothes invisible initially."
200,Radiokinesis,Arrowverse,"You’re able to absorb radioactivity and harness it, even if the source of the radiation is vast distances away. After absorbing the radiation, you double your size increasing your strength and durability. Absorbing too much radiation will leave you weakened."
200,Receptarier,Battle Through the Heavens,"It is not an exaggeration to say that being an alchemist is the most profitable profession in this world. Even the most basic alchemist would garner much respect from small clans, as their pills could have a myriad of beneficial effects. Numerous services are often free to alchemists. But it is not a simple profession, nor is it easy. Aside from the basic requirement of fire attribute with a sliver of wood for refining, you also need a strong spiritual perception. This is because you will need to tightly control the temperature around potentially thousands of different ingredients which all need different treatment. Those without a strong soul power are unable to divide this kind of attention and thus cannot progress beyond the most basic of pills. By taking this perk you will have more than met these requirements. Becoming a Tier 7 alchemist is simply a matter of time and finding the right teacher. Further than that? Well, that depends on whether you can reach the next stages of Spiritual Strength."
200,Repulsion,My Hero Academia,"The user of this Quirk is able to manipulate a repulsive, invisible force that bounces anything that comes in contact with it away, like magnets with the same polarization. The user is capable of either wrapping it entirely around them or shape it into various invisible shapes like bars, barriers and varying geometric shapes to protect themselves or others. The major limitation is that while the force cannot be broken, it can be overpowered and pushed through if enough force or weight is behind something it tries to repel, and the user will be subjected to intense vertigo should this happen."
200,Spatial Strength,Battle Through the Heavens,"Long ago you were supremely unlucky enough to be caught in the turbulent wake of a Spatial Storm, a terrifying silver vortex that could kill Dou Zhongs. By pure chance you were at the very edge and were only severely hurt. But from this exchange the remnant spatial strength actually somewhat merged with you Dou Qi. This affords you slightly increased sensitivity to space, and as you grow stronger you may be able to begin manipulating it earlier than usual. This is nothing on the level of the Ancient Void Dragon race, but it might perhaps be what set them on that path."
200,Specialist - Fuinjutsu,Naruto,"Every ninja no matter what, specialises in at least one area. Some specialise in ninjutsu, some specialise in genjutsu, and some in fuinjutsu. Specialists possess far greater power and skill than those not specialised in their chosen area. For each purchase of this perk, you can become exceptionally good at learning your chosen specialization. For example,  one who picks fuinjutsu would have the potential to equal the greatest of the Uzumaki Clan with the proper training, while those who pick genjutsu could eventually rival Itachi Uchiha himself even with his Sharingan. This purchase bestows all the relevant knowledge and information needed and allows for a beginner to learn everything related to your chosen specialty in a fraction of the time it would normally take. The narrower the  focus of your specialization, the faster you learn. This perk can be purchased multiple times, and you can mix specialities for free, such as making a Nin-Taijutsu specialization, but you have to purchase the specialities you want to mix and fuse in order to do so. Barring medical ninjutsu, you can purchase any specialty."
200,Specialist - Genjutsu,Naruto,"Every ninja no matter what, specialises in at least one area. Some specialise in ninjutsu, some specialise in genjutsu, and some in fuinjutsu. Specialists possess far greater power and skill than those not specialised in their chosen area. For each purchase of this perk, you can become exceptionally good at learning your chosen specialization. For example,  one who picks fuinjutsu would have the potential to equal the greatest of the Uzumaki Clan with the proper training, while those who pick genjutsu could eventually rival Itachi Uchiha himself even with his Sharingan. This purchase bestows all the relevant knowledge and information needed and allows for a beginner to learn everything related to your chosen specialty in a fraction of the time it would normally take. The narrower the  focus of your specialization, the faster you learn. This perk can be purchased multiple times, and you can mix specialities for free, such as making a Nin-Taijutsu specialization, but you have to purchase the specialities you want to mix and fuse in order to do so. Barring medical ninjutsu, you can purchase any specialty."
200,Specialist - Ninjutsu,Naruto,"Every ninja no matter what, specialises in at least one area. Some specialise in ninjutsu, some specialise in genjutsu, and some in fuinjutsu. Specialists possess far greater power and skill than those not specialised in their chosen area. For each purchase of this perk, you can become exceptionally good at learning your chosen specialization. For example,  one who picks fuinjutsu would have the potential to equal the greatest of the Uzumaki Clan with the proper training, while those who pick genjutsu could eventually rival Itachi Uchiha himself even with his Sharingan. This purchase bestows all the relevant knowledge and information needed and allows for a beginner to learn everything related to your chosen specialty in a fraction of the time it would normally take. The narrower the  focus of your specialization, the faster you learn. This perk can be purchased multiple times, and you can mix specialities for free, such as making a Nin-Taijutsu specialization, but you have to purchase the specialities you want to mix and fuse in order to do so. Barring medical ninjutsu, you can purchase any specialty."
200,Summoning Pact,Naruto,"This scroll, upon signing it with your blood, will allow you to summon one type of animal. This can be whatever animal you want. They are all trained in basic ninja arts and some individuals among them are of irregular size. The scroll doesn’t need to be on your person for the jutsu to work and if you allow, others can sign it too to be able to summon your type of animal. Can be bought multiple times for multiple types of animals, discounted after the first purchase."
200,Utilitarian Bender,Avatar: The Last Airbender,"Bending can certainly be used as a weapon, but it can also be so much more, and you have a natural talent for using it for these more constructive pursuits. Constructing entire buildings piece by piece with Earthbending, healing using Waterbending, blacksmithing with Firebending, or even just grabbing a stubborn out-of-reach tool with Airbending - you're a master at using your abilities for day-to-day life. This also increases your ability to perform precision bending, ranging from freezing a single raindrop to creating a sculpture so life-like it captures each individual hair."
200,Ki Accumulation,Generic Wuxia,"You are skilled at meditating and gathering your ki. You can use ki (or chi, or qi, of spirit energy) to strengthen your body and mind, and to use many higher-level martial arts to their highest potential. All Youxia can use Ki, but only you have the purity of focus to gather your energies and restore them even during the fury of battle."
200,Training Journal,Naruto,"This little book has been in the possession of many shinobi throughout the ages, all of whom decided to write here about their jutsu training in detail. For 50 CP, the journal possesses a handful of techniques from previous owners. For 200 CP, every once in a while, you will find a new section in the journal potentially allowing you to, in time, learn all jutsu in the Naruto series, though this could probably take a few hundred years considering the rate at which new information will reveal itself and that you have to learn all of them yourself."
300,[Five Focus],Medaka Box Abnormal,"You’re able to turn your fingers into long red talons now, very pointy ones. You can manipulate the ailments and sicknesses of anyone you scratch with these claws, making them healthy as a horse or filling them with every disease known to man in an instant. You can even control the stage and speed of the diseases and sicknesses that you inflict onto people, as well as traits such as the infection rate or capability, toughness of the disease itself and more."
300,Chlorokinesis,Young Justice,Chlorokinesis allows the user to control and greatly accelerate the growth of plants on the molecular level with their mind. This can be used to create hybridized plants as well as plantlike minions and creatures.
300,Earthflow,My Hero Academia,"The user of this Quirk is able to exert a great control over large amounts of earth at once for a variety of effects such as causing landslides, digging and so on. In addition to more straightforward uses, the user is also able to make sentient creatures with animal level intelligence out of dirt and stone known as Earth Devils that can prove quite formidable. The only limitations are fatigue and needing a source of earth nearby, which it often is unless you’re adrift on a boat at sea."
300,Electrokinesis,Young Justice,"Electrokinesis allows the user to manipulate existing sources of electricity, such as power plants or storm clouds, as well as create a small amount of electricity themselves. This can be used to fry most electronics, as well as your enemies."
300,Impact Recoil,My Hero Academia,"This Quirk allows the user to reverse the impact caused by an opposing physical force, sending the force back into whatever, whoever or wherever it came from. This Quirk can be applied not only to one’s self, but to nearby allies as well, allowing the user to potentially protect them or use them as meat shields. There is a small windup before its activation necessitating a bit of prediction. It can, of course, only work against physical impacts and doesn’t help with things like fire or electricity"
300,Maximum Security,My Hero Academia,"The Quirk user has a great deal of control over iron and iron alloys as well as the ability to command it over a wide area, over one hundred meters. Although they have full power to manipulate and shape such material, they have a natural inclination/talent towards forming it into bars and chains, being able to perform more complex actions when manipulating iron using these shapes. They don’t actually have the power to sense iron and must be able to find it themselves to assert control. Manipulating truly massive amounts of iron can quickly become tiring. It’s easier to hover iron over a surface, horizontal or otherwise, than suspending it in the middle of the air."
300,Meteorologist,My Hero Academia,"The Quirk user is able to manipulate water vapor to spontaneously form clouds even if there weren’t any before. From there, the Quirk user is able to simulate various forms of weather, such as heavy winds, rain, hail, snow, thunder and lightning. The Quirk user’s powers and influence lowers the wider the range they’re attempting to cover. A few city blocks could be hit with spontaneous, albeit mundane seeming rain. At the personal level however, the Quirk user may leverage a small cloud to send heavy rain sideways like a firehose’s flow, launch baseball sized hail, throw people off their feet with tornado force winds, blanket foes in snow and send out minor but potent electrical blasts. Quirk user is limited by humidity, as particularly arid conditions make it much more difficult to create requisite clouds. Quirk user requires some level of protection against the elements, as they have no innate resistance to temperature extremes or weather forces."
300,Noise,My Hero Academia,"The user of this Quirk can cause whatever they touch to generate one of two different unique types electromagnetic fields “disruptive” and “attractive.” A disruptive field scrambles electronic signals internally while scrambling photons externally across the surface of whatever touching, making it appear to be covered in television static. An attractive field siphons electrons from existing electronic fields to charge the object in question, causing it to seemingly produce electricity from nothing and glow. This Quirk is excellent for giving the user a steady supply of electricity, setting electrical traps, shutting down electronics and even immobilizing people by scrambling nerve signals. While this Quirk is active, the user is susceptible to being jolted through contact with metal. Disruptive fields hold no real effect on objects with no relation to electricity. Attractive fields weaken considerably when away from any notable electronic fields."
300,Overhaul,My Hero Academia,"The user of this Quirk is able to disassemble and reassemble anything they can touch with their hands, either restoring it to its previous state or an entirely different one at the user’s discretion. With this Quirk comes an endless variety of applications. Instantly obliterate people or obstacles, fix a broken object, cure chronic ailments, heal severe damage, warp terrain to the user’s advantage, fusing materials or objects together, even reviving the freshly deceased good as new. Overhaul may even be used to fuse people into new, composite entities or fuse people with objects to give them a hellish existence. Notable, is that any living being, including the Quirk user, will experience excruciating, terrible pain whenever affected by Overhaul either partially or completely. Overhaul’s extreme control over the reassembly process is only able to work with what it has on hand. As hand contact is required to apply the effects of Overhaul, enemies that are able to attack while avoiding the Quirk user’s hands can avoid being obliterated"
300,Parahuman - Air Control,Worm,"Don’t laugh at it, the power to sense and manipulate air within a large radius is incredibly potent. The range of your power is roughly several city blocks, and its strength is enough to shred stone within an instant and metal shortly after. Of special note is your ability to compress air to the point that it’ll act like a liquid or solid, granting it incredible strength from the raw pressure. Releasing this compressed gas makes for incredibly dangerous aerokinetic explosions. Your power’s strength and control is much greater in areas with large open spaces and strong winds. If an airborne opponent was stupid enough to fight you high up in the atmosphere in the global slipstreams you’d be a living force of nature."
300,Parahuman - Gravity Manipulation,Worm,"You can manipulate gravity, increasing it immensely or completely nullifying it. Your ability to change its direction also means you can do things like fly, make it so that along a particular street people can walk on the building’s sides like it was a sidewalk, and much more. The effects of this power on an area can either be temporary, or last until you reverse them or they are disrupted by another effect. The upper limit of how strong you can make gravity increases with time. You start with five times earth gravity being your upper limit. This power’s range is a radius equal to about two city blocks around you, which will increase slowly over time."
300,Parahuman - Sensorium,Worm,"You can paint very large areas in an invisible field that allows you to hijack and manipulate the senses of those within. You can make them perceive and experience anything you can imagine, covering all possible senses. Blatant use allows you to effectively create holodecks wherever you will it, while subtle use allows you to misdirect and deceive with unparalleled finesse. Exotic senses will require attention on your part to account for, although your power has no trouble spoofing these just as easily as normal ones. As a secondary ability your imagination and creativity is enhanced, along with effectively perfect internal visualization."
300,Perfect Control,Generic Naruto Fanfiction,"Okay, whoa. This is quite nifty! Your chakra control is now utterly, absolutely perfect, which means that no matter how much of it you use and how many different manipulations you do at a time, you never waste so much as an iota of it, retaining absolute pinpoint control at all times. And chakra isn’t the only thing you can control so finely, either. Welcome to the world of perfect muscle control and coordination. You have utterly inhuman mastery over each and everything in you, your energies and your body, so strong that it never frays, let alone breaks, no matter what. You can manipulate chakra with your mind alone, and thus perform any Jutsu you know without the need of hand seals at all. In future jumps your control over your bodies expands to cover any other bodies you may acquire, and you can control any and all powers and abilities you acquire just as finely as your chakra."
300,Pyrokinesis,Young Justice,"Pyrokinesis allows the user to create and manipulate fire and heat, allowing them to throw fireballs and greatly increase the ambient temperature. The user is also immune to fire and most forms of heat; not to the point of being able to fly through the sun, but they could fly much closer than most spacecraft."
300,Rock of Ages,Generic Xianzia,"You have managed to unlock the secret of agelessness and youth. But what is the benefit to immortality if you cannot share it with others? You may bestow this longevity with others though this is not without cost to yourself. You must expend enough magical or spiritual energy to essentially blow up a mountain each time you use this technique. As such, you will likely require time and meditation in between each use of this ability and may be unable to utilize it altogether if you lack sufficient spiritual or magical strength. When you do succeed however the targets body is returned or accelerated to their physical peak and will remain as such forever unless external forces seek to rob them of their youth and vigour. You do not have to use energy from your own stores; energy siphoned from items, or other beings will work just as well."
300,Soundgarden,My Hero Academia,"The user of this quirk is able to manipulate a large amount of sand and glass at once with the sound of their voice, giving commands in a way that sounds like song more than orders. This Quirk, aside from just manipulation, also allows the user to seamlessly shift sand into glass and back again, turning sand into glass with higher pitch vocalizations and glass into sand with lower pitch vocalizations. An exceptionally low tone bellowed and sustained can cause any sand under the user’s command to pack itself together, attempting to condense and squeeze anything in the way. An exceptionally high note vocalized and sustained causes glass to reverberate and eventually explode/shatter. Shaping glass into “blooming” constructs like flowers seems to be easiest. The major limitations are lack of protection to the abrasive and cutting abilities of their own power, as well as the condition of their throat. Prodigious overuse of the ability has predictable results in scratching up and damaging vocal chords, making continued use difficult."
300,Technopathy,Arrowverse,"You have the ability to control any form of technology within your immediate facility, overriding it with your own encryption which changes and mutates like a biological virus, and can make technology do whatever you desire. You can also sense technology in your surroundings. Lastly you’re able to create a digital copy of your brain and upload it to any technology around you, but the copy will die if the power is cut from the device you’ve uploaded the copy to unless transferred elsewhere."
300,Parahuman - Biosculptor,Worm,"On touch you are able to sense every detail about living matter you're in contact with, and can shape it with a thought. You are only limited by your own (admittedly great even just with this powers senses) knowledge of what you're doing, the amount of biomass you have to work with, and physical laws. As long as it is organic you can weave it like a master musician would a masterpiece from the violin, or like a sculptor would mold their masterpiece. Contact means you're at least touching part of the living being you're wanting to effect. Requires direct flesh to flesh contact on your part, doesn't work through clothes or coverings, and doesn’t work on yourself. This power isn’t instantaneous, although it’s still extremely quick."
400,Air Specialization - Pressurebending,Avatar: The Last Airbender,"Requires: Bending Arts: Air

You have learned a unique form of Airbending invented right before the Genocide, utilizing a combination of wind and movement of air to create areas of extremely highly pressure. By preventing these areas from equalizing by surrounding it in a shell of high-speed wind, the pressure within these shells causes the air within to act as if it was solid, effectively letting you create short-lived objects. This art can also be used to create extreme low-pressure zones, and if you master it, you may even be able to create true vacuums."
400,Earth Specialization - Metalbending,Avatar: The Last Airbender,"Requires: Bending Arts: Earth

Long thought to be impossible, you are able to sense and Bend the tiniest impurities of earth within metal, target them, and use them to bend the metal itself. Though much more difficult than Earthbending, mastery of this art will enable you to move and shape metal objects as you please, tearing through solid steel like it was tissue paper or tossing tanks like childrens' toys. However, as an Earthbending specialty, this will only work on metals with impurities; completely pure metal will forever be out of your ability to control."
400,Fire Specialization - Lightningbending,Avatar: The Last Airbender,"Requires: Bending Arts: Fire

You are one of a very few set of firebenders able to separate positive and negative energy within your body, using this imbalance to create lightning. A dangerous and difficult art, it requires an absence of emotion and peace of mind; any deviation can prove fatal. However, its power is unrivaled, making those able to utilize it extremely feared. You have also mastered the art of lightning redirection, guiding electricity through your body before expelling it harmlessly."
