0,,CP Cost,Name,Jumpdoc,Chapter,Description
76,,400CP,Tower of Naraka ,Asura's Wrath,Domain: Protection,"After suffering a fatal blow, your soul will appear in the white void between life and reincarnation. This is 
Naraka, realm of infinite towers. To leave it, you must ascend the tower, and no amount of flight or 
power allows you to cheat the distance the journey back to the living world is as long as it needs to be to
attain the necessary enlightenment. It will take you anywhere from 12,000 years to 1 year to climb back 
out to your lifeless body (which has regenerated and been rendered indestructible in the meantime). 
Mortals might build a shrine around your fossilized form Mantra directed to you helps you ascend faster. 
If you're still in Naraka and not in your body when the current jump concludes, the Jumpchain ends. 
Falling off the tower, failing to ascend by jumpend, you reaching fail condition, or ten years passing also 
ends the chain. Alternatively, instead of outright killing an opponent, you may send their soul to Naraka 
and require them to climb out."
77,,600CP,BETTER GO READ MY OWN MANUAL ,The Culture Minds,Domain: Protection,"You have mental libraries of everything you are, what you carry and what you can do. If you need to 
know if or how you can do something that is within your capabilities, the information is there. This 
information covers your belongings, inventory and personal equipment as well, updating in real time. It 
is most useful for configuring yourself or your assets to carry out a task you haven't personally done 
before, but this detailed manual also holds the sum of the technology that makes up your body, allowing 
you to fully repair, rearm or fully construct a new from first principles all the technology that your body 
has incorporated within it. It does not, unfortunately, provide information on things you know nothing 
about, or things that are just so bizarre that nobody has considered them, but may contain theoretical 
notes. Very theoretical notes. Carrying out those never-considered options lies in your hands."
78,,600CP,By the grace of the Machine God ,Adeptus Mechanicus,Domain: Protection,"By His blessing, let the machine be sanctified. With ritual and prayer, protect His works from corruption 
and witchery. Raise a bulwark of iron anointed with sacred oil and incense and safeguarded its form and 
functions from eldritch powers. Be their origin within the material or immaterial, powers that attempt to
twist the form or control the functions of your machines will be repulsed. Minor hexes and vexes will be 
repelled with contemptuous ease, while mightier powers must devote a great deal of power and 
concentration to overcome this protection. Even then, they will struggle to do so."
79,,600CP,Humans First ,Supergod,Domain: Protection,"Humans are far from safe from use for the experiments of the powerful in their pursuit of more power. If
you're unlucky, you could be turned into a subject yourself. But if you are, you're one of those maybe 
fortunate few that can turn it back on your captors. You always retain control over your mind and body 
when changed or mutated, no matter what is doing the changing, and can even refuse some or all of the 
changes as you see fit. Bond with an alien spore and you remain in full control of the new powers, rather
than the spore being the controller."
80,,600CP,Infinite Improbability ,Hitchhiker's Guide to the Galaxy,Domain: Protection,"You are now the luckiest being in the universe at least when it comes to survival. If there is even the 
faintest chance of you surviving something? You will. You may not enjoy it, but you'll survive it. 
Unfortunately, the trade off is that wildly improbable things keep happening to you. Now, you can turn 
off this protection and have a peaceful life instead but then you're not guaranteed survival. Somehow, no
matter where you go, regardless of if the rest of this is toggled on or off, you'll always have done the 
equivalent of having read the safety instructions and memorized all the escape routes and emergency 
procedures for anything. This covers everything from knowing how to safely exit a crashing starship to 
how to initiate emergency shutdown of an out of control reactor. Somehow, knowing all this will not 
make you a dreadfully dull person."
81,,600CP,Limits? ,Generic Worm Fanfiction,Domain: Protection,"So powers are supposed to be limited aren't they? Depends on the fanfic, really. Either way, yours aren't.
No, this doesn't double your powers every six months. That'd be crazy. What this does is smash every 
glass ceiling, barrier or restriction into so much dust. Any and all of your powers, abilities, skills etc., are 
like muscles for you now, only growing stronger the more you exercise them. This does nothing for your 
rate, at least by itself, but it means that regardless of how they're supposed to operate, any and all of 
your powers can now be trained up infinitely. Furthermore, no power or skill you have can ever harm 
you directly, unless it's someone else using it on you. Nor, for that matter, can anything you do to 
improve yourself. Too much, at least. Training too much till you break half your muscles will still put you 
in the hospital, but what would be a lifelong crippling for others would only be a temporary thing for 
you, and you'd still benefit fully. You can use and develop mutually exclusive or opposite powers without 
any harm, and similarly use any and all powers you have without fear of ruining your own body or mind 
or whatever. No amount of overusing your powers can hurt you or them permanently. Again, you might 
suffer for a while, but it'll only ever be temporary and they'd grow that much stronger for it."
82,,600CP,Luck Forgives All Sins ,Warhammer 40k: Tau Empire,Domain: Protection,"Developing AI without instigating a rebellion. Fiddling with Warp travel without Gellar fields. Messing 
with biological manipulation and nanotechnology without creating a homogenizing swarm. While you or 
those under you work to push technology forward, you will somehow stumble your way around or past 
the major drawbacks and potential disasters you could invite, whether you know they are there or not. 
This won't let you ignore those threats, but will push you to solutions that don't trigger them, such as 
skimming the warp instead of entering it, even if this results in inferior results. Unless you know about a 
threat and deliberately work in such a way as to trigger it (such as trying to form grey goo), your luck will hold."
83,,600CP,Physical Resistance V ,Essential Body Modification Supplement,Domain: Protection,"Your body resists negative effects.
I: You are immune to normal diseases, parasites, bacteria, toxins, and the degenerative effects of 
radiation.
II: You are immune to the items listed in tier I, regardless of origin. When you are injured, the injury is 
approximately 25% less than it would be otherwise. You also have a high pain tolerance.
III: As tier II, but your resistance to damage increases to 50%. You are also, at your discretion, resistant to
effects that would mutate or alter your form.
IV: As tier III, but your resistance to damage increases to 75%. You are also immune to the effects of pain,
though you are aware of it.
V: As tier IV, but your resistance to damage increases to 90%. You are also immune to any effects that 
would mutate or alter your form unless you choose otherwise"
84,,600CP,A Good Night's Rest ,Generic Hentai Superheroes,Domain: Protection,"Wow. They really put you through the ringer didn’t they? Just... wow. But it’ll be alright. All you have to 
do is get a good 8 hours of sleep, and it will be like none of it ever happened. Any scars, any wounds, any
stretching of certain holes. As long as you get 8 hours of uninterrupted rest, they will be all healed."
85,,600CP,"Anonymous Doesn’t Forget, But Everyone Else... ",Kamikaze Kommittee Ouka,Domain: Protection,"You are the epitome of anonymity. People will literally have trouble remembering who you are and what 
you look like most of the time. Even if you pull some of the craziest stunts, they will forget all about you 
personally after a few minutes — even if they remember the event. It makes for an easy getaway when 
people have witnessed your shenanigans. This even affects electronic surveillance. For some reason, 
your face and identifying features just seem to blur and pixelate even more than the worst CCTV system. 
Of course, you can toggle this on and off whenever you want. Yep, a completely forgettable individual. 
I’m sure you won’t abuse this too much, right? ...Right? "
86,,600CP,Primacy ,Eclipse Phase,Domain: Protection,"So often when people fork themselves they don't consider the ramifications of what happens when their
forks disagree with them; each one considers themselves to be the originals, each one claiming to be 
equal to the others. Without having to put any annoying psychosurgery in place, any and all copies of 
your forks, clones, self-duplicates, shadow copies etc. will recognise that you are Jumper Prime, the 
original, and that they are the duplicates. Even copies of you that you didn't make such as if someone 
got a sample of your DNA and grew themselves a clone recognise you as their original. This recognition 
gives you a significant degree of authority over your copies: they tend to default to your orders and see 
you as superior even if you are technically identical to them. Other versions of you with different 
motivations or programming (eg: evil clones) still have that programming, but might be more reluctant to
fight someone they know is their original or maybe they'll be more eager to fight, depending on your personality."
87,,600CP,Removed From Context ,Young Justice,Domain: Protection,"Being from outside of this world makes it much harder for others to predict what you're doing or planning at any given time, making you harder to counter in a fight as well as harder to plan against. In addition, it's impossible to replicate your powers and technology that aren't native to whatever world you're in. If you willingly choose to share or give your technology, then it may be replicated.
FREE: Souvenir: After major battles/missions, you always seem to find an item or trophy that you can take that's pleasing to look at or of some (sentimental) value. (Free)
FREE: Most Common Superpower: Whether or not they actually are a hero, everyone still looks the part; the appearances of you and your companions are now well above average, making you all very handsome/gorgeous. (Free)
FREE: Required Secondary Powers: The powers here run on comic book physics, letting their users do things like lifting heavy objects without sinking into the ground and running at super speeds without catching their hair on fire. Powers that overlap with the powers you purchase/get here, such as multiple super strength powers, also benefit from this. (Free)
FREE: Costume: You have an expertly made costume of your design. It's not that much more protective than normal clothing, but it's very iconic. If it gets destroyed or lost, a new one will appear in your Warehouse, with any modifications you've applied to it intact. You may choose to import an existing costume or outfit for free."
88,,600CP,Fragment Of A Pure Heart ,Generic Hentai Fantasy,Domain: Protection,"The problem with being the Hero or Heroine in a place like this is that every self proclaimed demon lord 
and every self important noble slimeball is going to want you in some way. Could be a trophy wife, could 
be a sex slave, but they're going to want you. Your body resists these changes, requiring more effort to inflict them upon you, and forcing them back out if left unattended - though, that may take years. However, regardless of what they do to your mind and body in order to break you, there will always be a small part of your mind that remains 
you. You might be left trapped in your own body, but come the end of the jump, that fragment will get 
you out of there and purge the changes for the next jump. "
89,,600CP,ROOT OF ALL GENIUS ,Medaka Box Abnormal,Domain: Protection,"The greatest minds of our world didn't make their great discoveries when they lived happy, peaceful 
lives. They made them in times of war, after living through hell themselves. Or at least that's the view of 
a certain young genius. The worse the situation you find yourself in or the more miserable you are on a 
personal level, the better you and your powers will get. A little constant annoyance won't make much 
discernable difference but constantly subjecting yourself to tortures and poisons and purposefully 
ruining your relationships with those you love, all the while reaching the climax of the villain's evil plan, 
and you could dwarf your original power, so long as you kept yourself in that situation."
90,,600CP,The Golden Ending ,Generic Hentai World,Domain: Protection,"This is it Jumper, the happily ever after that every Harem Protagonist dreams of achieving. You’ve 
reached the “marry them all” stage in your journey where your entire harem is in love with you (and 
possibly each other) and everyone is happy to share, or if you haven’t yet then you will eventually. Once 
you’ve reached this ideal state nothing short of deliberate abuse or neglect on your part can make the 
members of your harem break up or fall out of love with you or with each other. New girls will be 
welcomed into the fold by their elder sisters rather than shunned or rejected, though this doesn’t 
guarantee a lack of personality conflicts. Even if you vanish into a Gauntlet for a hundred years or do a 
stint as an evil overlord they’ll all continue to love and support you, if perhaps from a distance, until you return to them. "
91,,600CP,So Long and Thanks for All the Fish ,Hitchhiker's Guide to the Galaxy,Domain: Protection,"You always know when the world is about to end, literally or metaphorically, when you're being played 
by forces greater than yourself, and just how doomed you currently are. Thankfully, you're exceptionally 
good at planning around those things. You could literally leap out a window in a skyscraper without a 
plan and come up with one on the way down. The more screwed you are, the more outmatched you are,
the closer the end of the world is, the clearer and faster you think and the luckier you get. As long as 
someone isn't specifically targeting you, you are almost certain to come up with some hair-brained 
scheme to survive, and have it work. Once per jump, when you would otherwise have died, you will 
spontaneously find yourself in a new version of that reality, one exactly like the original, but missing 
whatever just killed you. If it's an individual, they'll be someplace else at the time."
92,,600CP,Hardcore ,Generic Lewd Sci-Fi,Domain: Protection,"Be it the hardships of your early life, the most ruthless training, or augmentation with cybernetic 
systems, you have been transformed into something incredible. Your body isn’t soft like meat - it’s like a 
statue of bronze, strong enough to tear through walls. Your stamina is utterly inexhaustible provided you have the smallest amounts of food, air and water to sustain yourself. With an iron body comes an iron mind: capable of extreme feats of mental and bodily control to withstand any injury, torture or hardship. If your body is mechanically able to perform a task, you can do it; likewise, you can fully ignore any sensations of pain or pleasure just by willing it so. It’s not an exaggeration to say you could fuck for days on end if you felt like it."
93,,600CP,Stress Evolution ,Factorio,Domain: Protection,"The most dangerous trait of a hive's minions is the ability to rapidly evolve in response to injury. Cracked 
shells grow back thicker. The most heavily-worked muscles bulge with new tissue. Overtaxed acid glands 
are pumped full of hormones to encourage development. Worse, when these tougher variations and 
dragged back to a hive for re-absorption the new traits are passed on to all future generations. That gift 
is now yours. When overworked and under stress, growth is immediate and noticeable. Skin toughens in 
response to cuts. Bones grow back even stronger. Even the mind grows sharper when taxed, and your 
body will automatically work to ensure every enhanced trait is carefully balanced with the rest of your 
biology - develop hyper-acute senses, and the mind will adjust to handle the new input."
94,,600CP,Master of Masters,Generic BDSM,Domain: Protection,"To be a master is to be naturally-inclined to gain power and stand above others. You are the logical 
conclusion to that statement: a master who stands above even other dominants. Your will is absolutely 
ironclad and impossible to break: be it via torture or mind control or other methods, you will kneel to 
neither man nor god. But the same cannot be said for others: when subjected to your methods, even the
fiercest dominatrix may find herself developing a submissive streak, if only where you are concerned."
95,,600CP,The Holy Collection ,Dies Irae,Domain: Protection,"Very few are capable of touching the Lance of Longinus and surviving. Only two men at this time are 
great enough to truly wield it. The reason for this is that the Lance seeks to protect itself from outsiders, 
burning away at the body, mind and soul of any who touch it without permission. Only those of earth 
shattering power can bypass this without being the true owner of the Lance. Now they'll need the same 
permission to touch anything that you own. So long as it is a possession of yours, you are able to extend 
this same three target ward to any object you possess. Any who touch your weapons, armor, accessories,
clothes or even idle trinkets or money without permission will find their bodies rotting, their minds 
shattering and their souls burning away, quickly enough to kill in just seconds for most or even less for 
those truly weak compared to you. Those near or equal to your power will still be harmed but it would 
take a few minutes of contact for them to be severely harmed. Those far above you will be unfortunately
largely unaffected, at least until you become stronger. You can choose to disable this effect for specific 
objects, specific people or overall as you please."
96,,900CP,Accentuate the Positive | Eliminate the Negative ,Limitless,Domain: Protection,"-Accentuate the Positive (400CP) You now have an immunity to side effects of a certain kind. A super 
cool sword that takes over the body of its wielder? It's not getting even an inch inside of you. A demon 
making a pact with you for powers? Well, he is inside of your soul, but he's now stuck, only able to fuel 
your new abilities like a glorified battery. This perk only protects you against sources of power from 
outside of your body, including combat drugs, artifacts, enchantments, magical pacts, items and other 
things you wield by giving you only the beneficial parts and leaving the rest behind. This comes with 
complete immunity to addiction.
-Eliminate the Negative (500CP) Now the immunity to side effects can affect internal things. Magic that 
may have drawn on your emotions to fuel its power now has a separate pool. Any drawbacks your 
powers, biological traits or magic systems may have held have been wiped away."