0,,CP Cost,Name,Jumpdoc,Chapter,Description
1,,50CP,Summer Fashion ,Fate/Whore Order,Domain: Protection,"While a not insignificant portion of Scathach’s efforts take place in Shinjuku, the city of Yakuza, a larger 
portion takes place in Luluhawa and Vegas, two of the four summer Singularities. It should come as no 
surprise then that this allowed Scathatch to dress both herself and others in even more risque clothing 
than they would normally wear. In other words, swimsuits. And boy, were they swimming in men and 
sperm right quick. The way this perk affects that is that it takes that otherwise weak piece of fabric and 
grants it the Servant class durability it will need to not get utterly destroyed, be it from swords and 
lances or over eager men trying to rip it off. This also applies to lingerie and other naughty things, but 
not to actual clothes. It also prevents them from staining due to all the fluids. "
2,,100CP,A Bottomless Heart ,Generic Hentai World,Domain: Protection,"For an ordinary person it may be enough to only have one other person to spend your life with, but 
there’s nothing ordinary about you, is there? Love and emotional attachment comes to you easily and 
you find it more difficult than most to let go of those you care about, to the point that choosing one 
woman over another when you love them both is unthinkable to you. Luckily, this is not without its 
benefits. You have a perfect photographic memory for information about people you care about, no 
matter how many of those people you might have. You’ll never forget their birthdays, favorite meals, 
erogenous zones, etc. and can easily keep track of their needs and desires without even thinking very 
hard about it."
3,,100CP,Ageless II ,Essential Body Modification Supplement,Domain: Protection,"You do not age or otherwise degenerate over time in the normal manner, You will never die of old age and will maintain peak performance and health with no degeneration forever. You may choose to halt or resume your visible aging at any time."
4,,100CP,Eureka!,Generic Lewd Sci-Fi,Domain: Protection,"It’s a little worrying just how many scientific advancements came from accidents and a scary lack of safety standards. Luckily for you, while you aren’t any less or more accident prone than normal, such accidents tend to be on the sexy side of things. Less “melt everyone’s face off” and more “melt everyone’s clothes off”, or being bitten by a radioactive pig wouldn’t turn you into a half-porcine monsterbut bestow on you their ability to have 30 minute orgasms, until it wore off."
5,,100CP,It Has Needs ,World of Tentacles,Domain: Protection,"A genius’s mind is as deviant as it is brilliant, and the products of that genius trend towards the deviant as well. By including erotic elements in the creation of your items or monsters, such as summoning a demon with a tantric ritual or powering a device with the energy of Orgasmic Extraction, the creation process becomes much easier at the cost of making the result more dependent on those elements. So long as you keep such needs sated your creations will be distinctly more powerful and easier to control, but the opposite is true if their needs are not fulfilled."
6,,100CP,Love at First Sight ,Generic Hentai World,Domain: Protection,"It’s said that every journey begins with a first step, and whether that step is a good one or not can set 
the tone for the whole trip. This is no less true for relationships than for anything else. Luckily, you have 
a gift for starting things off on the right foot: whether you’re starting a new job or making new friends or 
meeting a destined lover for the first time, everything just seems to go exactly the way you need it to in 
order to make a good first impression on people. You’ll never fumble your words or trip over your own 
shoelaces ever again (unless you meant for that to happen, some girls are into cute clumsy dorky guys 
after all)... at least, not at first. After step one it’s all on you to maintain that positive impression."
7,,100CP,BLACKBODY ANOMALY ,The Culture Minds,Domain: Protection,"As an Excession, it's important to keep your secrets. Scans and sensor readings that try to gather 
information from past the skin of your body give either nothing, infinity or extremely contradictory and 
impossible readings. You may disable or enable this effect at will."
8,,100CP,Corruption Resistance ,Essential Body Modification Supplement,Domain: Protection,"This perk confers protection against supernatural influences that target your soul or that fall outside the 
bounds of physical or mental influence. Unless you specifically wish for it to do so, no contract, curse, 
possession, or effect can take hold of, bind, or damage your soul or being. When you first gain this perk, 
your soul is restored to an uncorrupted, whole state and any supernatural influences are cast off."
9,,100CP,Murphy's Law ,SCP Foundation,Domain: Protection,"You've been around so many experiments, so much weird shit, that you notice things other people don't 
and instinctively position yourself, as a subconscious reaction to anything that can go wrong, and avoid 
the eventual backfire. The knowledge that a few errant bubbles in a flask can quickly turn into boiling so 
violently that even the open end of it isn't enough to let all of its energy out, turning it into a chemical 
explosive, is not lost on you. Neither is the fact that that open flask over there just bubbled when a piece
of dust fell into it. If you're running the experiments, you know how to avoid those circumstances, and how to extinguish the fires if and when they break out."
10,,100CP,Painted On ,Generic Lewd Sci-Fi,Domain: Protection,"Clothing just seems to fit so much better when you wear it. You can decide how tight the fit of your 
clothing is, as well as reduce the thickness or thinness of the fabric. This lets you decide how supportive 
the clothing is, too, as well as whether it’s sheer or not. This doesn’t change the clothing’s other 
features, like its style or colors, or what kind of functions or protection it provides."
11,,100CP,Protection ,Milk Hunters,Domain: Protection,"With Senpai going around and raping anyone who catches his eye during monster attacks, it might be a 
good idea to have a bit of “protection.” Protection against STDs and unwanted pregnancies, that is. From 
now on, you can choose whether or not you will get pregnant or impregnate someone during sex, and 
you’re not only immune to STDs, but you’ll cure any that your partners have. Unless you don’t want to, for some reason."
12,,100CP,Parasite's Compromise ,Monster Girl Encyclopedia,Domain: Protection,"It's so cruel to hate a parasite, it just wants to live like any other living thing. It's just that its survival 
instincts tend to create conflict with its host. However, you know how to make the experience mutually 
beneficial. If you are infected with a parasite, you can merge with the parasite and take control of it, thus
preventing it from harming you; in fact, the parasite, having merged with you, will now often be 
beneficial for your body, covering defences that your body alone could not handle. You will essentially be
sharing the same mind and memory (with you in charge), and since the host (you) is now bonded with 
the parasite, there will be no further conflict over living space or control. On the flipside, if you are in the
form of a parasite and have infected a living host, you can, by gaining consent from the host or by 
overpowering the host's will, merge with the host, you becoming the host and the host becoming the 
parasite. Either way, parasite or host, you remain the dominant one in the bond. If you wish to break off 
the merge on either end of the spectrum, you can separate again, on condition that the parasite (even if 
it's you) will be automatically ejected from the host's body. Please note that the perk applies not only to 
physical parasitism, but also spiritual forms of parasitism such as possession (which is also pretty common here with things like Cursed Swords)."
13,,100CP,Snakeskin ,Generic Lewd Sci-Fi,Domain: Protection,"Why do you even bother with armor when the other guy has a disintegrator? It’s better just to sidestep 
the blast, so that’s what you do. The less your clothing is covering you up, the better you dodge and the 
faster you are. Wearing something as revealing as a space-fabric loincloth or latex bikini will give you 
enough of a speed and agility boost to rush and overwhelm a handful of opponents with blasters even if you were bare-handed."
14,,100CP,Wet Tshirt Contest ,Generic Hentai Modern,Domain: Protection,"When doing sports, you may come to realize that having J-cup breasts or a dick as long as your leg makes
going anywhere fast very painful. Thankfully, you don’t have that problem. As long as you’re in good 
health - ie, no broken bones or debilitating illnesses - you can move about with perfect ease. Even if 
they’re bigger than you are, walking around - or running, as is probably more accurate – won’t be hindered at all."
15,,100CP,What Doesn’t Kill You ,Generic Hentai Superheroes,Domain: Protection,"Hurts like a bitch. But you’ll survive. Your pain tolerance has increased, making lesser wounds less painful."
16,,100CP,Strategy Trance ,Brockton's Celestial Forge,Domain: Protection,"At will you may go into a trance in which your mind speeds up, your eyes glaze over and you start to 
instinctively analyze your current situation, any data points about your enemies, environment, your 
available powers and tools and their uses. You can then use all that information to instinctively construct 
hypothetical scenarios of possible resolutions to the encounter. After the trance ends you will have 
boosted competence to follow through with any plans you made within the trance, almost as if your 
instincts are guiding you.
The trance does not leave you defenseless, two things protect you during it, firstly a few external 
seconds of trance can be up to 10s of minutes of internal time. Secondly you will immediately wake up 
from the trance if you are attacked or if you would have wanted to be woken from it at any time for 
some other reason.
This perk is further boosted by any other mental perks you have and synergies and integrates aspects of 
all your mental perks to enhance the trance in some way or another."
17,,100CP,"Zero-G, Zero Problems ",Generic Lewd Sci-Fi,Domain: Protection,"Artificial gravity takes most of the space sickness out of space travel, but it can still unsettle every now 
and again. You’re now immune to motion sickness and vertigo, especially from zero or fluctuating gravity,
so engage in all the zero-g gymnastics you like."
18,,100CP,SUPERHUMAN DESIRE ,Medaka Box Abnormal,Domain: Protection,"You always wanted to be special and that want was itself so strong that you really did become so. 
Whenever you are subjected to a procedure that will improve or beneficially alter you with a chance of 
injury to you, death or even just the procedure failing outright, it will instead have a guaranteed chance 
of success. Risky operations will always go off without a hitch, shoving an energy source into your own 
body will have it combine with you successfully if there was even the smallest chance of you not dying."
19,,100CP,No Fainting ,Generic Hentai Fantasy,Domain: Protection,"Now, I know what you’re thinking. Whenever the monster catches the pretty lady, it rapes her into 
unconsciousness via sheer sexual overload. However, due to shenanigans, you can store this pleasure for 
enjoyment at a later date. It’s a tiny bit precognitive, as it will activate on its own right before something 
that actually would knock you out."
20,,100CP,Toggle ,Young Justice,Domain: Protection,"Toggle allows its user to forgo learning to control their powers by simply allowing them to turn their 
powers off when they aren't needed. This can be done per power, so there isn't a need to go without the
ability to teleport because you don't want to use your super strength. Also works on out of Jump powers.
You can think of this like a dial. It can be on, or full power, as well as off, or no power, and anywhere in 
between those two states."
21,,200CP,Blank II ,Essential Body Modification Supplement,Domain: Protection,"Abilities which gather information about your past, present, or future do not work on you. This includes 
scrying, divination, mind reading, and even cold reading and lie detection. This ability not only affects 
your immediate person but also provides a degree of protection to items and people around you, making
it difficult to predict the past, present, or future of any group you move with or vessel you travel on. If 
you have the Essential Mutuality perk, your affected companions gain the full benefit of your Blank perk 
even if they are acting independently.
I: You are immune to all supernatural and technological abilities and devices which perform the functions
described above. You simply do not register to such abilities, though your own abilities function 
normally. Purely mundane skills at cold reading or lie detection will be less effective, but still function to 
some degree. Dsc: Sch/Ass/Arc/Sup/Lch/Bea/Dra/Exp/Hea
II: Even mundane versions of the above items do not function against you. Furthermore, you are able to 
detect when someone is actively attempting to discern such information through supernatural or 
technological abilities or devices and feed them false information of the type they expect. Thus, you can 
feed an image of yourself asleep in bed to a scrying spell while you're secretly across town beating up 
thugs or you can have a truth detection spell return 'truth' when you are telling a lie. Note that this does 
not protect you from compulsions to tell the truth or share information directly. Additionally, any items 
which you create have a measure of this protection, making it difficult to predict actions directly relying 
on those items and making it impossible to detect the items themselves with most supernatural abilities."
22,,200CP,A Little Rape Never Hurt Anybody ,Generic Hentai Superheroes,Domain: Protection,"The human mind is designed to only be able to handle so much trauma. Too much forces it to shut down,
possibly even killing its owner. You no longer have to worry about this. Your body can handle the pain, 
both physical and mental, with no psychological trauma afterwards."
23,,200CP,Happily Ever After ,A Change In Tactics,Domain: Protection,"The Shepherds are heroes straight out of legend, and their adventures are the kind of tales which are 
beloved by children and immortalized by bards and artists. Such stories rarely end in heartbreak and 
tragedy, or with the married life being dull and unfulfilling, and yours won’t either. So long as you hold 
genuine love for your partner(s) the earth will move to bring you together and keep you together no 
matter what kind of adversity you might face, be it separation in wartime or more domestic relationship 
issues. While this won’t do anything to prevent conflicts from occurring, what conflicts do occur will 
always be able to be resolved, and as long as you don’t give up on the relationship it will always be 
salvageable no matter how bad the situation becomes. "
24,,200CP,BUOYANT ON THE SKEIN ,The Culture Minds,Domain: Protection,"Space-Time, or the skein of the universe, tends to be thought of as flat but distorted by gravity, the mass 
of objects sinking them into the skein and distorting it around them. The mass of your body and form, 
however, floats on the surface of the skein like a leaf on the surface of a pool; creating no disturbances 
around it, and always floating on the top while waves and currents pass beneath you. No need to cheat 
with anti-gravity or rest on top of a force field. Though you retain your mass, you are not subject to 
gravity if you do not wish to be, and are immune to attempts to affect you with gravitational 
disturbances and spatial distortions, unless you choose to disable this effect."
25,,200CP,Health Care Plan ,Generic Hentai Modern,Domain: Protection,"As much as this world runs on porn logic, that logic isn’t very stable, and there’s actually a lot of work 
that goes into it. However, not for you. While a casting crew would have to make sure to find actors with 
no STD’s, said diseases seem to flee your presence. Preparations, from foreplay to an ass cleaning for 
anal, simply happen ‘off screen’, allowing you to go directly from ‘lets fuck’, to actually fucking."
26,,200CP,Inoculated ,Bio-Weapon Quest,Domain: Protection,"You are immune to the chemicals and special powers of your creations. If you genetically engineered a 
snake, you'd be immune to its venom, if you transformed a schoolboy into a rape monster you'd be 
immune to their aphrodisiac pheromones and special attacks."
27,,200CP,Fashion ,Highschool of the Dead,Domain: Protection,"Your clothing and entire body acquire defensive properties equal to the most superior protective items 
you have currently equipped. Emphasis on protective item an iron or steel ring won't give you metal 
tough skin the minimum is things like knee pads from extreme sports, helmets even an apron would 
count, though all that'd do is protect you from the dangers of a kitchen"
28,,200CP,One Minor Exception ,Generic Hentai Modern,Domain: Protection,"There’s this one little highly inconvenient rule about idols that you’re probably about to run into. 
Specifically, no dating. No boyfriend. No sex! It’s supposed to preserve the appeal or something. But, 
since this is hentai, that rule was made to be broken. Even if someone gives you a firm talking too about 
how you aren’t allowed to date anyone, they'll fail to punish you for actually breaking it. Maybe even to 
notice you breaking it in the first place. Coincidentally, you also qualify as a virgin sacrifice even if you 
aren't. "
29,,200CP,Secretly A Masochistic Contortionist ,Generic BDSM,Domain: Protection,"Good thing you used to take ballet and gymnastics, jumper. I don't know how you would have been able 
to survive that split otherwise... what's happening to your underwear right now? Simply put, you are 
now inhumanly flexible and durable, and any sensation that would normally register as discomfort or 
pain is now pleasurable to you. This doesn't help with the muscle deterioration that sets in after six 
months in an armbinder, but whoever put it on you will be able to get your elbows to touch without 
dislocating your arms, and you'll enjoy every moment of it. You can choose to toggle this perk on and off 
at will and can always tell the difference between “good” pain and “bad” pain, i.e. the kind you get from 
a few hours at the gym versus the kind you get from a gunshot wound. The latter kind of pain does not 
trigger this perk’s effects by default unless you choose otherwise."
30,,200CP,Form Mastery III ,Essential Body Modification Supplement,Domain: Protection,"You are adept at changing between forms.
I: You may change forms over the course of about a second, even if you cannot concentrate properly. 
Being drunk, drugged, or half-unconscious can't stop you from changing shape to an alternate form. 
Alternate forms never result in dysmorphia for you.
II: As tier I, plus your shapechange is now instant, requires only a thought, and nothing short of a 
Drawback or Jump Fiat effect can stop you from doing so. Additionally, unless a Drawback of Jump Fiat 
effect says otherwise, you may have your clothing resize with you or merge into your body, as most 
appropriate to your new form.
III: As tier II, plus you may combine forms freely, choosing which aspects of each form to use for what 
purposes. This applies to any forms you may adopt through shapeshifting abilities, but it also includes 
alt-forms gained from other sources."
31,,200CP,Inertia of Self II ,Essential Body Modification Supplement,Domain: Protection,"You are protected against effects that would affect your mind and existence.
I: You are immune to any effect that would affect your memories. If someone turns back time, alters 
reality, or attempts to directly alter your memories, you retain both the 'original' and 'new' memories, 
instinctively knowing which set is which. Other than your two sets of memories, this perk does nothing 
to tell you who changed things or even what they specifically changed if it isn't otherwise obvious.
II: You are immune to any effect that would alter or outright destroy your body or existence. This 
protection extends to conceptual, temporal, and reality warping effects that work either directly or 
indirectly to destroy or alter you. This would prevent a time traveler from killing you as a baby or causing 
an accident that would leave present-you paralyzed. It would not protect you from a fireball created 
through temporal manipulation or having a time traveler frame you for a crime that lands you in prison."
32,,200CP,Showing Off ,Generic Hentai Fantasy,Domain: Protection,"Your body is (probably) nothing to be ashamed of, so don't be. No matter how far outside the so called 
dress code you get - bar actual nudity, because that's not clothes - no one will raise a complaint about 
said clothing. What's more, you won't feel any shame over your own questionable style of dress."
33,,200CP,Ward’s Maxim ,World of Tentacles,Domain: Protection,"Does nobody besides you read Lovecraft before they start dabbling with eldritch forces anymore?! 
You’ve learned to never call up anything that you can’t put down and you put that lesson into play by 
ensuring you’ll never lose control of your creations. Any creatures summoned or created by you as well as any devices you build have a built-in kill switch which you can use to restrain, kill, power off, or otherwise neutralize them at will. The nature of this trigger is up to you as long as the effects are the same, but it can only be exploited by you or those instructed in its use by you. You are also automatically inoculated against any chemical or biological 
agents you may create."
34,,200CP,Juggernaut ,Terraria,Domain: Protection,"Your armor is a lot more effective at doing what it does just by the sheer virtue of it being latched onto 
and wrapped around your fleshy bits. Not to get too far into the math of it, your armor is about half-again more effective than it would be otherwise."
35,,200CP,Where No One Has Come Before ,Generic Lewd Sci-Fi,Domain: Protection,"Protective outfits are often necessary to survive in hostile conditions comfortably, but as long as you’re 
wearing the most important parts you can expose some of yourself without harm. If most of your space 
suit is ripped away, as long as your air tank and helmet is fine you’ll be able to survive in space, or you’ll be able to unzip your pants in a toxic atmosphere to screw a Venusian without worry."
36,,200CP,Mental Resistance III ,Essential Body Modification Supplement,Domain: Protection,"Your mind and will are strong.
I: You are very difficult to intimidate and have a high resistance to mental fatigue (such as from extended 
warfare or study) and can generally delay dealing with mental trauma until any immediate crisis is dealt 
with. Also, you do not get bored with tasks easily and can study or practice abilities for extended periods 
without penalty or need for a break.
II: Immunity to the items in tier I plus a high degree of resistance to memetic hazards, insanity,mind 
control, and other factors that would impact how your mind works.
III: Complete immunity to the items in tiers I and II."
37,,200CP,Release Mechanism ,Generic BDSM,Domain: Protection,"Sometimes you just want to be tied up, but you may not always have someone around to do the tying 
and more importantly, to release you once you've had your fun. It's a good thing for you then, that you 
now know how to include an emergency escape into anything you set up yourself. This goes beyond 
understanding how to use ice to keep a key out of reach for an hour or two: if you build a machine, you 
will always be able to include some kind of shut-off switch in a discreet spot that you can still get to 
easily if things go wrong. If you find yourself in the middle of casting a magic spell and suddenly need to 
stop, you now know just how to stop without releasing unstable energies that could harm you or your surroundings."
38,,200CP,Professor Guinea Pig ,Ben 10 0.1,Domain: Protection,"You have successfully managed to transplant your own brain into a jar now attached to your body! 
How?...I...I don't actually know. Regardless, you have the ability to use your own body and mind as a 
guinea pig with you as a one-man science team, even if it would normally be improbable or downright 
impossible. Replace both your arms with robotic copies at the same time, shove organs into robotic 
vessels and armor, and so on. All by yourself. Don't think about it too hard."
39,,200CP,Clothing Un-damage ,Generic Hentai Fantasy,Domain: Protection,"The less armor you wear, the less likely it is to be hit, and thus the less likely it is to be damaged. But of 
course, armor that is ignored is no armor at all. No matter how flimsy or how little it leaves to the 
imagination, your armor is just that. Armor. A steel plate bikini is as good as a set of full steel plate, and 
something made of a magical metal like mythril would be even better. Basically, you can now get away with absurd ‘fantasy style armor’ without the logical consequences of leaving your boobs/abdomen exposed that would normally ensue."
