0,,CP Cost,Name,Jumpdoc,Chapter,Description
40,,200CP,Prototype Process ,Ben 10 0.1,Domain: Protection,"Science is a learning process and sometimes that learning process involves explosions, malfunctions, or idiots messing with things they shouldn't. Well, they used to, anyways. When technology you've built or used would normally suffer a malfunction or an experiment would become a disaster, it will instead create a harmless inconvenience instead of blowing up in your face. A device's sensitive power core being struck would see it shut down immediately, a DNA serum you inject into yourself gives you mild indigestion instead of mutating you into a horrible monster, and so on. If a result would be entirely negative for you, the impact is dulled to a comical accident instead of something that could endanger your life and those of others. How lucky for you.
FREE: Smartest In Five Galaxies [Free for Genius] – Three galaxies! THREE! Why is that so hard to get right?! Either way, people tend not to question or doubt you in your fields of expertise, which given your experiences on this journey, might well be a lot of things! When you speak, others tend to believe you're the smartest one in the room or at least somebody worth listening to when it comes to a matter you're an expert of, like advanced technology or just using common sense. Even if you've done very questionable things with that expertise, people tend to consider your input important enough to at least hear out.
FREE: Look, this sort of thing just happens. Sometimes you're doing a normal experiment and suddenly the lab has an accident and now whatever you're working on is starting to talk to you. When it does, it's your duty to take responsibility for it like a good creator should. Whenever you create life, whether by accident or design, you know how to properly treat and either tame or raise your creations. Regardless of whether they're as smart as a small puppy or able to speak fluently in your language a day in, you know how to treat them properly to the point they will obey you or at least not try to bite your head off. This only works if you don't abuse or hurt them, mind, so try not to be an idiot when your toaster starts speaking in tongues."
41,,200CP,Safety First ,Cardcaptor Sakura,Domain: Protection,"You can choose to be completely unaffected by your own magic when it suits you, including beings that 
were created by you or spells taught to others that you designed."
42,,200CP,Stavros Mueller Beta ,Hitchhiker's Guide to the Galaxy,Domain: Protection,"You know when you're going to die in any universe or rather, you have a very good idea of at least one 
event that has to happen before you can die. Time Travel Is FUN!"
43,,200CP,Surpassing the Creator ,NieR Automata,Domain: Protection,"The aliens made you with a purpose. They defined you with rules. Behaviors. Limits. Your siblings bent 
those rules and exterminated their creators. You broke them entirely. The only limits and rules you 
follow are those you choose to. You're no longer bound by any sort of programmed rules or biological 
instincts or even supernatural restrictions on your behavior or free will. You are aware of them and to 
those unaware of your freedom, you may even appear to still be restrained by them, but you can choose 
to act as you will entirely unrestricted by them. A god of the machine can't be bound by mortal rules."
44,,200CP,Things best not known ,Smash Up-Obligatory Cthulhu Supplement,Domain: Protection,"You don't go mad from cosmic truths, but have a sense for when such secrets are dangerous to others. 
You are good at explaining things away besides. Best not to spread the madness around."
45,,200CP,Wavestrength ,NieR Automata,Domain: Protection,"The signal is clear and strong. You wouldn't be able to do your job if you couldn't connect to your girls in 
the field so thankfully you never experience issues with your connections. As long as your targets are in 
range, your broadcasts cannot be blocked, intercepted, hacked or otherwise interfered with. Even when 
you should be prevented from sending out anything at all, as long as you have something that can 
broadcast, it will broadcast. At perfect quality on both ends as well, ensuring that any signal that comes 
to you will be received without interference as well, at least when from your allies."
46,,200CP,Not a Single Stitch Left ,Generic Hentai Magical Girl,Domain: Protection,"It’s a good thing that the clothing for a Shoujo repairs itself every transformation, or they’d have some 
truly massive clothing bills. However, even though that clothing is destroyed, the actual protective 
enchantments - which probably exist - are still there. In other words, as long as you don’t put anything 
else on, you’ll have the same bonus as though you were wearing the last thing you wore. Normally this 
would only apply to you Shoujo costume, but now it applies to other things too."
47,,300CP,Brain in the Butt ,Donkey Kong Country,Domain: Protection,"You can transfer the location of your internal organs and other bodily systems such as your brain to other
places within your body. And it won't disrupt your normal bodily functions (unlike a certain croc who 
went from psychopath to dimwit when his brain slipped down to his tail)."
48,,400CP,Concept Ball ,Medaka Box Abnormal,Domain: Protection,"When two combatants reach a certain level of power, fighting becomes a bit pointless. When both of you
are Immovable Objects and Unstoppable Forces, you're just going to be pointlessly nudging against each 
other. Well, if you were equal you would be. But you're Not Equal. Whenever your own abilities that are 
meant to be without peer come into conflict with another such ability, yours trumps theirs. A blow that 
can pierce anything will tear through a defence that can block anything when you are using it. Your 
absolutes are more so, simply for the fact that you are the one using them."
49,,400CP,Context Problem ,Ben 10 0.1,Domain: Protection,"Magic comes from mana, or maybe it doesn't. It could just be life energy that makes using it easier. 
Maybe it's just really advanced science? Or is science really advanced magic? For some reason, your foes 
and onlookers have trouble nailing down what your abilities are and how they actually work. Instead of 
using things like context clues and experiences, they will assume it's something that makes sense to their
world instead of leaping to 'otherworldly invaders', and almost always in a way that gives you an 
advantage over them. It might be years before someone actually realizes how your special abilities actually work, let alone any weaknesses. Suckers!"
50,,400CP,All Day Every Day ,Generic Hentai Occult,Domain: Protection,"Don’t you ever get bored of this? Once you’ve modeled the world to your liking, all the uniqueness will 
be gone. Hearing ‘Would you like your morning blowjob master?’ might get you hard the first few 
(dozen) times, but eventually even women screaming your praise as they faint from overstimulation 
must get old. You did kinda drain the originality out of them you know? ...No? Well, I guess it’s just me 
then. Have fun with your slaves."
51,,400CP,Better Than Death ,Generic Hentai World,Domain: Protection,"Death is a very final thing so almost anything is better than that final separation from your beloved. If an 
enemy has a reasonable chance of capturing, and keeping captured despite their own efforts, either you 
or your love then there will be a significant chance of them doing so rather than immediately killing 
either of you. This specialised form of plot armor manifests as a combination of a mental inclination 
towards that end and recognisable opportunities cropping up which would make it advantageous for 
them to do this. However the protection by this perk offers fails while you are in the presence of your 
love. In addition, if an enemy is truly intent on death then, at best, this perk can delay that for a time by 
making them more likely to 'play'. "
52,,400CP,Blackmail Proof ,Generic Hentai Modern,Domain: Protection,"Now, it’s not to say that you simply can’t be blackmailed, but the vast majority of attempts to gather 
material to blackmail you with simply won't work. The key here is ‘could you have done anything’, like 
physically remove the camera from its hiding spot before anything could be taken, or sneaking into the 
security office to erase the last five minutes. Regardless of if you actually knew it was coming, as long as 
you could have gotten rid of it, it will do so automatically. Or if you prefer, it can be shunted into the 
warehouse for your perusal. "
53,,400CP,Enigmatic Engineering ,Stellaris,Domain: Protection,"Your technology has rights-management included at the reality-level. You can decide who can reverse-
engineer, derive from, manufacture, and even use your technologies. And you can change it at a 
moments' notice. If your xeno ally turns on you, then you can simply revoke access to those lasers you 
loaned them. Which not only disarms the ships equipped with the blueprints you gave them, it would 
also disarm ships armed with weapons derived from your gifts. Not only that, but the documentation, 
controls, and hardware suddenly become inscrutable. You could have soldiers looking at their guns 
wondering what the trigger does. This perk also protects from traitors trying to give away your technology, as well."
54,,400CP,Corruption and Conviction ,World of Tentacles,Domain: Protection,"A dark and twisted power is the birthright of every demon king, and sin flows through your veins like 
blood. Is it any wonder, then, that the corruption which normally afflicts practitioners of the dark arts 
has so little hold on you? You possess a will of steel and are immune to most forms of corruption and 
mind control. No matter what depraved powers you might possess or be subjected to, your mind and 
body will always remain your own. Should you choose to indulge in the effects such magics might 
normally foist on you then that is another matter, but these effects influence you only with your express 
permission, and you may rescind that permission whenever you please. But beware of holy and divine 
magics when you indulge, for your resistance is less effective against magic that cleanses and purifies. "
55,,400CP,Genetic Diversity ,Generic Hentai Modern,Domain: Protection,"You have had so many forms from your jumps that your children will never receive genes from you that 
will cause them any problems even if their other parent is one of your relatives, their half sibling, or even a clone of you."
56,,400CP,Happily Ever After ,Milk Hunters,Domain: Protection,"As I’ve previously mentioned, Senpai has been going around and raping anyone who catches his eye, 
when they’re rendered unconscious by the energy that appears during monster attacks. With that in 
mind, in addition to said monster attacks, something to help keep your loved ones safe seems like a good
idea. This perk will give your friends and lovers a form of plot armor. It won’t be as powerful as 
Bystander Effect, but it should still be more than enough. Someone, or something, that’s out looking for 
victims will overlook those that you care about, in favor of others. If they’re still targeted, for some 
reason --if the one targeting them was specifically after them, or there was nobody else around for them
to target, for example--, they will have supernatural luck in escaping relatively unharmed; their attacker 
will trip, people who can help will stumble across them, they’ll instinctually choose the best escape 
routes, and so on. On top of all of this, you will also be able to feel when those that you care about are in
danger, and how badly they need your help. Of course, you can turn this sense off, if you want, but why 
would you?"
57,,400CP,Environmental Tolerance IV ,Essential Body Modification Supplement,Domain: Protection,"You are not damaged by hazardous environments, though this does not provide you a method of 
propulsion.
I: You no longer need to breathe and do not suffer from temperatures between -100C and +100C (-150F 
to +200F). You are immune to most radiation (up to about 1,000 mSv; the amount experienced during 
unshielded exposure to space).
II: As tier I, plus you do not suffer from temperatures below 1500C (+2700F) or the effects of pressure 
lower than 1000 atmospheres (including the effects of vacuum). You are immune to the effects of 
radiation at all levels.
III: As tier II, but the protection extends to any non-magical environmental source.
IV: As tier III, but the protection extends to magical environments such as energy planes."
58,,400CP,Love Overcomes All ,Milk Hunters,Domain: Protection,"Assuming that you decide to steal/”rescue” the Pretty Cures from Senpai, having a harem of several girls 
might raise a few eyebrows. Especially if you’re dating fourteen-year-olds while you’re in your mid-
twenties. Fortunately, you won’t have to worry about that. From now on, nobody outside of your 
relationship will judge you or your lover(/s) for anything related to said relationship; the number of 
people involved, the ages of those involved, the genders of those involved, and so on. This will also work 
on overprotective family members and jealous exes."
59,,400CP,Man Of Mystery ,Generic Hentai Occult,Domain: Protection,"Don’t you know that women just love a man of mystery? Well, you certainly are one. Simply put, you 
can, at any time, erase, remove, or otherwise hide any recorded information about yourself that 
currently exists. Security camera? Freak accident in power fluctuation erased it right before it was 
accessed. Yes, ‘accident’... And, as I said, women love a man of mystery. Not good for lasting 
relationships, but the less they know about you, the sexier you seem to them."
60,,400CP,Failsafe ,Supergod,Domain: Protection,"It might be worth just taking a step back from this all. This superhuman arms race, is it really all a good 
idea? I guess not. You may not have the power to stop your country from foolishly creating a weapon of 
mass destruction but with this, you'll at least be able to stop that weapon from being the thing to 
destroy you all straight away. Your experiments and efforts at crafting or creating something never 
backfire on you. When they fail, be it a self-destruction or turning against you, they will instead shudder 
to a stop and deactivate harmlessly. You won't automatically know what caused them to go wrong, 
though you can probably find out with some effort, but with this no process or invention you make and 
are in the control of will end in your harm or death. Others can still be harmed a plenty though, so long 
as it wouldn't harm or endanger you as well."
61,,400CP,Friends on the Other Side ,Lords of the Night - Zombies,Domain: Protection,"Ether Zombies oftentimes are guided by strange voices, spiritual presences no one else feels or 
experiences. You are one of them, but the forces guiding you are clearly helping you and furthering your 
interests. You are just given an advantage at... everything. You pick the right door at the end of a riddle 
without reading the riddle. You aim for weak spots you never noticed. You react to attacks you never saw
coming. This never gives you more than immediate knowledge, and about things happening right around
you now. It can help you pick the right answer from a multiple choice question with a definite right 
answer, but can't tell you if a friend will betray you next week. Not even if they made the choice right 
now, unless they are in your presence when they make that choice. Within these limitations, they're 
overwhelmingly strong. If you needed to mechanically represent this for something other than multiple 
choice (which you'll just always win), think of it like a +10 insight bonus on everything that makes sense 
for an insight bonus. The forces helping you are outer-planes forces. Powers that hedge them out can 
interfere. They also work through divination. Powers that protect against divination can also interfere. 
Though that interference can still say something, and they'll likely pass that on to you."
62,,400CP,Sneaky Fucker ,World of Tentacles,Domain: Protection,"Humans have built up quite the society to protect themselves from predators like you, but all the walls 
and gates and guards in the world can’t stop you if they don’t know you’re there. Your stealth skill is 
uncanny: you move with abnormal quiet, blend in with your surroundings, and leave much less of a trail 
than you should, even ghosting past automated surveillance and leaving an indistinct blur on unwanted 
video recordings. Mundane tracking methods like forensics and DNA analysis produce no useful data 
about you, and magical methods fare little better. Perhaps most terrifyingly, you can extend the benefits 
of this perk to any victims you might be carrying with you, allowing you to kidnap people without leaving
any trail to follow. However if you are caught somehow you lose this perk’s benefits until you escape any 
pursuit."
63,,400CP,Unbeliever ,Rance 02,Domain: Protection,"So Divine Magic works based on your piety? Doesn’t matter, you can use it perfectly while not believing 
in any God and even ‘getting along’ with devils. Exactly, when it comes down to your powers, you can 
skip that kind of troublesome requirements. Even something like using contradictory powers at the same
time, becomes easy and without any negative effects. Still, wouldn’t you prefer to act the part from time 
to time? "
64,,400CP,God of Death ,Death Note,Domain: Protection,"You gain the ability to phase through walls and don't require food, water, sleep or air."
65,,400CP,Harmony ,Generic First Jump,Domain: Protection,"Sometimes, the things you are collecting will clash with each other or are difficult to use together. That is
no longer the case. You could safely use both the Dark and Light sides of the Force, channel both divine 
and demonic energies, wield conflicting forms of magic or energy, mix radically different technologies or 
biologies, even keep your entire harem in one place, and they will all get along with each other. They will
get along with you as well. None of your abilities, possessions, Companions or anything else that belongs
to you in some way will be able to harm, corrupt, or alter you against your will."
66,,400CP,Immunity ,Draka Series,Domain: Protection,"What are you immune to? What aren't you immune to, Jumper? Your body, mind, and soul flat out 
ignore any effects that could semi-plausibly be described as a disease, an illness, or a corruption. 
Whether it be a biological disease, weaponized nanotech, a magical curse, infectious memes, a literal 
madness plague, or whatever else, you won't even feel it.
Anything that wishes to harm you has to do so directly, via main force. So being shot, stabbed, or set on 
fire, or being mind-controlled by superior psychic force, or having your soul destroyed by a Killing Curse...
those sorts of things still work. But any and all attempts to bring you down by subtler, more internal 
means just fail utterly."
67,,400CP,Loading Human.exe ,Generic Worm Fanfiction lll,Domain: Protection,"You can turn off your emotions at will. This makes it easier to make logical decisions but you have trouble
understanding others while they're off. You won't get stuck with them off because turning them back on 
would be illogical or anything like that. Oh, and you get along famously with robots and AI. You really get them."
68,,400CP,LOCKED ROOMS ,The Culture Minds,Domain: Protection,"Your mind can be compartmentalized to a variety of ends. You could shunt data to a locked room in your 
mind, one which memetic effects, viruses, or corrupted data cannot escape. Or just block off certain 
knowledge until the time is right for you to access it. These locked rooms cannot be read by mind-
reading methods unless you willingly open them. You can even lock a compartment of your mind and 
figuratively throw away the key, keeping it sealed even from yourself until some condition is met. They 
will also be able to contain any interlopers, memetics or unusual effects that stray into your mind from 
other sources, digital or not, though you should act fast so as to avoid locking away the majority of your 
mind."
69,,400CP,MOTHERSHIP ,Culture,Domain: Protection,"Despite how independent most Ships end up being, they tend to owe extremely strong ties to their 
constructor units. The fabricating vessel remains important to many ships, something as close as they get
to family, so those ships who manufacture a lot of others tend to be able to call on them when needed. 
The Minds and Ships you build have a strong loyalty and connection to you. It's almost guaranteed that if
you wanted to bring them in on a scheme that most Minds would reject or object to, they would accept 
out of what they feel are familial ties, the bond nearly unbreakable. This applies to all your children, 
descendants and sentient creations."
70,,400CP,Not This Again ,Girl's Frontline,Domain: Protection,"You know how mad scientists never seem to learn from their mistakes? Like, when their colleague 
discovers the secret to a more powerful AI, but the coding makes commands like Protect the factory 
from intruders basically orders for genocide? Luckily, you're much better at learning from your mistakes 
or others'; the more immediate your contact with said screw-up, the less likely you are to repeat it even 
accidentally. This can be trained like any other skill; with time, you can train yourself to do just about 
anything your body is capable of to near-zero margins of error, although progress tends to slow down 
when you reach the half-way mark."
71,,400CP,Phylactery ,Monster Girl Encyclopedia,Domain: Protection,"An item used by Liches to serve as the vessel for their soul. From the soul, you can remotely control your 
body and see through it. Since the phylactery keeps your soul separate from your body, your mind 
remains unaffected by hormones, spirit energy, pain, and other sensations that would normally disrupt 
your concentration. If the phylactery is damaged, your soul will automatically return to your body."
72,,400CP,Renewal ,Age of Wonders ll,Domain: Protection,"Wounds can be mended, cities can be rebuilt. Even the lands tainted by death magics or burnt by fire can
be restored, seeded with crops and forests until life flourishes anew. Life magic embodies this ideal, 
holding the power to endure, to undo all harms and ease all woes. Your spells and abilities are infused 
with this power, and it is impossible to corrupt or twist them against their purpose. Furthermore, 
although your magics are now more difficult to suppress or destroy, if your enchantments are only 
partially broken they will slowly restore themselves to their full potential, their own magical natures 
healing as surely as more physical wounds."
73,,400CP,Safe Self Modification ,SB Dragonball Z,Domain: Protection,"Putting your brain inside a jar so you can transfer it into a robot body may not seem like the smartest 
thing to others. However, they don't know that you have the peculiar ability to always succeed in your 
self-modifications. The chances of things going wrong with the procedure are simply zero. As long as the 
technology behind it is solid, then malfunctions, complications in surgery, and other accidents like that 
just don't happen. In addition, none of the modifications you make will ever be incompatible, or conflict 
with each other. Want to use gene therapy on your robot body? That somehow works."
74,,400CP,Sixth Sense of the Sith ,Monster Girl Encyclopedia,Domain: Protection,"You have especially high olfactory senses that not only strengthen your normal senses such as smell and 
hearing but also give you an ability to sense danger. You are able to sense threats to both yourself and 
people you care about. Furthermore, you have a study sense that helps you concentrate and develop 
skills that will help the people you care about; for example, if you wanted to help a wizard companion in 
his studies, you would be able to master enough sorcerous skills to competently assist him, and if you 
were part of a royal court you could quickly pick up proper etiquette so that you never embarrass your 
mistress during official functions."
75,,400CP,THEY ARE MINE AND MINE ALONE ,Medaka Box Abnormal,Domain: Protection,"Perhaps you can no longer lose your powers due to your own growing up but it's still possible for people 
to take them away from you by force. Or at least it was before you made it known how much you refuse 
to let go of what you consider yours. It's impossible to degrade or take away your abilities in any shape 
or form, even on a merely temporary basis. Attempts to weaken, nullify, disable, steal, destroy or do any 
other sort of negative thing to your powers or the energies that they run on will find themselves not 
even touching you. It seems like your powers really are too integral to your being to ever be taken away 
from you."
