0 CP,Beth Sanchez ,Rick and Morty Jump,"Your very own Beth Smith, who never got together with Jerry or anyone else, and unlike with Jerry, Beth actually cares about you."
0 CP,Crazy Lover ,Fallout 3,"A slave from Paradise Falls, Clover is as deadly with a blade as she is crazy. Crazy in a fight, crazy in the sack, crazy every which way but loose! But most of all, she's crazy in love with whoever's holding her leash. As her new owner, she would devote her everything to you, even at the cost of her own life."
0 CP,Friendly Mutant ,Fallout 3,"An intelligent super mutant who retained his intellect, Fawkes was held captive and tormented within Vault 87 for his entire existence. But you have come along and freed him, and for that he's eternally grateful. With his mutant biology and a giant gatling laser, there's little that could stop him."
0 CP,Slave,Star Wars - Darth Bane,"Slavery is alive and well in the Star Wars universe, so you might as well buy into the market. With this purchase you get a beautiful and utterly loyal slave. They may be male or female individual of the Zeltron, Twi’lek or Togruta species. This slave can be exceptionally talented in the arts, in matters of manual labour or in ‘entertaining’ their master. They do not technically count as a companion, but can be imported free of charge into future Jumps. No one will object to your ownership of them or question their exotic appearance irrespective of the local laws or demographics."
0 CP,Supernova,Rick and Morty Jump,"There seems to be some kind of temporal paradox, because this is a younger and hotter version of Supernova. This Supernova has not experienced the life that would lead to the outcome of the Supernova from the show, leaving her still enthusiastic and lively, not bitter and enraged. You helped her getting settled after she realized she could never return to her own time, and ever since she has been incredibly loyal and supportive of you, yet due to her younger age and inexperience, she is unable to go the next step towards the relationship she wants to have between you. Should you take the initiative and take the first step, you will find a woman who would dedicate her life for you. You will never have to fear her cheating on you, whether it be with a sentient ant hill or something else. She has all of Supernovas powers and abilities."
100 CP,A Psyker Sidekick ,"Warhammer 40,000 - Space Marines","This mortal psyker has been attached to your unit to assist you in sorcerous matters. They lack the physique of a Space Marine, but their training in the psyker ways has been extreme, and their talent for learning is prodigious. They are a Beta-level psyker, either a Primaris psyker if you’re loyal to the Imperium (no relationship to Primaris Space Marines), or a sorcerous rogue psyker if you are a Traitor. If you’re one of the Thousand Sons, they can even be your own personal Thrall Wizard. You may choose two psychic disciplines for them to have an enormous level of knowledge and talent in, and you can rest assured that they are immune to possession from entities of the Warp.
"
100 CP,Assiduous Asari ,Mass Effect - Jumpchain,"Young, only about fifty years old, this Maiden Asari is bright, bubbly, kind, and, well, naive. In the extreme. You’ll meet her getting into trouble with some Batarians, of the “rape and torture” persuasion, and even if she’s got some fire, she’s naff in a fight. Assuming you don’t step in it’s going to be a definite bad end. However, once you’ve rescued her you’ll find she’s loyal to a fault and, while lacking common sense, an excellent cook, wonderful company, and a balm to any weary soul. She’s also most wonderfully talented at all the skills needed at keeping up a household. Somehow, she also managed to win the genetic lottery - having the potential to end a biotic on the level of Samara. Assuming you train her up."
100 CP,Assistant VI,Mass Effect - Legendary Edition,"It can be argued that the development of AI is inevitable, as all sufficiently advanced technology will eventually become an AI, and the fate of those that deny it is stagnation. We aren't quite there yet, but this personal assistant model Virtual Intelligence is the closest thing allowed in Citadel Space. It can be stored in your omni-tool and can keep track of large amounts of data. With some tweaking, it might eventually become an actual AI, but that is ultimately up to you"
100 CP,Astropath ,Imperial Guard Regiment Gauntlet,"This comm psyker is trained in usage of his powers to establish telepathic communication with astropaths in other systems, this allows your regiment to more directly ask for reinforcements and further guidance from the sector and other important intel. She is a bit haughty and enjoys the feeling of power being the only person that serves as a lifeline between you and the wider world. She is not the best fighter and often pretends to be clumsy. Or at least says that she is pretending. Her haughty front will slowly fall off as you spend time together and survive through various ordeals. She might even become a bit protective of you and try to get some deals from neighbouring worlds, sometimes without your knowing. This will lead to some minor things like additional equipment arriving, transports arriving earlier, being warned about imminent attacks and so on."
100 CP,Collection of Gifts ,Rogue-Like Evolution Jump,"How romantic. It appears you have acquired a supply of gifts for your possible partners, such as candies, varied flowers, perfumes, cute plush toys, interesting books, dildos, vibrators and other kinds of sex toys for example. All the gifts you receive by taking this item will be mundane and usually have no other uses for you than gifting them to your loved ones, but, as a bonus, the supply will always have gifts your partner(s) will enjoy receiving, including things like bags of fresh human blood if you’re dating a vampire for example. Lastly, this supply of gifts will be replenished weekly."
100 CP,Cousin ,Out of Context: Superman Substitute Supplement ,"You seem not to be the only super person on this planet with this companion who was raised on your destroyed planet, thanks to the stasis in their pod they are still a teenager despite being older than your in canon self, they also don't have to be related to you."
100 CP,Digital Companion,Halo Gauntlet,"A UNSC smart A.I assistant. The A.I can be programed with a custom appearance and task. The A.I is sentient so it will quickly start to learn, develop it's own personality and eventually even see you as its partner instead of a master. After 7 years the A.I will descend into a volatile state called “Rampancy.” The A.I will become very dangerous while it's in this state but you do have a chance to save it."
100 CP,Dr. Moira Vahlen,X-COM Enemey Unknown ,"Moral scruples are not generally Dr. Vahlen’s thing. The foremost expert that could be found to study novel life-forms unrelated to anything on Earth, the aliens will soon come to fear her laboratory."
100 CP,Dum-E and U,MCU 1,"Okay these robots may not do much, but they've got spirit! ...whatever passes for spirit in robots. Taking the form of single robot arms on treads, they try to do their best to aid you around your home and fulfill your wishes. Along with excellent pattern recognition they're unusually good at assisting with fabrication and mechanical construction of electrinics. Just be mindful that you need to word things properly .                                                                                                                                                                                "
100 CP,Engine-sister,Warhammer 40k - Adeptus Mechanicus,"Voluminous red robes cannot hide the curves beneath to this woman's eternal embarrassment. Friendly and perky in conversation to both man and machine, she is torn between her desire to be closer to the machine and her attachment to humanity. The possibly of a harmonious union between the two has inspired her to follow you."
100 CP,Fiery Warrior,Warhammer 40k: Imperium of Man,"A fairly typical member of the T’au Fire Caste, it’s a mystery why and how she came to ally herself with you. Specializing in long-range combat with her advanced rifle and battlesuit, she can deal incredible amounts of damage and get away before your enemies know any better."
100 CP,Fire from the Stars,World of Lews Superheroes,"When war came to their homeworld these two alien princesses fled and came to Earth in search of refuge from their enemies. Luckily, they found you shortly after landing and latched on to you to be their guide on this strange new world. Though twins, their personalities are almost polar opposites: the younger is sunny and optimistic, perhaps even naive, while the elder has a more cynical and even ruthless disposition and could easily be lured into villainy. Despite their differences they’re as close as sisters can be, maybe even as close as lovers, though I’ll let you discover that for yourself. Both girls possess the Alien powerset and their powers recharge from both sexual activity and ultraviolet light, so they’re quite fond of skimpy outfits and naked sunbathing between battles. They’re also highly empathic and responsive to emotions, yours especially thanks to the close bond they’ve formed with you. Both girls occupy a single companion slot."
100 CP,Fleet and Flotilla ,Mass Effect - Legendary Edition,"Love is a fickle thing, both impossibly wonderful and thoroughly miserable. Hopefully, this will smooth out some of that. When in a romantic relationship, you will find that neither of your feelings for each other will ever fade, in fact they seem to do the opposite. The only way a relationship will fail is if you actively commit multiple acts that the other strongly disagrees with."
100 CP,Galatea,Something Unlimited,"She wasn’t supposed to exist yet and, depending on your actions, she might not even be created at all, but, if you want to, you can pay a special price to get her as your Companion right now. Galatea is Supergirl’s clone that you created using professor Emil Hamilton’s samples of the original Galatea, having all of Kara’s powers as a Kryptonian in addition to having a more mature physique than Supergirl that is noticeable due to her bigger ... muscles. Furthermore, she’s completely loyal and horny towards her daddy, you, as this trait is reinforced by being literally built into her genetic code and mental layout. This version of Galatea also has fake memories of fighting the Justice League and being critically injured after disobeying your orders so she has a strong thirst for revenge against the heroes as well as being unwilling to disobey you again despite being quite the hot head."
100 CP,Harley Quinn ,Something Unlimited,"She was the no.1 sidekick of the Joker, having an unhealthy devotion towards him, despite him usually treating her as if she were worthless, however, after a failure on a thief caused by her, the Joker simply
decided to discard her. You found her right after the Joker slapped her and threw her on the floor, so you decided to give her shelter and even helped her to steal a precious diamond in a failed attempt to recover the Joker’s trust. Currently, Harley has already completely given up on the Joker and has redirected her devotion completely to you, being fully willing to act for you with the best of her abilities. In addition to being an excellent fighter and having a complete set of skills related to entertainment, she’s also an incredibly skilled psychologist and manager."
100 CP,Impressionable Youth,Warhammer 40k - Craftworld Eldar,"A child? Why would this child be sent to you, with no Perks save for basic Eldar physiology? The answer becomes clear on closer inspection – this one is apparently a half- breed. While they lack training in any of the common skills of the Eldar, they did seem to inherit some knowledge of repairing Mon'Keigh technology – perhaps training by their human parent earlier in life?"
100 CP,Jeweled Farseer,Warhammer 40k: Imperium of Man,"It’s not unusual for the Eldar to side with the Imperium if the need arises, but this one seems to have latched herself onto you, claiming to see a great destiny before you. Her mastery of the Warp is undeniable, especially when she sends countless shards of crystals to explode violently in the enemies’ faces."
100 CP,Light Bee ,Red Dwarf,"A small cylinder used for creating a hologram of a recorded personality matrix or AI. System for
recording matrices also included. Its very energy hungry though, so do ensure you have some
batteries."
100 CP,Master of Ordinance ,Imperial Guard Regiment Gauntlet,"Have you ever had a problem with your artillery not hitting their targets properly, when they should? Not having enough munitions to pound the enemy into the dirt ? Then you will need this lady and her almost magical skill in acquiring more ammo. If you weren’t always well informed about the whole process she went to acquire said ammunition, you would think she is a heretical witch. Sadly the ammunition she procures only ties to your artillery detachments and mortars as anything beyond that is not her specialty. She can be a bit ruthless and her general answer to any problem is to pound it into dust with overwhelming artillery barrages."
100 CP,Nevermore,World of Lews Superheroes,"Magical powers can come from a lot of places but being part-demon is one of the more common sources given the proliferation of succubi and incubi in the mortal realm. This dark heroine gained her phenomenal magical powers by being the daughter of a powerful demon lord, and to say she has serious daddy issues is something of an understatement. Despite being half-succubus she’s obsessed with self-control and has become highly repressed by trying to reject her demonic heritage, but this is far easier said than done and her spells occasionally backfire on her in lewd ways, like tying herself up in heavy bondage. However with the right mentor to help her get over her hangups she could become a powerful force for good (or evil)."
100 CP,Primaris Psyker,Imperial Guard Regiment Gauntlet,"You have garnered a service of Primaris Psyker. These psykers are feared by many due to their overall disposition and uncomfortable atmosphere surrounding them. She is not happy about the whole “fear” part and this has led her to be very closed and focused on job and her own mental psyche (kinda important, when any mistake can lead to daemon incursion). She is scared of being seen as a monster and having to be exposed to the stares of people so you won’t see her much. If you try to help her and make her feel accepted, she will turn a bit possessive. On one hand, her mental fortitude will go through the roof due to her being sure of herself and having support in you, but having a yandere psyker following you around can sometimes be a problem."
100 CP,Princess Leia Organa ,Star Wars - Jedi Prince,"Adopted daughter of famed Senator Bail Organa of Alderaan, a planet destroyed a few years ago. She has proved herself as a diplomat and a rebel leader."
100 CP,Psychic Master,Fallout Mutants,"A beautiful woman who wouldn’t be too out of place on one of those Old World holovids, she is by far one of the most potent and versatile psykers around. Not only can she lift Super Mutants into the air with ease, but her telepathy allows her to read the minds of anyone nearby. Her most useful power, though, is her ability to teleport within line of sight, offering her unparalleled mobility."
100 CP,Senate Aide,Star Wars - Jedi Apprentice ,This beautiful Senate Aide is exactly what you need to navigate a bureaucracy. Just don’t expect him/her to ever become a skilled combatant or even a senator unless you acquire your own means to join the republic. What he/she does is keep you apprised of what is going on in the Senate and maybe help you work out some deals and generally help you accomplish your goals legally.
100 CP,Sergeant Abbey ,Gears of War,"A sniper has the job of finding high-value targets and eliminating them with extreme prejudice. But this war has forced adaptation, and so Abbey has taken it upon herself to also use her skills to guide those under her command and keep an eye out for anything they need to handle. She’s quite insistent on others following her orders however, and has been on record for shooting next to those who are disobedient to send a message. Abbey"
100 CP,Sgt. Annette Durand ,X-COM Enemey Unknown ,"A psychic rescued from experimentation, this French woman is ready to make the invaders pay, and rescue any of their victims she can."
100 CP,Sylandri Veilwalker ,Warhamer 40k - The Ynnari,"A shadowseer of the Harlequins’ Masque of the Veiled Path troupe. Fond of secrecy and illusions, an
incredible friend to have, but also incredibly annoying with her efusal to ever explain herself, deal with the cleanup, or do shared chores."
100 CP,T-900 Infiltrator ,Terminator,"Despite primarily being designed for infiltration, many T-800 models are not very... convincing. They are often robotic and emotionless, acting in ways that would very much raise eyebrows within modern society, let alone within the paranoia-filled Resistance cells that the T-800 is supposed to infiltrate. But that’s why this was built. Unlike its predecessor, the T-900 is truly human-like. A T-900 could infiltrate human society for years on end and most people will never consider their behavior to be anything other than human. Emotions, tears, everything really. And now, a T-900 has made it her life’smission to protect and follow you. She is extremely knowledgeable with a multitude of information downloaded right into her database, and she will, to the best of her ability, use all that she is to serve you. Treat her well."
100 CP,Tala,Something Unlimited,"She was the Project Cadmus, Division Head responsible for magical and mystical projects, until she
was betrayed by Faust and released by Grodd, but, once you defeated him, she became completely loyal to you, to the point of even calling you master. While Tala is a gifted and powerful sorceress, her greatest weapon is her knowledge of sorcery that allow her to create several different magic items and potions, but, unfortunately, a lot of her materials is still at Cadmus, so you’ll need to recover them before she’s able to actually create something useful. Lastly, she’s also good at giving massages."
100 CP,Terminator,Halo Termination,"Pick any Terminator type, except T-5000 and T-Infinity, and you will get a personalized variant of it as your bodyguard and Companion. You can choose its personality, its behavior and how it treats you."
100 CP,The Best Secretary ,Superman - The Animated Series ,"Mercy Graves is Lex Luthor’s incredibly competent and intelligent assistant. While others serve Lex out of fear or in search of wealth, Mercy is genuinely loyal to her boss despite his flaws. She is a master of hand-to-hand combat and possesses an acerbic wit that can cut deeper than any knife."
100 CP,The Canoness,Star Wars vs Warhammer 40k,"There are few amongst the Sisters of Battle who live long enough and prove themselves worthy of reaching this position. You however seem to have befriended one such figure. This individual is a Sororitas Canoness who wields a powerful set of Paragon Wargear. This is one of the most valuable and venerable pieces of equipment used by the Sororitas. This woman has a close relationship with you and cares for you a great deal. She could even tolerate you performing acts of heresy without trying to kill you. In addition to this she has a small group of followers made up of six Celestian Sisters. These women are her so-called daughters. They will do anything in their power to protect their Canoness and due to your relationship with her you as well. You may design the personality, appearance, and your exact relationship with each of these women as you wish. 
"
100 CP,Veteran Bodyguard ,"Imperial Guard Regiment Gauntlet
","Battlefield is not a place where technically any sane Jumper should be and since your form here will be
significantly reduced, you need to be careful. That is why you need someone to protect your back. This
soldier is a grizzled veteran of many battles. She has skill in wielding most of the weapons of the Imperial Guard and even when push comes to shove, she can also handle non-Imperial weaponry due to a rare pass from the inquisition combined with more combat experience than any normal human should ever have to have. How could she get this amount of influence? Nobody knows. She tends to act like the mother of the squad, always caring for everyone, but especially for you. She will notice, when you are tired and guard you, when you are at your weakest. If you fall asleep at your job, she will give you a lap pillow. Hanging around her for some time will peel more information about her previous work. She used to work for inquisition as one of the personal kill teams of one of the Inquisitors with huge reach in this part of the space. Which explains why she gets access to more weirder weapons in her arsenal. Her youthful appearance is also a result of rejuvenat treatments as her service to Inquisition was long one. Don’t ask the lady her age, would you ?"
100 CP,Wyrdvane Psyker,Imperial Guard Jumpchain,"You’ve picked up a Wyrdvane Psyker, a psyker who has yet to fully master their powers, though they are trained and screened enough to minimise the risk of Perils of the Warp occurring. Under the gaze of a more experienced, controlled peer (such as yourself), they can link minds together and channel the power of the Warp in a relatively safe manner"
100 CP,Yes Man,Fallout: New Vegas,A Mark-II securitron with a big happy face. Actually has very powerful logical circuits so can accurately predict the activities of major players if given enough data. Gives good advice but is insanely sycophantic so will enthusiastically go along with whatever you say.
100 CP,Your Monkey ,Warhammer 30k - Primarch GF,"This fella may look like a regular orangutan. Ehh... actually, for all intents and purposes, they probably are except for one crucial detail. They are a savant when it comes to technology. It’s unknown if they were discovered during the Great Crusade. You might even be the first Imperial citizen to ever meet a Jokaero Overall, they’re pretty friendly and seem to like you, so they’ll follow you around wherever you go. Even if you manage to make a translator to figure out what they’re saying, it tracks with what is known about Terran primates. “Food,” “Tree,” “Friend,” and other simple concepts they can convey. If you try to get them to explain their technology, the translator will start outputting nonsense."
100 CP,The Mechanist ,Fallout: Automatrons,"A girl with a talent for machinery and an earnest desire to help people, she was inspired by a comic she came across to don the mantle of The Mechanist, a superhero who saved others through his robotic creations. She’s very skilled when it comes to building and repairing robots, and could probably build a
protectron with her eyes closed."
200 CP,Burning Passion,Star Wars - Jedi Fallen Order,"This red headed woman claims to be a Jedi, but her passionate behavior and aggressive combat style would make one question that. She also seems to have a deep knowledge of Sith Sorcery and Sith Alchemy."
200 CP,Domino,Deadpool,"Domino is your gal if you need luck on your side. She’s not just lucky; she’s ridiculously lucky, which makes her a perfect fit for any mission where the odds aren’t in your favor. Grab Domino, and things just start going your way—whether it’s avoiding death traps or pulling off a nearly impossible heist. She’s smart, cool under pressure, and has a habit of getting things done, even when everything should be going wrong."
200 CP,Edgy Apprentice,Star Wars - Sequel Trilogy,"An incredibly edgy apprentice under your command. They’re surprisingly loyal for an evil space wizard, and don’t mind incredible acts of violence. In fact they really like it, and thrive off being petty evil at least some of the time. Their edginess is up to you. Whether a red skinned Twi’lek with some daddy issues and a revealing wardrobe, or a very anger prone young man who “totally isn’t in a phase” but continues to be conflicted."
200 CP,Elusive Element,Loki Jump,"Spending most of their life alone and on the run from the TVA, this individual has considerable talent when it comes to escaping and evading the notice of others. Their impressive skill as a planner and strategist has been bolstered by a talent for enchanting others, allowing them to manipulate minds and possess others with a touch."
200 CP,Grown more beautiful I mean,Star Wars Movies Compilation - The Star Wars Saga,"Using this Perk you are able to keep the emotional attachment someone has for you active and sustained as though they had seen you on a frequent basis. You are also able to alter the interpretation of this affection the other party has for you in order for it to match the circumstance preventing you from getting friend-zoned or similar emotional dead ends.
"
200 CP,Heir of Clan Skirata,Star Wars - Jedi Fallen Order,"This woman with dark hair and bright eyes claims to be the last mandalorian of Clan Skirata. She’s quite skilled, and would be glad to join you in battle, as she seems to be a bit of an old head and seeks glory in battle."
