400 CP,A Deck of Cards ,Imperium Nihilus ,"At end of the 41st Millennium, a sorcerer of the Thousand Sons was captured and interrogated by the Inquisition. While the ultimate fate of the sorcerer is in question, the Inquisition did find many of the sorcerer’s possessions worth examining. And much like the sorcerer, the whereabouts of these possessions are a mystery, leaving the Inquisition forced to instead replicate such relics to the best of their capabilities. Somehow, it seems that fortune once again shines upon you for you find yourself in possession of one of these Inquisitorial replicates, one that might prove to be the most powerful amongst them. Appearing to be a never-ending set of tarot cards, each one harkening back to a time when Terra was still young and green, each of these cards holds a special power. By defeating a foe—lethally or otherwise, so long as their soul remains—these cards shall glow with an otherworldly power. This marks the perfect opportunity to use the card’s unique properties. Through a ritual, one you shall instinctually know so long as the cards are in your possession, you may bind the souls of others into one of these cards. Once bound, you may call upon these foes, summoning them onto the field, to assist you in battle. Whether it is to slaughter your foes or to aid your allies, it matters not. What matters is that so long as they are summoned, your foes shall heed and obey your commands, both the letter and the spirit. There is no risk of them working against you for as long as they are bound."
400 CP,As A Fine Wine ,Warhammer 40k - Squats,"All Squats grow in psychic potential and power with age, you just do so twice as quickly and without apparent limits. This applies equally to all your other powers and skills."
400 CP,Astral Projection,Star Wars Sequel Trilogy V1.1,"If you can send a message across great distances, what’s stopping you from sending an object, or  ourself? By putting your body into a meditative state, you may project the hyper-realistic image of yourself or other objects to places half a galaxy away. You may also transfer small physical objects between one point and another, though this must occur over drastically shorter ranges (roughly a mile), and the person receiving the object must also be attuned to the Force in some way."
400 CP,Daemon Weapon,Emperor's Children Gauntlet,"A melee weapon crafted using a Greater Daemon of Slaanesh, in addition to being far superior to a normal weapon it will corrupt anyone around you eventually converting them into your faithful servants. This is guaranteed NOT to corrupt you any corruption you incur in this world will be your own doing."
400 CP,Dagger of Mortis ,Star Wars vs Warhammer 40k,"The Dagger of Mortis is a mystical weapon held on the altar of Mortis. This weapon was hidden by the Father due to its ability to kill any being including the Celestials. That is the most powerful ability possessed by the dagger. Any being that is struck by a lethal blow will die. Any immortality they possess will be stripped away and any unique methods of defense will be bypassed. 
"
400 CP,Force Lightning,Star Wars Sequel Trilogy V1.1,"The power made famous by the Emperor himself is now yours to take. You may draw on the energy of the Force to conjure bolts of lightning from your fingers. These surges are very powerful and deadly, capable of killing almost anyone in a few short seconds of agonizing pain. Only other masters of the Force or those with special defenses against energy attacks can withstand these attacks. Be warned that this power can be reflected by said opponents, and you have no special immunity to its destructive power. Even still, a fully realized master of this power could clear an average room in a few heartbeats. Your enemies underestimate you at their own peril."
400 CP,Force Sever,Star Wars Sequel Trilogy V1.1,"The Jedi, the Sith, and all those in between all rely on their connection to the Force to grant them their powers. Using this ability to disrupt that connection would sever their powers and leave them as mundane as someone not sensitive to the Force. This technique requires you to seal your target within a spiritual prison, meaning it is ineffective against opponents more powerful than you. Still, is it not the Jedi way to spare your opponent, in the hopes they might repent?"
400 CP,Infinity Circuit ,Generic Warhammer 40k ,"An Infinity Circuit is the psychoactive matrix at the heart of each Aeldari Craftworld. These matrices house the souls of the fallen Eldar and give their guidance to the living. Purchasing this will grant you an infinity circuit that contains the souls of many fallen Aeldari including warriors, craftsmen, and a variety of others. These will be willing to provide you with all of the knowledge they possess and should you have wraith constructs be willing to take command of them to assist you in battle. This circuit can also protect any Eldar that are with you from Slaanesh as long as you bring their soul stones here. In addition any willing souls can be stored in the circuit such as those contained in a soul stone. This can include any race or type of being as long as they are willing.
"
400 CP,Life Giver ,Fallout Mutants,"In case you haven’t noticed, it is quite difficult for nearly any form of plantlife to grow in the Wasteland, the poisonous radiation having long since ruined any nutrients within the ground. You are sure to change that, though, and you are now capable of conjuring and controlling plantlife, ones that are sure to survive even here. Creating a mighty oak tree is certainly within your capabilities, but restoring life to one ofthe burnt-out husks that dot the wastes is probably going to be a bit easier on you."
400 CP,Lorenzo's Crown,Fallout Mutants,"An artifact that may possess otherworldly origins, it was uncovered by Lorenzo Cabot in the Rub’ al Khali desert in 1894, and has kept him alive all the way until 2287. This piece of headwear will not only halt your aging, making you effectively immortal, but it will also focus and empower any psychic powers you may possess. Even when worn by someone who isn’t a psyker, it will give them a minor telekinetic ability."
400 CP,No mystical energy field controls my destiny,Star Wars Movie Compilation - The Skywalker Saga,"You can toggle this perk in order for you to become a blank spot in fate hiding you from any form of precognition or prophecies.
"
400 CP,Pariah,Warhammer 40k - Squats,"Well, well, it seems not all Squats are psychic after all. You are so non-psychic, you loop into anti-psychic. Psykers and daemons can’t affect you, and tend to freak out when they get too close. Your touch burns things of the Warp."
400 CP,Psychic,Farscape,"You have access to psychic powers. At first you can only take pain away from others and onto yourself, but with practice you'll soon find yourself able to share unity (essentially the Vulcan mind meld) with others or even kill people with your brain. These powers are mostly limited to affecting things with some form of psychic or spiritual energy, so don't expect it to work on robots or to ever perform telekinesis. You can also use these powers on energy beings, ghosts, or similar psionic or spiritual entities."
400 CP,Runestones of Jarankyor ,Warhamer 40k - The Ynnari,"Special psychestones used by one of the greatest Farseers of past millennia. These enhance the clarity of precognition so much that anyone can see visions of the future in the stones, and a Farseer can parse an order of magnitude more futures, faster than ever."
400 CP,Sceptre of Marko Ragnos,Star Wars - New Jedi Order,"A large rod with the unique power to drain the Force from areas, shoot it as powerful laser beams or
infuse it into new targets. With enough energy, you could raise the dead, or make a force-user of an ordinary sapient. Perhaps with time and study you may learn to strip the unworthy of the Force with it."
400 CP,Temporal Fist ,Destroy All Humans,Freezes time for everyone but the user for a short period. The user can still use other powers in this state.
400 CP,The Doom of Jumper,Warhammer 40k - Tyranids,"The raw psychic power that courses through your mind has now imbued itself into your very body whilst your physical form has now strengthened your mind considerably. Your physical power and your psychic power are now linked to each other, rising and falling as the other does so. The more power you gain in one category, even if only a temporary boost, the more power you will gain in the other. Psychic energy will cause your body to grow stronger, faster and tougher whilst increasing your physical forms capabilities will increase the power, speed and tenacity of your mental abilities."
400 CP,Tithe of Souls,Warhammer 40k - The Warp,"Hungry, are we? Within this glass vial rests thousands of high quality (psyker grade), non-sentient souls for either your consumption or as currency and fuel/reagents for other purposes. This vial restores itself once every week after being emptied or damaged/destroyed"
400 CP,Unlimited Potential,Destroy All Humans,"By purchasing this you have unlimited growth potential for your psionic powers, with practice you can break the limits of the powers mentioned here, increase your psi energy capacity and can learn new psionic powers in"
400 CP,Webway Gate ,Planetary Governor,"A rare and highly valuable structure opens a portal into the mythical Webway, a network of tunnels and portals in a dimension that lies parallel to the realms of matter and madness. This allows for near-instantaneous interstellar travel, as the kilometres-wide toroidal structure can accommodate even the largest of vessels. This ancient alien technology is highly sought after by various factions, including the Imperium, Eldar, and Dark Eldar, and its possession can provide a significant strategic advantage
"
400 CP,Zoanthropy,Warhammer 40k - Tyranids,"You’ve become a Zoanthrope, of sorts. All the incredible psychic power of a Zoanthrope is yours to command, though you do not need to take on the body of a Zoanthrope unless you wish to do so. Every Zoanthrope is a mighty psyker, capable of tearing through large sections of whole armies on their own, though natural Zoanthropes are limited by needing to devote almost all their brainpower to controlling their own power. You do not have this limitation. In fact, you not only find controlling your own psychic powers to be quite easy and natural, you also won’t find yourself harmed by overuse of psychic energy. If you ever reach a point where you would channel too much psionic force at once, it will simply slip harmlessly away from your mind, though it is possible to override this."
500 CP,Primaris Psyker,Imperial Guard Jumpchain,"To channel the raw power of the Immaterium is something truly harrowing, as even the slightest mistake can spell damnation (or worse!). Yet those battle-psykers who survive their regular brushes with the raw power of the Warp can grow ever stronger than before, until they are recognised as Primaris Psykers, among the most potent human psykers available to the Imperial Guard. You are one of them, your long experience in mastering the Warp boosting your psyker rating to Gamma and allowing your psychic powers to grow ever more potent the more you use them, allowing you to unlock further refinements and learn new disciplines with which you can use your powers.
"
500 CP,Teach Me,Star Wars Sequel Trilogy V1.1,"When you’re playing with phenomenal powers, perks are no substitute for a true master. While most castaways lack the connections to find teachers, you don’t have that problem. Whether you’re training with a new power, navigating a new locale, or just trying to get a grasp on the situation, you’ll never be far from someone who can show you the ropes."
600 CP,Bloodline of Power,Star Wars Sequel Trilogy V1.1,"Whether you’re a Palpatine, a Skywalker, or are the start of your own dynasty, you have a deep reservoir of power at your disposal. Force Users will have the potential to one day challenge the Emperor himself, while pilots and soldiers would “merely” become legendary inspirations to their factions. Whatever your path, you will blaze a trail. You’ll grow faster in strength and skill than even you could expect. Whatever you’re good at, you’re going to be the best. Soon you’ll be a master yourself, combining powers and techniques you can only dream of."
600 CP,Darth Andeddu’s Writings,Star Wars - Darth Bane,"Darth Andeddu was one of the few figures in history to have mastered the technique of Essence
Transferal. This technique allows one to persist past their corporeal form and take the bodies of others for their own. Unlike what one may find in the tomb on Prakith, these detail a whole new level of Essence Transferal for he or she who would take this route to immortality. Unfortunately for most, transferring such vast amounts of Dark power to a new body causes it to rapidly degrade and forces them to move on or risk being consigned to The Void. With this purchase, you need not worry about such an eventuality. You may perfectly transfer yourself to a new host body, maintaining it and all your abilities perfectly for as long as you’d otherwise naturally live."
600 CP,Force Storm,Star Wars Sequel Trilogy V1.1,"Where others wield the lightning bolt, you wield the thunderstorm. This powerful display allows you to cast a wide field of disruptive electrical energy all around you. Even when wielded by a novice, this power would swallow small villages whole. If you were an ancient master fueled by vast reserves of power, you could disrupt entire fleets of warships. You are no longer a singular being, Jumper. Now, you are a force of nature."
600 CP,Hive Mind,Fallout Mutants,"Have you ever looked at someone and wondered, ‘what is going on inside their head?’ Well wonder no more, as you are a very potent telepath, capable of reading minds and communicating with others through your thoughts alone. You can use this to sense the minds of anyone nearby, eliminating stealth from biological opponents, but the most important ability offered by this is being able to create telepathic links. When you forge these links, it will allow you to communicate as though they are right next to you no matter how far away."
600 CP,Hoktar ,Stargate Atlantis,"You’re not an Ascended, but you’re closer than most. You find yourself gifted with ""weak"" psychic abilities such as telepathy, psychokinesis, clairvoyance, technopathy, regeneration, healing, etc, which you can develop and refine with sufficient time and practice. What you get is much more versatility than power – by comic book standards you’re only street tier – but entire alien species in this universe have successfully pretended to be gods with less."
600 CP,Invisible Hand,Fallout Mutants,"When one thinks of psychic powers, they will inevitably turn towards moving objects without even touching them. This is for many reasons, such as how obvious a psychic display it is, but it is also due to just how versatile telekinesis really is. Though you could lift a person into the air and crush them with relative ease, you could also use it for many other tasks, such as picking a lock without any bobby pins or repositioning your weapons in the air in order to get a better angle of attack. With practice and experience, there are many options open to you when you possess this power."
600 CP,Psy-Tech,Fallout Mutants,"It is only to be expected that when mankind learned of the existence of psychic powers, that they would turn to technology to study it, and then enhance it. You are one of the very few people who are capable of creating tech meant to enhance and mimic psychic powers. From headwear that can nullify or improve their potency, to guns using telekinetic energy to lift and move heavy objects. You could also use this to upgrade or create a variant of power armor that links with the brain itself, allowing for more fluid movement and better control. When the supernatural and science work in tandem, the possibilities are endless."
600 CP,Shadow in the Warp,Warhammer 40k - Tyranids,"One of the most feared attributes of the Hive Fleets is the phenomenon known as the Shadow of the Warp. The Tyranid’s as a collective have such an immense psychic force that they mute the warp around them, preventing it or psychic powers or transmissions from taking place. This not only blocks off warp travel but also isolates planets from communicating with other worlds and neuters psychic opponents. You have a personalised variant of this, even when unconnected from the hivemind that allows you to massively weaken or even nullify if weak enough, any psychics or similar power users in your area. Your aura’s range is enough to cover a large battlefield and you can even severely weaken beings who are innately connected to the warp or similar places within your aura."
600 CP,The Shadowlight ,"Warhammer 40k: Ciaphas Cain, Hero of the Imperium","The Shadowlight is a powerful xeno artifact created by a race known as the Ancients. It was originally meant to be a powerful weapon meant to be used against the C’tan, but was destroyed. Despite this the relic is still incredibly powerful because of a side effect that it causes. Prolonged contact with the artifact can awaken psyker abilities in any individual and can increase the power of a psyker. This acts as both a passive and active boost. Meaning that slowly over time you will become stronger and while you are holding it your abilities will be boosted immensely."
600 CP,The Soul Devourer,Warhammer 40k - Tyranids,"In the past, you got the chance to feed on the very heart of an Eldar craftworld. All those souls, they gave you strength. You fed and fed until you could eat no more and you gained a shocking amount of power, whether you destroyed the world in your feeding or not. Your psionic abilities are enough to tear battleships in two or render a titan into slag and, as long as you continue to feed on souls, they will continue to grow. Souls give you power, permanently increasing your psychic strength just a little for every one you eat and with all the food on offer to you, you could eat a lot of souls in the near future."
800 CP,Relic of Khaine ,Warhamer 40k - The Ynnari,"In the Fall, even resilient Kaela Mensha (Bloody-Handed) Khaine reached his endurance’s limit and fled, shattering into a thousand pieces as crossed the barrier into the material universe. These pieces were collected by the Eldar, nurtured in the heart of each Craftworld’s Infinity Circuit. Each year, a Young King is selected who in times war or crisis enters the relic’s chamber. Minutes or hours later, a scream is heard and the Avatar of Khaine emerges. Once a year, you or an ally can merge with this relic, a devotional statue, and for just one day experience the awesome power of the towering God of War and Murder."