200 CP,Huragok Ally ,Halo - UNSC,"Something of a surprise and most definitely an attention-grabber, a Huragok is supposed to be one of the members of the Covenant Homogeny and has normally been seen only in their presence. Yet Huragok, also known by those in the UNSC as 'Engineers', are primarily pacifistic and dedicate themselves purely to repairing and working on any technology around them. This particular one seems to have gotten lost and ended up deciding to follow you for the sake of making sure your technology was functioning. Aside from melodic whistling sounds that sound slightly similar to Earth whales, Huragoks communicate using either sign language with their tendrils or through text messaging thanks to their penchant of being biological supercomputers. Huragok are highly prized for being able to fix almost anything they touch, and you should expect a lot of questioning if someone spots you with one.
"
200 CP,Jovial Jester,Warhammer 40k - Craftworld Eldar,"At first glance, this individual seems to be an average Harlequin, bearing the Player perk. However, closer examination reveals more – namely, that the individual in question is incredibly mentally unhinged – in an entirely harmless manner. Well, that is, if you consider a fondness for terrible puns, an irrepressible energy, and the seeming inability to stop smiling “harmless.”"
200 CP,Living Saint ,Warhammer 40k: Imperium of Man,"A legendary member of the Adepta Sororitas, Saint Celestine is now a Living Saint, she has been described as a grand design of the Emperor unfulfilled. She has lived multiple lives in the Emperor's service, and each time she is slain is reborn once more. She strikes with the Emperor’s light, and is a true terror amongst most of the daemons of the Warp."
200 CP,Logisticus Adept,"Imperial Guard Regiment Gauntlet

","Regiment of your size has a lot of inventory to categorize and I doubt you plan to do that by yourself and you can’t expect your soldiers to do this, right ? That is why you have sought the service of one of the Logisticus Adept techpriests. She is a bit of a weird case. While she is hardworking and will do her job efficiently, her side projects always seem to revolve around this strange artefact, she calls “Nicromic Coil Machine”. Always trying to improve it and make it... make bread nice crispy and hot. Not a weapon, but a cooking item. Rare field of research for techpriest. While all is said and done, this girl also is surprisingly well connected as this weird cult of Toast seems to be well intermingled in the insides of local Forge-worlds so you can expect shipments of the vehicles and weapons to be full of higher quality stuff than normal. Who would have thought that the popularity of crispy bread would ring true amongst so many techpriests."
200 CP,Noble Team,Halo Termination,"You get the whole Spartan Noble Team with all 8 members, including Richard Parsons (Rev-9 type Terminator) and William Torrance. They are all equipped with improved armors and weapons and received Skynet designed improvements and augmentations."
200 CP,Officer of the Fleet ,Imperial Guard Regiment Gauntlet,"The Imperial Navy has seen to it that your regiment has its own Navy attaché. Her attitude to you is very business like and expects you to do your job as she does hers. With efficiency and speed. She despises bureaucracy and will try to get through to the brass as fast as possible. Very rare type of officer onsidering how much nobility and officers love to delve and fester in the byzantine system of Administratum and other Imperial offices. This will lead to faster availability of Orbital and Aerial Support. Sometimes even other ships besides the destroyer will join in carnage to support your ground activities. When you get to know her more, you will find that she likes to spend a lot of time in bars, just hanging out with lower anked officers and soldiers and getting absolutely wasted. Along with other soldiers. In her moments of weakness, she will let out that she misses her home station that is coincidentally close to your area of  perations. Will you brave Warp just to get her to see her home station once more ? If you do, your relationship promotes to something more friendly and possibly intimate."
200 CP,Personal Android,Aliens vs Predator,"You’ve been issued, or requisitioned, an upgraded android as a personal assistant or bodyguard. Much stronger than any human and capable of operating with damage that would have killed a human, its appearance and personality is to your design. It is loaded with much better quality software than over-the-counter androids – it’s much more convincingly human when it needs to be, thinks faster, and has the same combat software as a military-grade android, though not with the physical improvements. However, it has no capacity for truly creative thought or self-improvement, merely coming to different arrangements of pre-set solutions."
200 CP,PROXY,Star Wars - The Force Unleashed,"This training droid is an identical copy of the same droid used by Starkiller and comes with a complete database of fighting styles for each setting you visit, the droid will also scale with you to ensure you’ll never be without a sparring partner."
200 CP,Redemptor Dreadnought,Warhammer 40k - Adeptus Astartes DLC2: Primaris Marine,"An upgraded version of the venerable Dreadnought, this new creation of the Adeptus Mechanicus still serves the same purpose as earlier variants: To allow crippled beyond recovery Astartes to continue to serve the Emperor, even in death. Like much of the Primaris’ armory, the Redemptor is a versatile machine, and may be armed with several weapons. The primary armament of a Redemptor, mounted on the right arm, is either an anti-infantry Heavy Onslaught Gatling Cannon for cutting down lightly armored foes in a hail of shells or a heavy Macro Plasma Incinerator, for destroying heavier armored targets with concentrated bolts of plasma. Mounted under the power fist on the other arm is either a Heavy Flamer or a lighter Onslaught Gatling Cannon, while the torso is fitted with either dual Fragstorm Grenade Launchers or paired Storm Bolters. An anti-air Icarus Missile System finishes off the Redemptor’s armaments, with all of this powered by an extremely potent plasma reactor. Of course, while the Redemptor does pack heavy firepower and is unusually responsive to its crippled occupant, there is a small flaw to the machine: The improved performance also puts increased strain on its occupant, causing those of weaker will to be ‘burned out’ by the demands put on their damaged bodies. Still, in these dark times, one thing the Imperium does not lack is more dying heroes... When purchased, you may choose to either have an ‘empty’ Dreadnought chassis for use by a critically wounded companion, or you may choose to have it already filled by a fallen Primaris Astartes who can serve as a Companion"
200 CP,Rosie the Riveter,Warhammer 40k - Navy Jump,"Rosie was drafted from her work in a Voidship construction and repair yard. She has a tendency to wear
a somewhat bulky void suit that don't entirely hide her curves, and keeps her hair short so it doesn't get caught in things or cause inconvenience when wearing a vac suit. While not a member of the Cult Mechanicus, she is instructed in the basics of secular repair techniques, and has a good feel for finding her way through the often maze-like interior of Imperial ships. She has a void suit and set of tools, as well as a rivet gun that has been converted into a rough and unwieldy but effective autopistol."
200 CP,Salacious Seer,Warhammer 40k - Craftworld Eldar,"This Seer, bearing both the Seer and Spirit Seer perks, appears to have an unhealthy interest in the concept of “love.” While romance is not unknown among the Eldar, this individual's propensity to use their gifts in a pursuit known as “matchmaking” is something of an annoyance to the Craftworld at large. Still, consider also that they seem to see a future together with you – regardless of any prior arrangements. The Craftworld's hope that you might be able to rein them in may well be unfounded..."
200 CP,Skynet ,Halo Termination,"Now you possess your very own, unshakably loyal, unhackable, incorruptible and devoted personal Skynet variant. It is housed in an advanced Neural Net Core that is small enough to be carried comfortably. Skynet is comparable to a Forerunner Contender-class Ancilla."
200 CP,Synthoid ,Batman Beyond,"A semi-intelligent synthetic humanoid programmed to serve a specific service for you. It could be used as bodyguard, a training drone, or something more.. personal. You can also choose whether this thing looks like an artificial machine or appears completely indistinguishable form a regular human. Regardless of it's appearance your synthoid will possess superhuman strength and durability, allowing it to tear apart solid stone structures with ease and shrug off anything weaker than high-powered weapons or explosives."
200 CP,Valeria DOOM,OOC - Doctor Doom,"This might be cause for concern. Through means similar to you, another mysterious stranger
has arrived. This woman of tastes is quite the prodigy. Apparently, she was born from a
matrimony of Doom and Scarlet Witch. While she might be egotistical and a tad “unorthodox”
(Read unstable), she is loyal to you and willing to assist you in your goals as long as you prove
to be a loyal ally."
300 CP,General Grievous (Legends) ,Star Wars vs Warhammer 40k,"General Grievous is a very powerful warrior, but his true version is far above what was shown originally. He is an incredibly powerful warrior and a nearly unmatched strategic genius. For reference he defeated an entire squad of Space Marines on his own without any trouble granted they were injured. He possesses the attitude of a warrior and believes that worthy opponents should be given a chance to die with honor. This attitude earned him the respect of the Crimson Razors even if they still hated him. By choosing this option you will gain a close relationship with Grievous on par with the one he had with his sister. He will never betray you and should you fall he would see the galaxy burn in order to avenge you. You may choose the exact nature of your relationship. For example if you were an Imperial perhaps you somehow earned his respect and he wanted to join you in your mission. 
"
300 CP,Laura Kinney,Deadpool,"Meet the grown-up version of Laura, aka X-23—better known as Wolverine's clone with anger issues and adamantium claws. She’s all grown up now, and guess what? She’s just as terrifying as Logan, but with a few more years of dealing with her emotional baggage. She’s a lethal fighter with killer instincts (literally), and those claws are still sharp enough to cut through anything. She’s a bit more balanced now, but don’t push her buttons unless you want to end up on the wrong side of those claws. Laura’s not just about rage anymore—she’s smart, strategic, and ready to carve her way through whatever mess you’ve dragged her into. Just don’t call her ""Wolverine Lite."" Trust me, it won’t end well."
300 CP,Leeloominaï Lekatariba Lamina-Tchaï Ekbat De Sebat,The Fifth Element,"Just call her Lelu. It’s easier that way. Lelu is the Fifth Element, a being designed several hundred of thousands of years ago. The Mondoshawans, a mechanical alien race, has been dedicated to her safekeeping and that of the stones necessary for destroying The Great Evil every 5,000 years. It is unknown if they created her or are simply caretakers. She meant to be sealed away until she is needed to save the universe, but events have conspired to revive her from her stasis and set her out into the world. Lelu herself is a slim woman, physically perfect in absolutely every way. Very little is known about her as a person, as those records have long since been lost and the Mondoshawans refuse to release their own. She is straightforward to a fault, with her actions and words. She is also quite emotional and quickly acts on those emotions despite the consequences. She initially can only speak the Divine Language, the language that is said to be the source of all others, but will quickly learn given time and information to do so."
300 CP,Miranda-116 ,Halo - UNSC,"Standing at a terrifying seven feet tall and moving like a phantom, this SPARTAN-II soldier seems to thrive on being stealthy and applying her potent strength in precise techniques to cause all manners of damage before the enemies even notice. She doesn’t like getting in open engagements, as that carries all kinds of risks and prefers the control one has when they’re not noticed. Doesn’t mean she doesn’t know how, as the few thousand confirmed kills on her record can attest. When she’s not in battle she prefers to read up on different literature and philosophy, and is the second thing people will notice about her. The first thing they notice if she has her armor off is the snow- white hair and amber eyes she has."
300 CP,Smart AI,Halo Wars,"This smart AI is still in the process of forming its identity, and has decided to trust you in its creation. You may decide their personality, appearance, etc., though no matter what you choose, they will start out inherently inquisitive of the world and maybe a little too easily impressed, just due to the fact they are new to the whole “existence” thing. UNSC High Command has also seen fit to put them under your supervision and has given them command of a large force as a test to see if AI commanders are feasible and reliable."
300 CP,The Shock Jock ,Superman - The Animated Series ,"Leslie Willis was a normal radio-show host until she was struck by a bolt of lightning that had travelled through Superman which somehow, improbably, gave her superpowers. She is now a being of pure energy and can create, absorb, and project massive amounts of electricity. She can also travel through power lines and remotely control electronics, though she also has hefty power requirements and must absorb electricity to recharge her powers. She is also incredibly vulnerable to water and will short-circuit if exposed to the substance."
400 CP,Azazil ,Mass Effect - Legendary Edition,"The Reapers are ancient beings, driven by a misguided mission. They are horrifying opponents, but potentially a powerful ally. This Reaper is not held back by the same code that controls it's brethren, and has decided to use it's newfound freedom to help you. How fortunate. Azazil has all of the abilities that you'd expect on a standard Reaper, but is interestingly not capable of Indoctrination. It isn't really concerned about regaining this ability, or doing much of anything, really. It might be a bit lazy."
400 CP,Delilah the Dark Elf ,MCU 1,"Not everyone agreed with the homicidal views of Malekith and his horde of Dark Elves in regards to the light in the universe. A rare few such as Deliah felt that their time had come and gone, and would resign themselves to seeing what this new state of creation could offer. She's very curious as a result, and it's a good idea not to leave her alone with any technology for more than ten minutes if you don't want it disassembled and in the process of being studied. She's very meticulous at recording anything she finds though, so perhaps it might be good to let her work.
"
400 CP,Human Replica Droid,Generic Star Wars Fanfiction,"Otherwise known as HRDs, Human Replica Droids are among the most advanced machines in the galaxy for good reason. These espionage droids are built in such a way that only the most thorough of medical scans can determine they’re fakes and all others fully show them to be truly organic. The droids are also incredibly intelligent and can fulfil a number of tasks for you; whether it’s acting as a diplomat, infiltrator, or even assassin they do it well. This particular unit has been programmed with extensive assassination protocols similar to Prince Xizor’s and is equipped with powerful eye blasters for some reason, it’s also quite loyal to you, almost slavishly if one thought about it. Its appearance is up to you, though if you don’t choose it’ll default to copying Guri."
400 CP,In time you will call me master ,Star Wars Movies Compilation - The Star Wars Saga,"Through this perk you can target someone in order to gain an awareness of how best to manipulate, mold and tempt them to your side as a loyal subordinate.
"
400 CP,Isha ,Warhamer 40k - The Ynnari,"The Aeldari mother goddess of healing, fertility and life, taken captive during the Fall and held a prisoner of Nurgle ever since. You freed her, but beware because Papa Nurgle and all his forces desperately want her back. On the plus side she has a mastery of biomancy that is literally peerless."
400 CP,Lighter Than Some,Halo - The Covenant,"A rarity amongst the Huragok- one that actually believes in something. This Huragok is a devoted pacifist, and feels the need to make amends for his actions during the battle of Harvest. To that end he comes with you, to bring peace and understanding across the Multiverse."
400 CP,Perfect Body ,Andromeda,"You are in possession of a fully functioning and programmed to your specifications android body with an appearance to your liking. This is more Sturdy than a standard avatar, it has been built with the best Vedran technology. Built to survive the horrors of the post Commonwealth society, and with blueprints to make more. This body can be upgraded if you know how and keeps upgrades in-between jumps. You can choose for this to be used as a free android companion.
"
400 CP,Pirate Leader,Empire at War,"If ever there were an appropriate usage of the term “magnificent bastard” to describe someone, this young pirate would be the perfect candidate. She is an eccentric trickster known for her unique out of the box thinking when it comes to space combat, her ability to charm almost anyone, and escape from pretty much any sticky situation she often gets herself into. Additionally, she treats her subordinates and those she considers friends particularly well, by pirate standards."
400 CP,X-Harem,Rogue-Like Evolution Jump,"You have an innate talent to lead with people, essentially making you extremely skilled when it comes to managing relationships of all kinds, be them romantic in nature or not. Not only this, but you’re also
skilled in finding ways to convince your partners to accept polyamorous relationships once they have enough trust in you, love you enough or are submissive enough. This also extends to being talented in managing and maintaining multiple relationships, basically encountering no issues due to this, with
anyone in your harem growing to love each other just as much as you do and will be capable of handling any potential issues without you needing to lift a hand."
500 CP,Shas'O Vior'la Shovah Kais Mont'yr ,Warhammer 40k - Tau,"Shas’o is a legendarily skilled commander who would surely end up in Trazyn the Infinite’s collection in a place of honor next to Ursarkar Creed. Fiercely independent and hot blooded (for a T’au), he is immune to the Ethereal’s pheromone-based mind-control and might occasionally catch tactical-level glimpses of the future, hinting that he may be the first T’au with a psy rating higher than Rho. He comes equipped with the Dawn Blade and a bespoke, elite Battlesuit."
600 CP,Distaff Counterpart,DC Mulitverse - Earth 11,"A gender swapped version of yourself. They have similar abilities, possessions, personality, and history to you, because they’re yourself from another dimension. They're ultimately still a companion though, so if a perk or item can't be replicated as per the jump document then this can't be used to get around that."
600 CP,Holy Relic,Halo - The Covenant,"This holy relic is shaped as a sphere with a great eye, and floats through the air. It is a monitor and overseer of a Forerunner installation, and as such, it has a veritable treasure trove of information regarding their ancient empire- though it will not share it all at first. It can defend itself with its powerful forerunner energy beam, located in its eye."