0,,CP Cost,Name,Jumpdoc,Chapter,Description
96,,500,Tarnished Gold,Breathless Wild,Corruption,"Few monsters and even fewer slaves are brave or cunning enough to defeat the likes of you, and anyone who tries and fails will pay the price for being foolish enough to challenge you. Whenever you defeat your enemies through strength or sexual prowess they’re sure to meet with a terrible fate as you gain immense power over them. Having already beaten them once before, your new slaves now find it nearly impossible to defy you again: a princess’s holy magic, a heroine’s clever skills, and a monster’s brute strength simply fail to work against you, making them slaves in spirit even if they still have a rebellious streak left in them. They’ll remain useful slaves so long as they remain loyal but their strength fails them the moment they try to betray you. You however can toy with your new slaves with impunity, as whatever resistance they might have to your power fails and leaves them utterly exposed to corruption, transformation, and domination."
97,,500,Vae Victis!,World of Lewd Fantasy,Corruption,"Any time you sexually take someone while completely disregarding trifles like their comfort or consent, the pleasure you can effortlessly force upon them is magnified by such an absolutely mind shattering degree that the goddess of celibacy herself could be broken by the agonizing ecstasies you bring, no matter how much she may hate herself for it after the fact. Additionally, for as long as you are fucking them like this, and then until the afterglow fades, your victims have any and all of their resistances to your powers striped away, leaving them totally helpless to fight off your various abilities. 

This unholy dominance even extends to the macro level, as where there's a whip, there's a way. The more and longer others are controlled or oppressed by you, ether in person or as your ruled subjects, the more they come to view it as a good thing and how the world ought to be. Given enough time all shall love and worship you for the blessing that is their slavery."
98,,500,You Need Me,Milk Hunters,Corruption,"It's nice to know that you're needed. Especially when you know that you can take advantage of that fact. The more that someone needs you, the less capable they are of turning down your demands. If you're the star player on a sports team, you can get away with treating your teammates like shit, verbally abusing them, and stealing from them. If you're the only thing keeping someone from losing their life and the lives of everyone they know and love? There's literally nothing you can't make them do. Well, as long as it doesn't make them risk their life and the lives of everyone they know and love, of course. Best of all, they won't try to get revenge, or anything like that, when they no longer need you. As a bonus, I'll make it so you'll have a feeling of just how far you can push this, and a talent for getting people under your power."
99,,600,A Darker Path,Emergence,Corruption,"You wanna drench yourself in sin huh? Drown in filth and bathe in misery. It’s not just the fucking anymore, not even the drugs. You love the misery of it all, the pain and humiliation and loss. But going too far is dangerous, isn’t it? Some things you can only do once. Yet, you’re lucky. You can keep falling and throwing yourself away...and it’ll keep coming back to you so you can enjoy it all over again. Even if you defile every inch of your body, abandon friends and family in the pursuit of pleasure, even bring yourself to the brink of death for fun, you’ll find yourself making your way back to how you once were. Purified in body, your loved ones reconnecting or finding new ones, even finding a new home and life. Not that it’ll last for long. We both know you won’t resist going back to that black hole of self-hate again and again and again."
100,,600,Asanagi Battles,Victim Girls (Rose Edition),Corruption,"The greater their reasons to resist, the weaker they seem to become. Girls with loving boyfriends or husbands, warrior women fighting against your empire with their sisters of battle, those who’ve struggled against your factions brutal oppression for years. Despite all the reasons they’d have to be the hardest to break, their resistance feels like paper against your efforts. The more reasons they have to defy you when it comes to you breaking them to heel, in a fight or otherwise, the less they’ll inwardly feel that when they come up against you directly. Sure, they’ll put up a fight on the outside but when everyone thought on the inside is about how hot you make their body feel, they won’t have nearly the strength they usually would. Even the greatest warrior goddess might turn into an ineffectual kitten if you can plan the encounter right."
101,,600,Beast of Lust,Shinmai Maou no Testament,Corruption,"There are demons and then there are monsters, the  darkest and most depraved souls in all three realms. Like Zolgia and Belphegor you are a creature torn straight from the pages of the Hero Clan’s most twisted tales, a monster who feeds on lust and devours the souls of his victims, consuming their life and power to add to his own. In your hands sex becomes a powerful weapon, a tool which you can use to destroy your enemies and reduce them to broken shells of their former selves. By forcing unwanted pleasure onto your victims you assault their sense of self, battering down the walls of their minds until all that’s left of them is a broken husk. A strong will can hold out against such torture for a time but even great heroes can’t last forever, and once a person has broken you’re able to feed on their vital essence, consuming any special powers they possess and taking them for your own in ways that even the most powerful succubus in all of hell can’t imitate."
102,,600,Bedroom Coup,eratohoK,Corruption,"By becoming the lover of a powerful political figure you’re able to usurp power from them. You will find that the person will love you so much, they’ll simply surrender all authority to you without a fight, and their vassals and servants will happily accept this transition with nary a protest. Additionally, should you cause a foreign leader to fall in love with you, will find it easy to convince them to surrender their nation to you; all the better to be close to you again."
103,,600,Bound Princess,Rope Master,Corruption,"If sexual desires are sinful and impure then maybe purity isn’t all it’s cracked up to be. There’s strength to be found in embracing your darker and lewder self, and you’ve found that strength and made it your own. 

Like Hina and friends, you're a magical girl (or boy) whose sexual desires have transformed into a source of magical power, allowing you to use magic based on your kinks. As a bondage-themed magical girl you might gain the power to conjure and command magical ropes and chains like a veteran rope master, while a love of wax play and electrostimulation might grant you fire and lightning magic. These magical powers (and any others you have) are at their strongest when you’re being subjected to your own kinks, turning pleasure into even greater power. A bondage princess can multiply the strength of her magical powers by binding herself in her own ropes or sealing herself into a gimp suit, and by bringing herself to orgasm she can fire off super-powerful finishing move spells even stronger than that. Despite their lewd nature these powers are considered holy and are extremely effective against ayakashi, demons, and similarly evil foes."
104,,600,Carnal Conquest,Breathless Wild,Corruption,"As vast as Hyrule may be, Ganon’s ambition has always been to rule over all of it, if not the world beyond its borders as well, and he’s proven himself quite capable of doing so many times in the past. The trick is simply to remove or corrupt the previous rulers, then step in to assert dominance over their former lands. Your iron-fisted rule allows you to use these tactics to great effect: by dominating or corrupting princesses or champions or other people of great importance you also assert dominance over all who followed them, allowing you to conquer entire towns, regions, and even countries in one fell swoop. Entire armies will fall apart in despair after you make their princess your concubine, while civilians take on the broad strokes of your ideals and desires for them, some eagerly and some reluctantly, snuffing out resistance to your rule as your new subjects embrace their new master whether they like it or not. Heroes and others with strong wills can still reject you, but if their wills break somehow they’ll submit just the same as anyone else."
105,,600,Corrupter of Men and Nations,Kuroinu,Corruption,"It takes a certain soul to not only revel in their own debauchery but to spread it to anyone they meet as well. You possess the will, knowledge, and influence to spread your corruption. You could slowly corrupt a paragon of a knight like Alicia or even Celestine herself from serving their nation into ‘serving’ their nation’s men and get those same men who once loyally followed her into treating her as nothing but a slut. The corruption you inflict on others is so great that it lingers on even after your death or disappearance and you could easily establish a self perpetuated empire that would thrive and prosper for decades.

Additionally when you conquer places you can easily massively swell the size of your army with people drawn to your victories. Even the once loyal soldiers of your enemy would join your force to make ends meet, and would gradually become corrupted in the same way that your men are and continue your debauchery."
106,,600,Demon Lord,Baalbuddy,Corruption,"You are the demon lord (not really) but you are a veritable font of degeneracy. The longer you stay in an area the more you can corrupt people nearby, emphasizing something through larger and larger tweaks to mind and body. Of course, there will always be a lewd bent to it. If simple lewdness is your aim, people will become more sexually open and permissive. A particular fetish can become the standard almost to the exclusion of anything else. Even pushing the idea of something like monogamy would see faithful couples being viewed as the ideal relationship and a wedding dress as the kinkiest of fetishwear. Given enough time these changes will become more overt and extend to the environment. People in general or certain demographics might have their bodies change in specific ways while articles of clothing and decorations begin to spontaneously change in cut and design. Some people might notice or even resist the changes, but most will eventually come to view the changes as the way things have always been and quite normal with dissenters and non-conformers becoming shunned and distained. You have full and precise control over how your corruption manifests. While this perk can’t make massive, impossible changes to the world or to people, it will slowly take effect on anything that enters your range. Which after a few years, can extend over a small country."
107,,600,Demonic Essence,"Archangel of Love, Love Mary ~Malignant Conception~",Corruption,"You are able to summon and channel the tainted divinity from which sprung Lord Elysium, and form him, all of demonkind. Using this power, you can corrupt and pervert the minds of others, using pleasure as a vector to slowly whittle down their morals and bring them into depravity. Well, “slowly” only applies to someone as strong as Love Mary P… for an ordinary human, only a few minutes of exposure to demonic essence would be enough to indelibly twist their mind into… well, whatever you want them to be, really. Nothing says that corruption needs to only have one end result. But this corruption affects more than the mind. It can twist into the core of a being and start to affect their powers and purity; if someone was as pure as Primera, it would take a long time of frequent injections of demonic essence to establish a true seed of corruption, and they’d no doubt fight back all the time. But once it takes root, it will twist “pure” and “good” powers into something lewd and evil, such as turning a transformation into a magical girl into a transformation into a succubus. After falling to corruption, any power that would be dependent upon love, would now be dependent upon lust. You may freely corrupt any of your own “pure” or “good” abilities into corrupted and evil alternates, if you so desire. If you are a God, then you may choose to have this corruption instead take the characteristics of one of your domains; perhaps you’d prefer to give things an elemental twist rather simply turning them evil, or maybe your corruption slowly turns things mechanical? The precise details of how your own demonic essence functions are up to you, but you have to decide the details now; no changing your mind later!"
108,,600,Forceful Expulsion,Sailor Uranus,Corruption,"How, exactly, does one “lose to cock”? You might just have an answer. Whenever you bring someone to climax, some of the fight falls out of them. Their desire to resist, their physical stamina, their reserves of mystical power, so on and so forth. Anything they might use to resist you is gone with the wind, piece by titillating piece. A small portion will go to supplement your sexual endurance, but you otherwise do not gain from this. Additionally, it will take slightly longer to recover such resources for every orgasm they sustain, meaning that escape is unlikely for as long as you continue to use them.

This effect may be applied, to a much lesser extent, to those under your command. Your minions extract less energy than you do and do not suppress energy regeneration in the same way, but they can still be useful when you need a break. If they run a train on her, it won’t be an issue, but in this case there’s no rest for the wicked: If so much as a second passes between their ministrations, the effect temporarily halts. Only until the next man has his way, but over time, it may be enough to pose a danger."
109,,600,Genbu Tale,Rope Master,Corruption,"You may be an exorcist or a magician by trade but at heart what you really are is a slave trainer. Few will admit to admiring your talents but none will deny your skills, for you’re a master of your craft who can turn an ordinary person into a work of erotic art. A slave under your care is as malleable as the finest clay, and you can easily sculpt them as you please, from breaking down unwanted resistance or training new skills to reshaping your slave’s entire personality. Under your care your slaves develop their powers and skills in a fraction of the time they’d need on their own even if you lack specific knowledge of their chosen fields (though obviously being a skilled and knowledgeable teacher will help them grow even faster). Those who have supernatural powers can even unlock new levels of power and shatter any mental blocks holding back their progress. But such gains come at a price: anyone you train as a slave becomes your slave in truth, searing the pleasures of submission and eternal loyalty into their bodies and souls, until not even magic or mind control can take them from you."
110,,600,Incubator,Majuu Purification Girl Utea,Corruption,"The Utea are much like uncut gemstones: beautiful, but in need of polish before they can become proper slaves for their future masters. You have a rare gift for teaching and would be a perfect mentor if only you weren’t corrupting your students. You have an eye for special or hidden talents, like naive girls who have untapped magical potential and would make powerful magical girls, and your world-class teaching talents allow you to take your students all the way to the peaks of their potential. Of course the more you train up your proteges the easier it becomes to manipulate and corrupt them as they eagerly drink in every lesson you teach them, even the ones that are actually just giving them hidden weaknesses that only you can exploit. You could easily make your students hyper-sensitive to certain kinds of pleasure, make them incapable of cumming without your touch, force their bodies to have lewd growth spurts, or simply awaken them to a litany of new fetishes."
111,,600,Joyous Reunion,Tifa Lockhart - Agent of Avalanche,Corruption,"There have been other visitors to this world from beyond before you arrived, but will there be others after? Your love is a truly insidious thing, akin to the Calamity from the Sky that doomed the Ancients. Your body can twist itself to become the perfect lure for your target, a being straight from their wet dreams. And once the bait is taken, they'll find themselves hooked, unable to resist the pleasures your flesh can give them. But the worst is yet to come for them: as they indulge in your body, you too may indulge in theirs, twisting them to be more to your liking in body and soul. Eventually they'll grow so devoted to your addictive love that they themselves will become a vector for you to infect and change others through them, your victims existing in a state of blissful subservience to your will as they become extensions of you. As the infection that is you spreads throughout the land, your body draws strength from those who join with it. You could twist your muscle fibers to gain the strength of a mighty swordsman, or increase your curves and beauty in the image of a lovely young flower girl that you seduced. And as your body gains strength, so too does the infection. Will you be a second Calamity to this world, so damaged from the first?"
112,,600,Mistakes were Made,High School DxD Blacked,Corruption,"Deals with the devil are a tale as old as time, but the Devil's don’t actually have the monopoly on them - if anything, they learned some of their best tricks from humans. Things like “I’ll sleep with you if you stop bullying my son”, or “I’ll suck your cock if you don’t release that photo”. There’s no one better at sinning than us humans, after all. Those who make deals with you will find them slowly sliding to become overwhelmingly in your favor, or even outright in opposition to their original goals - someone who paid you not to target someone by sleeping with you might eventually pay you to sleep with them by creating more opportunities for you to target the one they originally defended. Once the bargain is struck and you begin to conquer them, it won’t be long until they happily and gleefully reverse their position and give you anything you ask for in exchange for not stopping your abuse of their poor bodies."
113,,600,Parasitical Love,Victim Girls (Veronica Edition),Corruption,"Just conquering your foes isn’t enough. You need to defile them, to take everything from them as you sate your lusts. Whether you’re stretching someone’s holes wide or riding them into the dirt, sexual domination becomes a devouring act. Each time you make your partner orgasm, you can steal away their power, absorbed directly or ejected through their sexual fluids. Levels, skills, talents, raw strength and more. Their rape will hollow out their very being, until they’re as weak as the mewling kittens you leave them looking like. Every orgasm will drain an appreciable fraction of whatever you’re taking and if you’ve no use for it yourself, others can benefit by licking up the fluids you leave behind."
114,,600,Shared Will,The Lamuros Of Seven Colors,Corruption,"It should come as no surprise that the demon king is the best at rape out of all the demons alive. It might even be why he’s king. In an imitation of his skill, you have gained the power to rape their mind too. Normally you’d have driven their body crazy and left the mind reeling, barely able to recover. With this, you can make it more permanent, leaving their state of lust to be what they consider normal. By instilling a fragment of your own will into them, your own memories of what is ‘right’... They will never recover. Or perhaps they will never betray you? Recovery implies something is wrong, after all..."
115,,600,Suffer in Silence,Generic: Hentai World,Corruption,"All it takes for evil to triumph is for good men to do nothing. Lucky for you, the good men are all out to lunch and the good women are too busy getting stuffed full of cock. You will generally face far fewer complications for evil actions than other people would. Blackmail victims give in rather than go to the authorities, bystanders ignore you as you molest a woman on a crowded train, and neighboring kingdoms turn a blind eye to the threat you pose as you conquer a nation and turn all its citizens into sex slaves. Beware heroic individuals though, as this perk has no impact on their ability to oppose you directly."
116,,600,Tainted Seed,Majuu Purification Girl Utea,Corruption,"The secret weapon of the injuu king and key to the success of the Utea Plan, these corrupted Utea seeds allow the injuu to transform ordinary girls into powerful slaves with all the powers of a magical girl and the lustful nature of a sex demon. These tainted seeds can only be granted to a person with their consent but those who accept become magical girls at the cost of becoming permanently shackled to you. While they appear to be ordinary magical girls at first, your new slaves are incapable of harming you with any powers they have regardless of whether they got them from you or not, and the more that they indulge in the new desires that now stain their soul the more powerful they become. Eventually they’ll blossom into corrupted dark magical girls like Charm and Grace’s corrupted “uterus” forms. You only receive two seeds at first but you can make as many more as you want, though it requires an expense of magical power."
117,,600,Taking Possession,Generic: Hentai World,Corruption,"The more sexual pleasure you bring someone, the more that which is theirs become yours instead. This is a progressive transfer of any assets which they could give to you or which you would receive or share while married to them, up to and including themselves once they have nothing else left to give. Whatever you gain is yours alone, legally and metaphysically, but you may choose to conceal the transfer from your lover and temporarily permit them continued access. If you do actually marry someone then the transfer is immediate and total, irreversible even by separation, from the moment the ceremony is complete. In such a case you also, for the duration of the marriage, are able to give or deny their legal and metaphysical consent for them despite their personal wishes."
118,,600,What is Sex?,Bloom Pirate Hooker,Corruption,"So, funny story. The most beautiful woman in the world and Queen of Amazon Lily, Pirate Empress Boa Hancock, has no idea what sex is. Neither do her sisters, and the three of them used to be slaves to the world nobles. Pretty girl, slave, arrogant noble... How do they not know this? Regardless, Boa Marigold was quickly educated by the Soul Pirates on the intricacies of sex after seeing their copy of ‘Midarezaki Joshuu Kaizoku’ and wondering what it was. It was porn. Much like the Soul Pirates, with even the vaguest hint of innocence, you can turn any woman - or man, though they tend to dislike dickgirls for some reason - into functionally whatever you want. And of course, once you have your claws - or dick, as the case may be - in her, you can retain that control. Want her to spend years as a high class hooker, only to turn into your blushing bride? You can do that."
119,,600,What it Means to Love,"Archangel of Love, Love Mary ~Malignant Conception~",Corruption,"Your touch is marvelous, and to most humans would definitely be the most pleasurable thing they’ve ever experienced. And wouldn’t anyone who experienced something wonderful want to share it with those they care for? People who you corrupt will start to focus on the idea of sharing this corruption and sexual pleasure with people they care for. They will work to expose people to you, to give them to you, to make them experience the amazing pleasures you shared with them. But this works the other way around, too. When someone that a person cares about falls to corruption, the more appealing corruption seems to that individual. Turn everyone that somebody knows to your side, and that person is almost guaranteed to willingly give themselves over to you. This doesn’t only work with corruption, but with more mundane forms of persuasion, too, in a somewhat twisted form of peer pressure."
120,,700,Absolute Corruption,Generic: Hentai Tentacles,Corruption,"The soul is a powerful thing. By consuming a person's soul completely, you kill them. However, you can now fill them with your own power. Rebirthing them. Becoming a demon in their own right. Their body changes to suit your needs, their mind becoming completely loyal to you. A demon created in such a manner is twice as powerful as they were before and gain the ability to consume slivers of soul through sex."
