0,,CP Cost,Name,Jumpdoc,Chapter,Description
1,,0,Blessing of Aura of...,Feeder Fantasy,Corruption,"A bit wordy? Yes, yes it is. By default this ""blessing"" from the Goddess mirrors Sura's own 'weight gain aura,' that does nothing more than make it significantly easier for women to get fat in a radius large enough to cover a small town like Mordau. Unlike Sura's aura, should you be a woman you are exempt from your own 'corruption' influence. If weight gain isn't your cup of tea, you may instead alter it to some other small, yet biologically possible/natural metamorphosis. Excessive breast growth, for example. Growing new body parts is not possible."
2,,50,An Essay on Lust,Bricola,Corruption,"It's incredibly unlikely that future worlds will have plotlines like this one, and even less so that they could mutate beyond canon and into something like that happening here. Still, that’s not a reason not to try! This essay - or rather, these essays - are a sound and logical argument for how sex, lust, or even skimpy clothing can supposedly help any situation you'd care to name. Whether it's something big like convincing a company to set up a retreat similar to the Gotei 13s private island where you can sleep with its hottest members, or something simpler like making the dress code a tad bit more lax, if it's possible to make an argument, it's here. That said, I make no guarantees about you even being heard out, let alone keeping your job for such a ‘disgusting’ proposal. That part I leave up to you."
3,,100,Cock Sleeve,Niplheim’s Hunter,Corruption,"A former human who’s been broken and trained to your liking, this item is a lust brand bearer like Azel who’s been reduced to being an eager cock-addicted slave to your every whim. Smart enough and well-trained enough to obey you, she can be trusted to make trips into town on her own to fetch items from the stores or lure unsuspecting huntresses back to your lair."
4,,100,Collar and Leash,Boyce Park,Corruption,"A special collar that can’t be forced on you, but doesn’t open without your owner’s permission once it is shut. The same goes for shutting down all agreed on powers, allowing you to submit fully even after you grow in power. The leash is unbreakable and never gets in the way. Those legally mark you as owned property and never draw unwanted attention.

Yes, you can use it on someone else, if you must."
5,,100,Corrupting Aura,Corruption of Champions,Corruption,"With this poisons, potions, magics, and actions by your hand will have a greater chance at getting their desired effect if intended to corrupt a target. Minor elements of corruption also seems to spring up around you infecting your general environment should you wish it."
6,,100,Dirty Mouth,Kyonyuu Fantasy 2,Corruption,"The problem with all this ‘society?’ People have all this trouble stating what they want, brazenly and honestly. You do not have this problem, and rarely if ever will you face consequences for it. Yes, that barmaid will feel abashed that you publicly stated you want to rail her womanly valley like a bull in heat, but you were honest about it. No, it is not uncouth of you to publically laud and describe how good mermaids are at paizuri on account of them not having a pussy. No, that man isn’t going to slowly back away because you said you need to bathe in his baby batter... I think you get the idea."
7,,100,Golden Decoration,Princess Sacrifice,Corruption,"Golden Decorations are essentially a set of nipple piercings, labia piercings, and a clitoral piercing all linked with a thin gold chain. The labia piercings are used to pull them apart and open the vagina for view. Great for showing off that lovely human you’ve taken as a cum dump. They also can reduce the will of the one wearing them and making them more docile towards the owner."
8,,100,No Distractions,Bloom Pirate Hooker,Corruption,"But of course, sleeping with the enemy comes with it’s own risks. What if they somehow get the upper hand, they fake their defeat, try and woo out some critical information from you? Thankfully, those are concerns for other people. You always know when the person you’ve been working over the coals is actually ready to talk, or if they’re lying to save their skin. A subtle difference in the way a proper sex slave walks and how someone who’d only pretending walks. Even the tiniest flame of rebellion is like the dawn itself to you - you’d have to be blind to miss it."
9,,100,Play Rough,My Bride is the Demon Lord,Corruption,"Nobody really minds if you get a bit rough during sex. This doesn’t cover anything like hitting or abuse, but shoving your cock down your partner’s throat during a blowjob, spanking without permission, surprise anal sex, and similar rough play are all easily smoothed over and quickly forgotten. Do it often enough, and they might just develop a fetish for it... especially considering that this perk also gives you a natural talent for giving incredible amount of pleasure."
10,,100,Royal Stockade,Breathless Wild,Corruption,"When all else fails you can always fall back on selling your body to make whatever you need to survive. It might be degrading and humiliating but there’s no denying that it’s incredibly effective at raking in rupees by the bucketload. This is a stockade where you (or someone else you pressured into it) can do a brisk business servicing customers with your body. You have a knack  for putting it where it's private enough that you won’t be disturbed by anyone who’d take umbrage with you for running a business there but also public enough to draw a constant stream of customers who’ll happily part with their money for a sample of your talents, and the better your talents are the more money you can rake in from each patron you serve."
11,,100,Smart Piercing,Free Cities - Zenaku82 Edition,Corruption,"A special clitorl ring that can be placed on a slave. Once programmed, it’ll go off when the slave indulges in certain activities. This will help make the activity more pleasant, and eventually develop a fetish for it. Have it go after during a titfuck and she’ll start considering her breasts to be her primary sex organ. Have it go off during buttsex, and she might become anally orgasmic. Have it go off when you’re holding hands and watch how lewd she gets."
12,,100,You Know You Want To,Chichikko Bitch / Witch Bitch Collection,Corruption,"If you don’t like being molested, they why are you so wet? If you don’t like being raped, then why did you just cum? I’m sure you can see where I’m going with this. Your words are now... tempting. Just enough logic and accusation to shame the fight out of someone. To convince them for a moment that they really do enjoy this, that they really are a slut. Of course, words are nothing without the proper mood... and a thorough bitch breaking to drive the point in deeper."
13,,200,A Hero's Gentle Fall,Boku To Nottori Nakademia,Corruption,"In situations like this, you can’t be blamed if you slip a little and enjoy yourself if the other option is someone losing their life, right? Right! In situations where you’ve been trapped in a metaphorical corner, where the only options are morally dubious at best, you’ll find that as long as you were genuinely forced into the situation, others won’t hold it against you for...getting a little carried away. Pumping your puppeted (and very attractive) class president full of semen without the original owner of the body’s consent won’t have your other female classmates calling for your arrest in disgust. After all, it wasn’t your fault."
14,,200,A Sadist's Mercy,Earth Defense Team Star Guardians,Corruption,"The galaxy isn’t going to roll over and conquer itself for you, but take care that you don’t destroy the things you’re trying to conquer or kill the people you’re trying to enslave. Whether you’re interrogating a prisoner by almost drowning her or knocking out an enemy ship by targeting its engines you can always pull your punches and ensure that you do not deal more damage than you intend to inflict, allowing you to much more easily take captives instead of corpses. The only way you’ll ever break a slave beyond repair is if you choose to do so deliberately."
15,,200,Addictive Cum/Milk,Corruption of Champions v1.1,Corruption,"While they may not look like demons, aside from the horns, the minotaur bull-men of the mountains and the lacta bovine cowgirls might as well be demons themselves in some views. Perhaps an unkind assertion, but not an unfounded one. The corruption of these creatures has resulted in their body fluids becoming addictive, the cum of minotaurs being a powerful narcotic and aphrodisiac, while the milk of lacta bovines both strengthens the drinkers and gradually makes them completely, fatally dependent on the cowgirls.

Whether or not you are a member of these species, you do have that most distinctive feature of their biology, with addictive chemicals in either your cum or milk (or both, depending on which you can produce). Powerful enough that simply the smell is intoxicating, merely being in your presence can make even the most hardened people feel turned on. Not even the demons themselves are immune to this, leading some to co-dependent relationships.

Whether from a quirk of biology or not, you can choose not to produce the addictive chemicals too, diluting or entirely stopping the effects. Additionally, you’ll also find that you can mix and match these chemicals internally, if you'd prefer having all your fluids be narcotic drugs or if you'd like everything to be as thoroughly binding as a bovine's milk.

To facilitate the use of this new ability, you also seem to have acquired the near limitless production enjoyed by the bulls and cows, able to continually produce milk without fail for your entire life and/or cum enough to distend stomachs and fill small pools."
16,,200,Base Instincts,Naruto Blacked,Corruption,"Her heart may belong to him, but her body has another master. That’s what people say about the women you lure into your bed once they’ve had a taste of your cock and all the amazing things it can do to them. You’ve mastered the art of sexual conquest, turning your partners into your fucktoys by drowning them in the indescribable pleasure of being dominated by a superior lover. Your partner's consent is unnecessary but don’t be surprised if you wind up getting it anyways, as you can fuck the will to resist right out of your victims after their first few orgasms. They might regret submitting once the afterglow fades but each time you conquer them it gets that much easier to do so again until eventually they become completely yours."
17,,200,Black Mud and Impure Desires,Fate/Worm Night,Corruption,"Sometimes, life sucks. Sometimes it sucks so badly that you just sort of snap and lash out at the nearest thing, and accidentally convince your rapist kidnapper that also kidnapping and raping your sister is a good idea. You on the other hand? Well, congratulations because you can do it on purpose. With just a few words and maybe some suggestive pelvic thrusts, you can take any misfortune that befalls you and spread it out to the people around you. You get kidnapped, your sister gets kidnapped. You don’t sleep well and do poorly on a test, everybody does poorly on the test. It’s petty as hell and twice as bitchy to do, but it also serves the purpose of lessening the focus on you be it because there's half as many people raping you or because the sight of their missery and panic somehow manages calm and focus you. Just be aware that this isn’t exactly going to win you many friends."
18,,200,Blameless,Mind Control University,Corruption,"Let's just take a moment to state the obvious thing everybody already knows: mind-controlling someone without their consent is wrong. Horribly wrong. One of the vilest acts one can perpetrate against another. But for some reason, no one thinks that about you doing it. Oh, they still won't WANT you to enslave them, and they’ll actively fight against you enslaving them or others if they can, but if you DO bend their minds to your will, then even if they break free, they'll never hold it against you, they won’t be traumatized by the experience, they won’t try to come after you for it, and they'll never be mad at you or think less of you for enslaving others against their will either. (If you make serving you enjoyable enough, those who’ve broken free may even decide to submit of their own accord.) Useful if you find yourself needing to work with someone who would otherwise reject you on moral grounds."
19,,200,"Broken, Yet Not",Generic: Hentai Occult,Corruption,"Sometimes you need to just make a few light changes, maybe reorder their priorities. But, most of the time that won't happen - your dick will get the better of you and you’ll utterly break your new toy. And all the useful skills they had in their pretty little head will go down the drain. Thankfully, you don’t have that problem. Your toys will bounce back somewhat from what you do to them. Slavish devotion will remain, but they could at least pretend to be normal, and would be able to spend just under a week without the D without collapsing into an undersexed wreck."
20,,200,Delicate Manipulations,"Archangel of Love, Love Mary ~Malignant Conception~",Corruption,"It’s no simple thing, to corrupt an outstanding member of society into a depraved fucktoy eager to drag down the rest of humanity. It requires fine precision, delicate control, and the ability to realize when you’re pushing too far. Fortunately, you are a deft hand when it comes to manipulating other people, and you find it easy to twist others to your whim. Perhaps Ravana required demonic essence and mind control to drag down her pet project into depravity, but you’re even better than her; with words alone, you could despoil the heart and mind of even the purest and most determined. Oh, it would take you time — a long time, longer than Ravana’s method — but a mere resistance to mind control would never be sufficient to stop you from poisoning someone’s soul wit h your words. If you were to bolster your influence through mind magic, illusions, and other such tricks, well… the world would be your oyster, wouldn’t it?"
21,,200,Essence of Evil,Breathless Wild,Corruption,"Ganon’s essence taints everything it touches, but few things are more corrupt than the bodily fluids of the monsters he creates. Your essence is infused with dark magic, transforming your blood, sweat, cum, and other fluids into powerful aphrodisiacs. Your scent is a potent musk which stirs arousal in men or women of interest to you, and your bodily fluids are powerfully addictive if ingested. A single dose can cripple a victim with arousal, sapping her strength and giving her cravings for more. If taken in large enough quantities even the most stalwart heroine could be reduced to a mewling cum slut desperate for her next hit, though you can also reduce these effects if they become inconvenient. You’re also immune to your own fluids and any similar kinds of drugs."
22,,200,Faith in the Holy Slime,Slimy Sextet,Corruption,"You have prodigious skills at conversion. You can easily see where someone’s current religion has left them wanting, can determine a person’s needs that their faith has failed to meet, and can even tell a person’s subconscious conflicts with their faith after only a few minutes of meeting them. What’s more, you know how to play up other faiths in ways that answer this person’s needs; only the most stubborn of individuals would refuse to submit. And enough sexual pleasure could break through even those barriers—you could get a devout priestess to dedicate herself to you as her new god if your prowess was great enough, even if you had no actual divine powers."
23,,200,Fetish Idol,Generic: Hentai Occult,Corruption,"A small statuette depicting a young woman in a provocative pose. Quite possibly cursed by ancient powers, damned beyond imagination... Or maybe a prank from a bored succubus. Either way, leaving it near someone - no more than fifty feet - will slowly warp their mind to, let’s say ‘appreciate’ whatever fetish you choose to imprint onto the statue. If applicable, it will also warp the body - Using MILFs as an example, a young girl and a teenager might be unaffected, but a elderly woman or a mother would begin to become... more like a ‘prime’ example of the desired form."
24,,200,Leading by Example,World of Tentacles,Corruption,"A true king leads his people by the example he sets for them, and your example will lead your followers down a path of hedonism and debauchery. Your charismatic influence allows you to spread your values and fetishes to those who are loyal to you, even subverting moral codes and sexual taboos if necessary to do so. A demon king who favors bondage and slavery could gradually reshape a traditional kingdom into a slave state where his values are celebrated, even influencing the realm’s art and culture. The more influence you have over your subjects the more pervasive your influence and the more extensive your reach will become, so a king or emperor will have much greater sway over his people than an elected or temporary leader. You may also choose to limit this perk’s effects and spread your influence selectively, perhaps excluding particular followers or spreading some fetishes but not others."
25,,200,Man-Sized Box,Succubi’s Supporter,Corruption,"This is a large, sturdy box, filled with packing peanuts and large enough for a full-grown human to sit inside it. The packing peanuts are enchanted to keep the person shoved into the box in a form of stasis until the box is opened. Once the lid is closed, a variety of subtle spells come into play to keep other people from being interested in what is inside the box. As a result, this would let you ship a human being via the mail to the other side of the world without resulting in any legal problems. You get a new one one day after it arrives."
26,,200,Raping Willow,Defiler Wings,Corruption,"Alright, once more just to be safe. You know a good way to not get eaten by a dragon? Planting this tree close to your village. Similar to the Weeping Willow breed of tree, but it also gives off pheromones that cause monsters to want to rape you. And while that's honestly not a great thing, it prevents you from getting eaten, which is way better than being eaten. Things harvested from the tree will share this aspect, albeit to a lesser extent."
27,,200,Sin and Temptation,Majuu Purification Girl Utea,Corruption,"Having transformed into an injuu, a corrupted Utea becomes intimately familiar with lust and desires, both her own and those of other people. This makes her the ideal temptress, a seductive agent of evil who can sink her claws into her enemies without ever casting a single spell. You’re a wicked witch whose power to corrupt even affects your words and body language, and even those who can resist your magic might still fall prey to your silver tongue and sinful body. Beyond this skill at seduction, your ability extends even into the supernatural: just by looking at someone, human or monster, you can tell what makes them hot or leaves them cold, their deepest and darkest desires as exposed as an open book before your eyes. You can then masterfully tailor your seduction to your target, exploiting the tiniest crack in their resistance to lead them into temptation and sin. Should they fail to resist these mundane temptations, even the most powerful magical defenses will crumble, leaving your victims naked and exposed to your spellwork."
28,,200,Submissive and Ruinable,Victim Girls (Veronica Edition),Corruption,"They act nice sometimes but you know what they’re all wanting from you. Men are all brutes, savage beasts salivating at the thought of tearing you to pieces. The right look, the right smug little smile from you and you can start to tease it out of anyone. You’re able to slowly bring out a more dominant and, eventually, more violent side to anyone you spend enough time with. The more depraved you want them to be, the harder it’ll get, and they’ll need a real push to start hurting people other than you. Sometimes the nice guy really can be fixed, into the nasty monsters you love to have slapping you around."
29,,300,A Bed Full of Slaves,A Change of Tactics V2.2,Corruption,"Dragons have no equals in this world, not among monsters and certainly not among humans. Even if they were once royalty or mighty heroines, once you’ve conquered their hearts those chosen to be your mates are merely your loyal slaves or beloved concubines. Through pleasure or discipline you’re able to awaken submissive desires in your lovers and conquer their hearts, earning their loyalty and devotion and training them into willing and eager slaves. While they must come to you willingly at first, once you’ve lured a new conquest into your bed, every mote of pleasure you grant her becomes another lesson in submission, not only training her to serve you but to love her chains and take joy in submission. Once forged, these bonds of love and loyalty bind their bodies and souls to yours so strongly that nobody else will ever satisfy them, and neither magic nor mind control can force them to betray you, their very souls rebelling against it."
30,,300,Backdoor Access,Generic: Hentai Magical Girl,Corruption,"The fun thing about being the mysterious benefactor for an entire generation of magical girls is that you get to dictate everything about their powers. Or, in this case, how they repay you for that loaned power. Normally a Shoujo would be resistant to things like mind control or corruption, as a part of the packaged deal. However, the longer someone relies on power you gave them, the weaker to those efforts (originating from you, or your minions) they become. Let them keep ‘their’ powers for long enough, and you could completely rewrite them from the ground up in minutes."
31,,300,Black Widow,Tifa Lockhart - Agent of Avalanche,Corruption,"Shinra is full of rich and powerful men and women, and powerful men are known for their powerful needs. Who better than a high-class courtesan to see to those needs? A shame they won’t see the pistol in your purse until it’s far too late. You’re the most dangerous type of whore, the kind who uses intimacy to get in close and coax your partners into letting their guards down. Having sex naturally causes your partners to relax their guard around you and causes them great difficulty bringing those defenses back up in a hurry. 

Even partners who would normally be beyond human lose some of that fighting prowess and superhuman strength when they’re with you (not that they’ll ever notice), and they gradually lose more and more of it the longer you carry on a relationship with them. Given a long relationship eventually you’ll even be able to bring legendary SOLDIERs down to the level of ordinary humans long enough to snap their necks."
32,,300,Carve a Place in her Heart,Eyeing the Hot Elf in Another World,Corruption,"You’re a lustful beast. You wouldn’t be here otherwise. Opportunities to get laid all but drop into your lap, consent optional. And somehow, that lack of consent, that you’ll do as you please and damn their opinion on the matter? That just makes things better for you. Call it blackmail, netorare, corruption, whatever you like. Once you’ve forced yourself on a woman, events will start lining up to not only prevent her from lashing out at you, but to drag her back into your grasp. You’ve staked a claim on her, and no piddly boyfriend will keep her from you."
33,,300,Dark Bindings,Generic: Hentai Tentacles,Corruption,"Through demonic magic and dark rituals, you bind your victims to you. They are unable to leave you, unable to go further than 50 feet from you without horrific pain and suffering."
34,,300,Domination,Corruption of Champions v1.1,Corruption,"Whether naturally rising from your corruption or perhaps gained from a demon’s blessing, you have a kind of aura around you. Bolstering your dominance over others and making it harder for them to deny you. The more they submit to you, in battle, sexually, or simply to demands you make, the more eager your future pets become to do so on later occasions. It’ll start with easily ignored desires of submission, but will quickly grow stronger over subsequent meetings until they start dreaming of simply surrendering themselves to you.

Their own thoughts will grow treacherous, justifying their submission to themselves and reasoning that an occasional indulgence wouldn’t hurt. Eventually they’ll consciously or subconsciously throw any fights they would normally put up, unable to fight their hardest due to the deep-rooted desire to submit to you. By that point, they are liable to beg and plead for you to keep them around, abandoning their own goals in favor of your domination."
35,,300,Foul Breath,The Lamuros Of Seven Colors,Corruption,"A demon’s breath is a toxic thing, though not in the traditional sense. It does not corrode wood or metal or stone, but the hearts and mind of any who have the misfortune to breath that tainted air. With just a drop of magical energy, your every breath will unleash a powerful aphrodisiac into the world around you. So much so that a woman running away from you might just come crawling back moments later, begging for your touch. Of course, you are still weak. Against stronger opponents, something more would be required."
