0,,CP Cost,Name,Jumpdoc,Chapter,Description
36,,300,Internalised Sexism,Victim Girls (Veronica Edition),Corruption,"Even as your current victim struggles and squirms on you, onlookers won’t be able to help themselves thinking positively of you. “There’s a real man.” “What a lucky girl.” “So cool...” Your current victim might hate it but those around you find indecent thoughts creeping in. Your aggressive actions become attractive and cute. Slapping your partner around slowly takes on romantic connotations. Even a violent rape starts to become idolised over time. People exposed to you acting lewdly for long enough, even if the acts are minor still, will make up excuses for you as you act out more. It takes a lot longer to work on those close to your victims but eventually, even friends and family would rather finger themselves to the thought of you than step in to help their sister or lover. It becomes easier over time to get away with things and makes new targets all the more vulnerable."
37,,300,Making a Lasting Impression,Chichikko Bitch / Witch Bitch Collection,Corruption,"I mentioned before that your words were convincing. Well, now they’re a little bit more than that. See, you are now physically capable of literally beating a new fetish into some. With your meat stick. Not actual trauma. Anyways, through the oh so simple act of having sex with someone, you can ‘convince’ them that their favorite fetish is whatever kind of sex you just had. Go out of your way to creampie her a few (dozen) times, and the next session that’ll be how she asks you to end it. Or maybe she just can’t get into the mood anymore without you raping her throat? Well, it’s up to you - quite literally."
38,,300,Patient Predator,Sailor Uranus,Corruption,"The fear at the heart of any form of corruption is its insidious nature. It is not an obstacle surmountable with fire, steel, or lead. Fitness and martial prowess are useless wards against it. It is a clever force that drives one to want and love what they once hated, often in such a manner that it seemed their own idea. This is more frequently the case for you. Defilement that you lay upon someone, spiritual, magical, or otherwise, is more difficult to detect. If they do not specifically scan for corruption, they will likely never notice it. If they do, it is so faint that it might be missed regardless. Such forces are no more potent in your hands, but they are better suited to subtly warp and alter as befits their nature."
39,,300,Pleasure Equals Consent,Generic: Hentai Tentacles,Corruption,"Ever notice how the victim of tentacle rape doesn’t go out and tell people what happened? Well, that’s because the more pleasure they feel, the more confused they get by it. Perhaps it wasn’t rape. Perhaps it was simply sex they didn’t know they wanted. If you make them orgasm hard enough, they might even come back for more."
40,,300,"Rape, Pillage, and Plunder",Breathless Wild,Corruption,"Ganon’s minions were designed to dominate and enslave all who oppose them and it’d be terribly strange if they were no good at it. You’re a master of conquest and domination, and even seasoned heroines risk becoming your slaves if they fall into your clutches. Your mastery of sexual conquest allows you to break minds with pleasure and force your captives to orgasm after orgasm using only brute force rather than the skills of a more considerate lover, though having such skills will make your efforts that much more potent. These pleasures strip your slaves of their strength and resolve until all they can do is shake their hips and beg for more, all thought of escape or resistance completely forgotten. The more a person submits to you, whether beaten in battle, ravished into submission, or merely following your orders, the more you conquer their hearts and dominate their souls, gradually stripping away their desire (and ability) to resist you at all. Dominate someone hard enough and they’ll practically collar themselves for you."
41,,300,Snap Crackle Pop,Hypno App Fantasia,Corruption,"Now look at that, you’ve broken her completely! What are you supposed to do with a smashed up toy like that? It’s gotta be pretty boring even for a really extreme pervert. Not that I doubt you’re that. But since it’s so much more fun to have a reacting partner, you’re always able to bring them back to that state. It’s pointless to try with this if it didn’t happen while you were fucking like rabbits but otherwise you’re able to repair and put back together any sort of harm, broken bodies, shattered minds or outright death of the mind and body. It’s relatively easy to do, so you can get back to your fun in a few days at most, but it’ll never apply outside these situations. Even madness or death won’t be an escape for your favourite pets, if you can be bothered to put in the effort for them. If not...well, you can share this effect with one other person who can use it on anyone you break in these sexual situations too. What’s the use of slaves that make you work, eh?"
42,,300,Training Harness,Generic: BDSM,Corruption,"The perfect outfit for an unruly slave, the training harness is a full set of revealing leather straps with a modular design allowing for extra components such as a posture collar or ball gag harness or chastity belt to be locked in to it or removed depending on the master’s preference. The entire harness is sufficiently minimalist that it can be worn underneath most outfits that cover the torso.

To a willing slave this outfit is about as comfortable as it can be. It never chafes and any attached toys or accessories never cause more pain or discomfort than they’re intended to, and it serves to constantly remind the slave of their submissive status, making them more effective at carrying out orders in your name. To an unwilling slave... well, it’s still quite comfortable whether they like it or not, although they probably won’t appreciate being constantly reminded of their slave status at all hours of the day, at least not until said reminders finish wearing down the slave’s rebelliousness."
43,,300,Your New God,Fate / Blacked,Corruption,"Faith is a powerful thing. It can keep people going in the darkest of days, or provide unimaginable strength when against superior foes. What it can’t do is save a bitch from breaking on your cock. You’re exceptionally skilled at breaking women and replacing their priorities in life with something more appropriate, being a good cumdump. This goes double for holy women such as nuns, monks, and priestesses, and may even cause them to start the church of cock if you put enough effort into breaking them."
44,,300,Your Resistance Makes My Penis Harder!,Generic: Hentai World,Corruption,"You’re a violent, forceful bastard and you get off on it... and so will they, whether they want to or not. Your already formidable sexual prowess and endurance is boosted even further by your darker emotions. Whether it be from fighting them in a fair duel to the death or from abusing a helpless victim, that little whiff of violence or that taste of their fear somehow makes everything just that much better. And when you finally get past the “foreplay” and it comes time for the main event all that delightful build-up of tension will be channeled back into your victim several times over, blowing their mind and forcing them to heights of pleasure no matter how disgusted they might be with themselves for being unable to hold out. They might not like you any better after the moment passes, but they’ll be forced to admit that yet again you have conquered their resistance. It doesn’t necessarily take physical violence to ‘prime the pump’; any form of cruelty or coercion works equally as well, be it physical, mental, or other.

The one limitation of this perk is that it's only fun if they genuinely don’t want it (having a love/hate relationship with the experience is fine, but if they’re actually looking forward to it then it's not really “resistance”); consensual sex isn’t any less satisfying for you but neither does it get any special ‘charge’."
45,,400,Affection Born from Humiliation,Shunned by the Village,Corruption,"When you’re involved, shame has a way of opening up people’s hearts. The more you embarrass someone, the more that person will want to be humiliated by you. And the more degradation they experience, the more your positive actions towards them start to stand out. Every little pat on the head and word of praise from you becomes mightily amplified in effectiveness, to the point that you could make people start to fall in love with you over a few moments of tenderness following them being publicly humiliated by you, if the humiliation was extreme enough."
46,,400,Bad Ender,Corruption of Champions v1.1,Corruption,"Almost anyone can break a slut’s mind, just chain them up and let the imps at ‘em. It takes a lot more skill to keep your pets just functional enough, even as you replace everything they were with loyalty to yourself. Using pleasure and denial to correct their behavior, to mold and shape their psyche. All to remove such silly thoughts like ‘resistance’ or ‘independence’ and instead train them in new skills, like pleasing you or making your next captive scream. Luckily, you’re one of the best. By the time you’re done with your future pet’s training, they will be lucky too if they can remember their original name. That would mean you didn’t decide to rename them while you were turning them into a better toy. Keeping their mind a hair away from breaking through your training, you can carefully preserve everything you liked about them through the process. Whether it be their combat skill or even most of their mind, so they can understand how far they’ve fallen, while also training them to feel more pleasure than they’ve ever known before from simply obeying their master’s commands."
47,,400,Big Dick Brainwashing,Naruto Blacked,Corruption,"Why would women need any other man when they could just be owned by someone like you? There’s no point to point being in love with a limp-dicked little boy who can’t fuck his woman’s brains out like you can. You’re able to drill this truth into the woman you conquer, dominating their hearts and bodies and claiming them as your possessions. The more pleasure a woman experiences at your hands the less they can feel from any other partners and the more they’ll grow to love you and your cock. Simultaneously any feelings they have for their former lovers will wither and fade, eventually dying out entirely. On the other hand, once you’ve conquered a woman’s body and made her your bitch, nothing short of full on mind control can free her from her addiction to you and your cock."
48,,400,Big Master/Madame's Slave Emporium,Baalbuddy,Corruption,"Anyone else is likely to rescue a few slaves during their time here and get a new waifu out of the deal. You? You’re the one that enslaves prospective waifus in the first place. You are legally authorized to take and keep slaves, which is a valid response to many situations. Get attacked by bandits or muggers? Defeat and enslave them. Someone can’t pay a debt they owe you? Slave. Catch an escaped slave? They’re yours now. Catch someone breaking any kind of rule? You can chain them up and the relevant authorities will let you keep them in lieu of the normal punishment. You can even sell slaves too, and no one will think buying them from you or keeping one is anything strange. Of course, there is one catch. Slavery is legal for you now, which means there are laws you have to follow. You’re only free to enslave someone if there’s at least some kind of legal pretense to do so, otherwise it’s just kidnapping. Also, depending on the society you work in there are regulations (which you will always know by heart) regarding maximum terms of enslavement for various reasons, care and feeding, allowable fun slave activities and punishments, etc. More ethical societies have stricter rules, but they always lean heavily in a lewd way. Spanking or making them work naked (in warm weather) is something you can always get away with. Though nothing prevents you from doing dirty deeds to drive someone into debt or keep them in chains, being caught breaking the law will get you in trouble."
49,,400,Black Ooze,Generic: Hentai Occult,Corruption,"Did you make a deal with a ‘God’? No? Then perhaps you’d like to make one with this ‘demon’? This black ooze is barely alive and somehow entirely yours. It feeds by reaching inside a person and sucking them out, leaving only their skin. Speaking of, you can now slip inside of said skin, and wear them to steal their life. You can of course refill them with the ooze, but their personality will more or less be gone. You’ll have to rewrite them from the ground up."
50,,400,Blessing of Power,Breathless Wild,Corruption,"Ganon’s minions have no need of training to grow stronger the way knights and heroes do. Their strength comes not from practice and skill but from conquest and corruption, building their unholy might atop a pile of vanquished enemies and corrupted slaves. Even a lowly bokoblin can become a glorious golden beast if it has enough cunning and ambition. You’re able to gain greater strength by defeating or corrupting your enemies, reducing them to mere stepping stones on your path to power. Whenever you defeat an enemy who was stronger than you in some way your strength grows as if you’d stolen some of their strength and added it to your own. Defeat a lynel and your physical strength or cock size might grow, while a sorceress might fuel the growth of your intelligence or magical abilities. Corrupting or enslaving your conquests after defeating them allows you to harvest even greater power by actually stealing their strength, turning great heroes into helpless slaves and wise princesses into thoughtless sluts."
51,,400,Break my Skin and Drain me,World of Lewd Horror,Corruption,"Some metaphors for sex in horror are just barely metaphorical. Like the vampire who places his lip’s to a young lady’s neck to drink or the succubus who drains life with a kiss, you have a method of feeding during sex. This weakens your partner, but is exquisitely pleasurable. Even a single experience is enough to make someone addicted to you, desperate and begging to be fed from again. Luckily pure sex is just as satisfying once someone is hooked, though they’ll eventually need to be fed from again if you don’t want the addiction to wane. You could easily talk someone into doing quite a lot in exchange for another hit from your dick."
52,,400,Breaking the Mask,Angel Academy ~ Hardcore Dorm Sex Life,Corruption,"Behind the mask of a prim and proper princess lies a horny sow begging for a dick, she just doesn’t know it yet. You have ways of exposing a person’s true character when you fuck them, and by this I mean that you can selectively warp a partner’s personality as you seduce them, exposing their “true self” once you strip away the mask of their inhibitions. That cold fish headmistress could become a slob who ignores her responsibilities to get fucked, or she could be a closeted dominatrix ready to help you whip her students into shape. The degree to which you can warp a person’s personality is directly related to how sexually repressed they were before you seduced them: the aforementioned headmistress could become wildly different and a person who is merely inexperienced could have things to learn about themselves, but a person with no hang-ups about sex would have few if any hidden desires for you to expose."
53,,400,Chains of Love Submission,How Not to Summon a Demon Lord,Corruption,"A demon lord has no need for such things as “love” and “waifus”, he only needs his slaves to respect and obey him. So why do your slaves keep falling in love with you? It’s probably because you take good care of your minions, inspiring personal devotion and sometimes even love in those who follow you. Even if they came into your service against their will, so long as you treat your slaves or other minions well they’ll quickly come to enjoy serving you and do so loyally and enthusiastically. The shared love and loyalty your slaves have for you even serves to unite them in bonds of friendship or sisterhood rather than dividing them with petty squabbling for your favor or attention."
54,,400,Contagious Corruption,"Archangel of Love, Love Mary ~Malignant Conception~",Corruption,"With your Lord Elysium having been sealed for so long, there was no way he could directly replenish the number of demons serving him. Instead, demons were forced to do it themselves — and not by any method as slow as mating and bearing children. No, what they did was rape and violate. By giving pleasure to someone — even forced pleasure — they could awaken the corruption in the hearts of the deeply impure, and cause it to erupt and overwhelm the flesh, which would turn the subject into another demon. Becoming a demon in this manner also makes them fully loyal to you."
55,,400,Corruption and Conviction,World of Tentacles,Corruption,"A dark and twisted power is the birthright of every demon king, and sin flows through your veins like blood. Is it any wonder, then, that the corruption which normally afflicts practitioners of the dark arts has so little hold on you? You possess a will of steel and are immune to most forms of corruption and mind control. No matter what depraved powers you might possess or be subjected to, your mind and body will always remain your own. Should you choose to indulge in the effects such magics might normally foist on you then that is another matter, but these effects influence you only with your express permission, and you may rescind that permission whenever you please. But beware of holy and divine magics, for your resistance is less effective against magic that cleanses and purifies."
56,,400,"Corruption of Heroines, Downfall of Heroes",Master of the Harem Guild,Corruption,"Do you know what sucks? When you carefully craft a plan to take over the world, have your monsters slaughter the normal soldiers, and then a band of Heroes and Heroines show up and send all your plans crashing down. Luckily you know just how to deal with all those pests... sexually. You seem to have great luck with finding random guys and gals to fuck your enemies and distract them from opposing you. And any hero/heroine who had their lover cucked also seems to lose the will to fight making them easy pickings."
57,,400,Creampie Diplomacy,Haramase Simulator,Corruption,"Now, not everyone’s going to be equally happy about being required by law to fuck a total stranger. Depending on their first impressions, they might even think you’re a creep, lowlife, or filthy commoner. Luckily, you have a way of changing someone’s mind with repeated pregnancies. Regardless of how they feel about you before, they’ll begin enjoying your presence even as bearing your children starts to feel normal to them. Over time, you can go from being considered a creep or lowlife to a trusted friend, lover, or even master.

This also helps change their mind about the pregnancies itself. Even if they start out disliking or hating it, they’ll soon begin to feel a strange sense of disappointment if a creampie doesn't actually manage to impregnate them. Eventually they might start fantasizing about it, asking you to impregnate them, and thank you for getting them pregnant again."
58,,400,Dibellan' Scriptures,Modded Skyrim,Corruption,"It might be a bit of a stereotype, but being the goddess of love and beauty, Dibella is clearly the divine whore, and her priestesses probably aren't much better. This book is 'proof' of that. In the hands of her priestesses (or anybody with or following someone with similar domains) the book pulls this ‘truth’ closer to reality. While it won’t actually make them act as such, it will leave them far more... sensual. This is primarily apparent in the priestesses, but the congregation, or even just people who wander in needing a roof for the night will benefit from a minor appearance boost and some skill in bed."
59,,400,Don't Mind the Evil,Generic: Hentai Fantasy,Corruption,"Even though your goal here may be to steal people’s hearts, that’s no reason why they can’t actually like you beyond the whole ‘lots of sex’ part of your relationship. Treat your new brainwashed slaves well, and they’ll have doubts about actually killing you if they get free. Treat them like an actual person, and not just a walking fuckmachine, and they might even fall in love with you. Make actual love to them? Expect them to fight in order to be re-corrupted."
60,,400,Drunk on Love,Dulce Report,Corruption,"Angels', you see, are eusocial like bees; they have a queen, workers, and drones, all converted from humans. And this is how that is accomplished. Unlike creating a queen, which requires the previously mentioned genetic compatibility, a worker - another futanari, though not one that can create more - can be created simply by fucking them with that intention. Doing so without that desire will simply overwrite a small part of their genetic code, brainwashing them into obedience and a desire to fulfill your every whim - and to be filled by you again. Fun, right?

And if you don't have a penis, well, I'm sure that'll get fixed eventually, right?"
61,,400,Forget Your Friends,Bloom Pirate Hooker,Corruption,"Given enough time, even the most stubborn of souls will give into despair. Of course, why wait? You should be giving them a helping hand instead! When you overload someone - it makes no difference if this is with pain or pleasure - they’ll very slowly forget that things other than that sensation exist. Enough pain would make them forget their happy memories... Enough pleasure would make them forget they ever loved anyone who wasn’t you. Of course, if they just stand up and walk outside, that ruins everything. Best to keep them on lockdown."
62,,400,Heart Jar,Seven Mortal Sins/Seven Heavenly Virtues,Corruption,"Feeling dickish, Master/Madame? Hold this crystaline container up before someone, ideally as a surprise, and you can tear their heart out. They won’t die. In fact they will become immortal and eternally youthfull while you hold their heart. Of course, now they have no choice whatsoever when it comes to obeying your every whim. A simple squeeze of the container is enough to induce agonizing pain on a spiritual level in the heart-ripped individual. But hey, free servant. Although, do be mindful, if you aren’t ordering them around they DO still have free will. And could easily backstab you, with outside help, if you abuse them."
63,,400,Huntress Trainer,Niplheim’s Hunter,Corruption,"Maybe it’s because of how you spend all day beating metal and materials into newer and more pleasing shapes but you also seem to have a knack for doing the same with people. You have a sadistic streak a mile wide and can train your partners to enjoy even the most depraved forms of sex, starting with training their erogenous zones to be more sensitive and working your way up from there. With enough exposure to it, the pleasure of anything from BDSM to bestiality can be drilled into your partners until they’re happily dropping their panties on command for acts they might have hated once. Further, this training makes them much more effective in any kind of sex-based combat, such as when facing down a monster intent on raping them."
64,,400,I Fuck the Darkness,Destiny: Fuck the Darkness,Corruption,"You can outright fuck the Evil out of (or into) someone/something. “Inject” your own morality into them, with every thrust. An enemy peon like a Thrall or Dreg could be flipped and redeemed in a single row. But, of course, the more thoroughly entrenched their morality is, the longer, and more often, you’ll have to plow to rewrite their morality. Someone like Savathun could be the work of an entire decade, for instance."
65,,400,Iron Maiden,Monster Girl Quest V2,Corruption,"You have found an Iron Maiden MK.3 super-prototype abandoned by the Seekers of Truth. Upon activation you have earned it’s loyalty. It has shape shifting properties to allow for torture of creatures possessing unusual dimensions like a lamia’s, up to creatures of 12 feet in height. It can be placed on your property to deter intruders and has a host of sexual functions to assault both genders. It can also take the shape of furniture such as a chest or a wardrobe. If it is killed or damaged it will be able to self-repair even from disintegration in twenty four hours but will go into hibernation mode until further orders. It is fully sapient and intelligent and can understand complex orders, it is more than willing to let you safely partake of its pleasures if you request it. Furthermore it can make intelligent conversation and learn skills if you are willing to teach it. Lastly, it can make amazing dirty talk sure to arouse their victims or corrode their will and break their minds depending on orders and how she is feeling that day. However if it feels abused, bored or lonely (not a common occurrence) it might take things a bit farther than normal such as keeping you inside for thirty minutes to an hour longer than you asked or toy with it’s victims such as draining someone close to death, letting them recover, then as they try to run away trap them again. No matter what though, it would never harm it’s precious master’s mind by traumatizing it, unless of course that is what they want."
