0,,CP Cost,Name,Jumpdoc,Chapter,Description
1,,0,A Very Thorough Polishing,NUKENAI Seiken-chan,Seduction,"When you touch and handle a sentient item, the sensation translates to touching their spirit form. The exact nature will vary depending on the item’s features. Holding a sword by its handle might only translate to holding their arm or hand (how lewd), while giving a sword’s blade a polish with an oily cloth could make them feel like they’re getting a rub-down with lotion. You can probably guess how carefully maintaining and grinding the blade’s edge and tip with a well-lubricated whetstone feels for them."
2,,0,I Seduce the Darkness,Destiny: Fuck the Darkness,Seduction,"Let’s be blunt. There are a lot of things out there that might not find you anywhere on their “would bang” list. And some things that lack that list altogether. As that would be a massive hamper on your fun, this Perk makes it always possible for you to make the proper persuasive moves to worm your way into something’s good graces, at least in terms of lust. If it has sapience, you can seduce it, no matter how alien, eldritch, or incomprehensible it might otherwise be to you. Doesn't help you actually do it though."
3,,50,All in the Panel Work,Ashigei Shoujo Komura-san,Seduction,"This world has a pretty clear bias on where it wants your eyes to linger. Even if you’re a 10/10 all around, this perk ensures that those who find you attractive will have their gaze gravitating to certain parts of your body. By default, this focuses on your feet, and to a much lesser extent your whole lower body. You may choose a different part of your body to emphasize on purchase."
4,,50,Internal Radar,Generic: Monster Fucker/Horny Horror,Seduction,"The problem with masquerades, conspiracies, and dark underworlds is that it’s all kinda supposed to be secret. How are you going to meet some fanged sweetheart when she probably doesn’t even live in your town? 

This allows you to have an internal radar allowing you to get a vague idea of where to find the archetype you’re looking for. You can pick three archetypes, and they can be as vague as vampires to specific as single mothers. Once a month, you may change one of these archetypes."
5,,50,Normie Filter,Generic: BDSM,Seduction,"Many people are quick to judge others for their tastes in bedroom activities, and it can be hard to put yourself out there and admit to liking the things you do if you have a fear of rejection. Well worry no longer: you have an accurate sense for when a person is into or at the very least tolerant of your fetishes, regardless of what those fetishes may be. By judging their reactions to related topics you can accurately discern whether a person is faking interest or concealing it as well as gauge how likely they are to enjoy more specific types of play within that fetish. It’s still up to you to get their consent for those activities however."
6,,50,Ren's Collar,Evening Starter,Seduction,"A simple leather collar with a fine gold chain, it’s a very pretty decoration. It also has a subtle effect that charms individuals around you. While you can’t literally control them with said charm, they seem to favor you a bit more. Good for calming others and getting the upper hand in negotiations."
7,,100,Sacred Sword,My Bride is the Demon Lord,Seduction,"Much like with the original Hero and the Demon Lord, you just stand out to lustful people. The more interested someone is in sex, the more attention grabbing you become to them, and the fewer objections they’ll have to fucking you. This effect is increased on those who are your enemies."
8,,100,Alicia’s Admirers,Kuroinu,Seduction,"Appointed by the Goddess Celestine the Princess Knight and following the incredibly noble task of protecting the kingdom from the depraved and monstrous forces of the Legion it is no surprise that they are well loved by their followers. Even if you are not a Princess Knight you will find that you can easily gain the love and affection of your followers and people, especially if they see that you actually care about them. 

Very good for becoming an incredibly popular figure in the lands you rule, probably less than good when you're infatuated followers betray you and the country in order to claim you sexually for themselves."
9,,100,All Might Hoodie,Boku To Nottori Nakademia,Seduction,"Supremely comfortable, warm, and never seeming to get dirty, this limited edition paraphernalia that slightly resembles the number 1 Hero of Japan is sure to draw the eyes of those around you...oddly enough those eyes mostly belong to the fairer gender admiring your physique but occasionally you do meet some dudes who just think your hoodie’s cool. If damaged or destroyed a new one is sent to your current residence/storage."
10,,100,Bedpost Notches,Generic: Hentai World,Seduction,"It seems that, at least in terms of getting laid, success breeds success for you. Each sexual encounter you have with a different individual fractionally improves your seduction skills. Similarly for each different individual you have performed a specific sexual act with, everyone else becomes a fraction more amenable to the same thing once you have seduced them."
11,,100,Bedroom Eyes,Baalbuddy,Seduction,"If you’re here, then you’re probably the type to think ‘Ay bby want sum fuk?’ to be a great pickup line. Thanks to the wonders of magic, you can skip right past even that part. Just eyeball someone and bestow upon them the instant realization that you want to bang. This power will work on anything that has a mind, no matter how eldritch, alien, or broken it may be."
12,,100,Beneath the Mask,Angel Academy ~ Hardcore Dorm Sex Life,Seduction,"Society has convinced a lot of people that erotic desires are “improper” and “unbecoming of a lady” and so on, but society can’t change human biology. People are naturally wired to love sex and pleasure no matter how much they might try to pretend otherwise, and you can easily see through the excuses and false fronts they put up to hide their true feelings from you. You can always sense when a person has romantic or sexual interest in you, and you have an accurate sense for the subtle tells a person gives when “no” actually means “yes”. As long as you heed this unspoken consent your partners will never treat sex with you as rape after the fact, regardless of whatever protests they might make as you ravish them."
13,,100,Born to be Lewded,Haydee,Seduction,"Well, I can’t see how this would help you here, but, granted, whomever designed the Haydee units certainly had exquisite taste. Ahem, this Perk grants you the ability to get stuck in people’s heads, in the erotic fantasy kind of way. A stranger passing you in the street, supposing you survive this experience, wouldn’t even know your name, and yet they would be fixated on you for weeks just from the sight. If they were of an artistic bent, ream after ream of lewd art, of you. As a potential mercy, you can toggle this Perk."
14,,100,Chance Encounters,A Change of Tactics V2.2,Seduction,"The Shepherds are tied together by bonds of trust and friendship crossing race, class, and nationality, but before those bonds could be forged they had to find each other first. You have extraordinary good fortune in meeting new friends, whether it’s a mysterious stranger lying unconscious by the road who happens to be a magnificent tactician or an enemy soldier who could become the love of your life if given the chance. Fate conspires to arrange meetings between you and these potential allies and helps to ensure that your first meeting is a friendly one. Even in the chaos of battle with enemies all around you, you’ll somehow always manage to run into the one soldier who wants to defect without accidentally cutting her down first."
15,,100,Charming,The World of Lolis,Seduction,"There’s just something about you that tends to bring people in, Master/Madame. You have a charming nature that can allow you to seduce anyone you like, though it has a magnified effect when you’re trying to seduce people younger than you are. You’re guaranteed never to stumble over your words, as well finding the right ones in a given situation, making you a pretty effective intermediator. People just seem to get along around you, even when the personalities surrounding you might threaten to be quite volatile when mixed into a room together.

To top it all off, you also gain a natural kind of confidence when dealing with people or situations, giving off a dependable air that’s sure to make you quite popular."
16,,100,Cheesy Love Expert,Destiny: Fuck the Darkness,Seduction,"You know all of those groan-worthy stunts that get pulled in romantic comedies? You know, showing up outside a girl’s house and holding up a stereo... sappy stuff like that. You are now an expert at all of that. And as long as your intentions are upright, they will never be taken as creepy or offensive."
17,,100,Cold and Wrathful,World of Lewd Horror,Seduction,"You have the bearing of a true lord of the night and a melodic, sexy, and commanding voice along with (optionally) a pleasantly exotic accent that sounds unidentifiably foreign no matter where you are. Even under pressure, you can maintain a steely gaze and calm demeanor. Anyone with the slightest of submissive tendencies won’t be able to help but need to repress a shudder at the thought of you dominating them."
18,,100,Cool Uncle,LeWdBY,Seduction,"It can be hard connecting with the kids these days with their crazy fads. But the younger generation considers you to be almost one of them, an older and more experienced friend who they can come to with their problems. Or they might just want to hang out and play video games. In fact, they wouldn’t even be opposed to dating you. After all, you aren’t some old fogey. To them you’re a mature and trustworthy adult who would be an excellent teacher for their first romance or first roll in the hay."
19,,100,Dapper Gent/Dame,Destiny: Fuck the Darkness,Seduction,"You know what is severely under-rated in this day and age? Class. Every Guardian is too busy running hither and yon, chasing that next hottest piece of loot to just take a moment and, breathe. You are not that kind of person, and believe me, it shows in this world. You’ve got the presence of a royal, always poised and dignified under pressure of any kind."
20,,100,Escaping the JNPRzone,LeWdBY,Seduction,"What is wrong with the boys at Beacon that they can’t notice the gorgeous babes throwing themselves at them? At least you don’t have that problem. Rather than futilely dropping hints at an oblivious teammate, you know how to smoothly transition from friendship to fuck buddy, or a real relationship if that’s what you’d prefer, and how to easily maintain a friendship after making a failed pass or turning someone down."
21,,100,Family Tradition,Burakku Gakkou Ni Tsutomete Shimatta Sensei,Seduction,"There are some uncomfortably sexual family arrangements in this manga, not the least of which is Emi-sensei and her mother. But now, you find opportunities for such relationships popping up; people who are related to you are more open to the possibility of incestuous relationships, and the problems that ordinarily affect such affairs simply don’t occur.

As a side note, massaging a woman’s breasts on a regular basis will now prevent them from sagging."
22,,100,"Fe Fi Fo Fum, I Smell the Blood of a Fresh Vir-gin",Defiler Wings,Seduction,"Dragonspawn can only be made with the body of a virgin - or perhaps that’s just the pride showing itself? Regardless, your nose is right on the dot when it comes to these things. You can smell her virginity, how ‘ripe’ she is - or how long it will take for her to grow into it - and even things like how many children a woman has, or how recently she laid with a man. It seems like you can extract months worth of information on their ‘habits’ with just a whiff."
23,,100,Fraternize Away,Although Young People Recoil from Entering the Black Magic Industry...,Seduction,"You will never get in trouble for the non - hostile relationships you have with others in your workplace, regardless of if these relationships are romantic, sexual, or purely friendly, whether they be with coworkers, subordinates, or your superiors."
24,,100,Friendzoned for the Win,Generic: Virgin,Seduction,"Since you’re not really into that whole dating / sex thing, you’re exceptionally good at getting people to view you as a friend, possibly even a lifelong one, and sharing all the details of their romantic / sexual life with you as if you’re a trusted confidant."
25,,100,Hubba-Lubba-Bubba,Paccsu,Seduction,"The art of seduction in the world of Paccsu is something that can be said to be a bit lacking. Unlike other similar settings there doesn’t seem to be any suave masters of the art of flirting with dozens of potential suitors in the wing with the most anyone seems to be capable of are cheesy pickup lines. But who's to say that the cheesiness doesn’t have its own amount of charm and by taking this perk you’ll be on your way to filling that empty niche.

Now not only do you gain practical base level skills in the various intricacies of flirting and romance, like how to hold a conversation, how find out someone’s likes and wants with choice questions, and other such things, you also have a strong gut instinct on how to go about it with the various different people you meet. Whether that be how to butter up a shy introvert and pull them out of their shell, how to keep up with a bubbly and outgoing hobbyist, or how to stealthily pepper flirting and compliments into the “arguments” you have with someone who seemingly hates your guts. But the thing that gets improved the most is your ability to come up with cheesy, but highly effective pickup lines which also comes with a well of confidence and courage to silence any embarrassment.

And when you make use of these lines people never seem to react too negatively to them even if they get graphic. Though the people you use them on will get into it, and thus be more affected by your pick up lines and flirting, if you target/compliment parts of them they are proud of or that you truly find sexy about them."
26,,100,Innocently Lewd,Ane Naru Mono,Seduction,"A demon doesn’t know how to act human, mostly because they aren’t one. It really should come as a surprise then, that a demon is capable of stoking lusts into raging fires with little effort… by accident. Well, humanity has always wanted what it can’t have. Regardless, you have a simple switch in your head. When it’s on, every move you make, every word you say, every breath you take becomes excruciatingly sexy. When it’s off, you’re back to normal. Beautiful still, but not so much that they pop a boner just from looking at you."
27,,100,It's a Competition! Maybe!,A Change of Tactics V2.2,Seduction,"Many of the children of the Shepherds came back from Grima's terrible future in order to be reunited and become closer to their parents, but none of them imagined they might wind up sharing a bed with them. Whenever you seduce someone, their daughter (or mother, or sisters) start to feel a strong attraction to you as well, enough that with only a few small pushes you can get them in bed as well. Similarly it seems that once bedded by you little things like incest taboos seem to not be a bother to them anymore and they have no problems sleeping with you together and in fact seem to greatly enjoy the family 'bonding' to such an extent that its rarer for you to sleep with only one of them rather than all. This perk’s effects only target members of your preferred gender."
28,,100,Locket,World of Lewd Horror,Seduction,"This locket contains a portrait of your one true love. Or at least the one foe or victim that you’re most obsessing over at the moment. The picture inside changes to show their current state and surroundings, and brooding over the image will produce a small tug in your mind in the direction your prey is relative to you."
29,,100,Love at First Sight,Generic: Hentai World,Seduction,"It’s said that every journey begins with a first step, and whether that step is a good one or not can set the tone for the whole trip. This is no less true for relationships than for anything else. Luckily, you have a gift for starting things off on the right foot: whether you’re starting a new job or making new friends or meeting a destined lover for the first time, everything just seems to go exactly the way you need it to in order to make a good first impression on people. You’ll never fumble your words or trip over your own shoelaces ever again (unless you meant for that to happen, some girls are into cute clumsy dorky guys after all)... at least, not at first. After step one it’s all on you to maintain that positive impression."
30,,100,Mind the Gap,Ashigei Shoujo Komura-san,Seduction,"You have a way of bringing out the “gap moe'' in others. This could be something intangible, like a hobby, quirk, or personality trait that normally stays hidden. It could also mean catching them in unexpected scenarios, like spotting a normally reserved girl wearing a risque bikini at the beach. What you find will always be in some way charming. This doesn’t guarantee your involvement, just that you’ll be around to witness it."
31,,100,Networking,Generic: Fat-Fetish,Seduction,"The Internet is a fantastic thing, isn’t it? No matter how depraved you are, you can always find other people who share your kinks, no matter where you are in the world. Of course, you have to find those people on the web first, and this perk will help you do just that. It’s now child’s play for you to connect with, and if you want, to set up real-life meetings between yourself and other like-minded individuals, or the opposite side of the fetish, even across the world. Internet dating made easy."
32,,100,Nice Guys Finish First,Generic: Virgin,Seduction,"Whenever you do something nice for someone, or treat someone with respect, they’ll be much more likely to willingly have sex with you. This does not apply if your only motivation for this treatment is to get them to have sex with you, but does apply if getting them to have sex with you is not your sole motivation. As long as you can legit say it wasn’t your only motivation, you’re golden."
33,,100,Nii-chan no baka!,Generic: Incest,Seduction,"Even if you tease and torment someone, so long as you genuinely do feel affection for them, they will never let this boil over into actual dislike. At worst, you’ll definitely have a rowdy tsundere on your hand, but there will always be a dere side to it."
34,,100,No Shame to be Found,How they Fap in Parallel Worlds,Seduction,"A strange body and strange kinks tend to go hand in hand here. When it comes to you, sexual partners always seem willing to cooperate with any fetishes of yours that aren’t any more harmful than standard S&M play. They’ll even start to get into it themselves, though this usually doesn’t manifest in a long-term fetish. Whether your fetish involves projectile egg-laying, or shoe-making, your partner wouldn’t even think of shaming you for just liking what you like. It’s another story if those tastes aren’t exactly legal."
35,,100,Open Heart,Earth Girls,Seduction,"It can be good to let others know how you feel about things without saying it, right? You can open your heart to others, so they’ll be able to work out your emotions – so they know they might need to make the first move or understand your intentions, or you can close it to keep your feelings locked away."
36,,100,Pervert Detection,The Works of Aomizuan,Seduction,"This world is filled with degenerates who long for sex, any kind of sex, from anyone. You have a preternatural ability to locate such people. You can immediately tell from looking if someone would be opposed to you molesting them or if they’d just take it, whether they’d be fine with you doing everything up to penetration before objecting, or whether they’d accept absolutely anything you did to them. Excellent for picking out targets who won’t raise a fuss over you fucking them."
37,,100,Please Come Again,Mizuryu Kei Land,Seduction,"Maybe this isn't your first trip? Or did you simply do research beforehand? Anyways, as you might imagine, there is a large number of people here wearing barely covering outfits who want to get laid. However, I bet you didn't know that you have to pay money to fuck the cast/staff of the park. It's the other guests that are free game. Maybe it's as simple as having found a map, but you now have an uncanny ability to find individuals who share your fetishes. For the park, that's mostly just sex sex sex, though something simpler like maybe you just really want someone good at blowjobs is also possible."
38,,100,Please Stop Crying!,Ane Naru Mono,Seduction,"Women can be so tempermental sometimes, crying at the drop of a hat. And then you say one simple thing and they’re utterly furious with you! ...I think she might be drunk. Anyways, you’ve got something women love in a man - the ability to empathize with them and figure out why they’re sad and or angry. Not exactly a powerful skill, but when her getting angry means that she’s going to go murder a school for someone tripping you it’s best to defuse her fast."
39,,100,Prince Charming,Milk Hunters,Seduction,You gain a bonus when those that you’re attempting to seduce would be happier being in a relationship with you than with their current significant other. Whether you use this to “rescue” girls (or boys) from abusive relationships or for less noble reasons is up to you.
40,,100,Satan’s Not a Siscon,Although Young People Recoil from Entering the Black Magic Industry...,Seduction,"Having someone be attracted to you when you don’t — or can’t — love them in turn can be painful, as Nightmare Mary’s brother can attest. Thankfully, you won’t have to deal with that problem. People you don’t feel attraction to will not feel sexual or romantic attraction to you. On the other hand, if you feel desire for someone you don’t want to be attracted to, you have the ability to just turn it off, and not be attracted anymore. If you were attracted to someone who in turn desired to you, and turn off your own attraction, they will find their affections fading at a rapid but not suspicious rate. If you later turn on your own desire for them again, their own want for you will not magically return; you’ll have to earn it the hard way."
41,,100,Tea Parties,Generic: Incest,Seduction,"People always seem willing to indulge you just a little more than might seem normal. No matter what, someone will always have time to play with you."
42,,100,The Harder they Fall,Although Young People Recoil from Entering the Black Magic Industry...,Seduction,"You have a special talent for laying low those who would hold themselves superior to you. The haughtier and more arrogant someone is, the easier it is for you to seduce them. Get someone self - absorbed enough, and they’ll wind up prepositioning you without you even needing to try. Furthermore, the more arrogantly they present themselves, the more sexual pleasure your touch will bring them, until you overwhelm their fragile little minds with pleasure."
43,,100,The Nose Knows,The Works of Aomizuan,Seduction,"You can sense how sexually compatible others are with you through scent. The better someone’s genetics, and the more superior a child they would be able to give you if you reproduced with them, the better that individual smells. “Normal” or “inferior” people won’t smell bad, but people whose genetics would combine with yours the best will smell very, very good. It might well be intoxicating, if they were a good enough match. You can disable this perk if you’d rather keep your senses about you, such as if a cunning enemy happens to have exceptionally compatible genes."
44,,100,The Perfect Gift,Generic: Hentai World,Seduction,"A gift wrapped package or fancy envelope containing some random innocuous trinket, card, flowers, or candy. Give this to a girl and it will invariably turn out to be something she would like to receive as a present appropriate to the circumstances. If you go the extra mile to research her preferences and pick out something specific and then use this item to gift-wrap it then the effect will be enhanced. After giving one of these away you can summon a new one to gift again to another girl you know, but you can’t stockpile them. You are also protected from accidentally giving the same gift to more than one girl at a time, unless they’d actually like receiving matched sets."
45,,100,The Throne,World of Tentacles,Seduction,"Whether or not you’re an actual king yet is beside the point, every true demon king deserves a nice throne to sit on and this is one of the comfiest and highest-quality chairs you could ever find. You gain a boost to your charisma and intimidation efforts while seated on this throne, and unless you wish otherwise it will usually assume a form suited to its surroundings. A reincarnated princeling living with his mortal parents might find it disguised as a fancy recliner or office chair, while a medieval warlord will find it as a luxurious and extravagant throne, and so on."
