0,,CP Cost,Name,Jumpdoc,Chapter,Description
128,,400,Little Secrets,Naruto Blacked,Seduction,"Like any other sort of nobility, ninja clan heirs spend as much time on social calls as on their formal duties whether for negotiations and diplomacy or for simple gossip and chitchat. There’s a subtle art to this kind of social affair, a form of manipulation and social engineering, and a master of it like yourself can direct a conversation with such incredible precision that you can provoke exactly the reaction you want at exactly the moment you want it from any of your conversation partners. Simply mentioning your new paramour at the right time could pique the interest of your friends and inspire a thirst for big cocks, while showing off just enough skin to let someone see a new tattoo can guarantee that they’ll ask you about it. You’re no less adept on social defense as on offence, deftly steering a conversation away from sensitive topics that you don’t want to discuss, like whether you’re cheating on your husband or not."
129,,400,Magnificent Bastard,A Change of Tactics V2.2,Seduction,"A tactician’s mind lends itself well not only to commanding armies and battlefields but also to manipulating people. You’re a master of seduction and manipulation, wielding words as skillfully as a myrmidon's blade and turning the unwary into unsuspecting pawns who move and think exactly as you desire. You would be right at home in any royal court or secret cult, but your true specialty lies in seduction, exploiting a victim’s lusts as a weakness. Luring partners to your bed is child’s play, and the more infatuated they are with you the easier it becomes to wrap them around your fingers and bend them to your whims. Given time to work your wiles you could seduce a loyal wife into an affair, conquer her heart and claim her as your own, and persuade her to join a harem of devoted concubines. Naturally some will be harder to beguile than others but there are always ways to erode their defenses and make them more vulnerable to your charms."
130,,400,Magnificent Mortal,Seven Mortal Sins/Seven Heavenly Virtues,Seduction,"Weird, that Angel having a plain, friendly conversation with you even if you aren’t the paragon of virtue they were looking for. That Demon realizes full well you aren’t interested in the sin they’re peddling, but they’ll still spend time with you just for fun. Beings that are “above you” in terms of existance find you fascinating for your simple existence. Given time, and accounting for applicable personalities, this fascination could easily lead to lasting friendships, or romance. You’d undoubtedly be taking this for the romance."
131,,400,Making Love Over Rape,Power Play,Seduction,"People tend to have a certain way of having sex that they fall back on; some people prefer it gentle, or are just used to it that way, while others like to go rough. Sometimes they aren’t open to trying or enjoying new things... but not with you. Not only are your sexual partners more open you to trying new things in the bedroom, but when you fuck them in a way they aren’t used to—like gently making love to an Evil Sex King’s subordinate or being rough and forceful with someone who’s only known romantic sex—the pleasure will be greatly intensified, enough so that even suboptimal performance on your part would still leave your partner satisfied, and it would have a long-lasting impact on her.

Of note is that the virginal aren’t used to any kind of sex, so this is always active for them. Also of note is that very few people ever become “used” to being raped."
132,,400,Out of Order,Boku To Nottori Nakademia,Seduction,"Want your rendezvous to go uninterrupted? This handy sign adapts to the entry-way you place it at and has a powerful effect on people who see it. Only someone with a strong and present need to enter will be able to muster the will to cross that line, giving you some much-needed privacy."
133,,400,Right in the Sweet Spot,Generic: Virgin,Seduction,"One of the advantages of not really being available is that you present a kind of mystique of untouchability. You fit that to a tee, and people will find that your sexual / romantic neutrality makes you all so much more attractive. You now can fit into almost anyone’s strike zone, even if they’re a completely different species, if you show even the slightest hint of reciprocation."
134,,400,The 'Bad' End,Generic: Monster Fucker/Horny Horror,Seduction,"Oh boy you’ve gone and done it now. You ran, you hid, you stalled as best you could, but the big bad monster has got your cornered. While you might ordinarily meet an untimely end, you’d rather just be screwed. 

Fear no longer, for monstrous enemies now want you; like, carnally though. This starts small, but the longer they pursue you the more it will build. Passing interest, vague horniness, genuine desire, all the way up into need. 

Once fully realized they’d really rather not kill you, or even seriously injure you if it can at all be helped. While you will have escaped the clutch of death, you’re unlikely to escape the clutches of your new captor, at least not for a week or two."
135,,400,The Dragon Lover,Generic: Monster Fucker/Horny Horror,Seduction,"""Brave soul, you have been tasked with besting a most terrible and mighty enemy of the kingdom. Please, take up your sword and put them down for good... What do you mean you have other plans?""

You have a most curious power to resolve conflict through alternative means. Should you bed the enemy, things just sorta work out. The tension is diffused, the fighting is over, everyone can pack up and go home. 

So a pack of mutants are trying to accost you and some campers, or your king has sent you to slay a dragon. Doesn’t matter, people will get over it. No one has to like it, but somehow they just trust that you know what you’re doing here. "
136,,400,The Hero of Her Story,Shunned by the Village,Seduction,"Pleasure and desire give birth to one another. One feels desire, and satisfies that need with pleasure; one observes the pleasures of others, and is filled with desire. The pleasure you bring others is guaranteed to excite yearning in the hearts of those who observe it—and not generic lust, but desire specifically for you. It doesn’t matter if the pleasure is something someone willingly accepts or if it is inflicted onto them. Were a teacher to watch you rape her students one after the other, she would start to ache with yearning for her turn to finally come."
137,,400,Tokens of Affection,Dragon Princess Is Hungry,Seduction,"Well look who’s Mr. Popular. Whether it's due to your charming personality or just because they want to get in your pants, people have a habit of showering you with gifts whenever you manage to impress them. This can be anything from currency, to food and ingredients to even powerful weapons and tools. Maybe you should pay them back for all the help they’re giving you? I can think of one way that’s sure to make them happy..."
138,,500,Just Rewards,Nyakumi,Seduction,"FTF and Nyakuza members are often given all kinds of rewards by grateful girls. When you do something for someone, you are far more likely to be rewarded, be it in cash, gifts, or something more lewd. The bigger the task you completed, to them if not to you, the bigger the potential reward. There is no limit to this, so if you just saved the entire galaxy, you very well might receive a galactic-level reward."
139,,500,Love Slaves,Generic: Hentai World,Seduction,"Though his methods are... unconventional compared to the Romantic or the Harem Protagonist, at the end of the day a Scoundrel’s ultimate goal is still winning his love interest’s heart. But the heart can be tamed and dominated just like the body, and by doing so you can bind your partners to your side in chains of unconditional love and submissive lust. Love and dominance are now two sides of the same coin for you: when you exert dominance over a person you can choose to train them to fall in love with you as well, and those who already love you can be easily taught the pleasure of submission. This process is gradual and does not work on those who have no positive feelings for you at all, but as long as the tsundere is at least a little bit -dere for you then you can bring her to her knees and make her admit her true feelings for you. Even those who are naturally dominant can be made to fall for you with time and effort, though they will take considerably more effort to seduce than those who are naturally submissive."
140,,500,The Pleasure is All Mine,Legend Of Krystal,Seduction,"Pleasure is a funny thing when it comes to you. Pleasuring your partner gives you even more pleasure in return, almost three times as much in fact. To pleasure another is to pleasure yourself, and oh boy you’re good at bringing pleasure to others. You could cum just from giving a blowjob, or watching someone jerk off in your face until they drench you in cum. It doesn’t matter how you make them feel good, your body will feel it, and thank you for it."
141,,500,What are we Gonna do on the Bed?,Generic: Incest,Seduction,"Around you, people just can’t help themselves. When you’re attracted to someone, they will find themselves increasingly attracted to you in a complementary fashion, meaning that if you want someone to sweep you off your feet they’ll catch themselves fantasizing about doing just that, while if you imagine a more dominant fantasy, they’ll crave submitting to you. This doesn’t work on people who are actively hostile to you, but even people who actively dislike you will find themselves struggling to maintain that feeling if you genuinely do feel attracted to them."
142,,600,Contact List,Bokunchi No Mikage-san,Seduction,"Like Jougasaki-sensei, you have contacts in all levels of society. You meet new people and make acquaintances with ludicrous ease, and are easily able to push those acquaintances into actual friendships. In just a month after entering a world, you’ll know people from all walks of life, and would easily be able to arrange an internship or job offer for just about any profession a student could be interested in—and if you didn’t know someone who’d be able and willing, then you’d know someone who knows someone who would be. This contact list is more effective when you’re trying to use it for someone else’s sake, but even for your own personal matters, you’re effectively guaranteed to know a person able to help with whatever problems you may have."
143,,600,Deity's Beloved,Ambrosia,Seduction,"I don’t know if you’ve noticed this but there’s something about you that’s like catnip to the divine. In the past, you might have had entire holy wars started in an attempt to claim you but even in such ungodly times as these you’ll find those that remain looking on you with great favor. As long as you don’t do anything that they actively disapprove of, you’ll find that deities are willing to grant you minor boons and favors and if you actively work to further your relationship their gifts will only grow in size and scope from there."
144,,600,Have you Heard the Rumours?,Generic: Hentai Modern,Seduction,"There’s a rumor going round, about some girl out behind the gym after dark. And there’s another about the swim team and their coach. Both of these are blatantly untrue, but whens that ever stopped you? Once you start a rumor, the more it spreads, the more likely it is to come true. You might need to do a little work to get there. While you can say that the cheer squad is going to hold an orgy at your house, it won't happen unless you have an excuse for them to be at your house."
145,,600,Hunter of the Heart,Destiny: Fuck the Darkness,Seduction,"Hunters are nomads, here today and off across the system the next. Now, while normally this kind of distance would make relationships and seduction harder, for you it’s the opposite. Lay them once and vanish. Instead of moving on to the next willing lay, you’re target will just get hotter and more bothered the longer you abstain, wanting you specifically. Coming back together after an extended absence will only make the release more intense. Do this a couple times and even the coldest of hearts would be begging to be yours forever."
146,,600,Love 'em and Keep 'em,Angel Academy ~ Hardcore Dorm Sex Life,Seduction,"Training a woman’s body is quite the accomplishment, but conquering an angel’s heart is an achievement even for the greatest casanova. You are blessed with such charm and charisma that your naysayers may even call you an enemy of all women, or at least they will until they’ve fallen for you too. Love and lust are so closely intertwined for you that you can inspire feelings of love in any of your sexual conquests, using pleasure as the kindling to ignite a flame of passion. The more time that you spend taming your partner’s body the more you’ll nurture that flame, feeding it until eventually it burns uncontrollably for you. Even those who hated you at first could be swayed into falling for you given enough time and effort, but those who were already compatible with you for less carnal reasons will fall for your charms especially quickly. You’ll also find that your new lovers tend to be highly tolerant of your lecherous ways with other partners. With this level of charm you’re certain to live out the rest of your days surrounded by vast harems of adoring concubines so long as you don’t abuse or neglect them."
147,,600,Miss Monster,Victim Girls (Rose Edition),Seduction,"Way beyond all these ordinary predators are the proper monsters, the sort that don’t just seek to use soft, plushy girls for fun but eat and slaughter humans outright. Proper hunting beasts, malevolent demons and brutal horrors from beneath the sea, yet they one and all seem rather taken with you. Instead of being used as prey or sport for these creatures, you’ll often find that they care much more about capturing and keeping you alive, safe and even somewhat happy. Sometimes this might be to breed more of their kind with you, as you somehow have the capability to safely, quickly and effectively mate with any species now, and sometimes it’s to make you one of them, changing your body and more to become more monstrous, without losing those charming humanoid body parts or much of your mind. Either way, you’ll find yourself protected by monsters when you’d normally be hunted by them, though you could still be harmed in the crossfire of two competing beasts striving for your loyalty."
148,,600,Wink and a Smile,Generic: Hentai Modern,Seduction,"An idol, for all intents and purposes, makes a living off of being a sex object. Well, mostly. Anyways, you have the sheer charisma, beauty, and attitude to make an entire crowd - a BIG crowd- fall head over heels for you with only a few sentences. Hell, with a song and dance and a little bit of skin, you can make the people watching you on tv fall as well.... even if it was a recording from weeks ago. Mind you, there are probably people you don't want falling for you. Good luck with that, by the way."
149,,700,Dating Sim,Generic: Hentai Fantasy,Seduction,"You are smooth. Like fine silk. Mostly because every time you open your mouth, time freezes for just a few seconds while you review your options on what to say. Crass? Suggestive? Or you could take free choice and not use one of the predefined choices, but those probably won't go as well. Additionally, you can also summon a sub menu listing information on people, such as physical capabilities, likes and dislike, and how close they are to agreeing to sleep with you. Oh, and it comes with a settings menu too, letting you toggle different parts. If only they didn't all start ON."
150,,,,,,
,,Purchased Perks,,,,