0,,CP Cost,Name,Jumpdoc,Chapter,Description
46,,100,Travelling Companions with Benefits,Pokemon Harem Master,Seduction,"And while you’re on the road to becoming the very best like no one ever was, you may find yourself in the middle of nowhere with a cute girl - or a guy, I try not to judge - and you’d think that would be the perfect opportunity to bond and become more than friends. And luckily for you, you’d be right. Long journeys through the middle of nowhere are the perfect to get down and dirty with your companions. Why this works I don’t know, but being a hundred miles from civilization drastically enhances your charisma and sex appeal."
47,,100,Victim's Day Planner,Generic: Doujinshi High School,Seduction,"After writing down your current target’s name on the cover of this day planner, it will fill out to give you what they’re planning to do at any date and time over the course of the next week."
48,,100,Vulnerable Vixen,Erotic Equestria,Seduction,"My, what a cunning move for such humble prey. The more that someone is ‘above you’ in station, power, or both, the more they want to keep you. Keep you safe, sane, and sated, that is. This effect grows with the perceived disparity in power, with the most potent of powerful ponies being drawn to you like flies to honey."
49,,100,Your Love Makes it Better,Yurisekai,Seduction,"With the curse being what it is, there are quite a few people who suddenly lost family members - mostly men, because the curse isn’t fatal to women - and are in grieving as a result. I won’t say that you have an easy time taking advantage of these women, but you do have a knack for soothing their pains and helping them move on. Part of that is physical affection, the simple feeling of intimacy without much in the way of expectation, but the rest? The rest is some incredibly cheesy and cliche lines that you’ve probably used in your works at least once before. Turns out, they actually work. Put the two of them together, and your presence ends up being oddly calming to those in pain, regardless of if you actually put the moves on them."
50,,200,“Why am I so fucking turned on right now?”,Burakku Gakkou Ni Tsutomete Shimatta Sensei,Seduction,"People find the idea of you getting around to be really hot. Your promiscuity just increases your attractiveness to other people... even the perception of promiscuity, or even if they just invented you sleeping around with people in their own head without any basis.

Furthermore, other people won’t let their pre-existing relationships get in the way of acting on any attraction they may feel for you—and the people in those relationships don’t seem to mind that their own significant other did anything naughty with you. It just never seems to be a particularly important problem."
51,,200,A Deal was Made,Overwhored,Seduction,"The Overmind is an immortal tyrant, an incarnation of evil fought again and again by the people of the free world. But occasionally he does show noble traits to make people wonder about his evil nature. He is not known to break his word, for one.

With this, your more positive traits stand out a bit more. You just seem trustworthy enough for people to make a deal with, even if you're a known evil tyrant, encouraging people to try and negotiate. Actually sticking to your word also tends to work out well for you. Agreeing to leave a girl to your new ally instead of taking her for yourself as a sexslave just means that you’ll eventually get them both, once your ""ally"" sees how good it’d feel to give in."
52,,200,A Hero's Might,A Change of Tactics V2.2,Seduction,"It shouldn’t be a shock that great warriors are fervently admired and desired for their incredible strength, both on the battlefield and in the bedchambers. Your great strength makes you seem far more appealing to your preferred gender, your chiseled muscles and effortless exertions drawing the eye and lighting fires in the loins of potential partners. Those who feel your strength firsthand are especially affected: whenever you win contests of skill or strength your victory also wins you the affection or respect of the loser, and to greater degrees based on the magnitude of the defeat and the stakes of the battle. A close match during a friendly spar might only earn you your rival’s respect, but sparing an enemy’s life after dealing them a crushing defeat on the battlefield could easily leave them awestruck, or even lovestruck under the right conditions. Sworn enemies and those who oppose you personally are less affected by this perk, but even they will come around to respecting you after being defeated, if only grudgingly."
53,,200,A Jolly Good Rogering,World of Tentacles,Seduction,When you can't get away it can be better to think about the aftermath and how best to take advantage of it. The more sated or exhausted your or your sexual partners are by sex the more likely they are to leave you unharmed and to overlook details which will allow you to get away. A tentacle monster might abandon you passed out in a pool of fluids rather than eat you while the prison guard who just got a legendary blowjob from you is likely to forget to lock any doors when he staggers home.
54,,200,A Royal Affair,A Change of Tactics V2.2,Seduction,"Behind every great king is an equally-gifted tactician, advising them on matters of state and guiding them to victory in times of war. Some might even call a great tactician the true power behind the throne, and in your case that’s no exaggeration. You’re a gifted vizier able to easily gain the trust of royalty, nobility, and others in powerful positions simply by demonstrating your talents to them. You could gain the confidence of a queen after a single display of your skills and cement your influence over her simply by continuing to counsel and instruct her, and the longer you serve your patron the greater your influence becomes. After a year at most, and much less if you’re actively working toward such a thing, you could have your patron utterly subjugated, head-over-heels in love, and obeying your every command like a well-trained pet. But you’d never abuse the trust of your beloved monarch, would you?"
55,,200,Ace Wing(wo)man,Although Young People Recoil from Entering the Black Magic Industry...,Seduction,"Your friends (and lovers, if you are in an open relationship) will not only encourage you to have sex, but will actively try to set up scenarios to get you laid, regardless of their own views on pre- or extra-marital sex. Neither they nor anyone else will view this as being counter to their normal opinions regarding sex."
56,,200,Adorable Crybaby,Sei So Tsui Dan Sha,Seduction,"I’m sorry for being so forceful with you Master/Madame, but it’s getting harder to control myself around you~ You emit a (togglable) submissive aura that makes you irresistible to sexy dominant types, drawing them towards you like moths to a whimpering flame. Their desire to have sex with you seems to be directly correlated to how dominant their outward personality is, and how outwardly submissive you behave. Does not apply to anyone you wouldn’t be outwardly attracted to."
57,,200,Aiming,Generic: Lewd Shipgirls,Seduction,"Determining where your target is basic stuff. The real experts focus on how their targets move. This means that their attacks are more likely to be in the right place when they get there. You are an expert at this, making you excellent at all sorts of naval gunplay. 

It also applies to seduction. Love and war do have similarities. You’re more skilled at predicting how someone will react to different approaches, allowing you to develop a more accurate “firing solution” before shooting your shot."
58,,200,All a Part of the Procedure,Chichikko Bitch / Witch Bitch Collection,Seduction,"Screwing with their head to screw with them once things have gotten going is all well and good, but you need a way to actually get there. Other than force. With that in mind, you are now... exceptionally talented at bluffing. Read that as ‘pulling bullshit out of your ass’. This makes you rather good at taking advantage of the innocent young maidens who cross your path. Yes my dear, I AM certain that a blowjob is a valid medical procedure."
59,,200,An Inspiration to us All,Mizuryu Kei Land,Seduction,"As someone who has ‘have sex’ as a significant portion of their job, it should come as no surprise that people are a little leary of doing it with you. After all, fucking the cast costs, while the other guests are free. On the other hand, as someone whose job is to have sex, you can be damn sure that you’re amazing at it. So much so that anybody watching you while you have sex will rapidly become extremely horny. Well, they probably already were, but now they’re even more so. Just the push they need to pay for a member of the cast, no?"
60,,200,Are You Perhaps My Fan?,The Otaku in 2200 AD,Seduction,"An idol lives and dies by the support of their fans, so it pays to be able to recognize one. You can immediately determine what other people’s opinion of you is, and how much they like you—both how much they like you as a person, and how much they like the persona that you play."
61,,200,Big Dick Energy,Breathless Wild,Seduction,"Chieftain Urbosa was everything the gerudo ever wanted in their champion: domineering, amazonian, and blessed with a cock that made moblins cry with envy, or at least that’s how she’s remembered. It’s easy to see why such proud warriors would value such things but for you it seems everyone finds them appealing. You have what can only be described as big dick energy, an impressive aura of strength and virility which bolsters your charisma, and the bigger and stronger you are (and the bigger your cock is, if you have one) the more charismatic you become. Whether people find you incredibly attractive or intimidating or both at once, this animal magnetism makes you a natural leader for anybody who’s smaller or less well-endowed than you are, and if there’s any debate on the matter you can put it to rest by crushing your challengers in any sort of physical competition, reducing them to horny simps like the rest of your minions. Note that you needn’t be huge and well-hung to benefit: an amazonian MILF and a young man who’s hung like a bull will both benefit based on their respective strengths, not whichever quality they lack."
62,,200,Boundries,Elzikyuchi’s Dickgirls 2,Seduction,"The problem with giving up control is that there's no guarantee your partner won't go too far, or is in and of themselves too much for you to handle. Saying that you have the sexual stamina of ten men is great, until you meet someone with the stamina of one hundred and they all but fuck you to death trying to get off to their satisfaction. Luckily, that’s not something you often have to worry about. Your partners are exceptionally mindful of your limits - both social ones, like simply not desiring to perform a specific act, and physical ones, like being incapable of fully taking them inside of yourself. It doesn’t particularly matter if this is your actual lover or an ancient demon looking for a mortal to play with, though I will admit the second is far more likely to acknowledge your limits and then pass them anyways."
63,,200,Cheeky Pry,Boyce Park,Seduction,"Be it by humor or other means, You have a talent to appear very likable, making hunters more likely to pick you than others if they want a good time, less likely if they actually look for someone to hurt and anyone much more likely to go easy on you after the catch."
64,,200,Confession,Generic: Lewd School,Seduction,"Sometimes, people need someone they can talk to. Someone they can come to for help. Now, they’ll have an easier time opening up to you about problems they have outside of schoolwork. Help them with this, and their devotion towards you will grow. Betray this confidence, and watch them withdraw."
65,,200,Cool and Close,Miyuki-chan in Wonderland,Seduction,"You have a very seductive manner to you, such that the targets of your affection get flustered and find it difficult to resist your close contact. Even if they are unwilling, they are more likely to run away than fight (and they usually don’t flee right away). However, if you push enough of the wrong buttons, your quarry might finally decide to fight back. This also makes it easy for you to stroll right up to targets before they even notice you, allowing you to get close and personal before they can object."
66,,200,Dominant,Bio-Weapon Quest,Seduction,"In your hands, sex is both a weapon and a reward - the figurative carrot and the stick rolled into one. Manipulating and coercing other people with it comes naturally to you, whether you have a foot-long monster cock or not. Extracting information, punishing misbehaviour, and ensuring your slaves remain complaint is simply made all the easier with a solid fucking."
67,,200,Domino Effect,Fate/Loli Order,Seduction,"You know how that works, right? You push one over, it pushes the next which pushes the next which pushes the next, so on and so forth. Well with you, it’s not made from dominoes but from people. Make a friend and their friends and family will like you more. Sleep with something, and you'll find their sisters, mothers and friends slipping into bed with you. Reduce a woman to a living sex toy and those that knwo here will crumble all the more easily."
68,,200,Entourage,Monster Hunter XXX,Seduction,"Seems we’re taking ‘animal magnetism’ nearly literally. Taking this Perk endows you with a passive knack for gathering “groupies” inclined to either simply wait on you or offer a bit of sexual release. Male or female as your preference dictates, these individuals will each be roughly one tenth as powerful as you, setting allowing for such (and assuming you don't make them named characters), and will defend you right up until they start getting killed."
69,,200,Ero Manga,"The Otaku in 10,000 BC",Seduction,"This is a large cache of hentai manga. Like, a lot of it. The quality is exceptional in both story and art, and even if you ignored the eroticism of it, they would always make for a pleasant read. But the erotic aspects are themselves incredible, and patently amazing even to someone who can’t read. It covers a variety of topics, but all of them are things you would find appealing. If someone else reads this hentai, the likelihood of you having sex with them at some point in the future increases."
70,,200,Everyone's Fetish,Winger’s World,Seduction,"Size doesn’t matter? Whoever said that wasn’t a hyper. You’ll find that most people are into size. The bigger you get, the more aroused they get and you’ll be ready to scratch that itch real good."
71,,200,Expected Expectation,Ashigei Shoujo Komura-san,Seduction,"You’re a social butterfly that all but the most unreasonable people will struggle to dislike. You could be on close terms with every single club in a month, even if you didn’t join any. Rather than repelling others, your extreme quirks are often interpreted as a point of charm, even if anyone else doing the same would be seen as a pervert."
72,,200,First Time is Free,World of Moral Reversal,Seduction,"Virgin, high schooler, or just a plain pervert, people of any world are oddly open to the idea of paying you for sexual services, assuming they know it’s on the table."
73,,200,Haunted Television,Generic: Hentai Occult,Seduction,"You found this old thing at a garage sale after your old one broke. It belonged to an some highschool girl who was tragically hit by a bus. It’s also haunted by the ghost of said girl. Any women who watches this television is cursed with her dying wish - not dying a virgin. As a result, they’ll slowly start trying to get in your pants over the next hour or so. In addition, she can optionally strip the clothes off any character on the screen."
74,,200,It's Perfectly Normal,World of Moral Reversal,Seduction,"Through inclusion in pervy acts with you, whether loaning them a magazine, or something more intimate, you can ignite the spark of perversion in even the most stubborn prudes. The change may or may not be a lasting one, but their attempts to suppress it will only make the impending lust-induced outburst more intense."
75,,200,My Hero!,Fate/Loli Order,Seduction,"Whether it’s some asshole trying to NTR your wife or some unscrupulous bastard trying to get lucky with your daughter, there’s seemingly no end to morons willing to do stupid shit because they think they can get away. Even Chaldea isn't free of such bad apples. Thankfully, you're something of a Knight in Shining Armor; able to make quite an impression when you swoop in to save the day. Even if you were some towering monster that seemed more likely to tear people apart than comfort scared little girls, your noble nature shines through; ensuring that such scared or scarred victims will know to latch onto you for safety rather than lash out or flee. If anything, that fresh coat of their victimizer's blood may be just the thing to help them realize the nightmare is finally over. Moreover, the greater the plight you save them from the easier you'll find it to grow closer to them; earning their trust and affection in equal measure after your daring feats, making it all too easy to wipe away their tears and help them find peace or perhaps nurturing it into true love."
76,,200,New Best Friends,Bricola,Seduction,"When you’ve got that itch that needs scratching, Rangiku would probably tell you to head to the nearest bar and let someone order you a drink. That’s what she does more often than not, after all. Like her, when you’re in the mood for a partner for tonight only, you put out a faint aura of “please fuck me” that draws in all sorts of partners like flies to honey. At the same time, when morning comes, if you never want to see them again then that same aura will cause you to sort of slip past each other when you would otherwise cross paths again."
77,,200,Pheremone Mushroom,Monster Hunter XXX,Seduction,"Maybe you feel the need to step it up a notch to seduce that cute Hunter chasing you? Or how about that regal Teostra? Either way, this little pink mushroom (sold in bundles of six weekly) will amplify your natural sexiness by a solid fifty percent. If they were the type to be interested in you, they’ll be putty in your claws unless possessed of amazing willpower."
78,,200,Pierre's Own Luck,Generic: Norithics,Seduction,"It's one thing to charm yourself into somebody's pants, it's another thing to have the kind of charisma and sex appeal to smooth-talk your way into into a threesome, especially if the people you’re asking aren't necessarily a couple, don't really swing that way, or maybe they just hate each other, or have some other kind of weird sexual taboo that would normally prevent them from sleeping with each other. In addition to being so massively charming and sexy you can literally do just that, whether working individually or two at a time, you're able to use threesomes as a method to convince nearly any two people to sleep with you."
79,,200,Please Cum Again,Nyakumi,Seduction,Girls treated for Lewd Mist Exposure tend to seek out their rescuers to experience the ‘treatment’ again. This perk greatly increases the chance for people that you have sex with to come looking for another round. You definitely aren’t lacking for casual sex partners with a job like yours.
80,,200,Plot Twister,Sei So Tsui Dan Sha,Seduction,"You can’t let yourself be someone’s toy forever. You need to rise up, but when sex is your only weapon, you learn to make due. Now, you’re able to flip the tables on any power dynamic, by dominating those currently above you sexually. Whether they’re a sadistic bully or an unreasonable boss, they won’t be able to look down on you once you put them in their place with your body. This only affects how they feel about you, this won’t affect structural or systemic power they hold over you."
81,,200,Queen Slut,Victim Girls (Veronica Edition),Seduction,"All these harpies are drawn to you like honey. Like long lost sisters, women with similar body types and slutty interests as you are lured to your presence. If you happened to be some goblin tribes’ current breeder, you’d be responsible for luring plenty of ultra-fertile goblin-lovers to their hunting grounds without even meaning to. It has a smaller effect on girls that you already know, slowly encouraging their bodies and minds to twist more towards your particular brand of lewdness. By choice, you can have this instead work on the preferences of your current partner slash owner."
82,,200,Sever the Strings,Majuu Purification Girl Utea,Seduction,"Destined encounters, fated lovers... doesn’t it make you sick that magical girls get things handed to them so easily? Well I have good news for you: your otherworldly nature grants you the power to fuck with fate. In each world you visit you seem destined to meet the people you desire most, easily brushing aside any rivals who’d interfere with you. You don’t even need to kill the magical girl’s fairy partner or destined lover to keep them from meeting each other because stuff will just happen coincidentally and make them pass each other by, like ships in the night. In the meantime you can easily slide right into the empty space that person would normally occupy. Instead she’ll run into you and she’ll keep running into you over and over again because you’re the one she’s destined for now. Destined for what exactly? That’s for you to decide."
83,,200,Slow and Sensual,Chichikko Bitch / Witch Bitch Collection,Seduction,"Of course, if you go too fast then she might get the wrong - well, right - idea about your intentions. With that in mind, why don’t we start slow. This isn’t really a porn shoot, it’s just a modeling gig. You’ve done those before, right? Similarly, you are excellent at both backtracking if your attempts at leading them into lewdness backfire and disguising those attempts. Give us a twirl and a wink, lean forwards and pout, maybe flash your tits... One thing leads to another, and before they know it they’re sucking your cock."
84,,200,Smooth Criminal,Generic: Hentai World,Seduction,"Despite their loose morals and cheerful disregard for social norms a good Scoundrel is rarely lacking for romantic interests. The old adage about all girls loving bad boys has some truth to it for you because you can even seduce girls who dislike you, even if you’ve given them good reason to do so! You could cheat on your girlfriend, blackmail someone into dating you, or conquer a kingdom and claim the princess as your concubine, and yet when you turn on the charm your “victims” are no less likely to fall for you than anyone else. They might act cold or tsundere towards you at first but be patient and inevitably you’ll win them over even against their better judgement. Just take care not to push your luck: you’re a Scoundrel, not a Monster, and if you’re too cruel to your partners you’ll lose this perk’s protection."
85,,200,Smooth Talker,Angel Academy ~ Hardcore Dorm Sex Life,Seduction,"Getting people interested in you is only the first step: once you hook them you’ve got to reel them in. Not only are you charming and charismatic but your roguish charms allow you to leverage your sex appeal into a major advantage when it comes to tempting, manipulating, and seducing the opposite sex. You could easily disarm a haughty tsundere’s temper and turn her into a blushing mess just by flirting with her a little, or negotiate a discount from a cute shopkeeper by offering “alternative” forms of payment. The more attracted to you a person is the more easily they can be tempted and manipulated by your charms, and those who are so far gone that they’ve fallen in love with you can easily be wrapped around your little finger. However those who genuinely dislike you won’t be affected by this perk at all."
86,,200,Support Fighter,A Change of Tactics V2.2,Seduction,"There might be a better way to make new friends than to fight for your lives together but if there is you haven’t found it yet. You can harness the heat and pressure of battle in order to forge bonds of friendship, brotherhood, or even romance between you and your allies. Results will vary depending on the individual but even someone who doesn’t want to give you the time of day can’t help warming up to you after you’ve saved their life once or twice. Such bonds are also ironclad once forged, requiring a great deal of abuse or neglect on your part to sever them, and your enemies will find it all but impossible to drive a wedge between you and those you care about."
87,,200,Tempting Target,Boku To Nottori Nakademia,Seduction,"When it comes to possessing entities and other such puppet masters, you’re the honey to other people’s vinegar. You’ll find that they practically come out of the woodwork to get their hands (claws, tentacles, non-euclidean body parts with no name, etc.) you, and are far more likely to focus on you in particular rather than someone more unprepared for such an experience. Naturally, you can toggle this off if it gets a bit too much."
88,,200,The Joys of Submission,Slimy Sextet,Seduction,"It can feel so good to just... let somebody else take control. When you stop resisting and let someone else have their way with you, the pleasure you experience increases significantly, to the point that you wouldn’t need aphrodisiacs to reach the same highs of pleasure that the heroines in the game did."
