0,,CP Cost,Name,Jumpdoc,Chapter,Description
66,,400,Iron Maiden Grip,Metal & Lace,Corruption,"You know how a gal will be kicking ass and piling up bodies, but the moment someone grabs her by the wrist or upper arm, she suddenly turns into a helpless damsel? You can do that. Everyone’s ‘handle’ is slightly different, but you can identify it by brief examination. Doesn’t work if the intended victim is significantly larger than you are (such that you can’t get good leverage), a machine, embodying a Silhouette (unless you are as well), or not actually female. Victims will instantly recognize if you’ve lapsed your grip enough for them to break free and retaliate, which can be disastrous if they’re significantly stronger, more skilled, or supernaturally empowered."
67,,400,Kinklestial Spirit Mage,Chichikko Bitch / Witch Bitch Collection,Corruption,"You know, it’s a bit interesting that both Lucy and Yukino are massive sluts. Lucy at least does it for money - Yukino just likes getting gangbanged. Once is a coincidence, but twice is a pattern. See, right now, two is actually just under half the female celestial spirit mages. It stands to reason then, that the others are massive whores as well. In other words, you can basically infect a specific demographic (for example: pyromancer wizards, tinker heroes) with lewdness via fucking it’s members."
68,,400,Light Touch,Generic: Hentai Occult,Corruption,"You could modify a person into believing whatever you want, warp their body to fit your tastes... or you could make them change themselves to please you, or to pleasure themselves. You have a knack for the tools and toys that grant you your power, getting larger effects from smaller changes. Why bother dedicating any real effort towards acquiring an asset when you could issue just one or two commands, and set of a chain of dominoes that could save you days or weeks?"
69,,400,My Erona,Erona,Corruption,"Occasionally a slave you spent so hard training could find a way to escape your grasp, or a noble knight could force you to retreat and ‘rescue’ his loved one. Your slave could even have the gall to find some magic and remove your curse mark and the memory of any conditioning you put her through and go off to live a ‘happily ever after’. But no matter in what way she runs, your slave could never forget her time at your feet, and the memories will haunt her dreams and make it so that she will find no sexual relief at her own hand or the hands of her spouse. Eventually, she will find herself coming back to you out of the mistaken belief she can take revenge. Of course the moment she comes face to face with you, all the training you put her through will come crashing back down on her, leaving even the strongest-willed knights to fall to their knees and beg you to make them yours again.

After willingly giving themselves up again, any tricks, like memory alteration or purging their bodies of foreign magics, that their former friends or allies try to do to bring them back will be completely ineffective; they may have been blinded by magic and lust before, but they now serve you of their own free will."
70,,400,Pleasure Slave,Earth Defense Team Star Guardians,Corruption,"The most insidious part of the Dystopian conquest isn’t how they turn free people into slaves, but how they can make those slaves enjoy becoming the playthings of their new masters. You are a master slave trainer, skilled not only at breaking down the wills of your captives but also at building them back up again once you’ve broken them, turning your enemies into loyal pawns or mindless pets or whatever you have in mind for them. Moreover, unlike most slave trainers you needn’t torture your pets with conventional methods to break their wills. Pain and discipline may have their place, but in your hands pleasure alone can turn a defiant slave into a mewling pet begging for her next orgasm. It will take time to break strong-willed girls like the Star Guardians but even those brave little heroines can be brought to heel with enough time and patience..."
71,,400,Poisonous Friendships,Majuu Purification Girl Utea,Corruption,"The very bonds that make help the Utea a force to be reckoned with can also become chains that shackle them to each other, and when one magical girl falls to darkness she might very well drag her friends down with her if they don’t save her quickly. But for a dark magical girl this is quite ideal: who better than friends and loved ones to receive her dark gifts? Your relationships are the ideal vectors for spreading corruption to other people, allowing you to bypass resistances and immunities that might normally stop such magics by exploiting what they feel for you, even those for whom your friendship was an act all along. Even once you reveal your true nature those who fell for the act will still struggle to fight their so-called friend, pulling their punches and trying to capture and redeem you rather than dealing with you like any other opponent. Even if they do capture and purify you, you can choose to use the experience of hiding your corruption to husband a tiny ember of darkness deep in your womb ready to be stoked into a raging bonfire once more."
72,,400,Power Begets Powerlessness,Fate / Blacked,Corruption,"Heroes, goddesses, immortal god queens, you know what they all have in common? They don’t yet realize they’re addicted to cock. Their resistance is still likely to happen if they can remember to do so, but for some reason the personal power levels of your new breeding bitch only serve to make their enjoyment of their enslavement even harder to resist. A normal woman might feel bad about cheating, a goddess wouldn’t bother."
73,,400,Revenge in Kind,Generic: Hentai Magical Girl,Corruption,"So, you beat the Shoujo into the ground and took your reward from her. Probably her virginity. All of them. Regardless, unless you’re the scheming type with a lair and minions, you probably left her there, lying in a pool of cum. But you know she’ll be back right? She’ll want to beat you into the ground and blast you with whatever her special move is until you’re dead and gone. Thankfully however, she’s become convinced that she needs to take revenge in the same manner, to beat you at your own game. She needs to rape you. As you can imagine, this is probably doomed to failure."
74,,400,"Sharp Minds, Captured Hearts",World of Lewd Elves,Corruption,"Well, breaking a haughty elf into your personal meat toilet is nice and all, but it loses its charm when you realize you actually lost a valuable ally in favor of a glorified stress reliever. At least you won’t have to deal with those troubles anymore, now the ‘victims’ of your ‘love’ retain their physical and mental faculties even after being broken into your loyal toys. Sure a warrior might constantly fantasize about being pierced by your ‘sword’ but she will be just as skilled in fighting and training than as if you hadn’t fucked her into submission and a noble would be just as sharp witted and clever as ever, even if she would happily stop whatever plot she is working on to suck you off under the table. As an added bonus those you turn into loyal sex slaves seem to become really good at acting as if nothing has changed, even an attentive boyfriend would think absolutely nothing is wrong even when his ‘loyal’ girlfriend was cheerfully fucking you behind his back and a whole city would be capable of fooling most outsiders that everything is normal and that you haven’t made it into a sexual paradise.

You can still choose to make them nothing but sexblobs if you want though."
75,,400,Slave Contract,Gun Tribe,Corruption,"Slavery is a very recent part of history in this version of America, and something that could get you in a lot of trouble for engaging in it—or it could have, before you purchased this item. By buying this paper, you are legally considered the owner of all the slaves that you possess, regardless of the law’s actual stance on slavery. But more than legal protection of having slaves, you are a giant social blind spot. When it comes to you and your slaves, even the most ardently pro-freedom individual will accept your right to have a slave and not find anything strange about it. This applies to both slaves you own at the start of the jump, and those you take; people might fight against you when you try to claim someone as a slave, but once you’ve taken them as your own and are indisputably their master, even those that previously fought for their rights will accept that you are their new owner and stand aside."
76,,400,Slave Trainer,Free Cities - 9anon Edition,Corruption,"A skilled slave is a valuable slave, and you have the skills and know-how to make even the most useless slave worth having around. Beyond knowing how to instill your thralls with a mastery of the sexual arts and all manner of skills that’re practical to a slave, you’re also able to teach them any skills you personally possess rather quickly, even if they don’t have the capacity for them. Like teaching magic to someone without the ability to use it, or getting a dunce up to speed on quantum physics. This is still on the scale of many weeks, probably months, but that’s likely far faster than normal."
77,,400,Slut Breaker,Generic: Hentai World,Corruption,"You find that, despite their feelings or intentions, even virgins act like sluts once you have gotten properly started on them. As you force pleasure upon, or take your own from someone, they find their attempts to resist you weakening. Progressively their body will cooperate no matter what their mind thinks, their hips grinding without prompting or their tongue swirling even though they wish to bite down. The more often you inflict this state on someone the easier they fall back into it and the longer it will last even while they are not being actively stimulated. Keep it up and you can see the hatred in their eyes even as they dress like a whore or dance for your pleasure."
78,,400,Slut Sorting Algorithm,Generic: Hentai Occult,Corruption,"Most people will tell you that people cannot be reduced down to numbers. Most companies will try anyways, in an ever escalating and privacy invading attempt to sell you things. You, along with the council of censored faces, have pooled resource to put this together. A computer program that finds the women out there in the world who just need the tiniest push to dedicate their lives to lust. It also records the patterns of what does and doesn't work to make them fall, and will slowly learn to advise you on the process."
79,,400,Subjugation,Collar 6,Corruption,"If you can keep someone under your thumb, you can eventually bring them to heel. Doing this might not be easy or even practical in the most extreme cases, but the possibility will always exist, if you look for it. Always. “Absolute” mental defenses will turn out to have some tiny weakness you can exploit, “infinite” willpower will eventually run out for a short while, and the most intractably stubborn personalities will turn out to have some kind of fear you can use to your advantage. What form this opportunity takes will never be immediately obvious, but it will be there.

Moreover, this perk also lets you know how close you are to the red lines of breaking someone beyond recovery, just in case you want to take a step back and avoid personality death. After all, you’re not a little kid and, if you break your toys, it won’t be an accident, but because you wanted them broken."
80,,400,The ‘Rewards’ of Loyalty,Kuroinu,Corruption,"You’d think a group or empire that runs basically on lust would crumble the moment it meets any stiff resistance, but you’d be wrong. The men under your command, when motivated by proper ‘rewards’ seem to fight like devils, fighting when many other men would have already broke and ran. A ragtag group of mercenaries, for instance, could even take the heavily defended Sixth Fortress from the Seven Shield Alliance’s most veteran knights. Give them enough ‘rewards’ and your men would be unshakably loyal to you and to your lust filled campaign. I guess you could also just pay them in gold and plunder too...but where’s the fun in that?

If your army so happened to be made up of women instead, then they will be motivated to fight at similar levels for a chance to be ‘rewarded’ by you, or any captive men (or women) you have."
81,,400,The Lewd Virus,Lewd Virus,Corruption,"The Lewd Virus has a 100% fatality rate in women between the ages of 10-20. The infected have higher libidos, lower inhibitions, enlarged genitals, and an extreme resistance to fertilization (in women) and/or the ability to release ludicrous amounts of cum (in men). While (rarely infected) men can generally survive this illness, women must give birth, which will both cure and immunise them. And, due to their resistance to fertilisation, only infected men (or others with a similar copious volume in their loads) can impregnante them.

If this sounds like a world that you want to see, you're in luck! You get a single vial of this disease that will restock once every ten years if used. It won’t guarantee that everyone—or even the majority of people—catch the virus, but you can definitely come close with some careful planning and a bit of luck."
82,,400,The Power of Lust,Generic: Hentai World,Corruption,"Romantics and Harem Protagonists might win the hearts of their partners with the power of love but a Scoundrel gets much more mileage out of raw lust and naked desire. For you the surest way to win a woman’s heart is to tame her body first. You can choose to use any kind of sexual contact with another person to train that person’s body and mind to become more erotic; stoking their libidos, making their bodies more sensitive to pleasure, training them to enjoy new and exciting fetishes, or even making minor cosmetic adjustments, like making their tits and asses grow round and full. With a few weeks of daily encounters you could train a virgin schoolgirl into a perpetually-horny sex addict and get her hooked on all of your favorite fetishes. However this perk only works with consensual sex; your partners have to genuinely desire you before you can start feeding that desire."
83,,400,To Rule the Nest,High Elf x High School,Corruption,"But it’s not enough to just be at the center of a nest, you need to command it. And now you can; if someone desires to have sex with you and you are attracted to them, then that desire will become, from their perspective, a need. And as a“need”, almost anyone will be willing to go to great extents to see that need satisfied. Just like a starving person would willingly eat a food they normally hate, someone deprived of sex with you is likely to do just about anything you ask of them, no matter how degrading the act might be, as long as there’s the promise of you fucking them at the end.

To keep you from just being raped, this effect won’t interfere with the person’s respect for consent. Even if they were at their absolute desperate ends, they wouldn’t rape you... unless they’d be willing to rape you even without the enforcement of this lewd “need”."
84,,400,Touch of Darkness,Majuu Purification Girl Utea,Corruption,"Corrupted Utea command darkness and corruption just as competently as they once wielded healing and purification magic and they delight in using their tainted gifts to drag others down into depravity with them. Most injuu spawn new demons by forcing women to give birth to them, but you’re able to corrupt men and women alike: first rousing their desires through sex or temptation, and then utilizing them as the catalyst for an unholy tantric ritual that transforms your partner into a sex demon, unquestioningly loyal and bound to your soul. The more powerful your partner the more powerful the demon they become, but anyone with a great deal of lust or pent-up desire makes a magnificent injuu even if they have no magic whatsoever, and as your power grows you can make even stronger demons out of ordinary humans, to say nothing of magical girls or any other powerful individuals. A strong will can resist your power but only having no sexual desire whatsoever can grant total immunity to it."
85,,400,Wedding Crasher,Angel Academy ~ Hardcore Dorm Sex Life,Corruption,"Your sexual skills are unparalleled and your partners ache for your touch, but when you’re not around they might try going to others to scratch the itch you’ve given them. (Un?)fortunately you’ve already left your mark on your conquests, and nobody can satisfy them like you do anymore. The more pleasure you inflict on a partner’s body the harder it becomes for them to be satisfied by anyone else, though you can limit the perk’s effects to specific targets, such as only ruining your partners for other men. You can even drive a wedge between your conquest and any current partners they may have. Stronger relationships take more effort to break up: a chaste or abusive relationship might be damaged by a smouldering kiss, but True Love might need a month or two of regular cucking before you finish driving off the other guy."
86,,400,Women Should Serve You,Kuroinu,Corruption,"You might give those that you mindbreak to your men to ‘inspire’ them but both your men and the heroines both know who they serve. While I hesitate to call this anything as substantial as love they will find sex with others to have become duller and sex with you to have become more pleasurable. Given the option of a night of lovemaking with one guy or a short blowjob with you, she’d take the blowjob every time."
87,,500,Ass of Legend,Elzikyuchi’s Dickgirls 2,Corruption,"While the rather natural assumption about Dickgirls is that their cocks are so large and overpowering that anyone they fuck rapidly becomes addicted to them, there’s no rule that you can’t have an ass so amazingly fuckable that they end up addicted to you instead. Such an ass would be a weapon of mass destruction, taming Dickgirls by leaving them unable to fully pleasure themselves unless that divine booty was involved. You have such an ass. Once it’s been tasted, there are very few people alive - male, female, or shemale - that will fail to do anything you want in exchange for another opportunity to fuck it. To be perfectly clear, this does not apply to your hands, mouth, breasts, or any other body part. Only your ass is so overpoweringly absurd as to turn a highly dominant Dickgirl into a sumbissive slave in exchange for more."
88,,500,Can't Argue with Results,Generic: Lewd School,Corruption,"​All that people care about is results. When you're doing a job for someone, so long as that job is being done well, no one will care how you do it. If you're a teacher, as long as the people learning from you are getting good grades and behaving in the public eye, no one will care what your teaching style is. Trade correct answers for orgasms, as long as those test results are high. Punish the girl always talking in class by making her give you a blowjob. No one will bat an eye as long as her behaviour gets better. Still, be careful, this will only go so far."
89,,500,Demon King of Pleasure,Fate / Blacked,Corruption,"You may be a whore, but you are not one to be claimed. No, you are quite simply too slutty to break. You can genuinely claim to love every fetish that exists with all your heart, unless you have some personal trauma that prevents one of two of them from appealing to you. A big fat cock could make you cum buckets, as could a tiny microdick and a tearful love confession - honestly, the tiny dick might even be more erotic somehow, if only for the passion within it. More to the point, you’re fully capable of turning the situation around on an arrogant lover and addicting them to you instead of the other way around via sheer overwhelming skill at thottery."
90,,500,Instant Loss,Celestial Bordello,Corruption,"By taking a moment to gather your might, you can shatter the resistance of a woman with the first thrust of your cock, leaving them entirely broken from pleasure even before you spend the next few hours battering their innermost folds. Once you're done, they certainly won't be walking away from you - not only because they likely can’t walk after that, but also because they know that no one will ever come close to giving them the same kind of high as you. Perhaps with support or extraordinary willpower, they might be able to resist the burning desire, but that just gives you a second oppurtunity to make them snap."
91,,500,Lust Brand,Niplheim’s Hunter,Corruption,"Ah, and now we come the selling point of the whole adventure. The lust brand is a heart-shaped tattoo etched with magical power onto the navel of an unlucky (?) target, such as our heroine Azel. The bearer gains a well of magical power which they can use by drawing on the brand, but the more power is drawn the more the brand demands a price in return, inflicting the wearer’s body with supernatural lust that grows and grows until they can think of nothing but relieving it by any means necessary. This same lust will also afflict those around her, turning her into a potent form of rape bait.

While Azel possesses something similar to this item, this Lust Brand differs from hers in one very important way: the more the wearer is overcome by the seal’s aphrodisiac, the more they are subconsciously shaped into an obedient pet of the one who placed the seal on them. This is a seal you’d place on your enemies, not your friends. I hope. You do have those, right?"
92,,500,MILF Minded,World of Tentacles,Corruption,"Few women are fully-prepared to become a mother to human babies, much less to a tentacle monster’s spawn, but that’s nothing you can’t fix. When you have sex with someone you can opt to mentally or even physically adjust them for the role. You can slowly layer into a victim's mind feelings and compulsions for a broad range of effects related to motherhood, ranging from inflicting a fetish for impregnation to a horror at the idea of an abortion or compulsions such as one to tend to and care for their young no matter what. Similarly you can easily cure infertility, cause someone to lactate, correct a non-viable pregnancy, or even turn a man into a woman (albeit with a lot of work). You can accelerate these changes by having more sex and giving even greater pleasure to the expecting mother."
93,,500,Mindfucking,Celestial Bordello,Corruption,"Corrupting your victims with magic, or words, or pleasure- it all falls under the auspices of mind fucking, sure, but sometimes you just want to be more literal. You now have the ability to penetrate the braincases of anything you want to fuck without hurting yourself, usually through the ear. How pleasureable (or lethal for that matter) this is for your victim is up to you. Cumming inside them will fill their brain with your seed, literally impregnating their mind with an overwhelming, unquenchable arousal. If you have tentacles, or other means of finely manipulating such things, you can be more specific in your mental fuckery, wiping away certain ideas in favour of lust, or drowning particular stimuli in arousal. A little cum on the brain can go a long way."
94,,500,Slave's Ensemble,Breathless Wild,Corruption,"The Gerudo were the most militant of Hyrule’s races even before the Nightmare began, and their thirst for conquest has only grown since Ganon’s curse began subtly grooming them to serve him once more when he inevitably returns. These fetching clothes, fine jewelry, and magical tattoos will soon adorn your slaves and mark them as your property just as they do for many in the Gerudo and Yiga clans. The exact outfit is yours to pick: it can be as bold as a uniform or as subtle as a collar, womb tattoo, or piercings, and comes in as many forms as you like. 

At any moment, you can reach out and ping a given slave seal to learn its wearer’s location and general status, and cast spells on them even at great distances, whether to toy with their bodies and minds from across an entire kingdom or to protect them whenever rival monsters think to lay hands on your slaves. But few will dare do so: each seal holds an impression of your power and warns all who see it that harming your property will incur your wrath, and the greater your power grows the more effective this protection becomes. A bokoblin’s threats intimidate nobody, but a demon lord’s servants are nearly as safe as if he loomed over their shoulders at all times."
95,,500,Strength is Relative,Waifu Fighter,Corruption,"Despite having the strength to easily snap Jack’s arms without even trying, none of the women Jack rapes put up any actual resistance when he violates them. From now on, you’ll find that when it comes to forced sex, people just sort of don’t use the powers they have to fight back against you. Once you start making things sexual, your opponent just sort of... stops using their abilities against you. An ordinary human with this perk could rape Supergirl, and she wouldn’t just break free with her super strength. They will never find it strange that they don’t really fight back against you with all they have. 

This only applies for non-violent sex; if you start injuring them, this restriction on their powers completely disappears."
