600 CP,Face of the Conflict,Darth Bane Trilogy,"General Hoth, Lord Kaan and, now, you. These three possess the raw charisma and force of will to respectively militarise, as well as essentially take over, the Jedi Order, to change the fundamental nature of the Sith and to do whatever it is you plan to do with this purchase. Your presence, oration, charm, interpersonal skills and tangible convictions are increased drastically. Words pass your lips and the world responds, if not without several million middle persons. Persuade a proud King to surrender without a single battle, seduce a Jedi Master or a droid and convert crowds into fervent supporters of a cause they’ve only just been introduced to. Irrespective of whether or not your greatness has been determined by the Force, in time all may acknowledge it."
600 CP,Lord of the Fleet ,Star Wars vs Warhammer 40k,"To bring out the best of a fleet might you need someone who can truly command the ships and direct them at their whims. There are many individuals who are capable of this feat, but some stand out amongst the rest. Some notable examples of this are Grand Moff Tarkin, Grand Admiral Thrawn, Omega, and Chapter Master Orion. You now can be counted amongst these ranks and perhaps even stand at the top. Given time you could become the most feared and respected strategist in the galaxy. Few if any will survive a battle with you unless they possess overwhelming force and even then their victory is not guaranteed."
600 CP,The Bane of the Crimson Razors,Star Wars vs Warhammer 40k,The true visage of General Grievous is a terrifyingly effective combatant. After he was given a summary of the Imperiums strategies that had been observed he was able to plan out the entire strategy they would employ with perfect precision. Additionally he was a monstrous combatant able to combat multiple Space Marines simultaneously with ease. By taking this perk you will become the equal of true General Grievous at his best. These skills and tactical abilities allowed him to become known as the Bane of the Crimson Razors with the run down and ruined forces of the Confederacy. Perhaps with time you will gain a similar title.
600 CP,Kamino,Star Wars vs Warhammer 40k,Kamino is an aquatic planet located on the edge of the Outer Rim. The main feature of the planet is the massive cloning facilities responsible for supplying the Republic with a clone army. This planet will come fully staffed by the Kaminoans who will be capable of creating clones for you. They will be capable of creating a clone of anything as long as you can provide a proper template for them. They will also be capable of making some modifications to the clones should you wish to alter them in some way. The only restriction is that the clones will be created as infants. So it will take a few years for these beings to be ready in any meaningful way.
600 CP,Droid Production Plants,Star Wars vs Warhammer 40k,The bulk of the Separatist and Sith armies are made up of Droids. These forces range from the simple B1 battle droids all the way to the massive Vulture Droids that function as their main space fighters. This is a planet filled with numerous factories as well as space ports to construct new ships. These facilities will be capable of constructing any droid or ship that have the blueprints for. This facility will come with the blueprints for every piece of machinery used by the Sith. Aside from this the planet will come with a defense fleet on par with the ones used to guard any of the other major production centers.
600 CP,The Eclipse:,Star Wars - Dark Empire,"This isn’t something you should have, or anyone should really have for that matter but you do regardless. Under your command is a single Eclipse-Class Super Star Destroyer identical to Palpatine’s flagship. This monster is an absolute terror to face and represents the pinnacle of Imperial Naval technology; armed with five hundred and fifty heavy laser cannons and another five hundred turbolasers this ship is capable of easily smashing almost any other Star Wars ship in a straight slugfest. What it can’t beat in such a fight can easily be annihilated with its axial superlaser which is strong enough to crack planetary shields and slag continents and hit moving targets in battle. The ship is also equipped with ten gravity well generators to ensure opponents can’t make a run for it and a compliment of 600 TIE Interceptors and 96 TIE Bombers for fighter purposes. The warship comes crewed with droids and a standard crew."
600 CP,Mustafar,Star Wars Movie Compilation : The Skywalker Saga Jumpchain,Your warehouse gains a pocket dimension that houses a stable solar environment for the planet Mustafar with a copy of the planet which can be imported into future Jumps. Mustafar's lava flow holds unique and valuable ores that can expand on further jumps. These ores can mined from the lava and are extracted in different ways through the various automated mini facilities on the planet.
600 CP,The Devastator ,Star Wars Movie Compilation : The Skywalker Saga Jumpchain,"This Imperial Star Destroyer is armed with turbolaser batteries, ion cannons, and several tractor beam projectors. The ship has a tractor beam targeting array with diagonal support beams located between its two deflector shield generator domes and a communications tower, vertical support beams. Any ships drawn into its docking bay via tractor beam can be stored within a secure facility within your warehouse. This facility is specifically isolated from the rest of your warehouse so that it cannot be exited without either your assistance or dimensional shunting powerful enough to eject them from the warehouse."
600 CP,Super Star Destroyer,Star Wars Movie Compilation : The Skywalker Saga Jumpchain,"The largest warships in the republic and the empire’s arsenal which acts primarily as a
command ship. "
600 CP,Hammerhead-class Cruiser,KOTOR,"The main capital ship of the Republic fleet. This 300 meter long vessel can hold several hundred crew members and passengers, and is able to carry a single squadron of starfighters plus a few shuttles. The armament consists of four dual turbolaser cannons, two medium turbolasers, and a tractor beam emitter all mounted on the front of the ship. Numerous point-defense cannons are also scatterd along this vessel to protect against enemy starfighters. Typical rooms and facilities such as crew quarters, storage areas, medical, engineering, escape pods, dining, and holding cells are all installed on this vessel. A full crew of maintenance and combat droids will help you navigate, operate the onboard systems, fire the ship’s weaponry, and engage enemies until you can gather a proper crew. Additionally this ship comes fully stocked with supplies, a full compliment of starfighters stored in the hanger bay, and two shuttles. Starfighters and droids will respawn 24 hours after they’re destroyed or upon total ship respawn. Food, medicine, fuel, ammo, spare parts, and other supplies will replenish after they’re consumed."
600 CP,Jumper’s Militia,Star Wars - The Force Unleashed,"Much like a certain Jedi you didn’t trust the Clone soldiers of the Republic for one reason or another and instead elected to go another route and recruit your own army of volunteers for the Clone Wars. While these men and women are nowhere near as numerous as the armies of the Galactic Empire and only number about 500,000 they are still well trained and battle hardened veterans of the Clone Wars. They also come equipped with mid-tier weaponry and a small fleet of Clone Wars era warships."